{"question": "Quelle est l'obligation prevue par l'article mentionné dans LA-octobre2025?", "answer": "", "contexts": ["## Article 1 Statut de l'arbitre  \nPour officier sur événement homologué auprès de la FFE, l'arbitre doit être titulaire d'une licence A pour la saison en cours. Il doit être à jour de ses autres obligations administratives et obligations de formation."], "ground_truth": "Il doit être à jour de ses autres obligations administratives et obligations de formation."}
{"question": "Que precise de LA-octobre2025?", "answer": "", "contexts": ["Échecs Hybrides : Article 6.1.3 . Une compétition d'Échecs Hybrides est un événement dans lequel tous les joueurs et joueuses sont physiquement supervisés par des arbitres pendant qu'ils jouent en ligne.  \nÉchiquier Virtuel :Article 2. Fait référence à la représentation générée par la Plateforme de Jeu, de l'échiquier et des pièces sur l'écran des joueurs et joueuses telle qu'ils l'ont personnalisé à l'aide de la Plateforme de Jeu.  \nFPL : Annexe A.2. Fait référence à la Commission Fair-play de la FIDE.  \nLogiciel Fair-play : Annexe I, A.1. Outils logiciels utilisés par les fournisseurs de services de jeu et par la FIDE pour contrôler toutes les parties de tous les joueurs et joueuses coup par coup. Le logiciel Fair-play approuvé par la FIDE est le « FIDE Game Screening Tool ».  \nOrganisateur/Organisatrice en Chef : Article 16.1. La personne responsable pour la désignation et l'approbation de toutes les salles de jeu pour une compétition en ligne.  \nOrganisateur/Organisatrice Local(e) : Article 16.1. La personne responsable de la surveillance d'un seul lieu de compétition. Dépend directement de l'Organisateur/Organisatrice en Chef.  \nPendule Virtuelle : Article 4. L'affichage du temps de jeu restant pour chaque joueur et chaque joueuse par la Plateforme de Jeu sur l'écran de l'ordinateur, ou les appareils de jeu.  \nPersonne Enquêtrice (PE): Annexe I, H.3. Fait référence à un membre de la Commission Fair-play de la FIDE chargé d'enquêter sur une situation où des allégations de triche sont survenues."], "ground_truth": "Échecs Hybrides : Article 6.1.3 ."}
{"question": "Quelle règle est énoncée à la page 185?", "answer": "", "contexts": ["## 8.2. Détermination du Classement initial 'Ru' d'un joueur ou d'une joueuse (Voir Exemple)  \n- 8.2.1. Si une personne non classée marque zéro point dans sa première manifestation, c e score n'est pas pris en compte. Dans le cas contraire, son classement est calculé en utilisant tous ses résultats tel qu'indiqué au 7.1.4.\n- 8.2.2. Ra est le classement moyen des adversaires classés auxquels se sont ajoutés deux adversaires virtuels classés 1800. On considère que les résultats contre ces adversaires virtuels sont des matchs nuls.\n- 8.2.3. Ru = Ra + dp.  \nRu est arrondi à l'entier le plus proche.  \nLe classement initial maximal est 2200.  \n- 8.2.4. Si une personne non classée reçoit un classement publié avant qu'un tournoi dans lequel elle a joué soit pris en compte pour le classement, alors ce tournoi est pris en compte en la considérant comme une personne classée avec son classement actuel. Cependant, pour le calcul du classement de ses adversaires, elle est comptabilisée comme une personne non classée."], "ground_truth": "Si une personne non classée marque zéro point dans sa première manifestation, c e score n'est pas pris en compte."}
{"question": "Que precise de Contrat_de_delegation_15032022?", "answer": "", "contexts": ["## Art. 12-9 - Aide à la mutualisation du mouvement sportif  \nL'État intervient de façon indirecte avec le mouvement sportif en accordant une subvention de fonctionnement aux CNOSF et CPSF."], "ground_truth": "12-9 - Aide à la mutualisation du mouvement sportif  \nL'État intervient de façon indirecte avec le mouvement sportif en accordant une subvention de fonctionnement aux CNOSF et CPSF."}
{"question": "Combien de points sont mentionnés dans le règlement?", "answer": "", "contexts": ["On attribue donc à Hortense un classement fictif de 1530 pour les calculs de départages.  \n- Simon est seul dans son niveau à 1 pt (réussite d'environ 14%, Malus de x=-309)  \nOn connaît juste le niveau supérieur à 1,5 pt (Moyenne Elo Sup=1450 , réussite d'environ 21% : Malus de b=-230 ) Il y a 79 points d'écart entre les deux malus.  \nLe classement Fictif utilisé pour Simon sera donc 1450-79=1371  \n- Cécile, Damien et Emma sont dans un niveau où aucun joueur n'a de classement officiel.  \nIls sont dans le niveau à 4 pts (Pourcentage de réussite d 'environ 57% : Bonus de x= +50 )  \nLe niveau supérieur est à 4.5 pts (Moyenne Elo sup=1890 et réussite d'environ 64% : Bonus de b=+102 )  \nLe niveau inférieur est à 3 pts (Moyenne Elo inf=1530 et réussite d'environ 43% : Malus de a= -50 )  \nOn utilise donc la formule mathématique d'interpolation suivante :  \n<!-- formula-not-decoded -->  \n<!-- formula-not-decoded -->  \nOn donne donc un classement fictif de 1767 à ces trois joueurs pour le calcul des départages.  \n(Nous sommes, bien entendu, conscients que ce résultat est obtenu après plusieurs arrondis et qu'il est un peu décalé par rapport à la réalité.)  \nChapitre 4.3 :Les systèmes de partage des prix"], "ground_truth": "79 points"}
{"question": "Que concerne cette règle pour les joueurs?", "answer": "", "contexts": ["## 3.4 Statut des joueurs et des joueuses -homologation  \nLa Commission Technique fédérale se prononce sur le statut et la qualification des joueurs et joueuses :  \n- Avant le début de la saison, à la demande du club où est (sera) prise la licence ;\n- À tout moment, mais au plus tard dans les trente jours suivant la tenue du championnat, à la demande du club où est (sera) prise la licence, d'un autre club, de l'arbitre en chef, la Direction Technique Fédérale, du Comité Directeur.  \nLes clubs sont responsables de la qualification de leurs joueurs et joueuses (article 2 des Règles Générales)."], "ground_truth": "Les clubs sont responsables de la qualification de leurs joueurs et joueuses (article 2 des Règles Générales)."}
{"question": "Qu'est-ce que le jury?", "answer": "", "contexts": ["## 1. Généralités  \n- 1.1. Les titres à décerner sont :\n- 1.1.1. Arbitre FIDE (AF): l e niveau d'entrée des titres internationaux pour les arbitres.\n- 1.1.2. Arbitre International (AI): le niveau avancé des titres internationaux pour les arbitres.\n- 1.2. Ces règles décrivent les qualifications requises et la procédure par lesquelles un titre peut être décerné.\n- 1.3. Les titres sont valables à vie à compter de la date d'attribution ou d'enregistrement.\n- 1.4. Le jury est la Commission des arbitres de la FIDE.\n- 1.5. Le Comité Directeur peut valider les titres du 1.1 après consultation du Président de la Commission des Arbitres.\n- 1.6. La Commission peut recommander un titre par un vote par correspondance ou un vote électronique."], "ground_truth": "Le jury est la Commission des arbitres de la FIDE."}
{"question": "Quelle règle est énoncée à la page 159?", "answer": "", "contexts": ["| | Prix annoncé | Joueur | Prix à la place | Prix au partage intégral | Prix au système Hort |\n|-------|----------------|----------|-------------------------------|-------------------------------|-------------------------------|\n| 5 ème | 200 € | Emma | 200 € | 100 € chacun | 150 € |\n| 6 ème | 100 € | Farid | 100 € | 100 € chacun | 100 € |\n| 7 ème | 0 € | Germain | 0 € | 100 € chacun | 50 € |\n| 8 ème | 0 € | Hortense | Retirée de la liste des prix. | Retirée de la liste des prix. | Retirée de la liste des prix. |"], "ground_truth": "| Retirée de la liste des prix."}
{"question": "Quel est le rôle de l'arbitre selon ce passage?", "answer": "", "contexts": ["## RESPECTER L'ARBITRE  \n- En participant à une compétition homologuée, les joueurs et joueuses acceptent de jouer sous le contrôle d'un arbitre disposant de toute l'autorité nécessaire pour veiller à l'application des règles du jeu.\n- Garant du respect des règlements fédéraux et du respect de l'esprit sportif, l'arbitre est un représentant officiel de la F.F.E sur les lieux du tournoi.\n- Face à une décision de l'arbitre en cours de jeu, les joueurs et joueuses ne peuvent qu'obtempérer. Ils peuvent interjeter appel oralement dans l'instant, mais dès que possible ils déposeront leur réclamation par écrit selon des modalités qui doivent leur être expliquées par le corps arbitral."], "ground_truth": "- Garant du respect des règlements fédéraux et du respect de l'esprit sportif, l'arbitre est un représentant officiel de la F.F.E sur les lieux du tournoi."}
{"question": "Que se passe-t-il en cas de force majeure. (Alerte incendie?", "answer": "", "contexts": ["## 10.1. Cas de force majeure  \nRecommandations pour les arbitres et l'équipe d'organisation d'événements échiquéens : ils doivent indiquer aux joueurs/joueuses s'il est nécessaire d'interrompre la ronde ou le tournoi en cas de force majeure. (Alerte incendie, incident grave pendant le t ournoi,...)  \n10.1.1. Les parties peuvent être interrompues avec la possibilité de mettre un coup sous enveloppe (ajournement), il est toutefois préférable de reprendre les parties, si possible, même après une longue pause où le risque est présent que des joueurs/joueuses puissent avoir eu accès à une aide extérieure.  \nDans la mesure du possible, arbitre et organisateur mettront tout en place pour éviter les risques d'accès à une aide extérieure pendant la pause.  \n- 10.1.2. Si nécessaire, l'arbitre est autorisé à modifier la cadence de jeu (c'est -à-dire réduire le temps restant pour terminer les parties)\n- 10.1.3. Si nécessaire, il est permis de dépasser les 12 heures de jeu dans la journée pour terminer les parties interrompues et atteindre le nombre prévu de rondes.\n- 10.1.4. L'arbitre en chef et l'équipe d'organisation peuvent organiser, si nécessaire, une ronde avec une cadence de jeu différente pour terminer la journée/le tournoi avec le nombre de rondes requis.\n- 10.2. Autres cas (panne de courant, température basse, bruit, conditions de jeu difficiles, absence d'arbitre, ... )"], "ground_truth": "en cas de force majeure. (Alerte incendie, incident grave pendant le t ournoi,."}
{"question": "Qu'est-ce que le capitaine?", "answer": "", "contexts": ["## 3.5 Capitaines  \nChaque équipe doit avoir un capitaine qui peut-être joueur ou non joueur. Il ne peut pas officier en même temps en tant qu'arbitre.  \nDans l'exercice de ses fonctions, le capitaine d'équipe a le droit d'accéder à l'aire réservée aux joueurs.  \nA la fin de la session de jeu, le capitaine est responsable de la remise des feuilles de parties lisiblement écrites aux arbitres.  \nDurant les parties, le capitaine peut conseiller ses joueurs sur l'opportunité d'offrir, d'accepter ou de refuser une proposition de nullité, sur l'opportunité d'abandonner, sur la situation du match, à condition qu'il ne fasse aucun commentaire sur la position de l'échiquier.  \nL'arbitre a le droit d'assister à tout échange de propos entre un joueur et son capitaine. Le capitaine d'équipe doit transmettre les résultats le soir même au directeur de groupe soit par courriel ou par téléphone. La feuille de match doit être transmise 48h après le match."], "ground_truth": "le capitaine est responsable de la remise des feuilles de parties lisiblement écrites aux arbitres."}
{"question": "Que precise de J02_2025_26_Championnat_de_Fra?", "answer": "", "contexts": ["## 3.7.b) Composition de la feuille de match  \nChaque échiquier correspond à une catégorie d'âge :  \n- 1 e et 2 e (1 er en Nationale 3) échiquier : U16, U16F ou plus jeune ;\n- 3 e et 4 e (2 e en Nationale 3) échiquier : U14, U14F ou plus jeune ;\n- 5 e et 6 e (3 e en Nationale 3) échiquier : U12, U12F ou plus jeune ;\n- 7 e et 8 e (4 e en Nationale 3) échiquier : U10, U10F ou plus jeune.  \nDans un match, les échiquiers 1 à 6 (1 à 3 en Nationale 3) disputent une partie, les échiquiers 7 et 8 (4 en Nationale 3) deux parties.  \nDu Top Jeunes à la Nationale 2, lors de la première partie, l'échiquier 7 (8) de l'équipe ayant les blancs sur l'échiquier 1 rencontre l'échiquier 7 (8) de l'équipe ayant les noirs sur l'échiquier 1 avec les blancs.  \nLors de la deuxième partie, l'échiquier 7 (8) de l'équipe ayant les blancs sur l'échiquier 1 rencontre l'échiquier 8 (7) de l'équipe ayant les noirs sur l'échiquier 1 avec les noirs.  \nLe non-respect de cet article entraîne un forfait administratif sur l'échiquier concerné et tous ceux qui le suivent."], "ground_truth": "Dans un match, les échiquiers 1 à 6 (1 à 3 en Nationale 3) disputent une partie, les échiquiers 7 et 8 (4 en Nationale 3) deux parties."}
{"question": "Que precise de R01_2025_26_Regles_generales.p?", "answer": "", "contexts": ["## 11.2. Constitution de l'entente  \n- 11.2.1. Un des clubs est désigné comme club pilote de l'entente par les clubs concernés. Lors des compétitions, le nom de l'équipe doit commencer obligatoirement par \"Entente\" puis le nom du club pilote.\n- 11.2.2. L'entente n'est valable que pour une saison. Elle peut être renouvelée sur décision de la Ligue.\n- 11.2.3 Une entente peut être constituée entre 3 clubs uniquement dans le championnat de France des clubs féminins avec impossibilité de monter en division supérieure pour l'entente correspondante."], "ground_truth": "Constitution de l'entente  \n- 11.2.1."}
{"question": "Que doit faire l'arbitre d'après LA-octobre2025?", "answer": "", "contexts": ["## 3. La catégorie A.  \nLa catégorie A est le plus haut niveau de classification des arbitres internationaux.  \nPour être classés dans la catégorie A, les arbitres doivent remplir tous les critères suivants :  \n- 3.1. Ils détiennent le titre d'arbitre international depuis au moins cinq (5) ans.\n- 3.2. Leur statut d'arbitre est « actif ».\n- 3.3. Ils ont fait preuve d'une excellente connaissance des réglementations du jeu d'échecs, du règlement des tournois et aucune sanction ne leur a été infligée au cours de leur activité d'arbitre.  \n- 3.4. Ils ont été classés dans la catégorie B pendant au moins deux (2) ans.\n- 3.5. Ils ont exercé en tant qu'arbitre en chef ou arbitre en chef adjoint de catégorie B au cours des cinq (5) dernières années avec une évaluation positive :\n- a) dans au moins deux (2) tournois de catégorie A tels qu'indiqués au point 1.3.1, ou\n- b) dans au moins un (1) tournoi de catégorie A tel qu'indiqué au point 1.3.1 et trois (3) tournois de catégorie B tels qu'indiqués au point 1.3.2."], "ground_truth": "Pour être classés dans la catégorie A, les arbitres doivent remplir tous les critères suivants :  \n- 3.1."}
{"question": "Que se passe-t-il en cas de qualification en catégorie mixte et en catégorie féminine?", "answer": "", "contexts": ["## ◆ Cas des qualifications en mixte et en féminin :  \nChaque tournoi par catégorie d'âge, doit regrouper les catégories mixte et féminine.  \nÀ l'issue de la phase départementale, les joueuses prennent les places réservées au quota féminin, mais si leur classement dans le tournoi leur permet de se qualifier également en catégorie mixte, les joueuses gardent le droit de se qualifier dans les deux catégories lors du championnat interdépartemental.  \nÀ l'issue des qualifications interdépartementales, en cas de qualification en catégorie mixte et en catégorie féminine, les joueuses doivent informer la Ligue de leur choix pour le tournoi national."], "ground_truth": "en cas de qualification en catégorie mixte et en catégorie féminine, les joueuses doivent informer la Ligue de leur choix pour le tournoi national."}
{"question": "Combien de heures sont mentionnés dans le règlement?", "answer": "", "contexts": ["## 10.1. Le stage d'arbitre jeune (SJ)  \nLe stage SJ, d'une durée de 14 heures (2 jours), permet de préparer le titre d'arbitre jeune.  \nThèmes essentiels du stage SJ :  \nIl est essentiellement axé sur l'enseignement des règles du jeu. S'y ajoutent des cours portant notamment sur les spécificités des compétitions jeunes et scolaires, sur la philosophie de l'arbitrage, sur le réglage des pendules, sur le règlement intérieur de la D.N.A.  \nLe stage SJ est ouvert à tout licencié A âgé de 11 à 16 ans."], "ground_truth": "14 heures"}
{"question": "Quelle règle est énoncée à la page 1?", "answer": "", "contexts": ["## 1. OBJECTIF  \nAdossé à une comptabilité respectant le plan comptable, ce règlement financier a pour objectif essentiel d'assurer une totale transparence de la gestion financière de la Fédération.  \nDans ce but, il définit une organisation comptable et financière offrant un dispositif de suivi, d'alerte et de contrôle :  \n-  permettant d'assurer une bonne administration de la fédération,\n-  protégeant sa santé financière,\n-  permettant la conduite et la réalisation des actions et projets définis."], "ground_truth": "Dans ce but, il définit une organisation comptable et financière offrant un dispositif de suivi, d'alerte et de contrôle :  \n-  permettant d'assurer une bonne administration de la fédération,\n-  protégeant sa santé financière,\n-  permettant la conduite et la réalisation des actions et projets définis."}
{"question": "Qu'est-ce qui est autorisé?", "answer": "", "contexts": ["- 11.3.4. Fumer (y compris les cigarettes électroniques) est autorisé uniquement dans la section du lieu de la compétition désignée par l'arbitre.  \nNote de traduction : L'espace fumeur est à l'extérieur des bâtiments publics en France. Il faut essayer de l'avoir le plus proche possible de la zone de jeu et sous supervision d'un arbitre , d'un assistant ou d'une assistante.  \n- 11.4. Les joueurs et joueuses ayant terminé leur partie sont considérés comme des spectateurs et spectatrices. Cela signifie que les joueurs et joueuses ayant terminé leurs parties doivent quitter la zone de jeu. Laissez-leur quelques minutes pour voir les autres échiquiers en vous assurant qu'ils /elles ne dérangent pas les parties en cours."], "ground_truth": "est autorisé uniquement dans la section du lieu de la compétition désignée par l'arbitre."}
{"question": "Qu'est-ce que le coup?", "answer": "", "contexts": ["## I.1 Procédure d'ajournement :  \n- I.1.1. Si à l'issue du temps de la session de jeu , une partie n'est pas terminée, l'arbitre demande au joueur ou à la joueuse au trait de « mettre son coup sous enveloppe ». Il/Elle doit écrire son coup sur sa propre feuille de partie, sous une forme qui ne souffre d'aucune ambiguïté, mettre sa feuille d e partie accompagnée de celle de son adversaire, s'il y en a une, dans une enveloppe, la sceller et seulement ensuite arrêter la pendule d'échecs .  \nTant qu'il /elle n'a pas arrêté la pendule d'échecs , le joueur ou la joueuse conserve le droit de modifier le coup mis sous enveloppe. Si, après que l'arbitre lui a demandé de mettre son coup sous enveloppe, le joueur ou la joueuse effectue un coup sur l'échiquier, il/elle doit écrire ce même coup sur sa f euille de partie en le considérant comme le coup mis sous enveloppe.  \n- I.1.2. On considère qu'u n joueur ou une joueuse au trait qui ajourne la partie avant la fin de la session de jeu a ajourné à l'heure prévue pour la fin de ladite session. Son temps restant est consigné.\n- I.2 Les indications suivantes figurent en intégralité sur l'enveloppe :\n- I.2.1. Les noms des deux adversaires,\n- I.2.2. La position précédant le coup mis sous enveloppe,\n- I.2.3. Le temps de réflexion utilisé par chacun des adversaires,\n- I.2.4. Le nom du joueur ou de la joueuse dont le coup est mis sous enveloppe,"], "ground_truth": "le coup est mis sous enveloppe,"}
{"question": "Qu'est-ce que l'arbitre peut faire?", "answer": "", "contexts": ["## L'arbitre doit faire attention à éviter tout type de tricherie de la part des joueurs et joueuses.  \n- 12.3. L'arbitre doit surveiller les parties, surtout lorsque les joueurs et joueuses sont à court de temps, fait appliquer les décisions qu'il /elle a prononcées et inflige des sanctions aux joueurs et joueuses si nécessaire.\n- 12.4. L'arbitre peut désigner des assistants ou assistantes pour surveiller les parties, par exemple quand plusieurs joueurs ou joueuses sont à court de temps.\n- 12.5. L'arbitre peut attribuer à l'un ou aux deux adversaires un laps de temps supplémentaire au cas où la partie aurait été perturbée par des événements extérieurs à celle-ci.\n- 12.6. L'arbitre ne doit pas intervenir dans une partie, excepté dans les cas décrits dans les Règles du Jeu d'Échecs. L'arbitre ne doit pas indiquer le nombre de coups achevés, excepté en application de l'Article 8.5 quand au moins un drapeau est tombé. L'arbitre s'abstien t d'informer un joueur ou une joueuse, que son adversaire a achevé un coup ou qu'il/elle n'a pas appuyé sur sa pendule.\n- 12.7. Si quelqu'un observe une irrégularité, il peut uniquement en informer l'arbitre. Les joueurs et joueuses d'autres parties ne doivent ni parler ni n'intervenir d'aucune façon dans une partie. Les spectateurs et spectatrices ne sont pas autorisés à interfére r dans une partie. L'arbitre peut ex clure les contrevenants et contrevenantes du lieu de la compétition."], "ground_truth": "L'arbitre peut désigner des assistants ou assistantes pour surveiller les parties, par exemple quand plusieurs joueurs ou joueuses sont à court de temps."}
{"question": "Quelle règle est énoncée à la page 9?", "answer": "", "contexts": ["## 6.5 Votes et délibérations  \nLes abstentions et les votes nuls ne sont pas pris en compte pour le calcul de la majorité.  \nLes votes ont lieu à main levée ou par scrutin électronique, ce dernier devant permettre d'assurer la publicité des votes. Toutefois, les votes portant sur des personnes ont toujours lieu à bulletin secret. Ce procédé peut également être utilisé sur demande du président ou de la majorité des délégués présents représentant la majorité des voix présentes."], "ground_truth": "Toutefois, les votes portant sur des personnes ont toujours lieu à bulletin secret."}
{"question": "Quelle règle s'applique aux joueurs selon LA-octobre2025?", "answer": "", "contexts": ["## Exempts au 1 er tour  \nSi le nombre de joueurs/joueuses disponibles correspond exactement à l'un des nombres du tableau précédent alors aucune exemption n'est nécessaire et le tournoi se déroule de manière fluide.  \n<!-- image -->  \nSi le nombre de joueurs/joueuses disponibles ne correspond pas alors le nombre de « joueurs manquants » est à compter comme des « joueurs forfaits ». C'est donc égal au nombre de joueurs /joueuses sans adversaire qui seront exempts au 1 er tour.  \nExemple : Pour 52 joueurs disponibles. Il manque 12 joueurs pour arriver à 64 (64-52=12)  \nIl y aura donc 12 joueurs exempts sans adversaires qui se qualifient directement au tour suivant.  \nIl reste alors 40 joueurs qui s'affronteront sur ce 1 er tour (52-12=40)  \n<!-- image -->"], "ground_truth": "C'est donc égal au nombre de joueurs /joueuses sans adversaire qui seront exempts au 1 er tour."}
{"question": "Que doit-on faire selon l'article mentionné dans Contrat_de_delegation_15032022?", "answer": "", "contexts": ["## Art. 9-1 - Existence d'une stratégie d'observation, de l'emploi, des métiers et des compétences  \nL'INF de la FFE doit mener d'ici la fin de l'année 2022 une étude sur l'emploi aux sein des structures de la FFE permettant de définir:  \n-  Le nombre et le type d'emplois identifiés existants (animateur, moniteur, entraîneur, directeur de la performance, gestionnaire, développeur, etc.) dans les structures fédérées.\n-  La nature des emplois (principal ou accessoire).\n-  Le nombre et le type d'emplois identifiés à créer pour les quatre prochaines années.  \nAfin de prévoir les certifications professionnelles correspondantes à ces besoins ou celles à concevoir."], "ground_truth": "9-1 - Existence d'une stratégie d'observation, de l'emploi, des métiers et des compétences  \nL'INF de la FFE doit mener d'ici la fin de l'année 2022 une étude sur l'emploi aux sein des structures de la FFE permettant de définir:  \n-  Le nombre et le type d'emplois identifiés existants (animateur, moniteur, entraîneur, directeur de la performance, gestionnaire, développeur, etc.) dans les structures fédérées."}
{"question": "Que precise de 2022_Reglement_medical_1908202?", "answer": "", "contexts": ["## 2.2.1.1 Nomination  \nLe médecin fédéral est nommé par le comité directeur de la FFE parmi les membres pris en son sein. Il est obligatoirement docteur en médecine et licencié à la FFE. La durée de sa fonction est liée à celle du comité directeur de la FFE.  \nSa responsabilité civile professionnelle est couverte, pour ses actions fédérales par l'assurance en responsabilité civile de la FFE."], "ground_truth": "Il est obligatoirement docteur en médecine et licencié à la FFE."}
{"question": "Que precise de 2025_Reglement_Interieur_20250?", "answer": "", "contexts": ["## 4.2 Fusions et scission de clubs  \nTout club envisageant une fusion ou une scission doit formuler sa demande auprès du secrétaire général de la FFE avant le 15 mai en vue de son examen par le comité directeur de la FFE lors de sa dernière réunion de la saison.  \nPar l'intermédiaire de leur ligue régionale de rattachement, qui émettra un avis circonstancié, ces clubs doivent adresser au comité départemental et à la FFE leur projet de fusion élaboré conformément aux articles 15-2 et suivants du décret du 16 août 1901, comprenant notamment les statuts envisagés de la nouvelle association résultant de l'opération de fusion ou de scission. En toute hypothèse, en cas d'autorisation du comité directeur, les joueurs des clubs visés sont considérés comme non mutés pour la saison à venir.  \nPour le calcul des voix prévues à l'article 5.4 des statuts, le nombre de licenciés à prendre en compte est :  \n- -dans le cas d'une fusion de clubs, la somme du nombre de licenciés des clubs fusionnant ;\n- -dans le cas d'une scission, par le nombre de licenciés inscrits dans chaque club au procès-verbal de l'assemblée générale actant la scission."], "ground_truth": "Par l'intermédiaire de leur ligue régionale de rattachement, qui émettra un avis circonstancié, ces clubs doivent adresser au comité départemental et à la FFE leur projet de fusion élaboré conformément aux articles 15-2 et suivants du décret du 16 août 1901, comprenant notamment les statuts envisagés de la nouvelle association résultant de l'opération de fusion ou de scission."}
{"question": "Quelle règle est énoncée à la page 104?", "answer": "", "contexts": ["## Introduction :  \nAfin de limiter les suspicions d'arrangements entre joueurs /joueuses dans ce type de tournoi, le règlement du tournoi peut préciser que le tirage au sort des numéros d'appariement d'un tournoi « Toutes Rondes » est dirigé de façon à ce que les personnes de même « affinité » ne se rencontrent pas, si possible, dans les 3 dernières rondes.  \nCette information doit obligatoirement être communiquée en avance via le règlement intérieur du tournoi.  \nDans le texte FIDE original, en Anglais, il n'est question que de la même « fédération ». Il est bien entendu pertinent de l'utiliser aussi quand on rencontre le cas de personnes d'un même club, d'une même ville, d'un même département, d'une même ligue."], "ground_truth": "Dans le texte FIDE original, en Anglais, il n'est question que de la même « fédération »."}
{"question": "Quelle obligation est énoncée à la page 81?", "answer": "", "contexts": ["- o L'appareil ne doit pas corriger ou signaler de lui -même les coups illégaux ;\n- o Si un pat ou un mat n'est pas remarqué, si un coup illégal est achevé, l'appareil doit permettre de noter les coups suivants ;\n- o Un compteur de coups automatique doit être disponible.\n- L'appareil doit pouvoir redémarrer la notation après une mise en pause."], "ground_truth": "- L'appareil doit pouvoir redémarrer la notation après une mise en pause."}
{"question": "Qu'est-ce qui est interdit selon le règlement?", "answer": "", "contexts": ["- 17.5. Pendant une partie, il est interdit aux joueurs et joueuses de faire usage de notes, sources d'information ou de recevoir des conseils.\n- 17.6. Il est interdit de distraire ou de déranger l'adversaire de quelque manière que ce soit. Ceci inclut les demandes injustifiées, les offres de nulle injustifiées, l'envoi de messages inappropriés ou l'introduction d'une source de bruit dans la zone de jeu.\n- 17.7. Pendant une partie, les joueurs et les joueuses peuvent quitter la zone de jeu ou les lieux de la compétition seulement avec l'autorisation de l'arbitre.\n- 17.8. Les joueurs et les joueuses doivent respecter le code vestimentaire de la compétition, s'il y en a un.\n- 17.9. Toute infraction aux articles 17.1 à 17.8 conduit à des sanctions en accord avec l'article 18.4.\n- 17.10. Un joueur ou une joueuse a le droit de demander à l'arbitre l'explication d'un point particulier des Règles du Jeu d'Échecs en ligne de la FIDE.\n- 17.11. À moins que le règlement d'une compétition spécifie autre chose, un joueur ou une joueuse peut faire appel de toute décision de l'arbitre. Ceci inclut l'appel contre le résultat d'une partie, même si le résultat a été affiché par la plateforme de jeu et approuvé par l'arbitre."], "ground_truth": "il est interdit aux joueurs et joueuses de faire usage de notes, sources d'information ou de recevoir des conseils."}
{"question": "Que se passe-t-il en cas de départage entre deux équipes au différentiel?", "answer": "", "contexts": ["## 4.3. Forfaits  \nD é finition : voir Règles générales, article 3.  \nSi une équipe déclare forfait pour plus de la moitié des matchs du championnat, ses résultats ne sont pas comptabilisés dans le classement.  \nSi une équipe déclare forfait pour un ou plusieurs matchs, mais joue au moins la moitié des matchs du championnat, ses résultats sont comptabilisés dans le classement. Cependant, en cas de départage entre deux équipes au différentiel, les résultats de cette équipe forfait sont retirés pour le calcul.  \nSanctions sportives : voir Règles Générales, article 3.3.3.c."], "ground_truth": "en cas de départage entre deux équipes au différentiel, les résultats de cette équipe forfait sont retirés pour le calcul."}
{"question": "Qu'est-ce que la licence?", "answer": "", "contexts": ["## 3.4. Statut des joueurs et joueuses / homologation  \nLa Commission d'Homologation se prononce sur le statut et la qualification des joueurs :  \n- Avant le début de la saison, à la demande du club où la licence du joueur ou la joueuse est prise,\n- À tout moment, mais au plus tard dans les trente jours suivant l'éventuelle rencontre concernée, à la demande du club ou la licence est prise, d'un autre club, de la direction du groupe ou de la compétition, de la Direction Technique Nationale, du Comité Directeur.  \nLes clubs sont responsables de la qualification de leurs joueurs et joueuses. Ceux qui n'ont pas obtenu l'accord de la Commission d'Homologation et qui se trouvent en situation illégale peuvent être pénalisés rétroactivement.  \nUne vérification systématique des dispositions prévues aux articles 1.5. et 3.1. est effectuée par la direction de groupe."], "ground_truth": "la licence est prise, d'un autre club, de la direction du groupe ou de la compétition, de la Direction Technique Nationale, du Comité Directeur."}
{"question": "Que doit faire l'arbitre selon le règlement?", "answer": "", "contexts": ["## 8.4. Classement -Cérémonie de clôture  \nEn fin de tournoi, l'arbitre doit fournir un classement complet des participants. Dans le cas de joueurs ex-aequo, le système de départage utilisé doit avoir été annoncé dans le règlement intérieur. L'arbitre est également responsable de l'annonce des personnes récompensées lors de la cérémonie de clôture, l'établissement de cette liste nécessite de prévoir un temps suffisant pour éviter tout risque d'erreur et d'anticiper l'organisation de la cérémon ie de clôture avec l'équipe d'organisation."], "ground_truth": "l'arbitre doit fournir un classement complet des participants."}
{"question": "Quelle règle est énoncée à la page 21?", "answer": "", "contexts": ["## Art. 12-5 - Offres de formation et d'emploi  \nLe ministère des Sports soutient la création, le développement et la consolidation d'emplois associatifs, en particulier dans le cadre de contrats aidés.  \nLe dispositif SESAME (Sésame vers l'Emploi dans le Sport et l'Animation pour les Métiers de l'Encadrement) a été créé par les ministères chargés des Sports et de la Jeunesse dans le but d'accompagner vers un emploi d'éducateur sportif ou d'animateur, les jeunes de moins de 25 ans rencontrant des difficultés d'insertion professionnelle. En offrant un parcours individualisé leur permettant une qualification professionnelle et une aide financière, le dispositif SESAME vient renforcer le plan national « Un jeune- Une solution ».  \nDepuis 2018, le dispositif Parcoursup a été mis en place dans les établissements publics de formation du ministère des sports : les CREPS, l'école nationale de voile et des sports nautiques ainsi que le GIP Campus sport Bretagne proposent, aux candidats bacheliers ou en réorientation d'études supérieures, des places en formation initiale dans les formations menant aux diplômes d'État.  \nLes DRAJES en lien avec les SDJES mettent en œuvre les dispositifs de service civique et du service national universel (SNU)."], "ground_truth": "Le dispositif SESAME (Sésame vers l'Emploi dans le Sport et l'Animation pour les Métiers de l'Encadrement) a été créé par les ministères chargés des Sports et de la Jeunesse dans le but d'accompagner vers un emploi d'éducateur sportif ou d'animateur, les jeunes de moins de 25 ans rencontrant des difficultés d'insertion professionnelle."}
{"question": "Que precise de R03_2025_26_Competitions_homol?", "answer": "", "contexts": ["## Définition  \nLes compétitions homologuées sont les compétitions et tournois officiels de la Fédération Française des Echecs. La Fédération Française des Échecs est le seul organisme permettant l'homologation FIDE des tournois d'échecs se déroulant en France.  \nLes résultats des compétitions homologuées sont les seuls pouvant être pris en compte pour les différents classements."], "ground_truth": "La Fédération Française des Échecs est le seul organisme permettant l'homologation FIDE des tournois d'échecs se déroulant en France."}
{"question": "Qu'est-ce que la partie?", "answer": "", "contexts": ["## Directives III : Parties sans incrément amenant des fins de partie au KO  \nIII.1 Une « fin de partie au KO » est la phase d'une partie où tous les coups restant à jouer doivent être achevés dans un temps défini.  \nExemple 1 : Si selon le règlement du tournoi la cadence est de 2 heures pour 30 coups suivie d'une heure pour la fin de la partie. La 2ème période est jouée selon les directives de fin de parties au KO  \nExemple 2 : Si selon le règlement du tournoi, la cadence est de 2 heures pour l'ensemble de la partie. Cela signifie que la partie entière est jouée selon les directives de fin de parties au KO  \n- III.2.1. Les directives cidessous concernant la dernière période d'une partie, amenant une fin de partie au KO, ne doivent s'appliquer à une compétition que si leur utilisation a été annoncée au préalable.\n- III.2.2. Ces directives ne s'appliquent qu'aux parties d'échecs standards et aux parties d'échecs en cadence rapide sans incrément et non aux parties en cadence blitz.\n- III.3.1. Si les deux drapeaux sont tombés et qu'il est impossible d'établir lequel est tombé le premier alors :\n- III.3.1.1. La partie continue si cela se produit dans toute période de jeu autre que la dernière.\n- III.3.1.2. La partie est nulle si cela se produit dans une période de jeu où tous les coups restants doivent être achevés."], "ground_truth": "La partie est nulle si cela se produit dans une période de jeu où tous les coups restants doivent être achevés."}
{"question": "Qu'est-ce que la FIDE?", "answer": "", "contexts": ["## 0. Introduction  \n- 0.1. Seuls les titres tels qu'en 0.3 sont reconnus par la FIDE.\n- 0.2. Les règles suivantes ne peuvent être modifiées que par le comité directeur de la FIDE suivant les recommandations de la Commission d'Homologation (CH). En ce qui concerne les tournois, les changements s'appliquent uniquement à ceux débutant le jour de leur entrée en vigueur, ou aux tournois qui auront lieu ultérieurement.\n- 0.3. Les titres internationaux de la FIDE sont administrés par la C ommission d' Homologation, qui est l'unité de jugement final. Les titres reconnus pour le jeu d'échecs standard devant l'échiquier (comme définis dans les règles du jeu) sont les suivants :  \nMixtes : Grand-Maître (GM), Maître International (MI), Maître de la FIDE (MF), Candidat Maître (CM)  \nFéminins : Grand-Maître Féminin (GMF), Maître International Féminin (MIF), Maître de la FIDE Féminin (MFF), Candidat Maître Féminin (CMF)  \n- 0.4. Les titres sont valables à vie à partir de la date de confirmation par le conseil de la FIDE.\n- 0.4.1. L'utilisation d'un titre ou classement de la FIDE pour se soustraire aux principes éthiques du titre ou du système de classement peuvent mener une personne à la révocation de son titre sur recommandation de la Commission d'Homologation et entérinement par le conseil de la FIDE.\n- 0.4.2. Un titre ne peut être utilisé pour les résultats des adversaires que dans les tournois débutant après sa confirmation. (Exception : voir 1.1.4)"], "ground_truth": "la FIDE sont administrés par la C ommission d' Homologation, qui est l'unité de jugement final."}
{"question": "Quelle règle est énoncée à la page 16?", "answer": "", "contexts": ["## 4.1.3. Rapport de supervision  \nToute visite fait l'objet d'un compte -rendu à adresser par le superviseur ou la superviseure à la Direction des Titres, en complétant le formulaire de supervision ou en rédigeant un rapport.  \nLes rapports de supervision défavorables sont examinés par la D.N.A. qui prendra les mesures administratives nécessaires telles que définies à l'article 17.3."], "ground_truth": "Les rapports de supervision défavorables sont examinés par la D.N.A."}
{"question": "Qu'est-ce que les suivants?", "answer": "", "contexts": ["## 3.6. Feuille de match  \nAvant le début du match, le nom de la personne désignée comme capitaine doit être indiqué sur la feuille de match. La ou le capitaine peut être un joueur ou une joueuse de l'équipe ou toute autre personne licenciée à la Fédération. Les capitaines ont le droit de mandater une personne le représentant, sous réserve de l'accord de l'arbitre principal et de posséder une licence fédérale en cours.  \nLes capitaines des équipes doivent remettre leur liste à l'arbitre au moins 15 minutes avant l'heure prévue pour le début de la rencontre. En Top Jeunes, la liste doit être remise à l'arbitre au moins 30 minutes avant l'heure prévue pour le début de la rencontre. La liste dans l'ordre des échiquiers, mentionne les dates de naissance et les classements Elo : dernier Elo FIDE ou en cas d'absence, Elo national ou en cas d'absence, Elo estimé.  \nLorsque la liste est remise en retard, les pendules de tous les membres de l'équipe concernée sont avancées d'un temps égal au retard. Si, de plus, un joueur ou une joueuse arrive dans un délai suffisant pour ne pas être forfait, mais qui entraîne un retard à la pendule supérieur à une heure, ce retard est ramené à une heure.  \nCette liste ne peut plus alors être modifiée pour ce match.  \nElle ne peut comporter de \"trou\" : s'il n'y a pas de nom écrit à un certain échiquier, l'échiquier vacant et les suivants sont automatiquement perdus par forfait administratif."], "ground_truth": "les suivants sont automatiquement perdus par forfait administratif."}
{"question": "Quelle action est autorisée selon ce passage?", "answer": "", "contexts": ["## 8.7 Vote électronique  \nEntre deux sessions de réunion du comité directeur, un vote électronique par mail peut être soumis au comité directeur par le bureau fédéral.  \nCe vote ne peut pas être utilisé pour une décision portant sur une personne physique et ne peut être utilisé que pour des scrutins nécessitant la majorité simple. Il ne peut être utilisé dans les 15 jours qui précèdent une réunion du comité directeur, ni dans le mois qui précède une assemblée générale.  \nLes membres du comité directeur doivent recevoir les documents nécessaires pour se forger une opinion au minimum une semaine avant l'ouverture du vote. Ils doivent avoir un interlocuteur identifié apte à répondre à toutes les questions concernant ce vote. Les questions et les réponses seront obligatoirement diffusées à tous les membres.  \nLe scrutin sera ouvert pendant 3 jours ouvrés. Les votes seront envoyés à un(e) salarié(e) de la Fédération Française des Échecs, en utilisant le formulaire spécifique au vote électronique.  \nLorsqu'un vote aura été enregistré, il ne pourra être modifié.  \nLa question ne doit appeler que 3 réponses possibles : oui, non, ou abstention. Tout mail qui ne se limiterait pas à ces 3 termes sera considéré comme nul."], "ground_truth": "Il ne peut être utilisé dans les 15 jours qui précèdent une réunion du comité directeur, ni dans le mois qui précède une assemblée générale."}
{"question": "Quelle obligation est énoncée à la page 6?", "answer": "", "contexts": ["## 11.3. La demande d'entente  \n- 11.3.1. La demande d'entente doit être formulée et signée conjointement par les clubs concernés.\n- 11.3.2. Elle doit indiquer le club pilote de l'entente.\n- 11.3.3. Elle ne peut comporter qu'une seule compétition au sens strict.\n- 11.3.4. Chaque club est limité à une seule entente par compétition et par saison.\n- 11.3.5. La demande d'entente peut être faite jusqu'à la date limite d'inscription et doit être adressée à la présidence de l'organe déconcentré qui gère la compétition concernée. L'organe déconcentré statue dès réception de la demande."], "ground_truth": "La demande d'entente doit être formulée et signée conjointement par les clubs concernés."}
{"question": "Quelle règle est énoncée à la page 204?", "answer": "", "contexts": ["MIF≥ 2200  \nChapitre 6.3 :Titres de la FIDE  \n- 1.5.5. Les normes obtenues avant le 1/7/2005 devront avoir été enregistrées auprès de la FIDE avant le 1/7/2013 ou elles seront considérées comme expirées.\n- 1.5.6. Tout demande de titre incluant une norme obtenue après le 30/06/2022 doit inclure au moins une norme d'une des catégories suivantes :\n- a) Un tournoi individuel au système suisse dans lesquels la liste des participants et participantes comprend, à chaque ronde, au moins 40 joueurs et joueuses dont le classement moyen est d'au moins 2000. Dans ce cadre, les joueurs et joueuses ne seront pris en compte que s'ils/elles manquent au plus une ronde (à l'exclusion des exemptions résultant des appariements)\n- b) Les Olympiades du jeu d'échecs\n- c) Les tournois organisés sous l'égide du GSC qui permettent la qualification directe au tournoi des candidats de la FIDE (https://gsc.fide.com/regulations-2/ )\n- d) Les Tournois qui permettent la qualification directe à la coupe du monde de la FIDE\n- e) Les tournois individuels organisés sous l'égide de l'EVE (Article 1, Règles générales pour les compétitions FIDE, https://events.fide.com/ )\n- f) La phase finale du Championnat National Individuel  \nLes tournois ci-dessus, de b) à f), comprennent les tournois masculins (ou mixtes) et les tournois féminins."], "ground_truth": "Les normes obtenues avant le 1/7/2005 devront avoir été enregistrées auprès de la FIDE avant le 1/7/2013 ou elles seront considérées comme expirées."}
{"question": "Quelle règle est énoncée à la page 55?", "answer": "", "contexts": ["## 12.2. L'arbitre d oit :  \n- 12.2.1. assurer le fair-play\n- 12.2.2. agir dans le meilleur intérêt de la compétition\n- 12.2.3. s 'assurer qu'un bon environnement de jeu soit maintenu\n- 12.2.4. s 'assurer que les joueurs et joueuses ne soient pas dérangés\n- 12.2.5. superviser le déroulement de la compétition\n- 12.2.6. p rendre les mesures spéciales nécessaires dans l'intérêt des joueurs et joueuses handicapés et de ceux et celles qui nécessitent un soutien médical.\n- 12.2.7. suivre les règles et directives relatives au fair-play"], "ground_truth": "agir dans le meilleur intérêt de la compétition\n- 12.2.3."}
{"question": "Que doit faire l'arbitre d'après J02_2025_26_Championnat_de_Fra?", "answer": "", "contexts": ["## 2.5. Arbitre  \nEn Top Jeunes, chaque match est dirigé par un arbitre fédéral proposé par l'organisateur et agréé par la direction de la compétition après avis de la Direction Nationale de l'Arbitrage.  \nEn Nationales 1 et 2, chaque match est dirigé par une ou un arbitre fédéral.  \nEn Nationales 3, la personne faisant fonction d'arbitre doit être titulaire d'une licence A ayant l'aval de la direction régionale de l'arbitrage (DRA) de sa Ligue."], "ground_truth": "En Nationales 1 et 2, chaque match est dirigé par une ou un arbitre fédéral."}
{"question": "Quelle règle est énoncée à la page 19?", "answer": "", "contexts": ["## Art. 10 - Stratégie fédérale en matière de développement des équipements fixes et mobiles (ou innovants)  \nEn 2021, la FFE a signé une convention de partenariat avec l'Association des Maires de France (AMF) permettant de faciliter l'achat et la mise en œuvre de mobilier urbain échiquéen par les collectivités territoriales dans les lieux publics (cahier des charges, taux de financement, etc.).  \nAu travers du dispositif Class'Echecs, 5000 jeux d'échecs seront distribués dans les écoles du dispositif, jeux qui resteront disponible pour les 20 prochaines années dans ces lieux.  \nPar ailleurs, la FFE étudie la création d'un équipement mobile permettant de jouer aux échecs dans un monde virtuel (métavers, jeu 3D) permettant d'amener les jeunes des territoires carencés vers les clubs d'échecs."], "ground_truth": "Au travers du dispositif Class'Echecs, 5000 jeux d'échecs seront distribués dans les écoles du dispositif, jeux qui resteront disponible pour les 20 prochaines années dans ces lieux."}
{"question": "Qu'est-il permis de faire selon LA-octobre2025?", "answer": "", "contexts": ["Absolue : une préférence couleur qui ne peut être remise en cause (voir C.3) à l'exception des top joueurs (voir A.7, C.8, C.9).  \nRang :  \nInitial : voir initial  \nRésident :  \nScore  \n: le score « normal » des joueurs/joueuses dans un niveau de ceux ne sont pas flotteurs descendants ;  \nJoueur dans un niveau à apparier une personne qui n'est pas flotteur descendant  \nRésiduel ( groupe à apparier). La partie d'un niveau d'appariement hétérogène qui contient uniquement les joueurs résidents qu'il reste à apparier une fois l'appariement des flotteurs descendants terminé.  \nRetardataire : une personne qui entre dans le tournoi et qui est apparié après la première ronde.  \nS1 : premier sous-groupe du niveau d'appariement : il contient initialement soit tous les flotteurs descendants (dans un niveau hétérogène), soit la première moitié (arrondi à l'unité inférieure) des joueurs résidents dans un niveau homogène ou résiduel (voir B.2).  \nS2 : deuxième sous-groupe du niveau d'appariement. Il contient tous les joueurs résident qui ne sont pas dans le groupe S1 (voir B.2)"], "ground_truth": "Absolue : une préférence couleur qui ne peut être remise en cause (voir C.3) à l'exception des top joueurs (voir A.7, C.8, C.9)."}
{"question": "Qu'est-ce que le candidat?", "answer": "", "contexts": ["- 5.6. Des droits de titre devront être versés conformément au règlement financier de la FIDE.\n- 5.6.1. La fédération nationale est responsable du paiement de ces frais.\n- 5.6.2. Dans le cas décrit à l'article 5.2.2, le candidat est responsable du paiement de ces frais.\n- 5.7. Un délai de 45 jours est fixé pour que les candidatures soient examinées correctement.\n- 5.8. Toutes les candidatures seront diffusées en détail sur le site internet de la FIDE pendant un minimum de 60 jours avant leur validation. Ceci afin de permettre d'éventuelles objections."], "ground_truth": "le candidat est responsable du paiement de ces frais."}
{"question": "Que precise de A03_2025_26_Championnat_de_Fra?", "answer": "", "contexts": ["## 3.2 Couleurs  \nL'équipe première nommée dans les appariements des rencontres a les blancs sur les échiquiers impairs et les noirs sur les échiquiers pairs.  \nLors de la phase finale, le mieux classé lors de la première phase a les blancs sur les échiquiers impairs. Toutefois, si 2 équipes se sont déjà rencontrées lors de la première phase, alors les couleurs sont inversées pour la phase finale. Pour les parties Armageddon de la phase finale, le vainqueur du tirage au sort choisit sa couleur."], "ground_truth": "Lors de la phase finale, le mieux classé lors de la première phase a les blancs sur les échiquiers impairs."}
{"question": "Qu'est-il permis de faire selon R02_2025_26_Regles_generales_A?", "answer": "", "contexts": ["## 1. Appels sportifs  \nEn règle générale et dans toutes les compétitions, il peut être fait appel, dans le cadre de l'article 9.5 du Règlement intérieur, auprès de la commission d'appels sportifs (CAS) des décisions d'arbitres, des directions de groupe, des directions de la compétition et, dans le cadre de l'article 9.2.1 du Règlement Intérieur, de la commission technique fédérale.  \nSous peine d'irrecevabilité, l'appel doit être formulé par voie postale ou électronique dans un délai de dix jours à compter de la date de réception de la décision contestée."], "ground_truth": "Appels sportifs  \nEn règle générale et dans toutes les compétitions, il peut être fait appel, dans le cadre de l'article 9.5 du Règlement intérieur, auprès de la commission d'appels sportifs (CAS) des décisions d'arbitres, des directions de groupe, des directions de la compétition et, dans le cadre de l'article 9.2.1 du Règlement Intérieur, de la commission technique fédérale."}
{"question": "Quelle règle est énoncée à la page 143?", "answer": "", "contexts": ["## S ystèmes d'assistance vidéo pour les tournois  \nD'après le texte C.12 Video assistance system for tournaments approuvé par le conseil de la FIDE le 29/07/2024  \n1. Un système d'assistance vidéo est un ensemble de dispositifs d'enregistrement vidéo destinés à enregistrer le déroulement en images d'une partie d'échecs.\n2. Pour être considéré comme un système d'assistance vidéo, les dispositions suivantes doivent obligatoirement être vérifiées.\n3. 2.1. Tous les appareils doivent appartenir à l'équipe d'organisation, être installés et paramétrés par cette même équipe conformément aux consignes de l'arbitre en chef.  \n- 2.2. Les dispositifs doivent être placés de manière à ne gêner aucun des joueurs et joueuses et être placés entre eux. Tous les échiquiers doivent être filmés sous le même angle, qui ne peut pas changer pendant le tournoi, afin d'assurer une vue dégagée de l'éc hiquier et de la pendule.\n- 2.3. Les dispositifs doivent être installés dans le seul but de fournir une assistance vidéo aux arbitres et non aux autres objectifs, y compris la retransmission dans les médias et la presse.\n- 2.4. L'enregistrement doit commencer avant de début de la session de jeu et s'arrêter uniquement après que la dernière partie soit terminée.\n- 2.5. L'unité centrale (ordinateur relié à l'enregistrement) ne doit pas être placée dans l'aire de jeu à proximité des joueurs et joueuses : l'écran permettant de visualiser l'enregistrement ne doit être visible/accessible depuis aucune position possible des joueurs et joueuses.  \n2.6."], "ground_truth": "Pour être considéré comme un système d'assistance vidéo, les dispositions suivantes doivent obligatoirement être vérifiées."}
{"question": "Quelle règle est énoncée à la page 8?", "answer": "", "contexts": ["- o A l'égard des autres arbitres ou de la Fédération Française d'Echecs ;  \n- o A l'encontre des organisateurs des tournois pour lesquels il officie ;  \n- o A l'encontre des joueurs, joueuses et de leurs soutiens.  \n- S'interdire tout conflit d'intérêt :  \n- o Interdiction de participer à des paris sportifs sur la compétition ;  \n- o R efuser tout cadeau d'une valeur inappropriée ;  \n- o Ne jamais exprimer de préférence en faveur d'un des adversaires.  \n- Participer à l'instauration d'un climat de confiance et de sécurité au sein de la compétition ;  \n- Faire preuve d'un esprit de sportivité et promouvoir les valeurs du sport tel le respect, le fair-play et la responsabilité."], "ground_truth": "- S'interdire tout conflit d'intérêt :  \n- o Interdiction de participer à des paris sportifs sur la compétition ;  \n- o R efuser tout cadeau d'une valeur inappropriée ;  \n- o Ne jamais exprimer de préférence en faveur d'un des adversaires."}
{"question": "Qu'est-ce que le résultat?", "answer": "", "contexts": ["Cette règle n'est applicable que si l'article 9.1.1 (ne pas accepter une partie nulle par accord mutuel avant un nombre déterminé de coups) n'est pas utilisé.  \nLa meilleure façon de mettre fin à une partie et d'en confirmer le résultat est de l'écrire sur la feuille de partie (s'il y en a une - voir article 8) et que les deux adversaires la signent. Cela constitue alors un document officiel en cas de litige même si les joueuses et les joueurs peuvent encore faire des réclamations, des erreurs peuvent être commises et que le résultat n'est définitif que si l'arbitre le valide."], "ground_truth": "le résultat est de l'écrire sur la feuille de partie (s'il y en a une - voir article 8) et que les deux adversaires la signent."}
{"question": "Quelle règle est énoncée à la page 3?", "answer": "", "contexts": ["## 2.7.1. Tournoi de type A ou B :  \nLe Comité Directeur de la FFE fixe le montant des droits d'homologation. Ils sont indiqués dans le document « tarifs fédéraux ».  \nLes droits d'inscriptions et d'homologation sont à régler directement à la FFE.  \nSont exonérés des droits d'homologation :  \n- Les compétitions fédérales ;\n- Les tournois fermés organisés en partenariat avec la FFE."], "ground_truth": "Ils sont indiqués dans le document « tarifs fédéraux »."}
{"question": "Quelle est la durée mentionnée dans ce règlement?", "answer": "", "contexts": ["## 10.1. Le stage d'arbitre jeune (SJ)  \nLe stage SJ, d'une durée de 14 heures (2 jours), permet de préparer le titre d'arbitre jeune.  \nThèmes essentiels du stage SJ :  \nIl est essentiellement axé sur l'enseignement des règles du jeu. S'y ajoutent des cours portant notamment sur les spécificités des compétitions jeunes et scolaires, sur la philosophie de l'arbitrage, sur le réglage des pendules, sur le règlement intérieur de la D.N.A.  \nLe stage SJ est ouvert à tout licencié A âgé de 11 à 16 ans."], "ground_truth": "Le stage d'arbitre jeune (SJ)  \nLe stage SJ, d'une durée de 14 heures (2 jours), permet de préparer le titre d'arbitre jeune."}
{"question": "Qu'est-ce que les clubs?", "answer": "", "contexts": ["## 3.4 Statut des joueurs et des joueuses -homologation  \nLa Commission Technique fédérale se prononce sur le statut et la qualification des joueurs et joueuses :  \n- Avant le début de la saison, à la demande du club où est (sera) prise la licence ;\n- À tout moment, mais au plus tard dans les trente jours suivant la tenue du championnat, à la demande du club où est (sera) prise la licence, d'un autre club, de l'arbitre en chef, la Direction Technique Fédérale, du Comité Directeur.  \nLes clubs sont responsables de la qualification de leurs joueurs et joueuses (article 2 des Règles Générales)."], "ground_truth": "Les clubs sont responsables de la qualification de leurs joueurs et joueuses (article 2 des Règles Générales)."}
{"question": "Que se passe-t-il en cas de départage sur l'échiquier?", "answer": "", "contexts": ["## 3.3. Classement  \nLe classement est établi d'abord au nombre de points.  \nPour les titres de Champion et Championne de France, et pour toutes les places ex-æquo, le départage se fait en utilisant dans l'ordre :  \n- Le Buchholz tronqué ;\n- Le Buchholz ;\n- La performance.  \nEn cas d'ex-æquo pour les places qualificatives départementales ou de zones interdépartementales, le départage doit se faire soit par le système de départage sur l'échiquier, conformément à l'article 3.4, soit par le système de départage appliquant le Buchholz tronqué, le Buchholz, puis la performance, l'arbitre pouvant, le cas échéant, adapter le système de départage à la structure du tournoi.  \nEn cas de départage sur l'échiquier, c'est le résultat de ces matchs qui détermine le classement de tous les joueurs et joueuses ayant participé.  \nIl est impératif d'indiquer sur le règlement du tournoi qualificatif le système adopté."], "ground_truth": "En cas de départage sur l'échiquier, c'est le résultat de ces matchs qui détermine le classement de tous les joueurs et joueuses ayant participé."}
{"question": "Que se passe-t-il en cas de refus?", "answer": "", "contexts": ["## ELO RAPIDE  \n- 1199 pour les vétérans, seniors plus et seniors\n- 1199 pour les U20, U18, et U16\n- 999 pour les U14 et U12\n- 799 pour les U10 et U8  \nUn joueur ou joueuse dont le ELO descend en dessous du plancher ELO de la FIDE aura obligatoirement un ELO estimé à 1399 quel que soit son âge.  \nAu moment de la prise de licence, un club peut toutefois demander pour un joueur ou joueuse n'ayant de classement, un autre Elo qui sera accepté ou refusé après examen des pièces justificatives jointes à l'envoi de prise de licence. En cas de refus, l'Elo estimé attribué sera celui correspondant à la catégorie du joueur ou joueuse.  \nLes tranches des Elo estimés doivent s'échelonner de 50 points en 50 points (exemples : 1449, 1499, 1549, ...).  \nDans tous les cas, jusqu'à parution sur le site de la FFE de la licence, l'Elo officiel est celui correspondant à l'Elo estimé de la catégorie du joueur ou la joueuse."], "ground_truth": "En cas de refus, l'Elo estimé attribué sera celui correspondant à la catégorie du joueur ou joueuse."}
{"question": "Qu'est-ce que la deuxième?", "answer": "", "contexts": ["## 1.2 Déroulement de la compétition  \nLe championnat se joue par équipes de clubs. Un club ne peut engager plus de 2 équipes. S'il reste de s places à pourvoir à la fin de la procédure d'inscription, une nouvelle étape d'inscription sera ouverte sans limitation d'équipes par club.  \nLa compétition est organisée en deux phases :  \n- Première phase : en système suisse en 15 rondes,\n- Phase finale : Après la dernière ronde en système suisse, les 4 premières équipes des trois catégories (A, B, C), disputent une phase à élimination directe en demi-finales et finale pour déterminer les 4 premières places de leur catégorie. Un seul match est disputé dans chacune des rencontres, la première équipe rencontrant la quatrième tandis que la deuxième est appariée à la troisième. Les équipes gagnantes jouent la finale pour le titre tandis que les perdants disputent un match de classement pour la troisième place.\n- En cas de match nul lors de la phase finale, un des échiquiers du match est tiré au sort afin de disputer une partie unique en Armageddon. Les deux joueurs ayant joué sur l'échiquier concerné procèdent à un tirage au sort. Le vainqueur du tirage choisit sa couleur."], "ground_truth": "la deuxième est appariée à la troisième."}
{"question": "Quelle règle est énoncée à la page 23?", "answer": "", "contexts": ["## Art. 13-3 - Bilan et clause de revoyure  \nChaque année, un bilan de l'exécution du présent contrat sera réalisé conjointement par les Parties. Il est l'occasion d'une évaluation réciproque des engagements.  \nA cette occasion, la version définitive de la stratégie nationale est annexée au contrat de délégation .  \nA cette occasion, le ministre chargé des sports peut demander des éléments à la fédération ou aux commissions indépendantes.  \nDe même, la fédération peut demander des éléments au ministère chargé des sports ou ses opérateurs la concernant."], "ground_truth": "Il est l'occasion d'une évaluation réciproque des engagements."}
{"question": "Qu'est-ce que une pièce?", "answer": "", "contexts": ["| Période | 8.6 | Une phase de la partie, où les joueurs et joueuses doivent achever un nombre de coups ou tous les coups dans un temps donné. |\n| Pièce | 2.1 | L'une des 32 figurines sur l'échiquier. Ou 2. Une dame, une tour, un fou ou un cavalier |\n| Pièce mineure | | Fou ou cavalier |\n| Pièce touchée, pièce jouée | 4.3 | Si un joueur ou une joueuse touche une pièce dans l'intention de la jouer, il doit la déplacer. |\n| Points | 10 | Normalement un joueur ou une joueuse marque 1 point pour une victoire, 1⁄2 point pour une nulle, 0 pour une défaite. Une alternative est 3 pour une victoire, 1 pour une nulle, 0 pour une défaite. |\n| Position morte | 5.2.2 | Lorsqu'aucun des deux adversaires ne peut mater le roi adverse par aucune suite de coups légaux. |\n| Prise | 3.1 | Quand une pièce est déplacée de sa case vers une case occupée par une pièce adverse, cette dernière est retirée de l'échiquier. Voir aussi 3.7.4. En notation : x |\n| Promotion | 3.7.5 | Lorsqu'un pion atteint la huitième rangée et qu'il est remplacé par une nouvelle pièce (dame, tour, fou, cavalier) de la mêmecouleur. |\n| Rangée | 2.4 | Une ligne horizontale de 8 cases sur l'échiquier. |\n| Réclamation/demande | 6.8 | Le joueur ou la joueuse peut faire une réclamation/demande à l'arbitre dans diverses circonstances. |"], "ground_truth": "une pièce est déplacée de sa case vers une case occupée par une pièce adverse, cette dernière est retirée de l'échiquier."}
{"question": "Qu'est-ce que le joueur peut faire?", "answer": "", "contexts": ["- Violations des règles techniques en ligne : celles liées au système de visioconférence utilisé pour superviser la compétition, par exemple, les déconnexions, le fait de jouer sans caméra allumée, sans écran partagé, sans microphone allumé (si le règlement de la compétition l'exige) ne permettent pas en soi de supposer qu'une infraction de tricherie a été commise, mais le joueur peut être pénalisé en conséquence.\n5. Présomption de tricherie : il y aura une présomption de tricherie si l'analyse statistique par un algorithme validé et approuvé par la FIDE et/ou une autre méthodologie appliquée à la performance d'un joueur/d'une joueuse dans une partie unique, ou une série de parties ou de tournois montre un Z-score (reflétant l'écart entre la performance réelle du joueur et le niveau de jeu projeté pour un joueur/une joueuse ayant un classement Elo comparable) au-dessus du seuil officiel du Z-score.\n10. Dans un tel cas, si la FIDE engage une procédure disciplinaire à l'encontre du joueur/de la joueuse en question, la charge de réfuter la présomption de tricherie et de démontrer son innocence incombe au joueur/à la joueuse."], "ground_truth": "le joueur peut être pénalisé en conséquence."}
{"question": "Quelle règle est énoncée à la page 108?", "answer": "", "contexts": ["## Comment utiliser les tableaux ?  \nLes tableaux d'appariements ci -après organisent des tournois en 2 (4, 6, ...) rondes. Ces rondes sont interdépendantes et doivent obligatoirement se jouer par deux.  \nÀ ces rondes est adjointe une ronde dite autonome. Celle-ci peut être utilisée :  \n- Pour organiser un tournoi à une seule ronde.\n- Pour organiser un tournoi avec un nombre impair de rondes. Il suffit pour cela de prendre un tournoi à 2;4 ou 6 rondes et de lui ajouter la ronde autonome.  \nDans le corps des tableaux, les lettres représentent les équipes et les numéros représentent leurs membres.  \nEn ce qui concerne les appariements proprement dits, le premier nommé a les blancs.  \nL'exemple « Echiquier N°3.C2-A2 » indique donc que, sur le 3e échiquier, le 2e membre de l'équipe C a les blancs en face du 2e membre de l'équipe A.  \nLes tableaux établis pour 3, 4, 5 et 7 équipes sont complets et pratiquement équivalents aux « toutes rondes » , avec la différence qu'ils gagnent une ronde lorsque le nombre d'équipes est impair. Tous les autres tableaux sont établis pour organiser des tournois en 1, 2 ou 3 rondes seulement.  \nIl est possible cependant d'élever le nombre de tous les tableaux à volonté.  \nLes tableaux mis à disposition par la Direction Nationale de l'arbitrage ont été construits en novembre 1991, par l'arbitre international Jean-Claude Templeur, grâce aux documents originaux datés de 1978 fournis par Charles Molter, et sous son contrôle."], "ground_truth": "Ces rondes sont interdépendantes et doivent obligatoirement se jouer par deux."}
{"question": "Qu'est-ce que le roi?", "answer": "", "contexts": ["- 3.7.3.4. Le choix du joueur ou de la joueuse n ' est pas restreint aux pièces capturées précédemment.\n- 3.7.3.5. Ce remplacement d ' un pion par une autre pièce est appelé promotion. La nouvelle pièce issue de cette promotion est immédiatement active.  \nDans le cas d'une promotion, si le joueur ou la joueuse ne trouve pas la pièce nécessaire, il/elle a le droit d e mettre immédiatement la pendule en pause et d'appeler l'arbitre pour qu'on lui apporte la pièce qu'il /elle désire. L'arbitre doit fournir la pièce demandée et redémarrer la pendule. Le joueur ou la joueuse continue alors de réfléchir à son coup. Il/Elle n'a pas l'obligation de faire la promotion en utilisant la pièce demandée.  \n- 3.8. Le roi peut se déplacer de deux façons différentes :\n- 3.8.1. En se déplaçant sur une case adjacente\n- 3.8.2. En « roquant ». C'est un mouvement combiné du roi et de l' une des tours de même couleur le long de la première rangée du joueur ou de la joueuse. Le roque compte pour un seul coup, il est joué de la façon suivante : le roi est déplacé de deux cases depuis sa case initiale vers une tour située sur sa case initiale, puis cette tour est déplacée sur la case que le roi vient de traverser.\n- 3.8.2.1. Le droit de roquer est définitivement perdu :\n- 1) Si le roi s ' est déjà déplacé, ou\n- 2) Avec une tour qui s ' est déjà déplacée.\n- 3.8.2.2. Le roque est temporairement interdit :"], "ground_truth": "le roi est déplacé de deux cases depuis sa case initiale vers une tour située sur sa case initiale, puis cette tour est déplacée sur la case que le roi vient de traverser."}
{"question": "Que doit-on faire selon l'article mentionné dans J02_2025_26_Championnat_de_Fra?", "answer": "", "contexts": ["## 3.9. Litiges techniques  \nLorsqu'un litige technique survient en cours de partie, celle-ci doit toujours être poursuivie en appliquant les directives de l'arbitre. Un appel des décisions de l'arbitre peut être interjeté.  \nLa ou le capitaine ou le responsable de l'équipe plaignante rédige alors une réclamation.  \nL'arbitre et la ou le capitaine de l'équipe adverse rédigent chacun un rapport donnant leur propre version des faits. Tous ces documents sont transmis avec le procès-verbal du match, à la direction du groupe.  \nPour la phase finale du Top Jeunes, une commission des litiges du tournoi sera formée par l'arbitre principal. Sa composition sera la suivante :  \n- La direction de la compétition ;\n- Un membre du comité d'organisation ;\n- Un joueur ou une joueuse choisi dans les équipes non impliquées dans le litige ;\n- Un ou une entraîneur choisi dans les équipes non impliquées dans le litige ;\n- L'arbitre principal avec voix consultative.  \nUn membre ne peut statuer sur une affaire impliquant le club auquel il appartient."], "ground_truth": "Litiges techniques  \nLorsqu'un litige technique survient en cours de partie, celle-ci doit toujours être poursuivie en appliquant les directives de l'arbitre."}
{"question": "Qu'est-il interdit de faire selon 2022_Reglement_medical_1908202?", "answer": "", "contexts": ["| 4.2 | Substances interdites........................................................................................................... 5 |\n| | 4.3 Autorisation d'usage à des fins thérapeutiques (AUT)........................................................ 5 |\n| | 4.3.1 Objet......................................................................................................................... 5 |\n| | 4.3.2 AUT préalable........................................................................................................... 5 |\n| | 4.3.3 AUT à effet rétroactif................................................................................................ 6 |\n| 5 | Surveillance des joueurs et joueuses de niveau international..................................................... 6 |\n| 6 | Surveillance médicale des compétitions ...................................................................................... 6 |\n| 7 | Annexes.....................................................................................................................................................7 |"], "ground_truth": "| 4.2 | Substances interdites..........................................................................................................."}
{"question": "Qu'est-ce que les deux?", "answer": "", "contexts": ["Dans les règles du jeu d'échecs, l'incrément et le temps différé sont traités de la même manière. Par exemple, lorsqu'on calcule la durée d'une session de jeu, les deux sont multipliés par 60 pour trouver le temps total.  \nCADENCE FISCHER : Un temps fixe supplémentaire (incrément) est ajouté au temps principal de réflexion des joueurs/joueuses à chaque coup achevé. L'incrément pour le premier coup est ajouté avant le début de la partie. Si un joueur/une joueuse joue rapidement alors son temps restant peut augmenter.  \nIl existe deux types de cadences en temps différé, Bronstein et Simple (ou US). Avec le délai, un joueur/une joueuse ne peut jamais augmenter son temps au-delà de celui qu'il avait au début d'un coup. Si l'horloge est pressée avant que tout le temps de bonus ait été utilisé alors le temps de bonus restant est perdu.  \nLes deux méthodes de temps différé ont le même effet global.  \nCADENCE DELAY - SIMPLE : La pendule affiche le temps principal. Un autre affichage montre le compte à rebours du temps bonus, ce n'est que lorsque celui -ci est épuisé que le temps principal commence à diminuer.  \nCADENCE BRONSTEIN DELAY : Dans ce mode, le bonus est ajouté au temps principal et la pendule commence immédiatement le compte à rebours.  \n- 6.4. Immédiatement après la chute d'un drapeau, les exigences de l'Article 6.3.1 doivent être contrôlées."], "ground_truth": "les deux sont multipliés par 60 pour trouver le temps total."}
{"question": "Quelle règle est énoncée à la page 7?", "answer": "", "contexts": ["| Te sens-tu triste ou inquiet ? | | |\n| Pleures-tu plus souvent ? | | |\n| Ressens-tu une douleur ou un manque de force à cause d'une blessure que tu t'es faite cette année ? | | |\n| Aujourd'hui | | |\n| Penses-tu quelquefois à arrêter de faire du sport ou à changer de sport ? | | |\n| Penses-tu avoir besoin de voir ton médecin pour continuer le sport ? | | |\n| Souhaites-tu signaler quelque chose de plus concernant ta santé ? | | |\n| Questions à faire remplir par tes parents | | |\n| Quelqu'un dans votre famille proche a-t-il eu une maladie grave du cœur ou du cerveau, ou est-il décédé subitement avant l'âge de 50 ans ? | | |\n| Etes-vous inquiet pour son poids ? Trouvez-vous qu'il se nourrit trop ou pas assez ? | | |"], "ground_truth": "| | |\n| Pleures-tu plus souvent ?"}
{"question": "Qu'est-ce que le tournoi?", "answer": "", "contexts": ["## Arbitrage  \nLes tournois homologués doivent être, selon leur nature, arbitrés par des arbitres fédéraux. De plus, si le tournoi est homologué FIDE, l'arbitre doit être détenteur ou détentrice d'une licence FIDE et du titre requis par cet organisme (voir le RI de la DNA)."], "ground_truth": "le tournoi est homologué FIDE, l'arbitre doit être détenteur ou détentrice d'une licence FIDE et du titre requis par cet organisme (voir le RI de la DNA)."}
{"question": "Quelle règle est énoncée à la page 4?", "answer": "", "contexts": ["Elles ne peuvent être membre des organes disciplinaires saisis de l'affaire qu'elles ont instruite, ni avoir un intérêt direct ou indirect à l'affaire. Elles sont astreintes à une obligation de confidentialité pour tous les faits, actes et informations dont elles ont connaissance en raison de leurs fonctions. Toute méconnaissance de ces obligations constitue une faute."], "ground_truth": "Elles sont astreintes à une obligation de confidentialité pour tous les faits, actes et informations dont elles ont connaissance en raison de leurs fonctions."}
{"question": "Que se passe-t-il en cas de litige même si les joueuses et les joueurs peuvent encore faire des réclamations?", "answer": "", "contexts": ["Cette règle n'est applicable que si l'article 9.1.1 (ne pas accepter une partie nulle par accord mutuel avant un nombre déterminé de coups) n'est pas utilisé.  \nLa meilleure façon de mettre fin à une partie et d'en confirmer le résultat est de l'écrire sur la feuille de partie (s'il y en a une - voir article 8) et que les deux adversaires la signent. Cela constitue alors un document officiel en cas de litige même si les joueuses et les joueurs peuvent encore faire des réclamations, des erreurs peuvent être commises et que le résultat n'est définitif que si l'arbitre le valide."], "ground_truth": "en cas de litige même si les joueuses et les joueurs peuvent encore faire des réclamations, des erreurs peuvent être commises et que le résultat n'est définitif que si l'arbitre le valide."}
{"question": "Que se passe-t-il en cas de démission adressée au secrétaire général ou de vacance constatée par le bureau fédéral?", "answer": "", "contexts": ["## 9.9.2 Vacance  \nEn cas de démission adressée au secrétaire général ou de vacance constatée par le bureau fédéral, le poste est pourvu par un vote à bulletin secret lors du plus proche comité directeur sur proposition de tout membre de celui-ci."], "ground_truth": "En cas de démission adressée au secrétaire général ou de vacance constatée par le bureau fédéral, le poste est pourvu par un vote à bulletin secret lors du plus proche comité directeur sur proposition de tout membre de celui-ci."}
{"question": "Combien de coups sont mentionnés dans le règlement?", "answer": "", "contexts": ["- 9.6. Si l'une ou les deux situations suivantes se produisent, alors la partie est nulle :\n- 9.6.1. La même position est apparue, comme en 9.2.2 au moins cinq fois ;\n- 9.6.2. Une suite d'au moins 75 coups a été jouée par chacun des deux adversaires, sans aucun mouvement de pion ni prise. Si le dernier coup produit un mat, celui-ci est prioritaire.  \nEn 9.6.1, les 5 occurrences de la même position n'ont pas à être consécutives.  \nDans les deux articles 9.6.1 et 9.6.2, l'arbitre doit intervenir et arrêter la partie, déclarant la partie nulle.  \nSi le match nul associé à l'un ou l'autre des articles ci -dessus n'est pas remarqué pendant la partie, un des deux adversaires peut faire appel du résultat en utilisant la procédure d'appel normale."], "ground_truth": "75 coups"}
{"question": "Que doit faire l'arbitre d'après A03_2025_26_Championnat_de_Fra?", "answer": "", "contexts": ["## 3.8 Forfaits sportifs  \nDéfinition : voir Règles Générales, article 3.1.1  \nLe retard autorisé est fixé par l'organisateur.  \nUne équipe ayant plus de deux forfaits individuels perd le match avec un score de 3-0 de points de partie.  \nSauf événement exceptionnel dûment justifié reconnu par la direction du championnat, le forfait d'une équipe sans l'annoncer à l'arbitre avant que les appariements de la ronde concernée soient effectués, est sanctionné par une amende de 50 €. Cette équipe ne sera plus réintégré dans le championnat.  \nUne équipe ayant annoncé un forfait pour une ronde avant que les appariements de la ronde concernée soient effectués, peut réintégrer le tournoi uniquement s'il a effectué un forfait pour une seule ronde.  \nUne exclusion du championnat n'annule pas la ou les amendes, qui restent dues par le club à la FFE."], "ground_truth": "Sauf événement exceptionnel dûment justifié reconnu par la direction du championnat, le forfait d'une équipe sans l'annoncer à l'arbitre avant que les appariements de la ronde concernée soient effectués, est sanctionné par une amende de 50 €."}
{"question": "Quelle règle est énoncée à la page 150?", "answer": "", "contexts": ["## 8. Type D : départages utilisant les données associées aux adversaires rencontrés  \nLorsqu'on utilise des départages basés sur le classement Elo des joueurs et joueuses, le règlement spécifique du tournoi doit détailler la manière dont les joueurs et joueuses n'ayant pas de classement seront traités, ou alors l'arbitre en chef doit informer les joueurs et joueuses avant le début du tournoi.  \nNote de traduction : en France on utilise régulièrement la performance comme dernier départage. Le logiciel PAPI utilise un principe de calcul pour les non classés qui est décrit à l'article 15"], "ground_truth": "Note de traduction : en France on utilise régulièrement la performance comme dernier départage."}
{"question": "Quelle règle est énoncée à la page 65?", "answer": "", "contexts": ["## II.2 Contraintes concernant la position initiale  \nLa position initiale d'une partie de Chess960 doit satisfaire à certaines règles. Comme au Jeu d'Échecs standard, les pions blancs sont placés sur la deuxième rangée. Les autres pièces blanches sont placées au hasard sur la première rangée mais en respectant les restrictions suivantes :  \n- II.2.1. le roi est placé quelque part entre les deux tours, et\n- II.2.2. les fous sont placés sur des cases de couleurs opposées, et\n- II.2.3. les pièces noires sont placées face aux mêmes pièces blanches.  \nLa position initiale peut être générée avant la partie par un programme informatique ou bien à l'aide de dés, de pièces, de cartes, etc."], "ground_truth": "Les autres pièces blanches sont placées au hasard sur la première rangée mais en respectant les restrictions suivantes :  \n- II.2.1."}
{"question": "Qu'est-ce que la Fédération?", "answer": "", "contexts": ["- 1.13.2. L'administrateur du classement FIDE peut enregistrer de nouveaux joueurs dans des circonstances spéciales seulement, dans les événements de la FIDE. Dans ce cas, l'arbitre en chef et l'organisateur sont chargés de fournir les données correctes des joueurs. Les événements FIDE sont toutes les compétitions sous l'égide de :\n- a) la Commission du Championnat du monde &amp; Olympiades ou la Commission des Événements,\n- b) les compétitions continentales qui fournissent des qualifiés à l'une des compétitions susmentionnées,\n- c) les événements énumérés et décrits en détail dans différentes parties du Manuel de la FIDE.\n- 1.13.3. Les nouveaux joueurs peuvent s'inscrire eux-mêmes sur la zone de jeu en ligne de la FIDE (FOA). Ces joueurs ne sont pas associés à une Fédération nationale, mais le drapeau de la FIDE (FID) leur est attribué jusqu'à ce qu'ils deviennent membres d'une fédération nationale.\n- 1.13.4. Quand un enfant s'inscrit à sm.fide.com il se verra attribuer un ID FIDE. Si cette personne a déjà un ID FIDE avant l'enregistrement, sa référence FIDE sera conservée, aucune nouvelle référence ne lui sera donnée. Après la mise à niveau vers Premium sur sm.fide.com, un enfant obtient un classement CiS (CiS rating).\n- 1.14. Toutes les données des joueurs sont obligatoires pour l'inscription en ligne à la FOA. Pour les joueurs enregistrés par les responsables nationaux du classement ou par l'administrateur FIDE, prénom, nom, sexe, date de naissance, adresse e-mail et la Fédération sont obligatoires pour valider l' enregistrement."], "ground_truth": "la Fédération sont obligatoires pour valider l' enregistrement."}
{"question": "Que doit-on faire selon l'article mentionné dans R01_2025_26_Regles_generales.p?", "answer": "", "contexts": ["## 12. Arbitrage  \nPour arbitrer une compétition fédérale :  \n- Un ou une arbitre de la FIDE (FA) ou arbitre international (IA) de nationalité française, doit avoir une licence d'arbitre de la FFE en cours.\n- Un ou une arbitre FA ou IA n'ayant pas le code FRA auprès de la FIDE, doit avoir passé avec succès les examens permettant d'obtenir le titre d'arbitre fédéral de la FFE.\n- Un ou une arbitre ayant l'agrément de la FIDE (titre FIDE : NA ), doit avoir une licence d'arbitre de la FFE pour arbitrer une compétition fédérale."], "ground_truth": "Arbitrage  \nPour arbitrer une compétition fédérale :  \n- Un ou une arbitre de la FIDE (FA) ou arbitre international (IA) de nationalité française, doit avoir une licence d'arbitre de la FFE en cours."}
{"question": "Qu'est-ce que le score?", "answer": "", "contexts": ["## 7.3. Détermination du changement de classement pour les joueurs et joueuses classés (Voir Exemple)  \n- 7.3.1. Pour chaque partie jouée contre une personne classée, on détermine la différence de classement avec elle, D.  \nUne différence de classement de plus de 400 points est comptabilisée pour le calcul du classement comme s'il s'agissait d'une différence de 400 points.  \n(Depuis décembre 2024) Les parties jouées entre deux adversaires ayant une différence de classement supérieure ou égale à 600 ne seront pas comptabilisées si au moins l'un des deux joueurs à un classement supérieur à 2600.  \n- 7.3.2. (a) Utiliser le tableau 8.1.2 pour déterminer la probabilité de score PD pour chaque partie.\n- (b) ∆R = score PD. Pour chaque partie, le score est 1, 0.5 ou 0.\n- (c) Σ∆R = la somme des ∆R pour un tournoi ou une période de classement.\n- (d) Σ∆R x K = la variation de Classement pour un tournoi ou une période de classement.  \n7.3.3. K est le coefficient de développement.  \n- ➔ K = 40 pour une personne nouvelle dans la liste de classement jusqu'à ce qu'elle ait terminé des manifestations représentant au moins 30 parties.\n- ➔ K = 20 tant que le classement du joueur ou de la joueuse reste au-dessous de 2400."], "ground_truth": "le score est 1, 0."}
{"question": "Combien de secondes sont mentionnés dans le règlement?", "answer": "", "contexts": ["- 8.3. Les feuilles de partie sont la propriété de l'organisateur ou l' organisatrice de la compétition. Une feuille de partie électronique présentant un défaut évident sera remplacée par l'arbitre.  \nUn joueur ou une joueuse ne doit pas garder l'original de sa feuille de partie, sauf si le règlement de la compétition en décide autrement. Elle appartient à l'organisateur ou à l'organisatrice . Il/Elle doit la donner à l'arbitre dès la fin de la partie et il/elle peut garder la copie (s'il y en a une).  \n- 8.4. Si un joueur ou une joueuse dispose de moins de cinq minutes à sa pendule au cours d'une période de jeu donnée et ne bénéficie pas d'un temps additionnel de 30 secondes ou plus à chaque coup, alors pour le reste de la période il/elle n'est pas dans l'obligation de respecter les exigences de l'Article 8.1.1."], "ground_truth": "30 secondes"}
{"question": "Que precise de 2024_Statuts20240420?", "answer": "", "contexts": ["## 8.1 Composition  \nLe bureau fédéral comprend entre 6 et 8 membres tous pris au sein du comité directeur : le président, au moins un vice-président, le secrétaire général et un éventuel secrétaire adjoint, le trésorier et un éventuel trésorier adjoint, ainsi que d'éventuels membres conseillers. Les représentants des sportifs de haut niveau mentionnés à l'article 7.1 des présents statuts en sont par ailleurs membres de droit.  \nL'écart entre le nombre d'hommes et de femmes ne peut être supérieur à un.  \nDès son élection, le président propose la composition du bureau fédéral au comité directeur qui doit la ratifier par un vote au scrutin secret. Le président peut à tout moment et dans les mêmes conditions le recomposer pour la durée restante du mandat qui s'éteint avec celui du comité directeur.  \nLes postes vacants au bureau fédéral avant l'expiration de son mandat sont pourvus lors du plus proche comité directeur dans les mêmes conditions que pour sa formation initiale. La vacance résulte soit de la démission, soit de l'incapacité d'exercer les fonctions.  \nUn membre du bureau fédéral démis de ses fonctions ou y renonçant reste membre du comité directeur."], "ground_truth": "Les représentants des sportifs de haut niveau mentionnés à l'article 7.1 des présents statuts en sont par ailleurs membres de droit."}
{"question": "Qu'est-ce que la session?", "answer": "", "contexts": ["## 4.1.2. Séminaire de certification d'Arbitre International  \nLe séminaire de certification d'Arbitre International est une session d'entraînement pour les Arbitres FIDE actifs.  \nLe but de ce second niveau d'entraînement des arbitres est de s'assurer que le candidat est prêt à demander le titre d'IA, en termes de compétences techniques et d'expérience pratique.  \nLes cours et évaluations d'un séminaire d'arbitre international doivent être conformes avec l'article 1.2.1. La session est effectuée par deux (2) formateurs FIDE, dont un est le formateur principal.  \nLa session est conclue par une évaluation de l'aptitude. Les stagiaires qui sont déclarés prêts après évaluation se voient accorder une norme d'Arbitre International de séminaire."], "ground_truth": "La session est effectuée par deux (2) formateurs FIDE, dont un est le formateur principal."}
{"question": "Quelle obligation est énoncée à la page 15?", "answer": "", "contexts": ["## 9.3.2 Composition  \nLa direction nationale de l'arbitrage comprend huit à dix membres. Le directeur national de l'arbitrage est désigné par le président de la FFE, il propose les huit membres restants. Cette proposition doit être approuvée par le président et le comité directeur."], "ground_truth": "Cette proposition doit être approuvée par le président et le comité directeur."}
{"question": "Qu'est-ce que le coupe?", "answer": "", "contexts": ["## 3.4. Matchs de départage  \nLors des phases qualificatives départementales et des zones interdépartementales, les CDJE et Ligues peuvent choisir la cadence la plus appropriée en fonction des possibilités, depuis le blitz à la cadence de 3 min + 2 sec. /coup au rapide à la cadence de 15 min + 10 sec. /coup, tout en essayant, dans la mesure du possible, de tendre vers les modalités ci-après. Lorsque la cadence du blitz est choisie, les départages doivent se faire en match aller-retour.  \n- S'il n'y a que 2 joueurs/joueuses ex-æquo, le match se fait en parties à la cadence de 15 min. + 10 sec / coup en rencontres aller-retour avec couleurs inversées. En cas d'égalité à l'issue de ce match, un nouveau départage en blitz a lieu, en rencontres aller-retour à la cadence de 3 min. + 2 sec. / coup, avec couleurs inversées. En cas d'égalité, le match est rejoué.\n- S'il y a 3 ou 4 joueurs/joueuses ex-æquo, un tournoi toutes rondes en parties de 15 min. + 10 sec. est organisé. En cas d'égalité de 2, 3 ou 4 personnes à l'issue de ce match, une formule coupe est organisée entre les exæquo suivant les modalités du paragraphe ci-dessous."], "ground_truth": "le coupe est organisée entre les exæquo suivant les modalités du paragraphe ci-dessous."}
{"question": "Combien de minutes sont mentionnés dans le règlement?", "answer": "", "contexts": ["## 1. Cadence de Jeu  \n- 1.1. Pour qu'une partie soit prise en compte, chacun des deux adversaires doit avoir une des périodes minimales suivantes pour compléter tous les coups, en supposant que la partie se termine en 60 coups.\n- ➔ Quand , lors d'une partie, au moins un des deux adversaires possède un classement de 2400 ou plus, chacun doit disposer d'un minimum de 120 minutes.\n- ➔ Quand , lors d'une partie au moins un des deux adversaires possède un classement de 1800 ou plus, chacun doit disposer d'un minimum de 90 minutes.\n- ➔ Quand , lors d'une partie, les deux adversaires possèdent des classements en-dessous de 1800, chacun doit disposer d'un minimum de 60 minutes.\n- 1.2. Quand un certain nombre de coups est spécifié pour le premier contrôle de temps, il sera d'au moins 30 coups."], "ground_truth": "120 minutes"}
{"question": "Qu'est-ce que la ronde?", "answer": "", "contexts": ["## 6.7. Délai de forfait :  \n- 6.7.1. Le règlement d'une compétition doit spécifier à l'avance un délai de forfait. Si aucun délai de forfait n'est indiqué, celui-ci est égal à zéro. Tout joueur ou joueuse qui arrive devant son échiquier après le délai de forfait perd la partie, à moins que l'arbitre n'en décide autrement.\n- 6.7.2. Si le règlement d'une manifestation spécifie que le délai de forfait est différent de zéro et qu'aucun des deux adversaires n'est présent initialement, l a personne ayant les blancs perd tout le temps écoulé jusqu'à ce qu' elle arrive, à moins que les règles de la compétition ne spécifient autre chose ou que l'arbitre ne décide autrement.  \nLe début de la ronde est le moment où l'annonce est faite par l'arbitre. Si le délai de forfait est zéro, l'arbitre doit déclarer la partie perdue pour les joueurs et joueuses qui ne sont pas présents/présentes à leur échiquier.  \nIl est préférable d'afficher un grand dispositif de compte à rebours numérique sur le lieu de la compétition. Pour les événements FIDE avec moins de 30 joueurs, une annonce doit être faite cinq minutes avant le début de la ronde et une minute avant le début de la partie.  \nAutrement, une horloge doit être accrochée au mur à l'intérieur du lieu de la compétition et indiquer l'heure officielle du tournoi."], "ground_truth": "la ronde est le moment où l'annonce est faite par l'arbitre."}
{"question": "Quelle règle est énoncée à la page 6?", "answer": "", "contexts": ["## ARTICLE 18 - DEROULEMENT DE LA PROCEDURE D'APPEL  \nL'organe disciplinaire d'appel statue en dernier ressort.  \nIl se prononce au vu du dossier de première instance et des productions d'appel, dans le respect du principe du contradictoire.  \nLe président de séance ou la personne qu'il désigne, établit un rapport exposant les faits et rappelant les conditions du déroulement de la procédure. Ce rapport est présenté oralement en séance. Les dispositions des articles 12 à 15 ci-dessus sont applicables devant l'organe disciplinaire d'appel."], "ground_truth": "Le président de séance ou la personne qu'il désigne, établit un rapport exposant les faits et rappelant les conditions du déroulement de la procédure."}
{"question": "Quelle règle est énoncée à la page 2?", "answer": "", "contexts": ["## 2.2.2. Article 7.5.5 adapté sur les coups illégaux en cadence rapide :  \nPour les compétitions scolaires ainsi que pour les catégories U8, U8F, U10 et U10F des qualifications départementales et régionales du championnat de France Jeunes, organisées en France et prises en compte uniquement pour le Elo rapide National, la partie sera perdue après le 3e coup illégal achevé. Dans le cas d'un rapide homologué FIDE, c'est la règle de la FIDE qui s'applique, à savoir, perte après le 2e coup illégal achevé. Les clubs ou organes fédéraux organisateurs de tournois à cadence rapide non homologués FIDE, peuvent adopter cette exception à condition que cela soit précisé dans le règlement intérieur du tournoi."], "ground_truth": "Dans le cas d'un rapide homologué FIDE, c'est la règle de la FIDE qui s'applique, à savoir, perte après le 2e coup illégal achevé."}
{"question": "Quelle restriction est mentionnée dans ce passage?", "answer": "", "contexts": ["5. Les caméras ou autres dispositifs d'enregistrement qui ne respectent pas les articles 1.2 à 1.4 ne sont pas considérés comme un système d'assistance vidéo. Cela n'interdit pas à l'arbitre de les utiliser pour prendre une décision conformément aux règles du jeu d'échecs.\n6. Lorsqu'un système d'assistance vidéo est mis en place, il doit être supervisé par un opérateur/une opératrice ayant reçu une formation appropriée. La décision de mettre en place un système d'assistance vidéo dans un tournoi revient à l'équipe d'organisatio n.\n7. L'opérateur/opératrice doit agir suivant les instructions de l'arbitre en chef et de l'équipe d'organisation, il/elle ne doit pas accepter d'aide de personnes qui ne sont pas des officiels du tournoi et a une obligation de discrétion sur le contenu des ima ges. L'opérateur/opératrice ne doit pas partager les images ni les décrire à qui que ce soit, sauf autorisation particulière de l'équipe d'organisation et de l'arbitre en chef.\n8. L'arbitre en chef et les arbitres préalablement désignés sont les seuls officiels qui peuvent décider d'interrompre une partie pour consulter l'assistance vidéo.\n9. Les joueurs et joueuses n'ont pas le droit d'arrêter la partir pour demander à l'arbitre de vérifier les images, à moins qu'ils ne soulèvent une réclamation régulières basée sur les règles du jeu d'échecs ou d'autres règlements. Après le dépôt d'une réclamation, l'arbitre n'a pas l'obligation de forcément recourir à l'assistance vidéo."], "ground_truth": "Cela n'interdit pas à l'arbitre de les utiliser pour prendre une décision conformément aux règles du jeu d'échecs."}
{"question": "Quelle règle est énoncée à la page 130?", "answer": "", "contexts": ["Par exemple :  \n- A partir de S1, déplacer le 5 vers S2 est mieux que de déplacer le 4 ;\n- Déplacer les 5 et 2 vers S2 est mieux de déplacer le 4 et le 3 ;\n- Déplacer 5-4-1 est mieux que de déplacer 5-3-2 et ainsi de suite).\n- d. Le NAN différent le plus petit parmi ceux déplacés de S2 vers S1.  \nPar exemple :  \n- A partir de S2, déplacer le 6 vers S1 est mieux que de déplacer le 7 ;\n- Déplacer les 6 et 9 vers S2 est mieux de déplacer le 7 et le 8 ;\n- Déplacer 6-7-10 est mieux que de déplacer 6-8-9 et ainsi de suite)."], "ground_truth": "Le NAN différent le plus petit parmi ceux déplacés de S2 vers S1."}
{"question": "Qu'est-ce que les calculs?", "answer": "", "contexts": ["## 1. COMPATIBILITE  \nLa règle de compatibilité appliquée pour le Rapide est de ± 320 points .  \nLe seuil d'entrée au Rapide est de 7 parties compatibles.  \nPlancher Rapide : 800. Les calculs sont publiés mensuellement."], "ground_truth": "Les calculs sont publiés mensuellement."}
{"question": "Quelle obligation est énoncée à la page 82?", "answer": "", "contexts": ["## 7.2. Paramètre de fonctionnement  \nLa qualité d'un échiquier électronique s'évalue par le temps en microseconde pour transmettre et afficher les coups sur un dispositif de contrôle, le temps en microseconde pour la création d'un fichier PGN résumant les informations de la partie et le nombr e d'échiquiers électroniques pouvant être connecté à un unique ordinateur.  \nPendant un tournoi, la priorité reste le confort de jeu des joueurs et joueuses, réparer le dysfonctionnement d'un dispositif électronique de retransmission ne doit pas se faire au détriment de ce confort.  \nL'arbitre et l'équipe d'organisation doivent se concerter sur un éventuel décalage entre le moment du jeu et la retransmission. La retransmission d'une partie ne doit pas commencer en l'absence d'un des deux adversaires."], "ground_truth": "Pendant un tournoi, la priorité reste le confort de jeu des joueurs et joueuses, réparer le dysfonctionnement d'un dispositif électronique de retransmission ne doit pas se faire au détriment de ce confort."}
{"question": "Quelle règle est énoncée à la page 162?", "answer": "", "contexts": ["| Accessibilité | Aides Matérielles |\n| • Vérifier l'accessibilité aux locaux • Vérifier l'accessibilité à la salle • Vérifier l'accessibilité aux sanitaires • Vérifier l'accessibilité à la table de jeux • Vérifier l'accessibilité aux pièces (toutes les pièces ) et à la pendule. • Vérifier l'accessibilité aux informations et leur compréhension • Vérifier la possibilité de manipulation des pièces. | • Aide pour l'accès à la table de jeu. • Possibilité de disposer d'un assistant ou d'une assistante ayant l'agrément de l'arbitre. Ses missions seront définies par l'arbitre en concertation et en respect des règles du jeu (Déplacement des pièces/gestion de la pendule/notation des coups/gestion des réclamations). Il est conseillé de lire l'annexe D.2.10 des règles du jeu pour savoir ce que l'on peut autoriser. • Permettre un accès personnalisé aux affichages liés au tournoi. |"], "ground_truth": "• Vérifier l'accessibilité aux informations et leur compréhension • Vérifier la possibilité de manipulation des pièces."}
{"question": "Quelle règle est énoncée à la page 127?", "answer": "", "contexts": ["## B.1 Définitions des paramètres.  \nB.1.1. M0 est le nombre de flotteurs descendants issus du niveau précédent. Il peut être égal à 0.  \n- B.1.2. MaxPaires est le nombre maximum de paires qui peuvent être appariées dans le niveau étudié (Voir C.5).  \nNote: MaxPaires est habituellement égal au nombre de joueurs divisé par deux et arrondi à l'entier inférieur. Cependant si, par exemple, M0 est supérieur au nombre de joueurs résidents alors MaxPaires est au plus égal au nombre de joueurs résidents  \n- B.1.3. M1 est le nombre maximum de flotteurs descendants issus du niveau précédent pouvant être appariés dans le niveau étudié (voir C.6).  \nNote : M1 est habituellement égal à M0. Toutefois si, par exemple, M0 est plus grand que le nombre de joueurs/joueuses résidents alors M1 est au plus égal au nombre de joueurs/joueuses résidents.  \nM1 ne peut évidemment jamais être plus grand que MaxPaires."], "ground_truth": "MaxPaires est le nombre maximum de paires qui peuvent être appariées dans le niveau étudié (Voir C.5)."}
{"question": "Qu'est-il permis de faire selon 2025_Reglement_Interieur_20250?", "answer": "", "contexts": ["## 5.1.3 Développement  \nPour développer la pratique du jeu d'échecs dans leur ressort géographique, ils entretiennent des relations avec les collectivités territoriales de leur territoire et sont aussi encouragés à initier des projets justifiés par des nécessités locales.  \nAfin de garantir l'application de la politique fédérale au niveau local, une convention d'objectifs peut être conclue, au début de chaque saison sportive, entre la FFE, les ligues régionales et éventuellement les comités départementaux qui s'y rattachent.  \nCette convention établit les différentes actions que comptent mener les ligues et leurs comités. Elle précise également les moyens mis en œuvre par la FFE, les ligues et comités, ainsi que les objectifs fixés.  \nLes projets associatifs des ligues régionales doivent alors être communiqués au siège de la FFE. Le cas échéant, ces projets sont intégrés dans la convention d'objectifs passée entre la FFE, la ligue régionale et les comités départementaux qui s'y rattachent ; l'adéquation de ceux-ci au projet fédéral pouvant donner lieu à l'allocation d'aides de la FFE.  \nUn avenant à cette convention d'objectifs peut être conclu jusqu'au 31 décembre pour la mise en place d'un projet élaboré en cours de saison. Sa conclusion est soumise à autorisation du comité directeur. Un mois avant la fin de la saison sportive, les ligues et comités qui ont conclu une convention d'objectifs transmettent à la FFE un bilan des actions menées, qui doit être fondé, sincère, et établi sur la base des objectifs fixés en début de saison."], "ground_truth": "Afin de garantir l'application de la politique fédérale au niveau local, une convention d'objectifs peut être conclue, au début de chaque saison sportive, entre la FFE, les ligues régionales et éventuellement les comités départementaux qui s'y rattachent."}
{"question": "Que precise de 2018_Reglement_Disciplinaire20?", "answer": "", "contexts": ["## ARTICLE 2 - DEFINITION - COMPOSITION  \nIl est institué différents organes investis du pouvoir disciplinaire à l'égard :  \n-  des licenciés de la FFE ;\n-  des associations affiliées à la FFE ;\n-  tout membre, préposé, salarié ou bénévole de ces associations agissant en qualité de dirigeant ou de licencié de fait.  \nCes organes sont les suivants :  \n-  Un organe disciplinaire fédéral de 1 re instance dénommé « Commission Fédérale de Discipline » (CFD) ;\n-  Un organe disciplinaire régional de 1 re instance dénommé « Commission Régionale de Discipline » (CRD) dans chaque organe déconcentré régional de la FFE, saisi lorsque le Bureau Fédéral décide d'engager des poursuites selon les modalités prévues à l'article 9, sans transmettre directement l'affaire à la Commission Fédérale de Discipline, en fonction de la gravité du litige ;\n-  Un organe disciplinaire d'appel dénommé « Commission d'Appel », compétent pour trancher les appels interjetés à l'encontre de toutes décisions rendues en 1 re instance.  \nCes organes disciplinaires sont compétents pour prononcer des sanctions à raison des faits suivants, commis par une personne physique ou morale en une des qualités mentionnées ci-dessus à la date de commission des faits :  \n-  faits contraires aux règles posées par les statuts et règlements de la Fédération Française des Echecs ou de ses organes déconcentrés ;\n-  brutalités et insultes à l'égard d'un autre participant, d'un officiel ou du public lors d'une compétition organisée ou homologuée par la FFE ;"], "ground_truth": "Ces organes sont les suivants :  \n-  Un organe disciplinaire fédéral de 1 re instance dénommé « Commission Fédérale de Discipline » (CFD) ;\n-  Un organe disciplinaire régional de 1 re instance dénommé « Commission Régionale de Discipline » (CRD) dans chaque organe déconcentré régional de la FFE, saisi lorsque le Bureau Fédéral décide d'engager des poursuites selon les modalités prévues à l'article 9, sans transmettre directement l'affaire à la Commission Fédérale de Discipline, en fonction de la gravité du litige ;\n-  Un organe disciplinaire d'appel dénommé « Commission d'Appel », compétent pour trancher les appels interjetés à l'encontre de toutes décisions rendues en 1 re instance."}
{"question": "Qu'est-ce qui est obligatoire?", "answer": "", "contexts": ["Dans les cadences B, C et D en cadence \"Fischer\" équivalente, c'est-à-dire lorsque les joueurs et joueuses disposent d'au moins 30 secondes par coup, il est obligatoire de noter les coups en toutes circonstances.  \nR01-5/6"], "ground_truth": "il est obligatoire de noter les coups en toutes circonstances."}
{"question": "Qu'est-ce que le délai?", "answer": "", "contexts": ["- 10.3. Un joueur/Une joueuse (ou une personne représentant officiellement un joueur, une joueuse ou une équipe) peut faire appel de toute décision prise par l'AP, l'OC ou l'un/l'une de leurs assistants/assistantes. Cela inclut les capitaines d'équipe, les chefs/cheffes de délégation ou toute personne définie dans le Règlement de l'événement.\n- 10.4. Un appel doit être accompagné d'une caution et soumis par écrit avant la fin du délai imparti. Les frais et le délai sont fixés à l'avance. Les décisions du JA sont définitives. La caution est remboursable si l'appel aboutit. La caution (ou une partie de celle-ci) peut également être remboursée si l'appel a échoué mais est considéré comme raisonnable par le JA."], "ground_truth": "le délai sont fixés à l'avance."}
{"question": "Qu'est-ce que le jeu?", "answer": "", "contexts": ["- 9.1.2. Cependant, si le règlement de la compétition permet les nulles par accord mutuel, les règles suivantes s'appliqueront :\n- 9.1.2.1. Un joueur ou une joueuse souhaitant proposer la nulle le fait après avoir joué un coup sur l'échiquier et avant d'appuyer sur sa pendule. Une offre à tout autre moment durant le jeu est toujours valable, mais l'Article 11.5 doit être pris en considération. Aucune condition ne peut être liée à cette offre. Dans les deux cas, l'offre ne peut être retirée et reste valable jusqu'à ce que l'adversaire l'accepte, la rejette oralement, la rejette en touchant une pièce avec l'intention de la jouer ou de la prendre ; ou que la partie ne se soit terminée autrement.\n- 9.1.2.2. L'offre de nulle est notée par chacun des deux adversaires sur sa feuille de partie avec un symbole (=).  \nIl s'agit d'une règle utile pour l'arbitre et son utilisation doit être encouragée. Si un joueur ou une joueuse prétend qu'il est distrait par des offres de nulle répétées, sa feuille de partie doit être examinée pour en trouver la preuve sous la forme de plusieurs (=) affichés.  \n- 9.1.2.3. Une réclamation de nulle au titre de 9.2 ou 9.3 est assimilée à une proposition de nulle.  \nLa séquence de proposition de nulle est : 1. jouer un coup 2. proposer nulle 3. appuyer sur la pendule. Si un joueur ou une joueuse dévie de cet ordre, la demande reste valable mais il/elle peut recevoir une sanction selon l'article 12.9. Note de traduction : Car cela peut être considéré comme une gêne de l'adversaire"], "ground_truth": "le jeu est toujours valable, mais l'Article 11."}
{"question": "Que doit-on faire selon l'article mentionné dans 2025_Reglement_Interieur_20250?", "answer": "", "contexts": ["## 3.2 Modalités de délivrance de la licence  \nSeuls les clubs affiliés à jour de leur cotisation et de l'ensemble de leurs obligations envers la FFE sont autorisés à délivrer des licences.  \nPour que le club transmette au siège de la FFE une demande de licence, la personne concernée doit lui four nir :  \n- -son nom, son prénom, son genre, sa date de naissance, une adresse électronique et sa nationalité ;\n- -une autorisation parentale pour les mineurs non émancipés.  \nEn application de l'article L. 131-6 du Code du sport, les clubs transmettent également à la FFE les informations prévues par l'article D. 131-2 du même code pour les personnes soumises au contrôle d'honorabilité.  \nLes clubs peuvent demander aux personnes sollicitant la délivrance d'une licence de justifier leur identité."], "ground_truth": "Pour que le club transmette au siège de la FFE une demande de licence, la personne concernée doit lui four nir :  \n- -son nom, son prénom, son genre, sa date de naissance, une adresse électronique et sa nationalité ;\n- -une autorisation parentale pour les mineurs non émancipés."}
{"question": "Quelle règle est énoncée à la page 33?", "answer": "", "contexts": ["## RESPECTER L'ADVERSAIRE  \n- Respecter l'adversaire, c'est refuser de jouer en ayant recours à des moyens illégaux, à des sources d'informations extérieures, à la tricherie.\n- Respecter l'adversaire, c'est éviter de le distraire ou de le déranger de quelque manière que ce soit.\n- Respecter l'adversaire, c'est s'adresser à lui en des termes toujours courtois et polis."], "ground_truth": "- Respecter l'adversaire, c'est s'adresser à lui en des termes toujours courtois et polis."}
{"question": "Qu'est-ce que une alternative?", "answer": "", "contexts": ["| Période | 8.6 | Une phase de la partie, où les joueurs et joueuses doivent achever un nombre de coups ou tous les coups dans un temps donné. |\n| Pièce | 2.1 | L'une des 32 figurines sur l'échiquier. Ou 2. Une dame, une tour, un fou ou un cavalier |\n| Pièce mineure | | Fou ou cavalier |\n| Pièce touchée, pièce jouée | 4.3 | Si un joueur ou une joueuse touche une pièce dans l'intention de la jouer, il doit la déplacer. |\n| Points | 10 | Normalement un joueur ou une joueuse marque 1 point pour une victoire, 1⁄2 point pour une nulle, 0 pour une défaite. Une alternative est 3 pour une victoire, 1 pour une nulle, 0 pour une défaite. |\n| Position morte | 5.2.2 | Lorsqu'aucun des deux adversaires ne peut mater le roi adverse par aucune suite de coups légaux. |\n| Prise | 3.1 | Quand une pièce est déplacée de sa case vers une case occupée par une pièce adverse, cette dernière est retirée de l'échiquier. Voir aussi 3.7.4. En notation : x |\n| Promotion | 3.7.5 | Lorsqu'un pion atteint la huitième rangée et qu'il est remplacé par une nouvelle pièce (dame, tour, fou, cavalier) de la mêmecouleur. |\n| Rangée | 2.4 | Une ligne horizontale de 8 cases sur l'échiquier. |\n| Réclamation/demande | 6.8 | Le joueur ou la joueuse peut faire une réclamation/demande à l'arbitre dans diverses circonstances. |"], "ground_truth": "Une alternative est 3 pour une victoire, 1 pour une nulle, 0 pour une défaite."}
{"question": "Qu'est-ce que une personne?", "answer": "", "contexts": ["- 6.11.1. Si la partie doit être interrompue, l'arbitre met la pendule d'échecs en pause.  \nPar exemple, lors d' une alarme incendie. Avant de demander aux joueurs et joueuses d'évacuer le bâtiment, l'arbitre devrait, si possible, demander à ceux et celles qui se trouvent à leur échiquier de mettre leurs pendules en pause.  \n- 6.11.2. Un joueur ou une joueuse ne peut mettre la pendule d'échecs en pause que pour demander l'assistance de l'arbitre, par exemple lorsqu'une promotion va avoir lieu alors que la pièce requise n'est pas disponible.\n- 6.11.3. L'arbitre décide du moment où la partie reprend.\n- 6.11.4. Si un joueur ou une joueuse met la pendule d'échecs en pause pour demander l'assistance de l'arbitre, l'arbitre détermine si cette mise en pause de la pendule d'échecs est justifiée. En l'absence de raison valable, le joueur ou la joueuse reçoit une pénalité selon l'article 12.9.  \nLes raisons valables pour mettre la pendule en pause incluent :  \nUne irrégularité, telle qu'une position ou un coup illégal ;  \nUne personne est dérangée par son adversaire et/ou par des spectateurs/spectatrices ; fait un malaise.  \nUne pause toilette n'est généralement pas une raison valable sauf dans le cas d'une personne handicapée ou malade."], "ground_truth": "Une personne est dérangée par son adversaire et/ou par des spectateurs/spectatrices ; fait un malaise."}
{"question": "Quelle règle est énoncée à la page 11?", "answer": "", "contexts": ["## Article 9 Le jury d'appel :  \nLe jury d'appel est indispensable pour les tournois de haut niveau. En l'absence de jury d'appel, toute décision reste contestable devant la commission des appels sportifs de la FFE ou de la ligue concernée.  \nLorsqu'un jury d'appel spécifique est institué sur les lieux d'un tournoi, ses décisions sont immédiatement appliquées . La personne déboutée doit être informée de sa possibilité de recours auprès de la commission des appels sportifs de la FFE."], "ground_truth": "Lorsqu'un jury d'appel spécifique est institué sur les lieux d'un tournoi, ses décisions sont immédiatement appliquées ."}
{"question": "Qu'est-ce que la réclamation?", "answer": "", "contexts": ["## Voir le commentaire de l'article 9.2  \n- 9.4. Si le joueur ou la joueuse touche une pièce comme dans l'Article 4.3, il/elle perd le droit de réclamer la nulle selon l'Article 9.2 ou 9.3 lors de ce coup.  \nLe droit de réclamer un match nul est restitué au coup suivant mais ne peut être effectué rétrospectivement.  \n- 9.5. Réclamations de partie nulle.\n- 9.5.1. Si une personne réclame la nulle en application de l'Article 9.2 ou 9.3, elle ou l'arbitre met la pendule d'échecs en pause (voir Article 6.12.1 ou 6.12.2). Elle n'a pas le droit de retirer sa réclamation.\n- 9.5.2. Si la réclamation est jugée correcte, la partie est déclarée immédiatement nulle.\n- 9.5.3. Si la réclamation est jugée incorrecte, l'arbitre ajoute deux minutes au temps de réflexion restant de l'adversaire. La partie doit continuer. Si la réclamation était basée sur un coup prévu, ce coup doit être joué en respectant les Articles 3 et 4.  \nCette réclamation n'est pas traitée comme un coup illégal, toutefois i l est stipulé que le coup prévu doit être joué, s'il s'agit d'un coup illégal, un autre coup doit être joué avec la même pièce. Tous les autres éléments de l'article 4 s'appliquent.  \n- 9.6. Si l'une ou les deux situations suivantes se produisent, alors la partie est nulle :"], "ground_truth": "la réclamation est jugée correcte, la partie est déclarée immédiatement nulle."}
{"question": "Qu'est-ce que un sursis?", "answer": "", "contexts": ["## ARTICLE 23 - SURSIS  \nLes sanctions prévues à l'article 20, autres que l'avertissement, le blâme et la radiation, peuvent être assorties en tout ou partie d'un sursis.  \nLa sanction assortie d'un sursis est réputée non avenue si, dans un délai de trois ans après son prononcé, l'intéressé n'a fait l'objet d'aucune nouvelle sanction mentionnée à l'article 20. Toute nouvelle infraction sanctionnée pendant ce délai emporte révocation de tout ou partie du sursis."], "ground_truth": "un sursis est réputée non avenue si, dans un délai de trois ans après son prononcé, l'intéressé n'a fait l'objet d'aucune nouvelle sanction mentionnée à l'article 20."}
{"question": "Qu'est-ce que une joueuse?", "answer": "", "contexts": ["## C.04.1 Règles de base des systèmes suisses  \nLes règles qui suivent sont applicables à chaque système suisse, sauf spécification contraire explicite.  \n- a) Le nombre de rondes à jouer est annoncé avant le tournoi.\n- b) Deux joueurs ne peuvent se rencontrer plus d'une fois.\n- c) S'il advient que le nombre de joueurs et joueuses soit impair, une personne ne sera pas appariée. Cette personne est déclarée exempte : elle n'aura ni adversaire ni couleur et elle recevra autant de points que rapporte une victoire, sauf si le règlement du tournoi prescrit autre chose.\n- d) Une personne qui a déjà été exempte, ou a déjà remporté une victoire par forfait en raison de la non présentation de son adversaire à temps, ne pourra plus être exempte.\n- e) En général, un joueur/une joueuse est apparié contre un adversaire ayant le même score que lui.\n6. f)\n7. Pour chaque joueur/joueuse, la différence entre le nombre de parties jouées avec les blancs et le nombre de parties jouées avec les noirs ne peut être supérieure à 2 ou inférieure à -2.\n8. A la dernière ronde d'un tournoi, chaque système peut comporter des exceptions à cette règle.\n- g) Personne ne devra recevoir trois fois de suite la même couleur.\n10. Chaque système peut faire avoir des exceptions à cette règle à la dernière ronde d'un tournoi.\n- h) 1) En général, chaque personne reçoit la couleur avec laquelle elle a joué le moins de parties.\n- 2) Si les couleurs qu' elle a déjà eu sont équilibrées, alors, en général elle reçoit la couleur inverse de celle qu'il a reçue lors de la ronde précédente."], "ground_truth": "une joueuse est apparié contre un adversaire ayant le même score que lui."}
{"question": "Quelle règle est énoncée à la page 221?", "answer": "", "contexts": ["- f) La participation à un événement qui a été interdit à l'avance par la fédération nationale ou une instance supérieure compétente.\n13. 3.6. Infractions techniques\n- a) Modifier délibérément les appariements dans un tournoi, contrairement aux dispositions applicables en matière d'appariement.\n- b) Modification délibérée d'une feuille de partie, du procès -verbal d'un match ou d'un rapport du tournoi.\n- c) Signer délibérément des formulaires de normes incorrects pour les joueurs, les organisateurs et/ou les arbitres d'un tournoi.\n- d) Le nonrespect délibéré des dispositions du règlement d'un tournoi et des règles du jeu d'échecs, des instructions, des circulaires et des décisions des organes de la FIDE.\n- e) Un manquement important aux dispositions du règlement du tournoi et aux règles du jeu d'échecs, aux instructions, aux circulaires et aux décisions des organes de la FIDE."], "ground_truth": "Infractions techniques\n- a) Modifier délibérément les appariements dans un tournoi, contrairement aux dispositions applicables en matière d'appariement."}
{"question": "Qu'est-ce que la performance?", "answer": "", "contexts": ["## 3.1. Premier RAPIDE  \n- soit avec Nj ≥ 7 alors Pj est arrondi à la dizaine la plus proche et devient le Rapide\n- soit avec cumul Nj/Pj et des archives Pa/Na si Nj + Na ≥7  \nSi Nj &lt; 7 et pas d'archive, la performance est archivée et conservée uniquement jusqu'à la fin de la saison suivante. Si ces archives ne sont pas utilisées lors du calcul de fin de la saison n+1 alors elles sont définitivement perdues."], "ground_truth": "la performance est archivée et conservée uniquement jusqu'à la fin de la saison suivante."}
{"question": "Qu'est-ce que la présence?", "answer": "", "contexts": ["## 4.2.3. Évaluation diagnostique d'un stage de formation continue  \nLe stage de formation continue est conclu par une évaluation écrite.  \nL'objectif de cette évaluation est de donner aux candidats un retour sur leurs forces et faiblesses actuelles. Sauf dans le cas de résultats particulièrement faibles nécessitant un plan d'action personnalisé pour l'arbitre, seule la présence est enregistrée afin de valider le statut d'arbitre actif."], "ground_truth": "la présence est enregistrée afin de valider le statut d'arbitre actif."}
{"question": "Quelle règle est énoncée à la page 109?", "answer": "", "contexts": ["## Tableaux officiels d'appariements à 3 équipes.  \n- Les tournois concernant 3 équipes sont complets en 2 rondes. De ce fait, les rondes autonomes qui sont signalées par les lettres a ne sont appelées qu'à organiser des tournois en une seule ronde.\n- Lorsque le nombre de joueurs et joueuses de chaque équipe est supérieur à 12, il suffit de combiner les tableaux 1,2 et 3 en ajustant les numéros des joueurs.  \nExemple : Pour des équipes de 38 joueurs on peut appliquer :  \n- o Le tableau 1 pour les joueurs 1 à 12 (12 joueurs)\n- o Le tableau 1 pour les joueurs 13 à 24 (12 joueurs)  \n| Tableau 1 | Pour 3 équipes à 4 / 8 / 12 joueurs | Pour 3 équipes à 4 / 8 / 12 joueurs | Pour 3 équipes à 4 / 8 / 12 joueurs |\n|----------------|---------------------------------------|---------------------------------------|---------------------------------------|\n| | Ronde 1 | Ronde 2 | Ronde autonome |\n| Echiquier N°1 | A1 - C1 | B1 - A1 | A1 - C1 |\n| Echiquier N°2 | C2 - B1 | C1 - B2 | C2 - B1 |\n| Echiquier N°3 | B2 - A2 | A2 - C2 | B2 - A2 |\n| Echiquier N°4 | A3 - B3 | C3 - A3 | A3 - B3 |\n| Echiquier N°5 | B4 - C3 | B3 - C4 | B4 - C3 |"], "ground_truth": "De ce fait, les rondes autonomes qui sont signalées par les lettres a ne sont appelées qu'à organiser des tournois en une seule ronde."}
{"question": "Qu'est-il interdit de faire selon R01_2025_26_Regles_generales.p?", "answer": "", "contexts": ["## 9. Comportement des joueurs et joueuses  \nLa conduite des joueurs et joueuses est assujettie à une attitude correcte qui interdit par exemple :  \n- De fixer le résultat d'une partie avant son commencement ou dans un but lucratif,\n- D'abandonner un tournoi sans justification,\n- De déclarer forfait sans raison valable,\n- Pendant le jeu, de contrevenir aux règles du jeu.  \nLe non-respect de ces règles élémentaires sera sanctionné par des pénalités prises, soit par l'arbitre, soit par la juridiction fédérale compétente.  \nTout joueur et joueuse devra également se conformer à la Charte Éthique de la FFE."], "ground_truth": "Comportement des joueurs et joueuses  \nLa conduite des joueurs et joueuses est assujettie à une attitude correcte qui interdit par exemple :  \n- De fixer le résultat d'une partie avant son commencement ou dans un but lucratif,\n- D'abandonner un tournoi sans justification,\n- De déclarer forfait sans raison valable,\n- Pendant le jeu, de contrevenir aux règles du jeu."}
{"question": "Qu'est-il interdit de faire selon Interclubs_DepartementalBdr.pd?", "answer": "", "contexts": ["## 3.5 Capitaines  \nChaque équipe doit avoir un capitaine qui peut-être joueur ou non joueur. Il ne peut pas officier en même temps en tant qu'arbitre.  \nDans l'exercice de ses fonctions, le capitaine d'équipe a le droit d'accéder à l'aire réservée aux joueurs.  \nA la fin de la session de jeu, le capitaine est responsable de la remise des feuilles de parties lisiblement écrites aux arbitres.  \nDurant les parties, le capitaine peut conseiller ses joueurs sur l'opportunité d'offrir, d'accepter ou de refuser une proposition de nullité, sur l'opportunité d'abandonner, sur la situation du match, à condition qu'il ne fasse aucun commentaire sur la position de l'échiquier.  \nL'arbitre a le droit d'assister à tout échange de propos entre un joueur et son capitaine. Le capitaine d'équipe doit transmettre les résultats le soir même au directeur de groupe soit par courriel ou par téléphone. La feuille de match doit être transmise 48h après le match."], "ground_truth": "Il ne peut pas officier en même temps en tant qu'arbitre."}
{"question": "Qu'est-ce que les arbitres?", "answer": "", "contexts": ["## Glossaire  \nLes règles du jeu officielles restent les règles diffusées par la FIDE en anglais. En cas de doute, sur une traduction ou une interprétation, les arbitres sont priés de s'y référer. Laws of Chess 2023  \nDans la partie « approfondissement » du site internet de la DNA, nous mettons à votre disposition les règles traduites sans les commentaires ainsi qu'un document permettant la comparaison des règles en français et en anglais."], "ground_truth": "les arbitres sont priés de s'y référer."}
{"question": "Que precise de InterclubsJeunes_PACABdr?", "answer": "", "contexts": ["## 2. Structure des groupes d'interclubs Jeunes des Bouches-du-Rhône  \nUn seul groupe de Nationale 3 Jeunes est mis en place pour permettre l'accession en Nationale 2 Jeunes.  \nLe nombre d'équipes inscrites dans les Bouches-du-Rhône détermine le nombre d'équipes en Nationale 3 Jeunes :  \n-  Entre 1 et 10 équipes : le groupe de Nationale 3 Jeunes est constitué de toutes les équipes inscrites.\n-  Entre 11 et 13 équipes : le groupe de Nationale 3 Jeunes est constitué de 6 équipes\n-  Entre 14 et 19 équipes : le groupe de Nationale 3 Jeunes est constitué de 8 équipes\n-  A partir de 20 équipes : le groupe de Nationale 3 Jeunes est constitué de 10 équipes  \nLorsque le nombre d'équipes inscrites est supérieur au nombre d'équipe en Nationale 3 jeunes, un ou plusieurs groupes de Nationale 3 « Réserve » sont créés."], "ground_truth": "Structure des groupes d'interclubs Jeunes des Bouches-du-Rhône  \nUn seul groupe de Nationale 3 Jeunes est mis en place pour permettre l'accession en Nationale 2 Jeunes."}
{"question": "Quelle règle est énoncée à la page 14?", "answer": "", "contexts": ["## 2.6. Communication  \nPromouvoir le secteur de l'arbitrage  \n- Assurer la communication interne et externe de la D.N.A.\n- Fournir aux cadres de l'Arbitrage (membres de la D.N.A, Direct ions Régionales, Formateurs, formatrices, superviseurs et superviseures) des informations susceptibles de les aider à remplir leurs missions."], "ground_truth": "- Fournir aux cadres de l'Arbitrage (membres de la D.N.A, Direct ions Régionales, Formateurs, formatrices, superviseurs et superviseures) des informations susceptibles de les aider à remplir leurs missions."}
{"question": "Que precise de Interclubs_DepartementalBdr.pd?", "answer": "", "contexts": ["## 1.3 Engagement  \nPour participer à la compétition, tous les clubs, doivent impérativement faire parvenir à la Direction Technique du CDJE, au plus tard 15 jours avant le début de la compétition, un formulaire d'engagement dûment rempli, comportant :  \n-  la dénomination du club,\n-  les coordonnées du Président du club et du responsable de l'équipe avec l'adresse électronique et un numéro de téléphone du correspondant,\n-  les coordonnées précises de la salle de jeu mise à disposition, ainsi que celles de l'organisateur des rencontres.\n-  un chèque correspondant au montant des droits d'inscription (fixé lors du Comité Directeur), et établi à l'ordre de la \"CDJE 13\".  \nLors de leur inscription, les clubs doivent également s'être acquittés des éventuelles amendes contractées lors de la saison précédente, sous peine de non prise en compte de leur inscription.  \nLe calendrier et le formulaire, ainsi que les autres informations sur le déroulement de la compétition, sont transmis par le directeur de groupe soit par courrier ou par courriel.  \nVersion du 27/09/2016 Page  \n<!-- image -->"], "ground_truth": "-  un chèque correspondant au montant des droits d'inscription (fixé lors du Comité Directeur), et établi à l'ordre de la \"CDJE 13\"."}
{"question": "Quelle règle est énoncée à la page 200?", "answer": "", "contexts": ["| Porteurs de titres | 4 | 4 | 4 | 4 |\n| Nb max. d'une fédération | Aucun | Aucun | Aucun | Aucun |\n| Nb max. de sa fédération | Aucun | Aucun | Aucun | Aucun |\n| Nb min. autre fédération | Aucun | Aucun | Aucun | Aucun |\n| 61⁄2 | 2380-2406 | 2230-2256 | 2180-2206 | 2030-2056 |\n| 6 | 2407-2458 | 2257-2308 | 2207-2258 | 2057-2108 |"], "ground_truth": "d'une fédération | Aucun | Aucun | Aucun | Aucun |\n| Nb max."}
{"question": "Que se passe-t-il en cas de circonstances exceptionnelles (force majeure) ?", "answer": "", "contexts": ["## 9. La conduite des joueurs  \n- 9.1. Dès qu'un joueur ou qu'une joueuse a formellement accepté une invitation, il/elle doit jouer sauf en cas de circonstances exceptionnelles (force majeure) , tel que maladie ou incapacité. L'acceptation d'une autre invitation n'est pas une raison valable pour se retirer.\n- 9.2. Tous les joueurs et joueuse doivent avoir une tenue vestimentaire appropriée. En cas de non-respect du code vestimentaire, ils/elle peuvent avoir une sanction -voir l'article 13 du Règlement A.09 du FIDE Handbook « Ethics &amp; Disciplinary ».\n- 9.3. Un joueur ou une joueuse qui ne veut pas continuer une partie mais s'en va sans abandonner ou en informer l'arbitre fait preuve de discourtoisie. Il/Elle peut avoir une sanction , à la discrétion de l'Arbitre Principal (AP), pour manque de sportivité -voir l'article 12.9 des règles du jeu.\n- 9.4. Quand il est clair que des résultats ont été arrangés -voir l'article 11.1 des règles du jeu - l'AP impose des sanctions adaptées -voir l'article 12.9 des règles du jeu.  \nNote de traduction : Cet article invite clairement à considérer que les joueurs et joueuses se permettant des nulles rapides jettent le discrédit sur le jeu d'échecs.  \n- 9.5. Les joueurs et joueuses ne devraient pas manger devant l'échiquier durant la partie."], "ground_truth": "en cas de circonstances exceptionnelles (force majeure) , tel que maladie ou incapacité."}
{"question": "Qu'est-ce que le montant?", "answer": "", "contexts": ["## 5.1. La Direction Régionale d'Arbitrage  \nChaque L igue est tenue de créer une Direction Régionale d'Arbitrage (D.R.A .). Ses missions doivent respecter les objectifs de la Direction Nationale. Pour un fonctionnement harmonieux au sein de la Ligue, son positionnement doit être calqué sur celui de la D.N.A. vis-à-vis de la F.F.E. Une D.R.A. n'a qu'un pouvoir exécutif et non institutionnel. Un budget lui est alloué par la Ligue. Le montant est déterminé par le comité directeur de la Ligue, qui contrôle l'utilisation de ces fonds.  \nLa D.R.A. travaille en collaboration avec les différents membres de la D.N.A., pour assurer une synergie entre le niveau national et régional. Elle est également chargée de permettre l'échange des pratiques entre les Directions Départementales de l'Arbitrage de sa L igue, lorsqu'elles existent."], "ground_truth": "Le montant est déterminé par le comité directeur de la Ligue, qui contrôle l'utilisation de ces fonds."}
{"question": "Qu'est-il permis de faire selon 2018_Reglement_Disciplinaire20?", "answer": "", "contexts": ["## ARTICLE 16 - DELAI DE DECISION DE PREMIERE INSTANCE  \nL'organe disciplinaire de première instance doit se prononcer dans un délai de dix semaines à compter de l'engagement des poursuites disciplinaires.  \nEn cas de circonstances exceptionnelles, le délai de dix semaines peut être prorogé d'un mois par une décision motivée du président de l'organe disciplinaire et notifiée à la personne poursuivie, le cas échéant, à son représentant légal, à son conseil ou à son avocat, à l'association sportive avec laquelle elle a un lien juridique, selon les modalités prévues à l'article 8.  \nLorsque la séance a été reportée en application de l'article 13, le délai mentionné à l'alinéa précédent est prolongé d'une durée égale à celle du report.  \nFaute d'avoir statué dans ces délais, l'organe disciplinaire de première instance est dessaisi et l'ensemble du dossier est transmis à l'organe disciplinaire d'appel compétent qui statue en dernier ressort."], "ground_truth": "En cas de circonstances exceptionnelles, le délai de dix semaines peut être prorogé d'un mois par une décision motivée du président de l'organe disciplinaire et notifiée à la personne poursuivie, le cas échéant, à son représentant légal, à son conseil ou à son avocat, à l'association sportive avec laquelle elle a un lien juridique, selon les modalités prévues à l'article 8."}
{"question": "Qu'est-ce que la cadence?", "answer": "", "contexts": ["## Directives III : Parties sans incrément amenant des fins de partie au KO  \nIII.1 Une « fin de partie au KO » est la phase d'une partie où tous les coups restant à jouer doivent être achevés dans un temps défini.  \nExemple 1 : Si selon le règlement du tournoi la cadence est de 2 heures pour 30 coups suivie d'une heure pour la fin de la partie. La 2ème période est jouée selon les directives de fin de parties au KO  \nExemple 2 : Si selon le règlement du tournoi, la cadence est de 2 heures pour l'ensemble de la partie. Cela signifie que la partie entière est jouée selon les directives de fin de parties au KO  \n- III.2.1. Les directives cidessous concernant la dernière période d'une partie, amenant une fin de partie au KO, ne doivent s'appliquer à une compétition que si leur utilisation a été annoncée au préalable.\n- III.2.2. Ces directives ne s'appliquent qu'aux parties d'échecs standards et aux parties d'échecs en cadence rapide sans incrément et non aux parties en cadence blitz.\n- III.3.1. Si les deux drapeaux sont tombés et qu'il est impossible d'établir lequel est tombé le premier alors :\n- III.3.1.1. La partie continue si cela se produit dans toute période de jeu autre que la dernière.\n- III.3.1.2. La partie est nulle si cela se produit dans une période de jeu où tous les coups restants doivent être achevés."], "ground_truth": "la cadence est de 2 heures pour 30 coups suivie d'une heure pour la fin de la partie."}
{"question": "Quelle règle est énoncée à la page 172?", "answer": "", "contexts": ["## Chapitre 5.4 : Rapport Technique et fin de tournoi.  \nL'arbitre principal d'un tournoi homologué doit s'assurer de la rédaction et de l'envoi d'un rapport technique.  \nSauf exception, l'ensemble des documents constituant celui -ci sont envoyés par voie informatisés aux différents acteurs du suivi du tournoi.  \nLe rapport technique est une garantie indispensable du sérieux de l'arbitre dans l'ensemble de ses missions, en cas de réclamation d'un joueur ou d'enquête sur le déroulement d'un tournoi  \nL'arbitre devra également s'assurer des dernières étapes de gestion d'un tournoi une fois que celui -ci est considéré comme terminé."], "ground_truth": "Sauf exception, l'ensemble des documents constituant celui -ci sont envoyés par voie informatisés aux différents acteurs du suivi du tournoi."}
{"question": "Quelle obligation est énoncée à la page 98?", "answer": "", "contexts": ["## Ajouts aux règlements sur les échecs en ligne :  \nArticle 5.1. Les personnes aveugles/handicapées visuelles ou à mobilité réduite peuvent utiliser leur propre échiquier en plus de l'échiquier virtuel utilisé par l'assistance en ligne.  \nArticle 17.1.1 La personne assistante en ligne désignée doit avoir une vue complète de leur joueur/joueuse.  \nArticle 18.1 La personne assistante en ligne désignée doit avoir une vue complète du visage de leur joueur/joueuse."], "ground_truth": "Article 17.1.1 La personne assistante en ligne désignée doit avoir une vue complète de leur joueur/joueuse."}
{"question": "Quelle règle est énoncée à la page 93?", "answer": "", "contexts": ["## 18.2. L'arbitre d oit :  \n- 18.2.1. assurer le fair-play,  \n- 18.2.2. agir dans le meilleur intérêt de la compétition,\n- 18.2.3. s'assurer qu'un bon environnement de jeu soit maintenu,\n- 18.2.4. s'assurer que les joueurs et joueuses ne soient pas dérangés,\n- 18.2.5. superviser le déroulement de la compétition,\n- 18.2.6. prendre les mesures spéciales nécessaires dans l'intérêt des joueurs et joueuses handicapés et de ceux et celles qui nécessitent un soutien médical ;\n- 18.2.7. suivre les directives et les mesures de protection contre la triche de la FIDE (voir Article 16.4).\n- 18.3. Les arbitres surveillent les parties, surtout lorsque les joueurs et joueuses sont à court de temps, font appliquer les décisions qu'ils ont prononcées, et infligent des sanctions aux joueurs si nécessaire.\n- 18.4. Les options à disposition de l'arbitre pour sanctionner sont :\n- 18.4.1. l'avertissement,\n- 18.4.2. l'augmentation du temps de jeu restant à l'adversaire,\n- 18.4.3. la diminution du temps de jeu restant de la personne fautive,\n- 18.4.4. l'augmentation des points marqués par l'adversaire dans la partie jusqu'au maximum prévu pour cette partie,\n- 18.4.5. la diminution des points marqués dans la partie pour la personne fautive,"], "ground_truth": "agir dans le meilleur intérêt de la compétition,\n- 18.2.3."}
{"question": "Quelle règle est énoncée à la page 222?", "answer": "", "contexts": ["## 5.1. Registre des affaires  \nToutes les plaintes et tous les rapports concernant des violations du règlement disciplinaire des arbitres doivent être adressés à la Commission des Arbitres (ARB). Un registre des cas est établi par l'ARB et contiendra tous les cas, qu'ils aient été sanctionnés ou non, pendant 10 ans. L'ARB fournira au Bureau de la FIDE la décision écrite finale de la DSC."], "ground_truth": "Un registre des cas est établi par l'ARB et contiendra tous les cas, qu'ils aient été sanctionnés ou non, pendant 10 ans."}
{"question": "Qu'est-ce que la convocation?", "answer": "", "contexts": ["## 8.1 Convocation et ordre du Jour  \nAvant chaque fin de chaque saison, le comité directeur fixe les dates d'au moins trois réunions pour la saison suivante. Ces trois dates ne peuvent être modifiées que par décision du comité directeur prise à la majorité des 2⁄3 des voix.  \nLa convocation est adressée au moins quinze jours à l'avance par voie électronique ou postale. Elle indique l'ordre du jour établi par le président, les horaires et le lieu de réunion. Tout membre du comité directeur peut faire inscrire un point à l'ordre du jour avant l'ouverture de la séance, sous réserve d'approbation de la majorité de ses membres."], "ground_truth": "La convocation est adressée au moins quinze jours à l'avance par voie électronique ou postale."}
{"question": "Qu'est-ce que les titres?", "answer": "", "contexts": ["## 0. Introduction  \n- 0.1. Seuls les titres tels qu'en 0.3 sont reconnus par la FIDE.\n- 0.2. Les règles suivantes ne peuvent être modifiées que par le comité directeur de la FIDE suivant les recommandations de la Commission d'Homologation (CH). En ce qui concerne les tournois, les changements s'appliquent uniquement à ceux débutant le jour de leur entrée en vigueur, ou aux tournois qui auront lieu ultérieurement.\n- 0.3. Les titres internationaux de la FIDE sont administrés par la C ommission d' Homologation, qui est l'unité de jugement final. Les titres reconnus pour le jeu d'échecs standard devant l'échiquier (comme définis dans les règles du jeu) sont les suivants :  \nMixtes : Grand-Maître (GM), Maître International (MI), Maître de la FIDE (MF), Candidat Maître (CM)  \nFéminins : Grand-Maître Féminin (GMF), Maître International Féminin (MIF), Maître de la FIDE Féminin (MFF), Candidat Maître Féminin (CMF)  \n- 0.4. Les titres sont valables à vie à partir de la date de confirmation par le conseil de la FIDE.\n- 0.4.1. L'utilisation d'un titre ou classement de la FIDE pour se soustraire aux principes éthiques du titre ou du système de classement peuvent mener une personne à la révocation de son titre sur recommandation de la Commission d'Homologation et entérinement par le conseil de la FIDE.\n- 0.4.2. Un titre ne peut être utilisé pour les résultats des adversaires que dans les tournois débutant après sa confirmation. (Exception : voir 1.1.4)"], "ground_truth": "Les titres sont valables à vie à partir de la date de confirmation par le conseil de la FIDE."}
{"question": "Que se passe-t-il en cas de récidive?", "answer": "", "contexts": ["## 4.1. La CSD dispose de trois niveaux de sanction :  \n- a) L'avertissement écrit  \nPour les infractions mineures, un arbitre sanctionné par un avertissement écrit recevra une lettre officielle de la CSD, indiquant l'infraction et les mesures correctives attendues de la part de l'arbitre.  \nUn avertissement écrit reste valable pendant 12 mois.  \n- La non-application des mesures correctives attendues peut entraîner une sanction plus sévère.\n- b) Le blâme écrit  \nPour les infractions plus graves, un arbitre sanctionné par un blâme écrit recevra une lettre officielle de la DSC, indiquant l'infraction et les mesures correctives attendues de la part de l'arbitre.  \nUn blâme écrit reste valable pendant 24 mois.  \nLa non-application des mesures correctives attendues peut entraîner une sanction plus sévère.  \n- c) Disqualification  \nEn cas d'infraction grave, un arbitre peut être disqualifié pour une durée déterminée. Une disqualification signifie que l'arbitre n'est pas éligible pour être nommé ou désigné comme arbitre dans un événement homologué par la FIDE et/ou pour officier lors d'un tel événement.  \n- Pour une première infraction, la disqualification peut aller jusqu'à 18 mois.\n- En cas de récidive, la disqualification peut aller jusqu'à 24 mois."], "ground_truth": "En cas de récidive, la disqualification peut aller jusqu'à 24 mois."}
{"question": "Qu'est-il interdit de faire selon LA-octobre2025?", "answer": "", "contexts": ["- f) La participation à un événement qui a été interdit à l'avance par la fédération nationale ou une instance supérieure compétente.\n13. 3.6. Infractions techniques\n- a) Modifier délibérément les appariements dans un tournoi, contrairement aux dispositions applicables en matière d'appariement.\n- b) Modification délibérée d'une feuille de partie, du procès -verbal d'un match ou d'un rapport du tournoi.\n- c) Signer délibérément des formulaires de normes incorrects pour les joueurs, les organisateurs et/ou les arbitres d'un tournoi.\n- d) Le nonrespect délibéré des dispositions du règlement d'un tournoi et des règles du jeu d'échecs, des instructions, des circulaires et des décisions des organes de la FIDE.\n- e) Un manquement important aux dispositions du règlement du tournoi et aux règles du jeu d'échecs, aux instructions, aux circulaires et aux décisions des organes de la FIDE."], "ground_truth": "- f) La participation à un événement qui a été interdit à l'avance par la fédération nationale ou une instance supérieure compétente."}
{"question": "Qu'est-ce que la scission?", "answer": "", "contexts": ["## 4.2.3 La scission  \nL'opération de scission entraîne la création d'une deuxième association par les membres démissionnaires de la première association qui se scinde sans pour autant être dissoute, à moins qu'un vote de l'assemblée générale ne prononce la dissolution.  \nSi les clubs contreviennent à un refus de scission prononcé par le comité directeur, ils perdent les droits du club d'origine et sont chacun considérés comme un nouveau club partant sur le plan sportif au bas de la hiérarchie sportive.  \nLes présidents, comités directeurs, sièges sociaux et lieux de jeu des deux nouveaux clubs devront être totalement différents et indépendants. Le procès-verbal de l'assemblée générale du club ayant décidé sa scission devra comporter la répartition des équipes qualifiées dans les différents niveaux de championnat et de tous les droits sportifs entre les deux nouveaux clubs.  \nLa scission est effective après enregistrement à la préfecture des deux nouveaux clubs, dépôt des procèsverbaux de leur assemblée générale constitutive respective auprès du Président de leur ligue régionale qui contrôlera la légalité et l'indépendance réelle des deux nouveaux clubs et en informera le secrétaire général de la FFE.  \nPendant les deux saisons suivant la scission effective, les deux nouveaux clubs ne pourront pas cumuler plus de droits sportifs qu'un seul, et aucune autre autorisation de scission ou de fusion ne leur sera accordée."], "ground_truth": "La scission est effective après enregistrement à la préfecture des deux nouveaux clubs, dépôt des procèsverbaux de leur assemblée générale constitutive respective auprès du Président de leur ligue régionale qui contrôlera la légalité et l'indépendance réelle des deux nouveaux clubs et en informera le secrétaire général de la FFE."}
{"question": "Qu'est-ce que le match?", "answer": "", "contexts": ["## 3.4. Matchs de départage  \nLors des phases qualificatives départementales et des zones interdépartementales, les CDJE et Ligues peuvent choisir la cadence la plus appropriée en fonction des possibilités, depuis le blitz à la cadence de 3 min + 2 sec. /coup au rapide à la cadence de 15 min + 10 sec. /coup, tout en essayant, dans la mesure du possible, de tendre vers les modalités ci-après. Lorsque la cadence du blitz est choisie, les départages doivent se faire en match aller-retour.  \n- S'il n'y a que 2 joueurs/joueuses ex-æquo, le match se fait en parties à la cadence de 15 min. + 10 sec / coup en rencontres aller-retour avec couleurs inversées. En cas d'égalité à l'issue de ce match, un nouveau départage en blitz a lieu, en rencontres aller-retour à la cadence de 3 min. + 2 sec. / coup, avec couleurs inversées. En cas d'égalité, le match est rejoué.\n- S'il y a 3 ou 4 joueurs/joueuses ex-æquo, un tournoi toutes rondes en parties de 15 min. + 10 sec. est organisé. En cas d'égalité de 2, 3 ou 4 personnes à l'issue de ce match, une formule coupe est organisée entre les exæquo suivant les modalités du paragraphe ci-dessous."], "ground_truth": "le match est rejoué."}
{"question": "Quelle règle est énoncée à la page 180?", "answer": "", "contexts": ["## 5) Tarifs adoptés pour les compétitions fédérales :  \nCes indemnités sont celles votées par le comité directeur de la FFE de juin 2024. Elles peuvent être soumises à modification ultérieure par cette même instance.  \n- ➔ Pour les compétitions par équipes (Matchs des interclubs, phase qualificative des compétitions fédérales).  \nLe montant de l'indemnité est de 50€ pour une demi -journée et de 85€ pour une journée complète.  \n- ➔ Pour les finales des compétitions fédérales, nous appliquerons les indemnités journalières ci-dessous:  \n| Compétitions Fédérales | Durée de la compétition | Arbitre Principal | Arbitre Adjoint |\n|-----------------------------------------------------------------------|---------------------------|---------------------|--------------------------|\n| Top16 | 11 jours | 100 € | 85€ |\n| Championnat de France Rapide et Blitz | 2 jours | 100€ | 85€ |\n| Phase finale de la Coupe de France | 2 jours | 75€ | 50€ (adjoint facultatif) |\n| Phase finale du Top12F | 2 jours | 75€ | 50€ (adjoint facultatif) |\n| Phase finale de la Coupe Loubatière | 2 jours | 100€ | 50€ |\n| Phase finale de la Coupe de la Parité | 2 jours | 100€ | 50€ |\n| Phase finale des championnats de France scolaires (écoles + collèges) | 3 jours | 100€ | 75€ |"], "ground_truth": "- ➔ Pour les compétitions par équipes (Matchs des interclubs, phase qualificative des compétitions fédérales)."}
{"question": "Qu'est-ce que un drapeau?", "answer": "", "contexts": ["Autrement, une horloge doit être accrochée au mur à l'intérieur du lieu de la compétition et indiquer l'heure officielle du tournoi.  \nSi le délai de forfait n'est pas 0(zéro), il est conseillé que l'arbitre annonce publiquement l'heure du début de la ronde et qu'il/elle note l'heure de départ. Si le délai de forfait est par exemple de 30 minutes et que la ronde devait commencer à 15h00, mais a effectivement commencé à 15h15, les joueurs et joueuses ne perdent par forfait qu'à 15h45.  \n- 6.8. On considère qu'un drapeau est tombé quand l'arbitre constate le fait ou que l'un ou l'autre des deux adversaires a fait une réclamation valide à ce sujet.  \nUn drapeau est considéré comme tombé quand le fait est noté ou demandé, pas quand il est effectivement tombé. Si un résultat est atteint avant que l'on remarque la chute du drapeau alors ce résultat est conservé. L'arbitre doit annoncer la chute du drapeau dès qu'il/elle le remarque.  \n6.9. En dehors de l'application de l'un des articles 5.1.1, 5.1.2, 5.2.1, 5.2.2 ou 5.2.3, si un joueur ou une joueuse n'a pas achevé le nombre de coups prescrits dans le temps imparti, la partie est perdue par ce joueur ou cette joueuse. Toutefois, la partie est déclarée nulle, si la position est telle que son adversaire ne peut mater son roi par aucune suite de coups légaux."], "ground_truth": "un drapeau est tombé quand l'arbitre constate le fait ou que l'un ou l'autre des deux adversaires a fait une réclamation valide à ce sujet."}
{"question": "Quelle règle est énoncée à la page 182?", "answer": "", "contexts": ["Tous les tournois se déroulant dans des conditions hybrides telles que décrites au point 2.1 doivent être approuvés individuellement par la Présidence de la CH  \nDans des cas exceptionnels, le conseil de la FIDE -en prenant en compte l'avis de la CH ou la présidence de la FIDE -dans le cas d'événements avec des classements supérieurs à 2700 peuvent décider d'homologuer des tournois ou des matchs individuels q ui n'ont pas été soumis par la fédération national e.  \n- 0.3. Les rapports de tournois pour toutes les manifestations officielles de la FIDE et les événements continentaux doivent être transmis et seront comptabilisés pour le classement. L'Arbitre Principal est responsable de la transmission des résultats au responsable du classement FIDE\n- 0.4. La FIDE se réserve le droit de ne pas prendre un tournoi en particulier en compte pour le classement. Les organisateurs d 'un tournoi ont le droit de faire appel de cette décision auprès de la CH. Un tel appel doit être fait dans les 7 jours suivant la communication de la décision."], "ground_truth": "Les rapports de tournois pour toutes les manifestations officielles de la FIDE et les événements continentaux doivent être transmis et seront comptabilisés pour le classement."}
{"question": "Quelle obligation est énoncée à la page 3?", "answer": "", "contexts": ["## ARTICLE 8 - TRANSMISSION DES DOCUMENTS ET ACTES DE PROCEDURE  \nLa transmission des documents et actes de procédure mentionnés au présent règlement est effectuée par courrier recommandé avec accusé de réception ou par courrier remis en main propre contre décharge ou, le cas échéant, par courrier électronique à la personne poursuivie ou à son représentant légal, à son avocat, à l'association sportive avec laquelle elle a un lien juridique.  \nL'utilisation du courrier électronique doit garantir la fiabilité de l'identification des parties à la communication électronique, l'intégrité des documents adressés ainsi que la sécurité et la confidentialité des échanges entre l'ensemble des personnes participant à la procédure disciplinaire. Elle doit permettre également d'établir de manière certaine la date et l'heure de la transmission des documents ainsi que celles de leur réception par leur destinataire."], "ground_truth": "Elle doit permettre également d'établir de manière certaine la date et l'heure de la transmission des documents ainsi que celles de leur réception par leur destinataire."}
{"question": "Que se passe-t-il en cas de force majeure?", "answer": "", "contexts": ["## 4. Parties non jouées  \n- 4.1. Qu'elles se produisent à cause d'un forfait ou pour toute autre raison, elles ne sont pas comptabilisées. Sauf en cas de force majeure, toute partie où les deux adversaires ont effectué au moins un coup sera prise en compte pour le classement sauf si les règles relatives au fair-play en disposent autrement."], "ground_truth": "en cas de force majeure, toute partie où les deux adversaires ont effectué au moins un coup sera prise en compte pour le classement sauf si les règles relatives au fair-play en disposent autrement."}
{"question": "Qu'est-ce que le en?", "answer": "", "contexts": ["H.6 La PE instruit chaque cas dans un délai raisonnable, généralement en moins de deux semaines.  \nH.7 À la fin de l'enquête, la PE rédige un rapport à l'intention de la FPL pour examen, indiquant : l'action qui a déclenché l'enquête, les circonstances factuelles de l'incident, les conclusions de l'enquête et une proposition de sanction. Le rapport peut s'é tendre à toute autre violation des règlements de la FIDE constatée par la PE durant son enquête. La FPL peut demander à la PE d'examiner des faits supplémentaires et/ou de mener des investigations plus approfondies. H.8 Une fois que la PE a remis son rapport définitif, la FPL décide à la majorité si l'affaire doit être transmise à la CED pour être jugée. Si l'affaire n'est pas transmise à la CED, elle est considérée comme rejetée. La FPL transmet ses conclusions à la personne ayant porté plainte et à la personne accusée. Si la fédération nationale de la personne accusée est impliquée, elle en est également informée."], "ground_truth": "le en est également informée."}
{"question": "Que se passe-t-il en cas de sanction liées à la pendule?", "answer": "", "contexts": ["- 5.4.3.8. En cas de sanction liées à la pendule, il doit être possible pour un unique arbitre d'effectuer les corrections du temps et du compteur de coups dans un délai de 60 secondes.\n- 5.4.3.9. Il doit être impossible d'effacer ou modifier les données affichées par la pendule avec une manipulation trop simple.\n- 5.4.3.10. Les pendules doivent disposer d'un bref manuel d'utilisation.\n- 5.4.3.11. Toute cadence officielle doit être mentionnée dans les procédures de test des pendules.\n- 5.4.3.12. Les pendules d'échecs électroniques utilisées pour les événement s de la FIDE doivent être approuvées par la commission technique de la FIDE.\n- 5.5. Les pendules électroniques approuvées par la FIDE sont les suivantes :"], "ground_truth": "En cas de sanction liées à la pendule, il doit être possible pour un unique arbitre d'effectuer les corrections du temps et du compteur de coups dans un délai de 60 secondes."}
{"question": "Qu'est-ce que le professionnelle?", "answer": "", "contexts": ["## 2.2.1.1 Nomination  \nLe médecin fédéral est nommé par le comité directeur de la FFE parmi les membres pris en son sein. Il est obligatoirement docteur en médecine et licencié à la FFE. La durée de sa fonction est liée à celle du comité directeur de la FFE.  \nSa responsabilité civile professionnelle est couverte, pour ses actions fédérales par l'assurance en responsabilité civile de la FFE."], "ground_truth": "le professionnelle est couverte, pour ses actions fédérales par l'assurance en responsabilité civile de la FFE."}
{"question": "Qu'est-il permis de faire selon 2024_Statuts20240420?", "answer": "", "contexts": ["## ARTICLE 17 : MODALITÉS DE DISSOLUTION  \nL'assemblée générale ne peut prononcer la dissolution de la FFE que si elle est convoquée spécialement à cet effet.  \nLa décision de dissolution ne peut être prise que dans les mêmes conditions de convocation, de quorum et de majorité que pour la modification des statuts.  \nEn cas de dissolution approuvée, l'assemblée générale désigne un ou plusieurs commissaire(s) chargé(s) de la liquidation de ses biens.  \nDans cette hypothèse, elle attribue l'actif net à un ou plusieurs établissements analogues, publics ou reconnus d'utilité publique, ou à des établissements mentionnés à l'article 6, cinquième alinéa, de la loi du 1 er juillet 1901 modifiée."], "ground_truth": "La décision de dissolution ne peut être prise que dans les mêmes conditions de convocation, de quorum et de majorité que pour la modification des statuts."}
{"question": "Qu'est-ce que la priorité?", "answer": "", "contexts": ["## Instructions pour le tirage au sort « restrictif » des numéros d'appariement :  \nHandbook C.05 - Allocation « dirigée » des numéros d'appariement. Texte approuvé par l'Assemblée Générale de la FIDE de 1987.  \n1. L'arbitre doit préparer à l'avance des enveloppes sans aucune marque, chacune contenant les numéros d'une des séries A, B, C et D comme indiqué dans les tables de Varma au point n°5. Ces enveloppes sont placées ensuite respectivement dans des enveloppes plus grandes sur lesquelles est indiquée le nombre de numéros contenus dans les petites enveloppes.\n2. L'ordre dans lequel les joueurs/joueuses tirent leur numéro est prédéterminé ainsi :\n- Les personnes de la fédération ayant le plus grand nombre de représentants tirent au sort en premiers.\n- Lorsque deux fédérations ou plus comptent le même nombre de représentants, la priorité est donnée à l'ordre alphabétique des codes FIDE des pays.\n- Parmi les joueurs et joueuses d'une même fédération, la priorité est déterminée par l'ordre alphabétique de leurs noms.\n3. Par exemple, le premier joueur de la fédération ayant le plus grand nombre de joueurs et joueuses choisira une des grandes enveloppes qui contiendra au moins suffisamment de numéros pour son contingent, puis tirera au sort son numéro d'appariement dans cette enveloppe. Les autres joueurs et joueuses du même contingent tirent également leur numéro d'appariement dans la même enveloppe. Les numéros restants pourront être utilisés par les autres joueurs et joueuses.\n4. Les personnes du contingent suivant tirent alors une autre enveloppe et la procédure est répétée jusqu'à ce que tous les joueurs et joueuses aient un numéro d'appariements ."], "ground_truth": "la priorité est donnée à l'ordre alphabétique des codes FIDE des pays."}
{"question": "Que precise de F02_2025_26_Championnat_indivi?", "answer": "", "contexts": ["## 1.2. Déroulement de la compétition  \nElle se déroule en deux phases : une phase zone interdépartementale (ZID) et une finale.  \nLa première phase est organisée sous le contrôle de la Ligue. Elle est ouverte aux joueuses licenciées dans chacune des zones interdépartementales de cette Ligue.  \nSe qualifient pour la phase finale :  \n- 1 joueuse pour 1 à 10 participantes ;\n- 2 joueuses pour 11 à 20 participantes\n- 3 joueuses pour 21 à 30 participantes ;\n- 4 joueuses pour 31 à 40 participantes ;\n- 5 joueuses pour 41 à 60 participantes ;\n- 6 joueuses pour 61 à 100 participantes ;\n- 7 joueuses pour plus de 100 participantes.  \nDes repêchages parmi les participantes de la phase ZID pourront être éventuellement opérés pour la phase finale.  \nSont qualifiées directement pour la phase finale :  \n- La championne et la vice-championne de l'année précédente ;\n- Les premières de chacune des catégories de U8F à U20F de l'édition précédente ;\n- Une joueuse sélectionnée par le club organisateur ;\n- Les joueuses françaises titrées GM, MI, GMF ou MIF ;\n- Les deux premières classées dans chacune des catégories féminines du championnat de France Jeunes de la saison en cours. Si elles sont déjà qualifiées, les places reviennent aux suivantes ;\n- Une joueuse par ZID choisie par la Ligue, sans obligation d'avoir participé aux phases de qualification."], "ground_truth": "Déroulement de la compétition  \nElle se déroule en deux phases : une phase zone interdépartementale (ZID) et une finale."}
{"question": "Qu'est-ce que les mécaniques?", "answer": "", "contexts": ["- 6.4. Immédiatement après la chute d'un drapeau, les exigences de l'Article 6.3.1 doivent être contrôlées.  \nCela signifie que l'arbitre et/ou les deux adversaires doivent vérifier si le nombre minimum de coups a été achevé Considérons une partie en 90 minutes pour 40 coups et 30 minutes pour le reste de la partie. Il est normal de vérifier si 40 coups ont été joués par les deux adversaires juste après la chute d'un drapeau.  \nSi un compteur de coups (de « pressions sur la pendule ») est utilisé avec une pendule électronique, alors il est possible d'établir si 40 coups ont été achevés avant la chute d'un drapeau, car un drapeau (ou un « -» ) apparaît sur la pendule dans le cas où un joueur/une joueuse n'a pas achevé 40 coups dans le temps imparti.  \nDans le cas où les deux cadrans d'une pendule électronique affichent 0.00, l'Arbitre peut établir quel drapeau est tombé le premier, avec l'aide du «» ou toute autre forme de drapeau.  \nLorsque des pendules mécaniques sont utilisées, l'article III.3.1 des Directives sur les parties sans incrément et fin de partie au KO est appliqué  \n- 6.5. Avant le début de la partie, l'arbitre décide de l'emplacement de la pendule d'échecs."], "ground_truth": "les mécaniques sont utilisées, l'article III."}
{"question": "Quelle règle est énoncée à la page 132?", "answer": "", "contexts": ["Appariement pondéré : m éthode d'appariement dans laquelle un poids numérique est attribué à chaque paire ou flotteur descendant, conformément aux critères d'appariement, dans le but d'avoir le meilleur appariement possible. Le meilleur appariement possible est celui avec le poids le plus faible.  \nAvant dernier niveau à apparier (ADN) : un niveau qui a échoué au test de complétion et qui nécessite un nouvel appariement en y ajoutant des flotteurs descendants afin de compléter l'appariement du niveau des joueurs au score effondré. Pour ce groupe, un critère particulier s'applique (C.4) tandis que l'habituel critère C7 ne s'applique pas."], "ground_truth": "Le meilleur appariement possible est celui avec le poids le plus faible."}
{"question": "Quelle obligation est énoncée à la page 206?", "answer": "", "contexts": ["## 2.6.1. Mondial ou Continental  \nLes événements organisés par la FIDE ou une des quatre fédérations d'échecs continentales  \n- 2.6.2. International\n- a) Pour qu'un tournoi international homologué FIDE puisse être pris en compte pour une norme pour le titre d'Arbitre FIDE, il doit inclure des joueurs d'au moins deux (2) fédérations différentes.\n- b) Pour qu'un tournoi international homologué FIDE puisse être pris en compte pour une norme pour le titre d'Arbitre International, il doit inclure des joueurs d'au moins trois (3) fédérations différentes."], "ground_truth": "International\n- a) Pour qu'un tournoi international homologué FIDE puisse être pris en compte pour une norme pour le titre d'Arbitre FIDE, il doit inclure des joueurs d'au moins deux (2) fédérations différentes."}
{"question": "Que se passe-t-il en cas de situation douteuse?", "answer": "", "contexts": ["## 9.1. Remarques générales.  \n- 9.1.1. Ces directives doivent être appliquées pour tous les tournois scolaires sous la responsabilité de la FIDE et sont fortement conseillées dans le cadre de tout tournoi scolaire homologué ou non.\n- 9.1.2. Chaque joueur/joueuse enfant doit être accompagné d'une personne adulte référente (parent ou a utre).\n- 9.1.3. Les accompagnateurs/accompagnatrices peuvent aider les enfants à trouver leurs tables.\n- 9.1.4. Pendant une ronde/un match, tous les accompagnateurs/ accompagnatrices/ parents/ entraineurs /entraineures sont traités comme des spectateurs/spectatrices. Ils/Elles doivent rester en place dans la zone désignée et ne doivent pas interférer avec une partie en cours. En cas de situation douteuse, ils/elles peuvent uniquement contacter l'arbitre ou l'équipe d' organisation.\n- 9.1.5. Les accompagnateurs/accompagnatrices ne doivent pas utiliser d'appareil électronique dans la salle de jeu.\n- 9.1.6. L'utilisation de caméras avec flash est limitée aux 5 premières minutes de la ronde et uniquement avec la permission de l'arbitre.  \nUne vigilance accrue est indispensable lorsque des prises de photos sont autorisées, les enfants ne doivent être pris en photo que par des personnes qu'ils/elles connaissent et avec leur consentement ou par l'équipe d'organisation pour la communication médiatique liée à l'événement. Il est nécessaire pour l'équipe d'organisation de s'assurer le respect du droit à l'image. Cela est valable pour toutes les compétitions."], "ground_truth": "En cas de situation douteuse, ils/elles peuvent uniquement contacter l'arbitre ou l'équipe d' organisation."}
{"question": "Quelle règle est énoncée à la page 119?", "answer": "", "contexts": ["## Intérêt du tournoi : affrontements entre les joueurs les plus forts.  \nDans une coupe idéale, les plus forts joueurs et joueuses (ou équipes) se rencontrent le plus tard possible.  \nLe principe de base est le suivant : le plus fort joue contre le plus faible, le deuxième plus fort joue contre l'avant dernier, le troisième contre l'antépénultième, etc.  \n- → Avec huit joueurs, il faudra trois tours : Quart de finale, Demi-finale et Finale.  \nLe plus fort (N°1) joue contre le plus faible (N°8), le deuxième plus fort (N°2) contre le deuxième plus faible (N°7) et ainsi de suite.  \n| 1⁄4 de finale | 1⁄2 finales | Finale |\n|---------------|-------------|----------|\n| 1-8 4-5 | 1-4 | 1-2 |\n| 3-6 | 2-3 | 1-2 |\n| 2-7 | | 1-2 |\n| | | 1-2 |  \n- → Avec seize joueurs, il faudra quatre tours  \n| 1/8 de finale | 1⁄4 de finale | 1⁄2 finales | finale |\n|-----------------|---------------|-------------|----------|\n| 1-16 | 1-8 | 1-4 | 1-2 |\n| 8-9 | 1-8 | 1-4 | 1-2 |\n| 5-12 | 4-5 | 1-4 | 1-2 |\n| 4-13 | 4-5 | 1-4 | 1-2 |"], "ground_truth": "Le principe de base est le suivant : le plus fort joue contre le plus faible, le deuxième plus fort joue contre l'avant dernier, le troisième contre l'antépénultième, etc."}
{"question": "Quelle règle est énoncée à la page 5?", "answer": "", "contexts": ["## 3.8. Forfaits sportifs  \nDéfinition : voir Règles générales 3.1.  \nUne équipe ayant plus de trois membres forfaits (1 en Nationale 3) perd le match sur le score de 3-0 (10-0 de points de parties, 5-0 en Nationale 3).  \nUne équipe n'ayant pas l'intention de se déplacer ou dans l'impossibilité d'aligner au moins 5 membres (3 en Nationale 3), doit avertir le club adverse et la direction de son groupe, au moins l'avant-veille du jour fixé pour le match. Toute équipe ne se conformant pas à ces prescriptions et provoquant un déplacement inutile, sera tenue de rembourser intégralement les frais de déplacement et de séjour occasionnés. La base de calcul des frais de déplacement sera établie par la direction du championnat.  \nSauf événement exceptionnel dûment justifié reconnu par la direction du championnat, tout forfait d'une équipe sera sanctionné par les amendes suivantes :  \n- 300 € en Top Jeunes ;\n- 100 € en Nationale 1 ;\n- 50 € en Nationale 2.  \nLe non-paiement des amendes dans le délai fixé entraîne l'exclusion du championnat la saison suivante.  \nEn Nationale 1 ou 2, une équipe qui aura déclaré forfait pour trois rencontres pourra être exclue du Championnat de France Interclubs Jeunes la saison suivante."], "ground_truth": "Une équipe ayant plus de trois membres forfaits (1 en Nationale 3) perd le match sur le score de 3-0 (10-0 de points de parties, 5-0 en Nationale 3)."}
{"question": "Qu'est-ce que la comptabilité?", "answer": "", "contexts": ["## 2. L'ORGANISATION COMPTABLE ET BUDGÉTAIRE  \nLes modalités pratiques de tenue et de contrôle interne de la comptabilité sont définies par le Directeur Général, sous le contrôle du Trésorier. Le cas échéant, un cabinet d'expertise comptable indépendant peut intervenir sur tout ou partie de la comptabilité.  \nLe commissaire aux comptes certifie tous les ans la sincérité des comptes, du résultat, et de la situation patrimoniale de la fédération. Le Président, le Trésorier et son adjoint le cas échéant, veillent à ce que toutes les informations nécessaires soient communiquées en temps utile aux instances concernées.  \nLe trésorier assure le suivi de l'exécution du budget et présente les comptes à l'Assemblée Générale."], "ground_truth": "la comptabilité sont définies par le Directeur Général, sous le contrôle du Trésorier."}
{"question": "Que doit faire le joueur selon le règlement?", "answer": "", "contexts": ["Limbe : Sousgroupe d'un niveau d'appariement hétérogène qui contient tous les flotteurs descendants qui ne seront pas appariés avec ce niveau. (Par nécessité, ces joueurs doivent flotter à nouveau)  \nNiveau d'appariement : Un ensemble de personnes à apparier. De manière générale, il correspond à un groupe de points, mais il peut également contenir des personnes ayant un score plus élevé qui n'ont pas pu être apparié dans le groupe de points précédent (voir alors Flotteur descendant) ;  \nEffondré : (voir dernier niveau effondré) ;  \nHétérogène  \n: un niveau qui contient des joueurs et joueuses ayant des scores différents,  \nHomogène  \n: niveau qui comprend des joueurs et joueuses dont le score est identique ;  \nRésiduel  \n: voir groupe résiduel.  \nNuméro d'appariement du niveau (NAN) : Numéro attribué à chaque joueur dans le niveau d'appariement avant toute transposition ou échange, représentant le classement du joueur dans le groupe d'appariement.  \nOrdre :  \nvoir au mot initial  \nPaire : deux joueurs qui jouent l'un contre l'autre.  \nPartie ajournée : partie qui a été suspendue et qui sera reprise ultérieurement. Pour les appariements, elle équivaut à un match nul (temporaire).  \nPréférence couleur : La couleur que le joueur doit idéalement recevoir pour la ronde suivante. Elle peut être déterminée pour chaque personne qui a joué au moins une partie.  \nAbsolue : une préférence couleur qui ne peut être remise en cause (voir C.3) à l'exception des top joueurs (voir A.7, C.8, C.9)."], "ground_truth": "le joueur doit idéalement recevoir pour la ronde suivante."}
{"question": "Quelle règle est énoncée à la page 86?", "answer": "", "contexts": ["- c. Promotion en dame automatique : le joueur ou la joueuse peut configurer la plateforme de jeu pour forcer la promotion en dame sans qu'il ne lui soit proposé de choisir la pièce promue.\n- 3.7. Tous les coups et les temps de la pendule après chaque coup sont automatiquement enregistrés par la plateforme de jeu et visibles des deux adversaires.\n- 3.8. Si un joueur ou une joueuse n'est pas en capacité d'effectuer ses coups , un assistant ou une assistante, qui doit avoir l'agrément de l'arbitre, peut être fourni par le joueur pour réaliser cette opération."], "ground_truth": "Tous les coups et les temps de la pendule après chaque coup sont automatiquement enregistrés par la plateforme de jeu et visibles des deux adversaires."}
{"question": "Quelle obligation est énoncée à la page 33?", "answer": "", "contexts": ["## RESPECTER LES REGLES  \n- Les parties se jouent conformément aux règles du jeu telles qu'elles sont définies et adoptées par la Fédération Internationale des Échecs et par la Fédération Française des Échecs. Elles doivent être appliquées de bonne foi.\n- Le résultat de la partie ou du match doit être acquis loyalement, sans bafouer l'éthique sportive et ne doit donc pas découler d'une quelconque négociation. Les comportements susceptibles de porter préjudice à un autre compétiteur ou de nature à jeter le discrédit sur notre sport sont totalement prohibés.\n- Une proposition de nullité est toujours inconditionnelle. Le partage du point par accord mutuel ne doit pas résulter de considérations dont les tenants et les aboutissants se situent hors du contexte sportif et ne peut intervenir qu'à l'occasion d'un réel affrontement sur l'échiquier."], "ground_truth": "- Le résultat de la partie ou du match doit être acquis loyalement, sans bafouer l'éthique sportive et ne doit donc pas découler d'une quelconque négociation."}
{"question": "Quelle règle est énoncée à la page 64?", "answer": "", "contexts": ["- I.10 Tout joueur ou joueuse arrivant à l'échiquier après le délai de forfait perd la partie à moins que l'arbitre n'en décide autrement. Toutefois, si le coup sous enveloppe met fin à la partie la partie, alors cette conclusion s'applique .\n- I.11 Lorsque le règlement de la compétition prévoit un délai de forfait différent de zéro, les règles suivantes s'appliquent : si aucun des deux adversaires n'est présent à la reprise, le joueur ou la joueuse qui doit répondre au coup sous enveloppe perd tout l e temps écoulé jusqu'à son arrivée, à moins que le règlement de la compétition n'en dispose autrement ou que l'arbitre n'en décide autrement."], "ground_truth": "Toutefois, si le coup sous enveloppe met fin à la partie la partie, alors cette conclusion s'applique ."}
{"question": "Quelle règle est énoncée à la page 60?", "answer": "", "contexts": ["## C.13 Principales abréviations :  \n- C.13.1. 0-0 =  \nroque avec la tour en h1 pour les Blancs ou la tour en h8 pour les Noirs (petit roque)  \n- C.13.2. 0-0-0 =  \nroque avec la tour en a1 pour les Blancs ou la tour en a8 pour les Noirs (grand roque)  \n- C.13.3. x =  \nprise  \n- C.13.4. + =  \néchec  \n- C.13.5. ++ ou # =  \néchec et mat  \nC.13.6. e.p. =  \nprise 'en passant'  \nLes articles C.13.3 à C.13.6 sont optionnels."], "ground_truth": "0-0-0 =  \nroque avec la tour en a1 pour les Blancs ou la tour en a8 pour les Noirs (grand roque)  \n- C.13.3."}
{"question": "Qu'est-ce que la FPL?", "answer": "", "contexts": ["## F. Juridiction  \nLa Commission du Fair-Play de la Fide (FPL) est compétente pour toutes les questions liées à la tricherie, y compris les fausses accusations dans tous les événements officiels de la FIDE. Les personnes soumises à la juridiction de la FPL sont les joueurs et joueuses, les parties prenantes et les capitaines d'équipe. Les parties prenantes comprennent, sans s'y limiter, les responsables de délégation, les personnes qui secondent ou entrainent, les entraîneurs, les managers, les psychologues, les membres de l' organisation, le public, les parents, les journalistes, les officiels du jeu d' échecs, les arbitres, lorsqu'ils sont impliqués dans des incidents de tricherie."], "ground_truth": "la FPL sont les joueurs et joueuses, les parties prenantes et les capitaines d'équipe."}
{"question": "Qu'est-il permis de faire selon R01_2025_26_Regles_generales.p?", "answer": "", "contexts": ["## 2.3.2. Transfert en cours de saison  \nUn joueur ou joueuse ayant déjà une licence pour la saison en cours ne peut changer de club qu'avec l'accord de la présidence du club quitté. Il ou elle ne pourra participer aux compétitions par équipes pour le compte de son nouveau club qu'avec l'accord de la Commission Technique fédérale, qui aura été préalablement saisie par le joueur ou la joueuse, et qui informera les Présidences des Ligues quittée et nouvelle de la demande et de sa décision."], "ground_truth": "Transfert en cours de saison  \nUn joueur ou joueuse ayant déjà une licence pour la saison en cours ne peut changer de club qu'avec l'accord de la présidence du club quitté."}
{"question": "Qu'est-ce que le nom?", "answer": "", "contexts": ["Personne Enquêtrice (PE): Annexe I, H.3. Fait référence à un membre de la Commission Fair-play de la FIDE chargé d'enquêter sur une situation où des allégations de triche sont survenues.  \nPHI :Article 16.5. Plateforme d'hébergement Internet.  \nPiratage : Annexe I,B.3. Survient quand une autre personne joue à la place du véritable joueur dont le nom est celui qui est supposé jouer la partie.  \nPlateforme de Jeu : Article 2. Fait référence au système d'hébergement ou à l'environnement de jeu pour une partie d'échecs en ligne.  \nPromotion Automatique : Article 3.6.c. Un pion est automatiquement remplacé par une Dame ou une autre pièce selon les réglages sélectionnés par le joueur dans le logiciel de la Plateforme de Jeu.  \nSVC  \n: Article 13. Système de Vidéoconférence."], "ground_truth": "le nom est celui qui est supposé jouer la partie."}
{"question": "Quelle règle est énoncée à la page 225?", "answer": "", "contexts": ["- 1.14.1. Il est fortement recommandé aux joueurs sans adresse électronique de fournir une adresse électronique de contact valide. Pour les mineurs, l'adresse e-mail des parents est fortement recommandée.\n- 1.15. Un nouvel enregistrement réussi renvoie la référence FIDE du joueur.\n- 1.16. La référence FIDE d'un joueur nouvellement inscrit sera envoyée par courriel, ainsi que le mot de passe pour accéder aux données statistiques du site web de la FIDE."], "ground_truth": "Pour les mineurs, l'adresse e-mail des parents est fortement recommandée."}
{"question": "Quelle règle est énoncée à la page 31?", "answer": "", "contexts": ["- Menaces et coercition : Toute personne qui intimide un Arbitre, un Officiel de la Compétition ou un Joueur avec des menaces sérieuses dans le but d'influencer leur prise de décision et/ou de les empêcher d'agir.\n- L'incitation à la haine et la violence.\n- La tentative d'atteinte à l'honneur.\n- La complicité d'infraction par le fait d'aider ou de couvrir les participants coupables d'infractions au code de l'éthique."], "ground_truth": "- L'incitation à la haine et la violence."}
{"question": "Qu'est-ce que le ELO?", "answer": "", "contexts": ["## 3.7 Composition des équipes  \nVoir Règlement des Interclubs Ligue de Provence - Nationale 5  \n-  L'équipe doit être composée de 4 joueurs qui possèdent une licence A et affilié à un club des Bouches-du-Rhône. Chaque infraction est sanctionnée par la marque de - 2 avec partie gagnée pour l'adversaire.\n-  Après la ronde 3, chaque équipe ne doit pas aligner plus d'un nouveau joueur (n'ayant pas participé au moins une fois pour le compte de cette équipe), et dont le ELO est supérieur à 1500. En cas d'infraction, forfait administratif sur le 1 échiquier concerné et tous ceux qui le suivent. C'est-à-dire qu'autant de nouveaux joueurs au ELO &lt;= 1500 sont autorisés. Cette règle ne s'applique pas pour les clubs dont l'équipe 1 est en Nationale 6.\n-  Aucune limite n'est imposée sur le nombre de joueurs français."], "ground_truth": "le ELO est supérieur à 1500."}
{"question": "Quelle règle s'applique aux joueurs selon J01_2025_26_Championnat_de_Fra?", "answer": "", "contexts": ["## 2. Organisation générale  \nLe Championnat de France Jeunes se joue en sept tournois mixtes ouverts aux joueurs et joueuses pour chaque catégorie d'âge de U8 à U20, et sept tournois féminins uniquement ouverts aux joueuses de U8F à U20F. Deux Opens mixtes sont organisés pour les joueuses et joueurs non-qualifiés pour les tournois cités.  \nLes phases qualificatives ne concernent pas :  \n- Les jeunes ayant acquis leur qualification directe pour les Championnats de France de la saison en cours en fonction de leur classement Elo ou de leurs résultats dans les championnats de la saison précédente (voir § Qualifiés d'office),\n- Les jeunes des catégories U18 (cadets) et U18F (cadettes) ; U20 (juniors) et U20F (juniors Filles)."], "ground_truth": "Deux Opens mixtes sont organisés pour les joueuses et joueurs non-qualifiés pour les tournois cités."}
{"question": "Quelle règle est énoncée à la page 78?", "answer": "", "contexts": ["## 2. Pièces de jeu d'échecs  \n- 2.1. Les pièces d'échecs doivent être dans le style Staunton ; et faites de bois, de plastique, ou d'une imitation de ces matériaux.\n- 2.2. La taille des pièces doit être proportionnelle à leur hauteur et à leur forme ; d'autres éléments tels que la stabilité et les considérations esthétiques peuvent également être pris en compte. Le poids des pièces doit être adapté à leur confort de déplacement et à leur stabilité.\n- 2.3. La hauteur des pièces, par ordre décroissant, est la suivante : Roi - 9,5 cm, Dame - 8,5 cm, Fou - 7 cm, Cavalier - 6 cm, Tour - 5,5 cm et Pion - 5 cm. Ces dimensions peuvent varier jusqu'à 10%, mais les pièces doivent rester dans l'ordre décroissant de hauteur.\n- 2.4. Le diamètre de la base d'une pièce doit représenter 40 à 50 % de sa hauteur.\n- 2.5. Les pièces doivent être conçues de manière à pouvoir être clairement distinguées les unes des autres. En particulier, le sommet du Roi doit permettre de le distinguer de celui de la Dame. Le sommet du Fou peut porter une encoche ou être d'une couleur spéciale qui le distingue clairement d'un Pion.\n- 2.6. Les pièces « blanches » peuvent être blanches ou crème, ou d'autres nuances claires de ces couleurs. Les pièces « noires » doivent être brunes ou noires, ou d'autres nuances foncées de ces couleurs. La couleur naturelle du bois (noyer, érable, etc.) peut également être utilisée. Les pièces ne doivent pas être brillantes et doivent être agréables à l'œil. Exemple de pièces d'échecs :  \n<!-- image -->  \n<!-- image -->"], "ground_truth": "Les pièces d'échecs doivent être dans le style Staunton ; et faites de bois, de plastique, ou d'une imitation de ces matériaux."}
{"question": "Quelle règle est énoncée à la page 153?", "answer": "", "contexts": ["## 12.2. Sonneborn-Berger étendu pour les équipes.  \nPour les compétitions par équipes, quatre combinaisons de départage de type Sonneborn-Berger sont possibles en utilisant les valeurs données pour chacun des adversaires par le produit de deux éléments :  \n- Le nombre total de points de match ou de points de parties marqués par chaque adversaire.\n- Le nombre total de points de match ou de points de parties contre cet adversaire.  \nLes quatre possibilités sont pour, chacune des équipes adverses, de calculer :  \n- 12.2.1. Total des points de match de l'équipe adverse × Points de match marqués contre elle.\n- 12.2.2. Total des points de match de l'équipe adverse × Points de parties marqués contre elle.\n- 12.2.3. Total des points de parties de l'équipe adverse × Points de match marqués contre elle.\n- 12.2.4. Total des points de parties de l'équipe adverse × Points de parties marqués contre elle .  \nOn additionne ensuite les valeurs obtenues pour chacune des équipes adverses"], "ground_truth": "Pour les compétitions par équipes, quatre combinaisons de départage de type Sonneborn-Berger sont possibles en utilisant les valeurs données pour chacun des adversaires par le produit de deux éléments :  \n- Le nombre total de points de match ou de points de parties marqués par chaque adversaire."}
{"question": "Quelle règle est énoncée à la page 195?", "answer": "", "contexts": ["- ( 1) Qu'il /elle ait rencontré la combinaison requise d'adversaires , et\n- (2) Que cela lui laisse au moins le nombre minimum de parties prévu au 1.4.1\n- f) Quel que soit le format du tournoi, un joueur ou une joueuse peut ignorer les parties contre tout adversaire qu'il /elle a battu à condition que cela lui laisse au moins le nombre minimum de parties prévu au 1.4.1 contre la combinaison requise d'adversaire. Toutefois, la grille de résultats entière de l'événement devra être transmise. Pour les tournois en toute-rondes ou en toute-rondes aller-retour, la combinaison des adversaires doit être telle qu'une norme soit possible pour l'ensemble du tournoi.\n- 1.4.2. Les parties suivantes ne sont pas incluses :\n- a) Contre des adversaires qui ne font pas partie d'une fédération de la FIDE. Les joueurs et joueuses avec le code de fédération « FIDE » sont acceptés mais ne sont pas comptés comme des adversaires étrangers. Le conseil de la FIDE peut modifier cette exigence à titre temporaire.\n- b) Contre des joueurs et joueuses non classés qui marquent zéro contre les joueurs et joueuses classés dans les tournois toutes rondes."], "ground_truth": "Toutefois, la grille de résultats entière de l'événement devra être transmise."}
{"question": "Quelle règle s'applique aux joueurs selon R01_2025_26_Regles_generales.p?", "answer": "", "contexts": ["## 13. Commission Handicap  \nDes règlements spécifiques ont été édictés par la Commission Handicap :  \n- H01 : Conduite à tenir quant aux joueurs et joueuses handicapé(e)s.\n- H02 : Texte d'application pour les joueurs et joueuses à mobilité réduite.  \nR01-6/6"], "ground_truth": "- H02 : Texte d'application pour les joueurs et joueuses à mobilité réduite."}
{"question": "Qu'est-ce que le rôle?", "answer": "", "contexts": ["## Généralités pour la prévention anti-triche  \nLes mesures de prévention antitriche varieront selon les niveaux de tournois afin de prendre en compte l'impact budgétaire de celles-ci.  \nLes organisateurs sont responsables de la mise en œuvre de ces mesures de prévention et l'arbitre en chef a le devoir de vérifier que le tournoi se déroule en conformité avec ces mesures. Dans son rapport de tournoi, l'arbitre en chef doit signaler tous les manquements et violations de ces mesures de prévention.  \nLe fait de ne pas se conformer aux mesures de prévention et/ou de ne pas vérifier et rapporter cette conformité sera considéré comme un manquement majeur et pourra être signalé à la commission compétente.  \nLes organisateurs/organisatrices de tournois doivent adopter l'un des trois niveaux de prévention (Prévention Standard, Prévention Accrue ou Prévention Maximale). Les mesures de prévention doivent être indiquées dans l'annonce du tournoi.  \nDans les tournois au niveau de protection accru ou maximal, on peut prévoir des arbitres dont le rôle est l'anti -triche."], "ground_truth": "le rôle est l'anti -triche."}
{"question": "Quelle règle est énoncée à la page 160?", "answer": "", "contexts": ["## Directives pour l'accueil des joueurs et des joueuses d'échecs handicapées.  \nTraduction du texte de la Fide - Guidelines on Treatment of Disabled Chess Players -Handbook D.04.12  \n1. Ces directives doivent être utilisées pour tous les événements homologués par la FIDE\n2. Aucun joueur et aucune joueuse n'a le droit de refuser de jouer contre une personne handicapée contre laquelle il/elle a été correctement apparié.\n3. Les lieux de compétition doivent être accessibles à tous, ou un lieu alternatif acceptable doit être disponible pour les personnes ne pouvant accéder au lieu de compétition désigné.\n4. Lors de l'inscription, il sera possible de signaler si un joueur ou une joueuse a un handicap qui nécessite des adaptations particulières. Le joueur ou la joueuse doit informer l'équipe d'organisation de ces circonstances particulières au plus tôt. (La FIDE préconise 20 jours avant le début du tournoi).\n5. Aucune personne handicapée ne doit être pénalisée suivant les articles 6.2.6 et 8.1.6 des règles du jeu en raison de son handicap.\n6. Un joueur ou une joueuse avec handicap qui demande raisonnablement à temps le placement de son matériel à une place ou suivant une orientation particulière, a le droit de le faire, à condition que cela ne désavantage pas son adversaire ou les autres joueur s et joueuses. L'équipe organisatrice de l'événement doit veiller à ce que les besoins des deux adversaires soient pris en compte.\n7. Toutes les informations pertinentes doivent être disponibles avant le début de l'événement, y compris des affichages permettant de situer l'emplacement des toilettes, de la buvette et des sorties de secours."], "ground_truth": "Ces directives doivent être utilisées pour tous les événements homologués par la FIDE\n2."}
{"question": "Quelle règle est énoncée à la page 161?", "answer": "", "contexts": ["13. Il est recommandé que chaque fédération nationale du jeu d'échecs nomme un responsable des questions relatives aux handicaps.\n14. Il est fortement recommandé que tous les organisateurs et organisatrices d'événements échiquéens adoptent ces directives.  \nPoints importants à prendre en considération pour les tournois accueillant spécifiquement des personnes en situation de handicap (par exemple un championnat pour personnes malvoyantes)"], "ground_truth": "Il est fortement recommandé que tous les organisateurs et organisatrices d'événements échiquéens adoptent ces directives."}
{"question": "Qu'est-ce que la table?", "answer": "", "contexts": ["## 4. Tables et chaises  \n- 4.1. Pour toutes les compétitions organisées sous l'égide de l' EVE et de la GSC :\n- 4.1.1. La longueur de la table est de 110 cm (plus ou moins 15 %)\n- 4.1.2. La largeur de la table est de 85 cm (plus ou moins 15 %)\n- 4.1.3. La hauteur de la table est de 74 cm.\n- 4.2. Pour toutes les compétitions Junior, Jeunes, Cadets et Écoles organisées sous l'égide de l' EVE, la longueur, la largeur et la hauteur des tables peuvent être modifiées en fonction de l'âge des participants en accord avec l' EVE.\n- 4.3. Les chaises doivent être confortables pour les joueurs. Tout bruit lors du déplacement des chaises doit être minimisé."], "ground_truth": "la table est de 74 cm."}
{"question": "Que precise de R02_2025_26_Regles_generales_A?", "answer": "", "contexts": ["- ZID Guyane : département 973\n- ZID Hauts-de-France Nord : départements 59-62\n- ZID Hauts-de-France Sud : départements 02-60-80\n- ZID Île-de-France : départements 75-77-78-91-92-93-94-95\n- ZID La Réunion : département 974\n- ZID Languedoc Roussillon : départements 11-30-34-48-66\n- ZID Limousin : départements 19-23-87\n- ZID Lorraine : départements 54-55-57-88\n- ZID Lyonnais : départements 01-42-69\n- ZID Martinique : département 972\n- ZID Midi-Pyrénées : départements 09-12-31-32-46-65-81-82\n- ZID Normandie : départements 14-27-50-61-76\n- ZID Nouvelle-Calédonie\n- ZID PACA : départements 04-05-06-13-83-84.\n- ZID Pays de Loire : départements 44-49-53-72-85\n- ZID Poitou-Charente : départements 16-17-79-86\n- ZID Polynésie  \n---------"], "ground_truth": "- ZID Guyane : département 973\n- ZID Hauts-de-France Nord : départements 59-62\n- ZID Hauts-de-France Sud : départements 02-60-80\n- ZID Île-de-France : départements 75-77-78-91-92-93-94-95\n- ZID La Réunion : département 974\n- ZID Languedoc Roussillon : départements 11-30-34-48-66\n- ZID Limousin : départements 19-23-87\n- ZID Lorraine : départements 54-55-57-88\n- ZID Lyonnais : départements 01-42-69\n- ZID Martinique : département 972\n- ZID Midi-Pyrénées : départements 09-12-31-32-46-65-81-82\n- ZID Normandie : départements 14-27-50-61-76\n- ZID Nouvelle-Calédonie\n- ZID PACA : départements 04-05-06-13-83-84."}
{"question": "Qu'est-ce que les pendules?", "answer": "", "contexts": ["- III.3.1.1. La partie continue si cela se produit dans toute période de jeu autre que la dernière.\n- III.3.1.2. La partie est nulle si cela se produit dans une période de jeu où tous les coups restants doivent être achevés.  \nIII.4 Si le joueur ou la joueuse au trait a moins de 2 minutes restantes à sa pendule, il/elle peut demander qu'un incrément de 5 secondes par coup soit introduit pour lui/elle et son adversaire, si possible. Ceci représente une proposition de nulle. Si la propo sition de nulle est refusée et que l'arbitre accepte la requête, les pendules sont alors programmées avec l'ajout de temps ; l'adversaire reçoit deux minutes de temps supplémentaire et la partie continue.  \nIII.5 Si l'article III.4 ne s'applique pas et que le joueur ou la joueuse au trait a moins de deux minutes à sa pendule, il/elle peut réclamer la nulle avant que son drapeau ne tombe. Il/Elle doit appeler l'arbitre et peut mettre la pendule d'échecs en pause (voir Article 6.11.2). Il/Elle peut réclamer sur la base que son adversaire ne peut pas gagner par des moyens normaux et/ou que son adversaire n'a fait aucun effort pour gagner par des moyens normaux.  \n- III.5.1. Si l'arbitre est d'accord que l'adversaire ne peut pas gagner par des moyens normaux ou que l'adversaire ne fait aucun effort pour gagner la partie par des moyens normaux, l'arbitre déclare la partie nulle. Dans le cas contraire, l'arbitre reporte sa décision ou rejette la demande."], "ground_truth": "les pendules sont alors programmées avec l'ajout de temps ; l'adversaire reçoit deux minutes de temps supplémentaire et la partie continue."}
{"question": "Quelle est l'obligation de l'arbitre?", "answer": "", "contexts": ["## TRAITEMENT DES TOURNOIS FERMES A NORMES  \nLes obligations de rapport technique à l'adresse de la direction des tournois et du DNA sont les mêmes. Il convient juste d'y ajouter la grille des résultats renumérotée selon le classement final.  \nL'arbitre est tenu de conserver dans ses archives personnelles une copie du rapport technique pendant 1 an à compter de la fin du tournoi.  \nL'arbitre enverra également un rapport au secrétariat fédéral à l'attention du directeur technique national.  \nDirecteur Technique National : Monsieur Jordi Lopez jordi.lopez@ffechecs.fr  \nCe rapport doit être envoyé dans les 7 jours qui suivent la fin du tournoi. Tout retard pourra être sanctionné par le biais d'une mesure disciplinaire prise par la DNA à l'encontre de l'arbitre.  \nCe rapport comprend les pièces suivantes :  \n- → Liste des participants en respectant l'orthographe des noms adoptée par la FIDE, notamment pour l'alphabet cyrillique, avec numéros d'identification FIDE, Elo international, fédérations (en employant le code FIDE, en trois lettres).\n- → Grille des résultats (renumérotée selon le classement final)\n- → Fichier pgn de l'ensemble des parties (Ce fichier pgn peut être transmis sur le site de la fédération via le module « administration de tournois » où la boule papi est déposée - http://admin.echecs.asso.fr/ ).\n- → Attestations de normes, le cas échéant (formulaires FIDE) :"], "ground_truth": "L'arbitre est tenu de conserver dans ses archives personnelles une copie du rapport technique pendant 1 an à compter de la fin du tournoi."}
{"question": "Qu'est-ce que les classements?", "answer": "", "contexts": ["## B. Ordre Initial  \n1. Avant le début du tournoi, chaque joueur/joueuse se voit attribuer un classement. Celui-ci est généralement obtenu à partir de la liste des classements Elo. Si un classement Elo est disponible pour tous les joueurs et joueuses participants, il convient de l'utiliser.  \nIl est conseillé de vérifier tous les classements fournis par les joueurs et joueuses. Si aucun classement fiable n'est connu pour un joueur ou une joueuse, les arbitres devront en faire une estimation aussi précise que possible.  \n2. Avant la première ronde, les joueurs et joueuses sont rangés selon l'ordre suivant :\n- a. Leur force (classement Elo)\n- b. Leur titre FIDE. (G.M., M.I., G.M.F., M.F., M.I.F., C.M. (candidat maître), M.F.F., C.M.F. (candidat maître féminin) puis les non-titrés.\n- c. Alphabétiquement (à moins que ce critère n'ait été au préalable remplacé par un autre).\n3. Le rangement précédent est utilisé pour déterminer les numéros d'appariement : le plus fort obtient le n°1, etc.  \nSi, pour une raison quelconque, les données utilisées pour déterminer les classements sont incorrectes, elles peuvent être corrigées à tout moment. Les numéros d'appariement peuvent être réassignés, en accord avec les corrections réalisées. Aucune modifica tion des numéros d'appariement n'est autorisée après l'appariement de la 4 e ronde."], "ground_truth": "les classements sont incorrectes, elles peuvent être corrigées à tout moment."}
{"question": "Qu'est-ce que la FFE?", "answer": "", "contexts": ["## 10.6. Le séminaire d'arbitre F.I.D.E (SF)  \nLe séminaire SF, d'une durée de 30 heures (4 jours), permet de préparer le titre d'arbitre F.I.D.E. et AFE.  \nLe contenu du stage est celui défini par la F.I.D.E. pour les stages de formation d'arbitres F.I.D.E.  \nLes séminaires d'arbitres F.I.D.E. organisées sous l'égide de la FFE sont ouverts à tout AFO de niveau 2, licencié A et âgé d'au moins 20 ans."], "ground_truth": "la FFE sont ouverts à tout AFO de niveau 2, licencié A et âgé d'au moins 20 ans."}
{"question": "Quelle règle est énoncée à la page 72?", "answer": "", "contexts": ["## Préambule  \nToutes les compétitions d'échecs internationales sont jouées selon les Règles du Jeu de la FIDE (E.I.01A). Les Règles générales pour les compétitions FIDE sont utilisées conjointement avec les Règles du Jeu d'Échecs et sont applicables à toutes les compéti tions officielles de la FIDE. Il est recommandé qu'elles soient également appliquées à tous les tournois comptant pour le classement FIDE, en les adaptant si c'est nécessaire.  \nLes organisateurs/organisatrices, les Compétiteurs/Compétitrices et les Arbitres impliqués dans toute compétition doivent prendre connaissance de ces règlements avant le début de la compétition.  \nLes lois nationales du pays accueillant la compétition prévalent sur les règles FIDE."], "ground_truth": "Il est recommandé qu'elles soient également appliquées à tous les tournois comptant pour le classement FIDE, en les adaptant si c'est nécessaire."}
{"question": "Qu'est-ce que la manifestation?", "answer": "", "contexts": ["- 1.2.2. Pour les compétitions continentales, sous-continentales ou approuvées par les associations internationales affiliées à la FIDE, un titre ou une norme ne peut être obtenu que si au moins un tiers ou cinq des fédérations membres appropriées -en prenant en compte la plus petite valeur -participent à la manifestation.  \nLe minimum de participants et participantes à la manifestation est dix. Le minimum de rondes est 9.  \nLes Championnats du Monde (incluant U20) organisés par la commission des joueurs et joueuses handicapés sont exemptés de cette règle.  \n- a) Si des groupes sont fusionnés pour faire un groupe plus important, alors les exigences -au moins 10 participants et participantes d'au moins un tiers ou 5 des fédérations membres appropriées selon la valeur la plus basse -issues du 1.2.2 s'appliqueront à ce groupe fusionné. Des titres et des normes peuvent être attribués aux meilleurs joueurs ou joueuses des sous-groupes, à condition que le sousgroupe ait au moins 6 participants ou participantes d'au moins 3 fédérations et que le joueur /la joueuse marque un minimum de 50% sur le total des rondes.\n2. 1.2.3. Termes utilisés dans les t ableaux pour l'obtention directe de titres :  \nOr = Premier après tiebreak ; 1er ex-aequo = Au maximum les 3 meilleurs après départage ;"], "ground_truth": "la manifestation est dix."}
{"question": "Qu'est-ce que les enregistrements?", "answer": "", "contexts": ["## A. Dispositions générales  \nA.1 Toutes les parties de la compétition doivent être surveillées par un logiciel de surveillance (logiciel de Fair-Play) pendant et/ou après les parties.  \nA.2 Le seul logiciel de Fair-Play autorisé par la FIDE est le « FIDE Game Screening Tool ». Les autres logiciels doivent être explicitement approuvés par la Commission du Fair-Play de la FIDE (FPL).  \nA.3 La plupart des plateformes de jeu analysent automatiquement les parties d'une compétition par leurs propres procédures anti-triche Ces procédures ne sont pas officielles dans les compétitions de la FIDE. Elles donnent seulement une indication qui nécessite ensuite une enquête plus approfondie.  \nA.4 Les joueurs et joueuses doivent jouer sous leur vrai nom.  \nA.5 Il peut être demandé aux joueurs et joueuses d'être visibles par caméra en utilisant un SVC (entre les parties, les joueurs et joueuses peuvent être autorisés à éteindre la caméra). Les images de la plate-forme de vidéoconférence peuvent être enregistrées par l'organisateur. Seuls l'arbitre en chef, le groupe d'expertise (le cas échéant), les membres de la CED (Commission d'Ethique et de Discipline) et de la FPL peuvent y accéder si nécessaire. Les enregistrements sont effacés un an après l'annonce officielle des résultats, sauf si des procédures à l'encontre de participants et participantes au tournoi en question ont été ouvertes auparavant par la FPL ou la CED."], "ground_truth": "Les enregistrements sont effacés un an après l'annonce officielle des résultats, sauf si des procédures à l'encontre de participants et participantes au tournoi en question ont été ouvertes auparavant par la FPL ou la CED."}
{"question": "Qu'est-il permis de faire selon Interclubs_DepartementalBdr.pd?", "answer": "", "contexts": ["## 2.2 Calendrier  \nLes dates des différentes rondes sont données par la Fédération Française des Echecs.  \nUne ou des rencontres peuvent être reportées par un Directeur de groupe pour des raisons impérieuses (intempéries, etc...)  \nUne rencontre peut être avancée à la demande d'un club, en accord avec le Directeur de groupe et l'équipe adverse.  \nLorsqu'une journée de championnat est déplacée (avancée ou reportée), cette journée est considérée comme étant jouée à la date initialement prévue au calendrier. Un joueur participant pour le compte d'une équipe à une rencontre déplacée ne peut pas jouer pour le compte d'une autre équipe à la date initialement prévue.  \nLe directeur de groupe essayera de rester en concordance avec le calendrier de Nationale IV."], "ground_truth": "Une ou des rencontres peuvent être reportées par un Directeur de groupe pour des raisons impérieuses (intempéries, etc...)  \nUne rencontre peut être avancée à la demande d'un club, en accord avec le Directeur de groupe et l'équipe adverse."}
{"question": "Quelle règle est énoncée à la page 158?", "answer": "", "contexts": ["- On lui attribue donc (100 + 75) ÷ 2 = 87.5 €\n- Germain aurait eu 0 € pour le prix à la place et 75 € pour le prix au partage intégral.\n- On lui attribue donc (0 + 75) ÷ 2 = 37.5 €\n- Hortense aurait eu 0 € pour le prix à la place et 75 € pour le prix au partage intégral.  \nOn lui attribue donc (0 + 75) ÷ 2 = 37.5 €  \n| | Prix annoncé | Joueur | Prix à la place | Prix au partage intégral | Prix au système Hort |\n|-------|----------------|------------------|-------------------|----------------------------|------------------------|\n| 1 er | 1000 € | Arthur | 1000 € | 850 € chacun | 925 € |\n| 2 ème | 700 € | Bertrand | 700 € | 850 € chacun | 775 € |\n| 3 ème | 500 € | Cécile | 500 € | 450 € chacun | 475 € |\n| 4 ème | 400 € | Damien | 400 € | 450 € chacun | 425 € |\n| 5 ème | 200 € | Emma | 200 € | 75 € chacun | 137.5 € |\n| 6 ème | 100 € | Farid | 100 € | 75 € chacun | 87.5 € |"], "ground_truth": "- On lui attribue donc (0 + 75) ÷ 2 = 37.5 €\n- Hortense aurait eu 0 € pour le prix à la place et 75 € pour le prix au partage intégral."}
{"question": "Que se passe-t-il en cas de forfait général déclaré après le début de la compétition?", "answer": "", "contexts": ["## 3.3.2 Pénalités financières  \nEn cas de forfait général dans les compétitions nationales déclaré avant le début de la compétition, aucune pénalité financière n'est prononcée.  \nEn cas de forfait général déclaré après le début de la compétition, la pénalité prévue dans le règlement spécifique est plafonnée à 3 fois la pénalité prévue pour un forfait d'équipe isolé. Dans tous les cas de forfait général, les droits d'engagement restent acquis à l'instance gestionnaire de la compétition."], "ground_truth": "En cas de forfait général déclaré après le début de la compétition, la pénalité prévue dans le règlement spécifique est plafonnée à 3 fois la pénalité prévue pour un forfait d'équipe isolé."}
{"question": "Qu'est-il permis de faire selon Contrat_de_delegation_15032022?", "answer": "", "contexts": ["## Art. 13-2 - Révision du contrat  \nLe présent contrat peut être révisé si les deux Parties souhaitent en réviser le contenu.  \nIl peut également être révisé en cas d'inexécution des obligations nées de l'engagement contractuel des Parties au contrat. Dans ce cas, la partie qui constate l'inexécution peut :  \n- -Solliciter l'autre partie pour une révision du contrat ;\n- -Interrompre l'exécution de ses engagements contractuels réciproques.  \nEn cas de manquement grave à l'un des articles par la Fédération, le Ministère des sports pourra retirer la délégation pour une ou plusieurs disciplines sportives.  \nLe contrat de délégation est révisé lorsque la stratégie nationale de la fédération, dans sa version définitive, n'a pas été initialement annexée au contrat."], "ground_truth": "13-2 - Révision du contrat  \nLe présent contrat peut être révisé si les deux Parties souhaitent en réviser le contenu."}
{"question": "Quelle règle est énoncée à la page 13?", "answer": "", "contexts": ["## 8.3 Délibérations  \nHors les autres cas prévus par les statuts ou le règlement intérieur, les décisions du comité directeur sont prises à la majorité des voix présentes ou représentées.  \nElles sont en principe prises à main levée. Il est procédé à un vote à bulletin secret sur demande d'au moins un tiers des membres. Tout vote concernant une personne membre du comité directeur se déroule hors de sa présence ou à scrutin secret.  \nEn cas d'égalité et sauf scrutin secret, la voix du président est prépondérante."], "ground_truth": "Il est procédé à un vote à bulletin secret sur demande d'au moins un tiers des membres."}
{"question": "Qu'est-ce que le trait?", "answer": "", "contexts": ["## Article 3 Déplacement des pièces sur l'échiquier virtuel  \n- 3.1. L'échiquier virtuel est constitué par une matrice carrée de taille 8 x 8 dessinant 64 cases de taille égale, alternativement claires (les cases \"blanches\") et foncées (les cases \"noires\"). La case d'angle inférieur droit de l'échiquier est blanche.\n- 3.2. Les coups sont effectué s sur l'échiquier virtuel en utilisant un dispositif de jeu, par exemple un ordinateur avec une souris ou une tablette.\n- 3.3. La plateforme de jeu ne doit accepter que les coups légaux.\n- 3.4. La personne ayant le trait est autorisée à utiliser tous les moyens techniques disponibles sur la plateforme de jeu pour effectuer ses coups.\n- 3.5. A minima, la plateforme de jeu doit offrir au joueur ou à la joueuse la possibilité de sélectionner la case d'origine et la case d'arrivée pour effectuer son coup.\n- 3.6. Les options supplémentaires suivantes peuvent être activées et utilisées par les joueurs et joueuses :\n- a. smart move : le joueur ou la joueuse peut effectuer son coup en sélectionnant uniquement la case d'arrivée lorsqu'un seul coup peut être effectué sur cette case.\n- b. pre-move : le joueur ou la joueuse peut préparer son coup avant que son adversaire n'ait joué le sien. Le coup est automatiquement exécuté sur l'échiquier en réponse immédiate au coup adverse.\n- c. Promotion en dame automatique : le joueur ou la joueuse peut configurer la plateforme de jeu pour forcer la promotion en dame sans qu'il ne lui soit proposé de choisir la pièce promue."], "ground_truth": "le trait est autorisée à utiliser tous les moyens techniques disponibles sur la plateforme de jeu pour effectuer ses coups."}
{"question": "Quelle règle est énoncée à la page 102?", "answer": "", "contexts": ["## LE SYSTÉME RUTSCH  \nLe système Rutsch est un système d'appariement des tournois toutes rondes. Il s'appuie sur le principe du taquin et il est apparu au milieu du 19 ème siècle. Ce n'est que bien plus tard que son application se fit dans des tournois toutes rondes.  \nEn allemand, le glissement -caractéristique de cette méthode -se dit « ein Rutsch ».  \nIl se décline en deux méthodologies que voici :  \nDans les exemples donnés, un joueur/une joueuse sur case noire joue sa partie avec les noirs."], "ground_truth": "Ce n'est que bien plus tard que son application se fit dans des tournois toutes rondes."}
{"question": "Qu'est-ce que les décisions?", "answer": "", "contexts": ["## 9.5.2 Composition  \nLa commission comprend cinq membres désignés par le comité directeur qui en nomme le président. Ils peuvent être convoqués à une réunion si la nature du litige l'exige. Les décisions sont prises à la majorité absolue des membres ayant donné leur avis."], "ground_truth": "Les décisions sont prises à la majorité absolue des membres ayant donné leur avis."}
{"question": "Qu'est-ce que un appariement?", "answer": "", "contexts": ["Note d'explications du traducteur de la Version Française : Il est parfois envisageable qu'un niveau puisse avoir plusieurs solutions pour son appariement. Comparer les D-SA de ces différentes possibilités est une méthode qui a pour but de justifier qu'un appariement est meilleur qu'un autre. En pratique, cela ne devrait vous inquiéter que dans les niveaux hétérogènes et le respect d'un algorithme d'appariement rigoureux vous évitera tout questionnement."], "ground_truth": "un appariement est meilleur qu'un autre."}
{"question": "Qu'est-ce que la position?", "answer": "", "contexts": ["## Article 1 Nature et but du jeu d'Échecs  \n- 1.1. Le jeu d'échecs se pratique entre deux adversaires déplaçant leurs pièces sur un plateau carré appelé \"échiquier\".\n- 1.2. Le joueur ou la joueuse déplaçant les pièces de couleur claire (\"les Blancs\") effectue le premier coup, le joueur ou la joueuse déplaçant les pièces de couleur sombre (\"les Noirs\") effectue le coup suivant, après quoi les deux adversaires jouent alternativement.\n- 1.3. On dit d'un joueur ou une joueuse qu'il/elle « a le trait » lorsque son adversaire a « joué » son coup.\n- 1.4. Le but de chaque joueur ou joueuse est d'« attaquer » le roi de l'adversaire de telle manière que ce dernier /cette dernière ne dispose plus d'aucun coup légal pour répondre.\n- 1.4.1. On dit du joueur ou de la joueuse réalisant cet objectif qu'il/elle a mis « échec et mat » le roi adverse et qu'il/elle a gagné la partie. Il est interdit de laisser son roi ou de le déplacer dans une position où il se trouve attaqué par l'adversaire, de même qu'il est interdit de « prendre » le roi de l'adversaire.  \n- 1.4.2. L'adversaire dont le roi a été mis échec et mat a perdu la partie.\n- 1.5. Si la position est telle qu'aucun des deux adversaires ne peut parvenir à mettre échec et mat le roi adverse, la partie est nulle (voir. Article 5.2.2).\n- Si aucun des deux adversaires ne peut gagner, la partie est automatiquement un match nul. L'arbitre doit donc intervenir pour le déclarer lorsque :"], "ground_truth": "la position est telle qu'aucun des deux adversaires ne peut parvenir à mettre échec et mat le roi adverse, la partie est nulle (voir."}
{"question": "Quelle règle est énoncée à la page 20?", "answer": "", "contexts": ["## Art. 12-2 - Dispositifs communs entre les sports et l'éducation nationale  \nL'élargissement du périmètre ministériel consécutive à la fusion avec l'éducation nationale vient renforcer le continuum éducatif des jeunes de 3 à 18 ans sur les différents temps (scolaire, périscolaire, et extrascolaire) que cela soit au travers du plan mercredi, la promotion du sport à l'école, le plan mercredi, le 30' APQ.  \nLes dispositifs : « une école, un club », « Trop bon de faire du sport », « Mon club près de chez moi », « Génération 2024 » favorisent l'accompagnement des jeunes vers une activité physique et contribuent au développement du sport au sein des fédérations.  \nLe code de l'éducation prévoit, en ses articles L.331-6 et L.611-4, que des aménagements appropriés de scolarité et d'études doivent être mis en œuvre pour permettre aux sportives et aux sportifs de haut niveau ainsi qu'à celles et ceux classé(e)s dans la catégorie « Espoir » ou « Sportif des Collectifs Nationaux » de mener à bien leur carrière sportive."], "ground_truth": "Les dispositifs : « une école, un club », « Trop bon de faire du sport », « Mon club près de chez moi », « Génération 2024 » favorisent l'accompagnement des jeunes vers une activité physique et contribuent au développement du sport au sein des fédérations."}
{"question": "Qu'est-ce que les AF?", "answer": "", "contexts": ["## 1.2. Catégories d'Arbitres  \nLes catégories d'Arbitres sont utilisées pour classer les arbitres (AIs et AFs) selon leur expérience et déterminent si un arbitre est autorisé à officier dans des manifestations de dimension continentale ou mondiale.  \n1.2.1. Les AI sont classés selon les catégories suivantes :  \n- Catégorie A\n- Catégorie B\n- Catégorie C\n- Catégorie D  \n1.2.2. Les AF sont classés en Catégorie D"], "ground_truth": "Les AF sont classés en Catégorie D"}
{"question": "Que se passe-t-il en cas de flagrant délit ou de certitude qu'il y a eu triche?", "answer": "", "contexts": ["## Comment faire face à une accusation :  \nToute personne identifiée par la fédération peut signaler qu'il soupçonne un joueur ou une joueuse de tricher :  \n- Si cela concerne une partie en cours, il peut être judicieux pour l'arbitre de demander à cette personne de patienter, de laisser l'arbitre procéder dans le calme à une pré -enquête et d'observer les faits reprochés,\n- Si à la fin de la partie concernée la personne maintient son accusation de triche, elle devra l'officialiser en remplissant le formulaire de suspicion de triche tel que décrit dans la partie mission administrative de l'arbitre.\n- Avec le maximum de diplomatie envisageable, l'arbitre invitera la personne à éviter de lancer une accusation sur le coup de l'émotion et la préviendra qu'une accusation infondée peut également être sanctionnée.\n- Toute plainte orale ou informelle sera classée sans suite.\n- Sans accusation, l'arbitre ayant un doute raisonnable peut , de lui-même, remplir ce formulaire.\n- Dans tous les cas l'arbitre devra se préparer à fournir l'ensemble des pièces à convictions et témoignages permettant de statuer sur la triche.\n- En cas de flagrant délit ou de certitude qu'il y a eu triche, l'arbitre doit immédiatement prendre les sanctions nécessaires."], "ground_truth": "En cas de flagrant délit ou de certitude qu'il y a eu triche, l'arbitre doit immédiatement prendre les sanctions nécessaires."}
{"question": "Qu'est-ce que la PE?", "answer": "", "contexts": ["## I. Procédure  \n- I.1 Le délai de prescription est d'un an à compter de la dernière ronde de la compétition en ligne en question.\n- I.2 La langue officielle de travail de la PE est l'anglais. La PE peut, à la demande d'une des parties, autoriser l'emploi d'une langue autre que l'anglais par les parties concernées. Dans ce cas, la PE peut ordonner à l'un ou l'autre ou à tous les requérants de prendre en charge tout ou partie des frais de traduction et d'interprétation. La PE peut ordonner que tous les documents soumis dans des langues autres que l'anglais soient déposés avec une traduction certifiée dans la langue de la procédure.\n- I.3 Lorsque la PE ne rejette pas une affaire, la personne accusée doit être informée par écrit (par lettre, par courrier électronique ou tout autre moyen) de l'affaire en cours et de son droit de présenter à la PE toute déclaration et tout document en appui de sa défense.\n- I.4 La partie plaignante et la personne accusée ont le droit d'être représentées ou assistées par des personnes de leur choix.\n- I.5 Les documents relatifs à la procédure doivent être présentés par écrit, de préférence par courrier électronique.\n- I.6 Chaque partie impliquée dans une enquête est responsable de ses propres frais, directement ou indirectement liés à l'affaire.\n- I.7 Lorsqu'une personne soumise à la juridiction disciplinaire d'une autre commission de la FIDE est partie prenante à une enquête, la FPL peut fournir toute information appropriée à cette commission de la FIDE."], "ground_truth": "la PE est l'anglais."}
{"question": "Qu'est-ce que la victoire?", "answer": "", "contexts": ["## Article 17 Conduite des joueurs et des joueuses  \n- 17.1. Les joueurs et joueuses ne doivent rien faire qui pourrait jeter le discrédit sur le jeu d'échecs.\n- 17.2. Les joueurs et joueuses ne sont pas autorisés à utiliser leur propre appareil de jeu sur le lieu de compétition, à moins que le règlement de la compétition ne spécifie autre chose.\n- 17.3. Pendant une partie, il est interdit aux joueurs et joueuses d'avoir un quelconque appareil électronique non spécifiquement autorisé par l'arbitre sur le lieu de la compétition. L'arbitre peut exiger des joueurs et joueuses le droit d'inspecter en privé leurs vêtements, sacs, autres objets ou corps. L'arbitre, ou une personne mandatée par l'arbitre, inspecte le joueur ou la joueuse et doit être du même genre que le joueur ou la joueuse. S'il est évident qu'un joueur ou une joueuse a un tel appareil sur sa personne dans le lieu de la compétition, il/elle perd la partie. La victoire est attribuée à l'adversaire. Le règlement d'une compétition peut spécifier une sanction différente, moins sévère. L'arbitre en chef peut aussi décider d'exclure le joueur de la compétition.\n- 17.4. Le règlement de la compétition peut autoriser le stockage d'un appareil électronique dans le s sacs des joueurs et joueuses , à condition que l'appareil soit complètement éteint. Ce sac doit être placé dans un lieu agréé par l'ACL.\n- 17.5. Pendant une partie, il est interdit aux joueurs et joueuses de faire usage de notes, sources d'information ou de recevoir des conseils."], "ground_truth": "La victoire est attribuée à l'adversaire."}
{"question": "Quelle règle est énoncée à la page 183?", "answer": "", "contexts": ["## 6. Matchs  \n- 6.1. Les matchs pour lesquels un des deux adversaires n'est pas classé ne sont pas pris en compte pour le classement\n- 6.2. Quand un match se déroule sur un nombre déterminé de parties, celles jouées après qu'un gagnant ait été déterminé ne sont pas prises en compte pour le classement. On peut obtenir une dérogation à cette règle sur demande préalable."], "ground_truth": "Quand un match se déroule sur un nombre déterminé de parties, celles jouées après qu'un gagnant ait été déterminé ne sont pas prises en compte pour le classement."}
{"question": "Qu'est-ce que le qui?", "answer": "", "contexts": ["## Description du Système Algébrique :  \n- C.1 Dans cette description, le mot 'pièce' indique une pièce autre que le pion\n- C.2 Chaque pièce est désignée par une abréviation. En Français, l'abréviation employée est la première lettre, en majuscule, du nom de la pièce : R = Roi, D = Dame, T = Tour, F = Fou, C = Cavalier.  \nEn anglais : K=King, Q=Queen, R=Rook, B=Bishop, N=kNight (N est utilisé pour knight afin d'éviter l' ambiguïté)  \n- C.3 Pour l'abréviation du nom des pièces, chaque joueur ou joueuse est libre d'employer celle qui est communément utilisée dans son pays. Dans la presse, l'utilisation de dessins représentant les pièces est recommandée.\n- C.4 Les pions ne sont pas désignés par leur première lettre mais se reconnaissent par l'absence de celle -ci.  \nExemples : les coups sont notés e5, d4, a5 et non pe5, Pd4, pa5  \nC.5 Les 8 colonnes (de gauche à droite pour les Blancs et de droite à gauche pour les Noirs) sont désignées respectivement par les lettres minuscules a, b, c, d, e, f, g, et h.  \nC.6 Les 8 rangées (du bas vers le haut pour les Blancs et du haut vers le bas pour les Noirs) sont numérotées respectivement 1, 2, 3, 4, 5, 6, 7, 8. Par conséquent, dans la position initiale, les pièces et les pions blancs sont sur la première et deuxième rangée. Les pions et les pièces noirs sont sur la septième et huitième rangée."], "ground_truth": "le qui est communément utilisée dans son pays."}
{"question": "Qu'est-ce que les paires?", "answer": "", "contexts": ["Si le signalement intervient après la publication des appariements mais avant la fin de la ronde suivante, il sera pris en compte pour les appariements ultérieurs.  \nSi le signalement intervient après la fin de la ronde suivante, la correction aura lieu après le tournoi et uniquement dans le cadre du calcul du classement Elo du joueur/de la joueuse.  \n9. Lorsque l'appariement est achevé, les paires sont classées avant leur publication. Les critères de tri, dans l'ordre de priorité décroissante, sont:\n2. o Le score du joueur le plus fort de la paire concernée\n3. o La somme des scores des deux joueurs de la paire concernée"], "ground_truth": "les paires sont classées avant leur publication."}
{"question": "Que se passe-t-il en cas de non-respect du code vestimentaire?", "answer": "", "contexts": ["## 9. La conduite des joueurs  \n- 9.1. Dès qu'un joueur ou qu'une joueuse a formellement accepté une invitation, il/elle doit jouer sauf en cas de circonstances exceptionnelles (force majeure) , tel que maladie ou incapacité. L'acceptation d'une autre invitation n'est pas une raison valable pour se retirer.\n- 9.2. Tous les joueurs et joueuse doivent avoir une tenue vestimentaire appropriée. En cas de non-respect du code vestimentaire, ils/elle peuvent avoir une sanction -voir l'article 13 du Règlement A.09 du FIDE Handbook « Ethics &amp; Disciplinary ».\n- 9.3. Un joueur ou une joueuse qui ne veut pas continuer une partie mais s'en va sans abandonner ou en informer l'arbitre fait preuve de discourtoisie. Il/Elle peut avoir une sanction , à la discrétion de l'Arbitre Principal (AP), pour manque de sportivité -voir l'article 12.9 des règles du jeu.\n- 9.4. Quand il est clair que des résultats ont été arrangés -voir l'article 11.1 des règles du jeu - l'AP impose des sanctions adaptées -voir l'article 12.9 des règles du jeu.  \nNote de traduction : Cet article invite clairement à considérer que les joueurs et joueuses se permettant des nulles rapides jettent le discrédit sur le jeu d'échecs.  \n- 9.5. Les joueurs et joueuses ne devraient pas manger devant l'échiquier durant la partie."], "ground_truth": "En cas de non-respect du code vestimentaire, ils/elle peuvent avoir une sanction -voir l'article 13 du Règlement A."}
{"question": "Qu'est-ce que les générales?", "answer": "", "contexts": ["## Principe  \nLes compétitions fédérales sont toutes organisées une fois chaque saison. Les règles générales sont applicables à toutes les compétitions fédérales. La saison débute le 1er septembre et s'achève le 31 août. Seuls les clubs affiliés ayant respecté leurs engagements et exigences réglementaires envers la FFE, la Ligue et le CDJE, peuvent participer à une compétition fédérale officielle.  \nLes compétitions fédérales sont :  \n- Les Coupes (Coupe de France, Coupe Loubatière, Coupe de la parité)\n- Les Championnats de France par équipes (des Clubs, des clubs Féminins, des scolaires, des interclubs Jeunes)\n- Les Championnats de France (individuel, Féminin de parties rapide, des Jeunes, Universitaire, rapide, blitz)"], "ground_truth": "les générales sont applicables à toutes les compétitions fédérales."}
{"question": "Quelle règle est énoncée à la page 215?", "answer": "", "contexts": ["## 1.3.2.3 Événements de haut niveau  \nLes types d'événements suivants sont considérés comme des \"événements de haut niveau\" pour la classification des arbitres :  \na) Tournois toutes rondes Mixtes avec au moins dix (10) participants (6 dans un tournoi toutes rondes aller-retour), avec un classement moyen supérieur à 2600.  \n- b) Tournois toutes rondes Féminins avec au moins dix (10) participantes (6 dans un tournoi toutes rondes aller-retour), avec un classement moyen supérieur à 2400.  \nCes événements doivent être homologués pour les classements FIDE standard, rapide ou blitz."], "ground_truth": "Ces événements doivent être homologués pour les classements FIDE standard, rapide ou blitz."}
{"question": "Quelle règle est énoncée à la page 188?", "answer": "", "contexts": ["## 5. Matchs  \n- 5.1. Les matchs pour lesquels un des deux adversaire s n'est pas classé ne seront pas pris en compte pour le classement\n- 5.2. Quand un match se déroule sur un nombre déterminé de parties, celles jouées après qu'un gagnant a été déterminé ne sont pas prises en compte pour le classement. On peut obtenir une dérogation à cette règle sur demande préalable"], "ground_truth": "Quand un match se déroule sur un nombre déterminé de parties, celles jouées après qu'un gagnant a été déterminé ne sont pas prises en compte pour le classement."}
{"question": "Qu'est-ce que les coups?", "answer": "", "contexts": ["## Article 3 Déplacement des pièces sur l'échiquier virtuel  \n- 3.1. L'échiquier virtuel est constitué par une matrice carrée de taille 8 x 8 dessinant 64 cases de taille égale, alternativement claires (les cases \"blanches\") et foncées (les cases \"noires\"). La case d'angle inférieur droit de l'échiquier est blanche.\n- 3.2. Les coups sont effectué s sur l'échiquier virtuel en utilisant un dispositif de jeu, par exemple un ordinateur avec une souris ou une tablette.\n- 3.3. La plateforme de jeu ne doit accepter que les coups légaux.\n- 3.4. La personne ayant le trait est autorisée à utiliser tous les moyens techniques disponibles sur la plateforme de jeu pour effectuer ses coups.\n- 3.5. A minima, la plateforme de jeu doit offrir au joueur ou à la joueuse la possibilité de sélectionner la case d'origine et la case d'arrivée pour effectuer son coup.\n- 3.6. Les options supplémentaires suivantes peuvent être activées et utilisées par les joueurs et joueuses :\n- a. smart move : le joueur ou la joueuse peut effectuer son coup en sélectionnant uniquement la case d'arrivée lorsqu'un seul coup peut être effectué sur cette case.\n- b. pre-move : le joueur ou la joueuse peut préparer son coup avant que son adversaire n'ait joué le sien. Le coup est automatiquement exécuté sur l'échiquier en réponse immédiate au coup adverse.\n- c. Promotion en dame automatique : le joueur ou la joueuse peut configurer la plateforme de jeu pour forcer la promotion en dame sans qu'il ne lui soit proposé de choisir la pièce promue."], "ground_truth": "Les coups sont effectué s sur l'échiquier virtuel en utilisant un dispositif de jeu, par exemple un ordinateur avec une souris ou une tablette."}
{"question": "Qu'est-ce que les précédents?", "answer": "", "contexts": ["- C.10.3.3. Il y a deux cavaliers sur les cases h2 et d4, et l'un d'eux est déplacé sur la case f3 : soit Chf3 soit Cdf3, selon le cas.\n- C.10.3.4. S'il y a une prise sur la case f3, la notation des exemples précédents est toujours d'application, mais un 'x' peut être inséré : 1) soit Cgxf3 soit Cexf3, 2) soit C5xf3 soit C1xf3, 3) soit Chxf3 soit Cdxf3, selon le cas.\n- C.11 Dans le cas de la promotion d'un pion, le déplacement du pion est indiqué, suivi immédiatement de l'abréviation de la nouvelle pièce. Exemples : d8D, exf8C, b1F, g1T.\n- C.12 Une proposition de nulle doit être notée par (=)."], "ground_truth": "les précédents est toujours d'application, mais un 'x' peut être inséré : 1) soit Cgxf3 soit Cexf3, 2) soit C5xf3 soit C1xf3, 3) soit Chxf3 soit Cdxf3, selon le cas."}
{"question": "Qu'est-ce que les ne?", "answer": "", "contexts": ["## 4. Parties non jouées  \n- 4.1. Qu'elles se produisent à cause d'un forfait ou pour toute autre raison, elles ne sont pas comptabilisées. Sauf en cas de force majeure, toute partie où les deux adversaires ont effectué au moins un coup sera prise en compte pour le classement sauf si les règles relatives au fair-play en disposent autrement."], "ground_truth": "les ne sont pas comptabilisées."}
{"question": "Qu'est-ce que les pratiques?", "answer": "", "contexts": ["## 2. Classement des participants à égalité de points (Joueur/Joueuses ou Equipes)  \n2.1. Le système de départage des ex-aequo doit être annoncé dans le règlement intérieur du tournoi ou alors être annoncé que les ex-aequo partagent la même place au classement. Si rien n'a été annoncé, l'arbitre d oit décider avant le début du tournoi d'un système de départage technique comme décrit à l'article 4.  \n- 2.2. Trois méthodes sont possibles pour départager les ex-aequo :\n- Départage sur l'échiquier (Match de barrage) -Voir Article 3\n- Système de départage technique -Voir Article 4\n- Pas de départage ( L'égalité est acceptée )  \nPour certains départages, des exemples pratiques sont donnés en fin du paragraphe concerné."], "ground_truth": "les pratiques sont donnés en fin du paragraphe concerné."}
{"question": "Quelle règle est énoncée à la page 166?", "answer": "", "contexts": ["## http://www.echecs.asso.fr/Default.aspx?Cat=9  \n- → S'assurer de la transmission des résultats du tournoi sur le site fédéral .\n- → S'assurer que l'organisateur paie les droits d'homologation dans les 7 jours suivant la fin du tournoi.\n- → Rédiger le rapport technique du tournoi .\n- → Transmettre au secrétariat fédéral les éventuelles normes.\n- → Transmettre à la DNA les éventuels formulaires de plaintes pour tricherie ou signalement."], "ground_truth": "- → Rédiger le rapport technique du tournoi ."}
{"question": "Quelle règle est énoncée à la page 146?", "answer": "", "contexts": ["## 3. Départage sur l'échiquier  \n3.1. Si un départage sur l'échiquier est nécessaire, les paramètres suivants seront définis dans le règlement spécifique du tournoi, selon les besoins :  \n- 3.1.1. Si le départage sur l'échiquier concerne tous les ex-aequo , ou uniquement pour des places spécifiques (par exemple, la première place uniquement).\n- 3.1.2. Si la participation au départage sur l'échiquier se décide après l'application ou non d'un ou plusieurs des systèmes de départage sélectionnés à l'article 4.1\n- 3.1.3. Le format (par exemple : Toutes-rondes, élimination directe)\n- 3.1.4. La méthode d'attribution des numéros d'appariements.\n- 3.1.5. La méthode d'attribution des couleurs.\n- 3.1.6. Une ou des limites de temps pour toutes les parties.\n- 3.1.7. L'horaire des parties ou un temps de pause entre chaque partie."], "ground_truth": "Si un départage sur l'échiquier est nécessaire, les paramètres suivants seront définis dans le règlement spécifique du tournoi, selon les besoins :  \n- 3.1.1."}
{"question": "Quelle obligation est énoncée à la page 223?", "answer": "", "contexts": ["## Article 7 : Procédure d'appel  \n- 7.1. Toutes les décisions finales de la DSC et les décisions d'appel de l'ARB ou de l'EDC sont publiées sur le site web de l'ARB dans la section réservée à la DSC, à moins que le président de la DSC ne décide qu'il y a de bonnes raisons de ne pas publier du tout la décision. La décision concernée doit être publiée sous une forme expurgée et l'identité de toute partie à la procédure doit être gardée secrète dans la décision publiée.\n- 7.2. Le Bureau du FIDE conserve toute la correspondance reçue des plaignants, des défendeurs, de l'ARB ou de la DSC.\n- 7.3. Dans le cas d'une suspension imposée à un arbitre, une entrée appropriée sera faite au nom de l'arbitre concerné sur le serveur de classement de la FIDE afin de rendre la suspension effective.\n- 7.4. Les personnes qui actuellement sanctionnées par la FPL, l'EDC ou la DSC ne peuvent pas être membres de la DSC."], "ground_truth": "La décision concernée doit être publiée sous une forme expurgée et l'identité de toute partie à la procédure doit être gardée secrète dans la décision publiée."}
{"question": "Qu'est-ce que une assistante?", "answer": "", "contexts": ["## Organisation des salles de jeu  \n1. Une seule partie par table : au cas où un assistant ou une assistante est nécessaire, les tables doivent être plus grandes (2 m de largeur) et devraient être placées séparément.\n2. Les allées entre les rangées de tables doivent être deux fois plus larges (pour les chaises roulantes).\n3. Les arbitres doivent être facilement accessibles à tous les joueurs et joueuses.\n4. Des prises électriques peuvent être nécessaires pour certains appareils liés aux handicaps. Des personnes déficientes visuelles utilisent parfois une lampe pour leur échiquier, cette lampe ne doit pas gêner l'adversaire.\n5. Placez les joueurs aveugles à une table fixe pour faciliter leur orientation. Il est préférable de garder le même assistant/la même assistante pendant tout le tournoi (si l'équipe d'organisation fournit l'assistance) Assistants et assistantes\n1. Les assistants et assistantes doivent avoir une connaissance minimale des échecs.\n2. Les assistants et assistantes des joueurs/joueuses aveugles doivent connaître le nom des pièces dans les langues nécessaires (la leur, celle du joueur ou de la joueuse).\n3. Les assistants et assistantes des joueurs/joueuses aveugles doivent informer la personne qu'elle assiste quand ils/elles doivent quitter temporairement la zone de jeu.\n4. Les assistants et assistantes doivent toujours écrire les coups : c'est une aide importante pour les arbitres."], "ground_truth": "une assistante est nécessaire, les tables doivent être plus grandes (2 m de largeur) et devraient être placées séparément."}
{"question": "Qu'est-ce que un pion?", "answer": "", "contexts": ["Personne Enquêtrice (PE): Annexe I, H.3. Fait référence à un membre de la Commission Fair-play de la FIDE chargé d'enquêter sur une situation où des allégations de triche sont survenues.  \nPHI :Article 16.5. Plateforme d'hébergement Internet.  \nPiratage : Annexe I,B.3. Survient quand une autre personne joue à la place du véritable joueur dont le nom est celui qui est supposé jouer la partie.  \nPlateforme de Jeu : Article 2. Fait référence au système d'hébergement ou à l'environnement de jeu pour une partie d'échecs en ligne.  \nPromotion Automatique : Article 3.6.c. Un pion est automatiquement remplacé par une Dame ou une autre pièce selon les réglages sélectionnés par le joueur dans le logiciel de la Plateforme de Jeu.  \nSVC  \n: Article 13. Système de Vidéoconférence."], "ground_truth": "Un pion est automatiquement remplacé par une Dame ou une autre pièce selon les réglages sélectionnés par le joueur dans le logiciel de la Plateforme de Jeu."}
{"question": "Qu'est-ce que les preuves?", "answer": "", "contexts": ["- Pour les échecs en ligne, un seuil de 4,25. Cela représente une fréquence naturelle d'environ une fois sur presque 100 000. Compte tenu du taux de tricherie observé aux échecs en ligne, cela donne des chances évaluées d'environ 1.000 contre 1 contre l'hypothèse nulle de fair-play, vers l'extrémité supérieure de la plage de confiance de 99% à 99,9% considérée comme répondant au critère de « satisfaction confortable » du TAS dans le contexte des échecs.  \nNote de traduction : Cela veut dire qu'il y a à peine un risque sur 1000 de se tromper.  \n- Pour les parties d'échecs sur l'échiquier, un seuil de 5.00. Cela représente une fréquence naturelle d'une personne sur près de 3,5 millions, et est placé de manière similaire par rapport à un taux de tricherie observé en personne. Ces dispositions s'appliquent s'il n'y a pas d'autres preuves. Si de telles preuves sont disponibles, un Z-score de 2,50 ou plus peut être utilisé à l'appui.\n7. Fausse accusation : l'accusation irréfléchie ou manifestement infondée de tricherie aux échecs est une violation sérieuse des règles du fair-play. La fausse accusation aux échecs est un abus de la liberté d'expression qui est interdit par le code éthique et disciplinaire de la FIDE.\n8. Dans le cadre de ces directives, les tentatives de tricheries sont considérées comme de la tricherie."], "ground_truth": "les preuves sont disponibles, un Z-score de 2,50 ou plus peut être utilisé à l'appui."}
{"question": "Qu'est-ce que les capitaines?", "answer": "", "contexts": ["## 8. Rôle des Capitaines  \nChaque équipe doit avoir un ou une capitaine possédant une licence fédérale en cours qui peut jouer ou pas la rencontre. Il ou elle ne peut pas officier en même temps en tant qu'arbitre. En cas d'infraction, une amende pour défaut d'arbitre sera infligée. Son montant est indiqué dans le règlement spécifique de la compétition concernée.  \nDans l'exercice de leurs fonctions, les capitaines d'équipe ont le droit d'accéder à l'aire réservée aux joueurs et joueuses. Mais il est de leur devoir d'empêcher les membres de leur équipe qui ne sont pas impliqués dans le match d'entrer dans l'aire de jeu.  \nÀ la fin de la session de jeu, les capitaines sont responsables de la remise des feuilles de parties lisiblement écrites aux arbitres.  \nDurant les parties, les capitaines peuvent conseiller leurs joueurs/joueuses sur l'opportunité d'offrir, d'accepter ou de refuser une proposition de nullité, sur l'opportunité d'abandonner, sur la situation du match, à condition de ne faire aucun commentaire sur la position sur l'échiquier.  \nL'arbitre a le droit d'assister à tout échange de propos entre joueurs et joueuses et leur capitaine.  \nPour exercer leurs fonctions, les capitaines ont le droit de mandater une personne les représentant, sous réserve de l'accord de l'arbitre principal et de posséder une licence fédérale en cours.  \nEn cours de jeu, uniquement les capitaines sont aptes à formuler et à présenter une réclamation à l'arbitre ou, à défaut, à la direction de la compétition."], "ground_truth": "les capitaines sont responsables de la remise des feuilles de parties lisiblement écrites aux arbitres."}
{"question": "Que doit faire l'organisateur selon le règlement?", "answer": "", "contexts": ["## 8.1. Inspection et préparation du lieu de compétition  \n- 8.1.1. Toutes les zones auxquelles les joueurs et joueuses ont accès pendant leurs parties doivent être inspectées soigneusement et à plusieurs reprises par l'équipe d'organisation et les arbitres.\n- 8.1.2. Un espace pour les spectateurs/spectatrices doit être préparé. Les spectateurs/spectatrices ne doivent pas se tenir à moins d'un mètre d'un échiquier.\n- 8.1.3. Un éclairage d'environ 800 lux doit être utilisé. L'éclairage ne doit pas gêner par la perception des pièces en projetant leurs ombres. Il faut se méfier de la lumière du soleil, surtout si l'orientation de celle -ci varie au cours de la partie. L'organisateur doit pouvoir faire varier la qualité de l'éclairage de la salle.\n- 8.1.4. Il est fortement recommandé que la salle soit recouverte de moquette. Le bruit provenant des déplacements des chaises doit être évité.\n- 8.1.5. Le niveau des bruits extérieurs à proximité du lieu de la compétition doit pouvoir être contrôlé.\n- 8.1.6. Il est recommandé un espace d'au minimum 4 mètres carrés pour chaque joueur dans les matchs par équipes ou les tournois toutes-rondes.\n- 8.1.7. Des tables spéciales avec une connexion internet et électrique doivent être aménagées pour les arbitres."], "ground_truth": "L'organisateur doit pouvoir faire varier la qualité de l'éclairage de la salle."}
{"question": "Quelle obligation est énoncée à la page 137?", "answer": "", "contexts": ["## 3. Retardataires  \nS'il y a des joueurs intégrés après la première ronde, ces joueurs doivent être intégrés dans la liste d'appariement conformément à l'article C.04.2.B/C (ordre initial/retardataires).  \nLe dernier joueur de GA doit être le même que celui de la ronde précédente.  \nNote 1 : dans de telles circonstances, le numéro d'appariement du dernier joueur de la liste de GA peut être différent que celui attribué conformément de la règle 2."], "ground_truth": "Le dernier joueur de GA doit être le même que celui de la ronde précédente."}
{"question": "Que se passe-t-il en cas de problème technique?", "answer": "", "contexts": ["## Gestion des résultats du tournoi.  \nLa sauvegarde (boule) PAPI du tournoi doit être envoyé le jour même sur le site fédéral http://admin.echecs.asso.fr  \nUniquement en cas de problème technique, il est possible d'envoyer votre boule PAPI à Erick Mouret par mail ( erick.mouret@echecs.asso.fr )  \nRemarque : Le Fichier Papi doit être posté même si la situation des joueurs et joueuses (licence) n'est pas régularisée. Il est préférable d'avoir une irrégularité qui sera traitée a posteriori plutôt que de pénaliser le responsable fédéral chargé de la transmission à la FIDE et tous les autres joueurs et joueuses qui ne verraient pas le tournoi comptabilisé pour leur classement.  \n- → Il est possible d'envoyer le fichier Papi une ronde après l'autre pour permettre l'affichage des appariements en ligne.\n- → L'arbitre doit m arquer le Tournoi \"Terminé\" ce qui indique au responsable des homologations que le tournoi peut être traité.\n- → Une fois le Tournoi marqué \"Terminé\" il n'est plus possible de le modifier. Il faut demander le déverrouillage du tournoi pour prévenir le responsable des homologations qu'il va y avoir des modifications dans le résultat.  \nLes droits d'homologation sont dans tous les cas recalculés à chaque envoi d'une nouvelle boule Papi, les arbitres ne doivent pas oublier de supprimer les joueurs ou joueuses n'ayant joué aucune ronde (sinon ils sont comptés dans les frais d'homologation). La facture des frais d'homologation est aussi disponible dans la page de gestion du club référent à la rubrique tournoi."], "ground_truth": "en cas de problème technique, il est possible d'envoyer votre boule PAPI à Erick Mouret par mail ( erick."}
{"question": "Qu'est-ce que le roque?", "answer": "", "contexts": ["Dans ce cas, le joueur ou la joueuse doit déplacer sa tour, si c'est possible. Si aucun mouvement de tour n'est possible, il/elle doit déplacer son roi. (Article 4.3.1)  \n- 4.4.3. ayant l'intention de roquer, touche d'abord son roi puis une de ses tours alors que le roque avec cette tour est illégal, le joueur ou la joueuse doit effectuer un autre coup légal avec son roi (éventuellement le roque impliquant l'autre tour). Si le roi ne dispose d'aucun coup légal alors le joueur ou la joueuse est libre d'effectuer n'importe quel coup légal ;  \nVeuillez noter que le roque est un mouvement de roi. Si un joueur ou une joueuse essaie de roquer et que cela s'avère illégal, alors il/elle doit faire un mouvement de roi qui est légal. S'il n'y a pas de mouvement légal du roi, le joueur ou"], "ground_truth": "le roque est un mouvement de roi."}
{"question": "Qu'est-ce que le rapport?", "answer": "", "contexts": ["## Suspicion/plainte pour triche.  \nPour toute suspicion de triche en tournoi ou lors d'une partie, l'arbitre demande à l'accusateur de continuer sa partie en cours sans interpell er l'adversaire de quelque manière que ce soit .  \nSi l'adversaire souhaite faire remonter son soupçon ou si l'arbitre estime qu'il y a un doute raisonnable sur l'intégrité du déroulement de la partie alors l'arbitre rédige le formulaire de suspicion/plainte pour triche. L a personne accusée n'est pas nécessairement prévenu e à cet instant.  \nL'arbitre joint toutes les pièces nécessaires avec ce rapport : parties/photos/ témoignages/ plainte d'un joueur/d'une joueuse ou tout autre élément qu'il estime pertinent.  \nLe rapport est envoyé directement au secrétariat fédéral qui redirige le dossier vers la commission Fair-Play de la FFE. Cette commission donne alors un avis sur la probabilité de triche dans les parties incriminées. Si cet avis confirme que les éléments du dossier rendent légitime la suspicion de triche, alors le bureau fédéral demande la saisie de la commission de discipline.  \nA ce moment, la personne accusée est obligatoirement prévenue et peut user de son droit au contradictoire.  \nPour tout questionnement sur les procédures et conseils, les organisateurs et les arbitres peuvent se rapprocher de la commission Fair-Play de la FFE.  \nChapitre 5.4 :Rapport Technique et fin de tournoi."], "ground_truth": "Le rapport est envoyé directement au secrétariat fédéral qui redirige le dossier vers la commission Fair-Play de la FFE."}
{"question": "Quelle règle est énoncée à la page 187?", "answer": "", "contexts": ["## 0. Introduction  \n- 0.1. La réglementation qui suit pourra être modifiée par le conseil de la FIDE sur recommandation de la Commission d'Homologation (CH -Qualification Commission). En ce qui concerne les tournois, les changements s'appliquent uniquement à ceux débutant le jour de leur entrée en vigueur, ou ceux qui auront lieu ultérieurement.\n- 0.2. Les tournois à prendre en compte pour le classement devront être préenregistrés par la fédération hôte qui sera responsable de la transmission des résultats et des droits d'homologation. Le Conseil peut également accorder ce droit et cette responsabilité a ux organisations affiliées représentant un territoire autonome ne relevant pas de plus d'une fédération.  \nLe tournoi et son calendrier devront être homologués trois jours avant le début du tournoi. La présidence de la CH peut refuser d'homologuer un tournoi. Elle peut également autoriser un tournoi à être pris en compte pour le classement, même s'il a été homologué moins de trois jours avant le début du tournoi.  \nTous les tournois se déroulant dans des conditions hybrides telles que décrites au point 2.1 doivent être approuvés individuellement par le Président de la CH.  \nDans des cas exceptionnels, le conseil de la FIDE -en prenant en compte l'avis de la CH ou la présidence de la FIDE -dans le cas d'événements avec des classements supérieurs à 2700 peuvent décider d'homologuer des tournois ou des matchs individuels q ui n'ont pas été soumis par la fédération national.  \n- 0.3. Les rapports de tournois pour toutes les manifestations officielles de la FIDE et les événements continentaux doivent être transmis et seront comptabilisés pour le classement. L'Arbitre principal est responsable de la transmission des résultats au responsable du classement FIDE"], "ground_truth": "En ce qui concerne les tournois, les changements s'appliquent uniquement à ceux débutant le jour de leur entrée en vigueur, ou ceux qui auront lieu ultérieurement."}
{"question": "Que se passe-t-il en cas de situation imprévue?", "answer": "", "contexts": ["5. Au début de la partie et pendant toute la durée du jeu, seul l'assistance est responsable de se connecter à la plateforme de jeu, de jouer les coups annoncés et d' annoncer les coups de l'adversaire à son joueur/sa joueuse.\n6. Les joueurs et joueuses doivent s'assurer qu'ils peuvent entendre la personne les assistant de manière audible et distinctement. L'annonce des coups doit être entièrement épelée (par exemple : pion de e2 à e4) et en anglais, ou dans toute autre langue convenue entre eux.\n7. La personne les assistant peut utiliser soit :\n- Un nouveau compte sur la plateforme de jeu, spécifiquement pour ce tournoi\n- Le compte existant des joueur s ou des joueuses qu'elle assiste , avec l'autorisation de ceux-ci\n8. À tout moment durant la partie, les joueurs et joueuses ont le droit de demander le nombre de coups joués, le temps restant à sa pendule et le temps de leur adversaire.\n9. Les joueurs et joueuses, par l'intermédiaire des personnes les assistant, ont le droit de demander la nulle ou d'accepter une proposition de nulle de la part de leur adversaire, à tout moment. Aucune autre communication n'est autorisée entre eux. En cas de situation imprévue, les assistants et assistantes reçoivent les instructions de l'arbitre en chef.\n10. Pendant une partie, les joueurs et joueuses ne peuvent quitter la zone de jeu ou le lieu de la compétition qu'avec l'autorisation de l'arbitre.\n11. Tous les articles des règlements de la FIDE sur les échecs en ligne sont applicables aux personnes aveugles/handicapées visuelles ou à mobilité réduite en prolongeant le champ d'application de ces règles aux actions des personnes qui assistent les joueurs et joueuses."], "ground_truth": "En cas de situation imprévue, les assistants et assistantes reçoivent les instructions de l'arbitre en chef."}
{"question": "Que doit faire l'arbitre d'après Contrat_de_delegation_15032022?", "answer": "", "contexts": ["## Art. 9-2 - Existence d'une politique de formation tout au long de la vie :  \nL'INF sera en charge de la VAE et de la mise en place d'une formation continue pour l'ensemble des titulaires d'un diplôme de la FFE.  \nActuellement la FFE recense les diplômés fédéraux suivants:  \n-  1900 arbitres\n-  100 officiels\n-  1200 initiateurs\n-  2500 animateurs\n-  400 entraineurs  \nL'INF prévoit une refonte complète en 2023 des diplômes d'initiateurs et d'animateurs pour répondre à la demande de professionnalisation, notamment dans l'animation en milieu scolaire.  \nL'INF aura en charge la création d'une filière d'entraineurs professionnels en capacité de répondre aux objectifs du Projet de Performance Fédérale.  \nPour les bénévoles et dirigeants de clubs, l'INF s'oriente vers une modernisation des outils de formation plus adaptés à cette population (MOOC, distanciel, auto-formation, etc.).  \nUne campagne de sensibilisation au dispositif CEC/CPF est en cours depuis Avril 2021 afin d'activer des financements de formation de bénévoles par leur CPF, lorsque les formations de l'INF de la FFE seront agréées."], "ground_truth": "Actuellement la FFE recense les diplômés fédéraux suivants:  \n-  1900 arbitres\n-  100 officiels\n-  1200 initiateurs\n-  2500 animateurs\n-  400 entraineurs  \nL'INF prévoit une refonte complète en 2023 des diplômes d'initiateurs et d'animateurs pour répondre à la demande de professionnalisation, notamment dans l'animation en milieu scolaire."}
{"question": "Quelle règle est énoncée à la page 138?", "answer": "", "contexts": ["## 4. Points virtuels  \nLes rondes accélérées sont celles de la première moitié du tournoi (nombre arrondi à l'entier supérieur . Par exemple pour un tournoi en 9 rondes on accélérera 5 rondes)  \nPour la 1 re moitié des rondes accélérées (nombre arrondi à l'entier supérieur . Par exemple, pour un tournoi en 9 rondes on prend les 3 premières rondes ) tous les joueurs de GA reçoivent un point fictif.  \nCes points fictifs sont réduits à 0,5 pour les rondes accélérées restantes (pour la 4 e et la 5 e dans le cas d'un tournoi en 9 rondes)  \nNote : Aucun point fictif n'est donné aux joueurs de GB et tous les points fictifs disparaissent une fois que la dernière ronde accélérée ait été jouée (la 5 e du tournoi pour un tournoi en 9 rondes )."], "ground_truth": "Par exemple pour un tournoi en 9 rondes on accélérera 5 rondes)  \nPour la 1 re moitié des rondes accélérées (nombre arrondi à l'entier supérieur ."}
{"question": "Qu'est-ce que les pièces?", "answer": "", "contexts": ["C.10 Si deux pièces identiques peuvent arriver sur la même case, alors la pièce qui est déplacée est indiquée comme suit :  \n- C.10.1. Si les deux pièces sont sur la même rangée, par\n- C.10.1.1. L 'abréviation du nom de la pièce,\n- C.10.1.2. La colonne de la case de départ et.\n- C.10.1.3. L a case d'arrivée\n- C.10.2. Si les deux pièces sont sur la même colonne, par\n- C.10.2.1. L 'abréviation du nom de la pièce,\n- C.10.2.2. La rangée de la case de départ\n- C.10.2.3. L a case d'arrivée.\n- C.10.3. Si les pièces sont sur des colonnes et des rangées différentes, la méthode (1) est préférée. Exemples :\n- C.10.3.1. Il y a deux cavaliers sur les cases g1 et e1, et l'un d'eux est déplacé sur la case f3 : soit Cgf3 soit Cef3, selon le cas.\n- C.10.3.2. Il y a deux cavaliers sur les cases g5 et g1, et l'un d'eux est déplacé sur la case f3 : soit C5f3 soit C1f3, selon le cas.\n- C.10.3.3. Il y a deux cavaliers sur les cases h2 et d4, et l'un d'eux est déplacé sur la case f3 : soit Chf3 soit Cdf3, selon le cas."], "ground_truth": "les pièces sont sur des colonnes et des rangées différentes, la méthode (1) est préférée."}
{"question": "Quelle règle s'applique aux joueurs selon 2025_Reglement_Interieur_20250?", "answer": "", "contexts": ["## 4.2 Fusions et scission de clubs  \nTout club envisageant une fusion ou une scission doit formuler sa demande auprès du secrétaire général de la FFE avant le 15 mai en vue de son examen par le comité directeur de la FFE lors de sa dernière réunion de la saison.  \nPar l'intermédiaire de leur ligue régionale de rattachement, qui émettra un avis circonstancié, ces clubs doivent adresser au comité départemental et à la FFE leur projet de fusion élaboré conformément aux articles 15-2 et suivants du décret du 16 août 1901, comprenant notamment les statuts envisagés de la nouvelle association résultant de l'opération de fusion ou de scission. En toute hypothèse, en cas d'autorisation du comité directeur, les joueurs des clubs visés sont considérés comme non mutés pour la saison à venir.  \nPour le calcul des voix prévues à l'article 5.4 des statuts, le nombre de licenciés à prendre en compte est :  \n- -dans le cas d'une fusion de clubs, la somme du nombre de licenciés des clubs fusionnant ;\n- -dans le cas d'une scission, par le nombre de licenciés inscrits dans chaque club au procès-verbal de l'assemblée générale actant la scission."], "ground_truth": "En toute hypothèse, en cas d'autorisation du comité directeur, les joueurs des clubs visés sont considérés comme non mutés pour la saison à venir."}
{"question": "Qu'est-ce que une nulle?", "answer": "", "contexts": ["- I.2.3. Le temps de réflexion utilisé par chacun des adversaires,\n- I.2.4. Le nom du joueur ou de la joueuse dont le coup est mis sous enveloppe,\n- I.2.5. Le numéro du coup mis sous enveloppe,\n- I.2.6. Une éventuelle proposition de nulle en vigueur lors de la mise sous enveloppe,\n- I.2.7. L a date, l'heure et le lieu de reprise du jeu.\n- I.3 L'arbitre vérifie les indications portées sur l'enveloppe. Il/Elle est responsable de sa conservation.\n- I.4 Si un joueur ou une joueuse propose la nulle après que son adversaire a mis son coup sous enveloppe, la proposition reste valide tant que l'adversaire ne l'a ni acceptée ni rejetée selon les termes de l'Article 9.1.\n- I.5 Avant que la partie ne reprenne, la position qui précédait le coup mis sous enveloppe est rétablie sur l'échiquier et la pendule réglée de telle manière qu'elle indique les temps de réflexion restant lors de l'ajournement.\n- I.6 Si, avant la reprise, une nulle est convenue, ou si l'un des deux adversaires annonce à l'arbitre qu'il abandonne, la partie est terminée.\n- I.7 L'enveloppe n'est ouverte qu'en présence du joueur ou de la joueuse devant répondre au coup mis sous enveloppe.\n- I.8 En dehors des cas dont il est fait mention dans les Articles 5, 5.2.2, 6.9 et 9.6, la partie est perdue par un joueur ou une joueuse dont le coup mis sous enveloppe est :"], "ground_truth": "une nulle est convenue, ou si l'un des deux adversaires annonce à l'arbitre qu'il abandonne, la partie est terminée."}
{"question": "Que se passe-t-il en cas de réserve formulée sur la nationalité d'un joueur ou joueuse?", "answer": "", "contexts": ["## 2.1. Nationalité  \n- 2.1.1. En cas de réserve formulée sur la nationalité d'un joueur ou joueuse, le club est tenu de justifier cette nationalité à la direction de la compétition (ou du groupe pour les compétitions concernées) ou à la Direction Technique Fédérale dans les quinze jours suivant la notification de cette réserve. À défaut, ce joueur ou joueuse ne sera pas comptabilisé dans le quota des joueurs ou joueuses de nationalité française.\n- 2.1.2.a) Pour toute la saison sportive, le statut de résidant en France correspond à une résidence réelle au plus tard le 30 novembre de la saison en cours, même si la résidence change ultérieurement. Une résidence en France obtenue après cette date, ne sera valable que pour la saison suivante.\n- 2.1.2.b) En cas de réserve formulée sur le statut de \"résidence en France\", le club est tenu de justifier ce statut à la direction de la compétition (ou du groupe pour les compétitions concernées) ou à la Direction Technique Fédérale dans les quinze jours suivant la notification de cette réserve, au moyen d'un document officiel. À défaut, les joueurs ou joueuses concernés ne seront pas comptabilisés dans le quota des ressortissants de l'Union Européenne résidant en France ou extracommunautaires résidant en France depuis 5 ans.\n- 2.1.3. La possibilité de représenter la France dans les compétitions internationales est réservée aux joueurs et joueuses de nationalité française. Les compétitions internationales réservées aux jeunes sont ouvertes à tous les jeunes (U20 et catégories inferieures) scolarisés en France depuis au moins deux ans et inscrits sous le code FRA auprès de la FIDE."], "ground_truth": "En cas de réserve formulée sur la nationalité d'un joueur ou joueuse, le club est tenu de justifier cette nationalité à la direction de la compétition (ou du groupe pour les compétitions concernées) ou à la Direction Technique Fédérale dans les quinze jours suivant la notification de cette réserve."}
{"question": "Qu'est-ce que le ne?", "answer": "", "contexts": ["## 6.6. Tournois toutes rondes :  \n- (1) Chaque joueur ou joueuse s'engage par contrat à jouer pour toute la durée du tournoi.\n- (2) Lorsqu'un joueur ou une joueuse abandonne ou est exclu d'un tournoi toutes -rondes, les conséquences sont les suivantes :\n- S 'il/Si elle a terminé moins de 50% de ses parties et quitte le tournoi, son score reste dans la grille du tournoi (pour le classement et les archives), mais les points marqués par lui/elle ou contre lui/elle ne sont pas pris en compte dans le classement final. Les parties non jouées du joueur/de la joueuse et de ses adversaires sont indiquées par un (-) dans la grille du tournoi et celles de ses adversaires par un (+). En l'absence des deux adversaires, c 'est indiqué par deux (-).\n- S 'il/Si elle a terminé au moins 50% de ses parties, son score reste dans la grille du tournoi et il est pris en compte dans le classement final. Les parties non jouées du joueur/de la joueuse sont indiquées comme ci-dessus."], "ground_truth": "le ne sont pas pris en compte dans le classement final."}
{"question": "Qu'est-ce que un trophée?", "answer": "", "contexts": ["## 3.5. Prix  \nLes trois premières au classement général reçoivent un prix.  \nUn prix et un trophée sont attribués à la meilleure joueuse pour chaque catégorie d'âge jeunes, de U8F à U20F.  \nDes coupes récompensent les meilleures des autres catégories selon le nombre de participantes.  \nLors de la phase zone interdépartementale, différents titres et récompenses peuvent être attribués."], "ground_truth": "un trophée sont attribués à la meilleure joueuse pour chaque catégorie d'âge jeunes, de U8F à U20F."}
{"question": "Qu'est-ce qui est permis?", "answer": "", "contexts": ["## 6.7. Tournois au système suisse :  \n- (1) Si un joueur ou une joueuse abandonne un tournoi au système suisse, les points marqués par lui/elle et par ses adversaires restent dans la grille pour les besoins du classement. Seules les parties effectivement jouées sont comptabilisées pour le classement ELO.\n- (2) Si un joueur/une joueuse ne peut pas jouer une ronde précise, il/elle doit absolument en informer la personne chargée des appariements et l'AP avant que les appariements pour cette ronde ne soient publiés.  \nA moins que le règlement d'une compétition ne spécifie des modalités différentes :  \n- (3) Dans un tournoi L2 ou L3 : si, après qu'une ronde a commencé, deux joueurs /joueuses n'ont pas de partie alors ils peuvent être appariés l'un contre l'autre. Cela n'est autorisé que si l'arbitre et les deux joueurs/joueuses sont d'accord et qu'ils ne se sont pas déjà affrontés dans ce tournoi. L'arbitre ajustera le temps à la pendule de chaque joueur/joueuse de manière équitable.\n- (4) Dans un tournoi L2 ou L3, le règlement peut permettre à un joueur/une joueuse d 'obtenir un demi-point « bye » (sans jouer) à une ronde donnée. Cela n'est permis qu'une seule fois durant le tournoi, si la demande a été formulée suffisamment en avance et qu'elle est acceptée par l'arbitre. Une telle permission ne devrait pas être octroyée à un joueur/une joueuse qui bénéficie de conditions ou qui bénéficie d'une inscription gratuite au tournoi."], "ground_truth": "est permis qu'une seule fois durant le tournoi, si la demande a été formulée suffisamment en avance et qu'elle est acceptée par l'arbitre."}
{"question": "Quelle règle est énoncée à la page 139?", "answer": "", "contexts": ["## Partie 3: Les systèmes d'appariements  \n2. Lorsque l'arbitre en chef décide d'admettre un retardataire :\n2. o Si la personne indique qu'elle arrivera à temps pour le début de la première ronde, elle reçoit un numéro d'appariement et est appariée normalement.\n3. o Si la personne indique qu'elle n'arrivera à temps que pour le début de la 2 e (ou de la 3 e ) ronde, elle n'est pas appariée pour les rondes qu'elle ne peut pas jouer.\n4. Elle ne reçoit aucun point pour les rondes non jouées (sauf si le règlement du tournoi en décide autrement). Un numéro d'appariement lui sera attribué et elle n 'est appariée que lorsqu'elle est réellement arrivée.\n3. S'il y a des retardataires, les numéros d'appariement attribués au début du tournoi sont considérés comme provisoires. Les numéros d'appariement définitifs ne sont donnés qu'à la clôture de la liste des participants, ou quand des corrections sont effectuées sur les tableaux d'affichage de résultats.\n- D. Règles d'appariements, de couleurs et de publication.\n1. Uniquement pour les appariements, les parties ajournées sont considérées comme des parties nulles.\n2. Un e personne qui ne se présente par lors d'une ronde sans avoir prévenu l'arbitre est considéré e comme ayant abandonné le tournoi, sauf si cette absence est expliquée par des arguments recevables avant que l'appariement de la ronde suivante ne soit publié.\n3. Les personnes qui abandonnent le tournoi ne seront plus appariées."], "ground_truth": "o Si la personne indique qu'elle arrivera à temps pour le début de la première ronde, elle reçoit un numéro d'appariement et est appariée normalement."}
{"question": "Qu'est-ce que une compétition?", "answer": "", "contexts": ["- 12.3.18. S'il y a des restrictions concernant les fumeurs et fumeuses, elles doivent être mentionnées sur l'invitation.\n- 12.3.19. Les dispositions en matière de sécurité.\n- 12.3.20. Des considérations médicales spéciales telles que les vaccinations recommandées ou obligatoires à l'avance.\n- 12.3.21. Les dispositions pour : le tourisme, l es événements spéciaux, l'accès internet, etc...\n- 12.3.22. La date avant laquelle un joueur ou une joueuse doit donner sa réponse définitive à l'invitation et où il/elle donne son heure d'arrivée.\n- 12.3.23. Dans sa réponse, le joueur/la joueuse peut, s'il/si elle le désire, mentionner les conditions médicales préexistantes et les exigences diététiques et/ou religieuses spécifiques.\n- 12.3.24. Si l 'équipe organisatrice doit prendre des mesures spéciales en raison d'un handicap , le joueur/la joueuse le notifiera aux organisateurs dans sa réponse.  \n12.4. Une fois qu'une invitation a été envoyée à un joueur /une joueuse, elle ne peut pas être retirée, à condition qu'il/elle accepte l'invitation avant la date limite de réponse. Si une compétition est annulée ou reportée, l'équipe d'organisation doit fournir une compensation ."], "ground_truth": "une compétition est annulée ou reportée, l'équipe d'organisation doit fournir une compensation ."}
{"question": "Qu'est-ce que la procédure?", "answer": "", "contexts": ["## 16.1. Les devoirs de l'arbitre  \n- Respecter et faire respecter les règles et les règlements\n- Jouer un rôle pédagogique lorsque cela est nécessaire\n- Composer, le cas échéant, en accord avec l'organisateur, un Jury d'Appel (nombre impair de personnes, faire figurer dans cette liste à la fois des titulaires et des suppléants) habilité à examiner les appels des joueurs et joueuses en cours de tournoi, convoquer cette commission lorsque l'appel est recevable\n- Officier avec calme, dans un esprit de modération, d'ouverture et de conciliation, conformément à ce que préconise la F.I.D.E.\n- Jouer un rôle de conseiller technique avant le tournoi (par exemple : rédaction du règlement intérieur en collaboration avec l'organisateur)\n- Veiller au confort matériel et moral des joueurs en signalant à l'organisateur toute anomalie susceptible de perturber les compétiteurs, et l'aider à trouver des solutions appropriées, veiller à ce que la liste des prix soit affichée dès la première moitié du tournoi, s'assurer du bon affichage des informations techniques obligatoires : liste des joueurs par Elo décroissant, appariements, classement général et grille américaine ronde après ronde, règlement intérieur du tournoi, composition du Jury d'Appel\n- Autoriser la pratique du « bye » dans les tournois au système suisse homologués par la F.F.E. uniquement lorsque la procédure est clairement décrite dans l'annonce du tournoi et le règlement intérieur.\n- Refuser de « diriger » les appariements, ne pas céder face aux pressions de joueurs désirant réaliser une norme ou une performance et sollicitant à cette fin une transgression des règlements, ne procéder à aucune protection de familles ou de clubs transgressant le texte F.I.D.E. C04"], "ground_truth": "la procédure est clairement décrite dans l'annonce du tournoi et le règlement intérieur."}
{"question": "Qu'est-ce que une adversaire?", "answer": "", "contexts": ["## 1.4.6. Classement des adversaires  \n- a) La liste de classement en vigueur au début du tournoi sera utilisée (voir les exceptions en 1.1.4.) Le classement de joueurs ou joueuses appartenant à des fédérations temporairement exclues au début de la manifestation peut être déterminé en faisant appel au secrétariat de la FIDE.\n- b) Pour les besoins des normes, le classement minimum (plancher ajusté de classement) des adversaires sera comme suit :\n- c) Au plus un/une adversaire peut avoir son classement augmenté jusqu'au plancher ajusté de classement. Quand plus d'un /une adversaire est en dessous du plancher, le classement de l'adversaire le plus faible sera augmenté.\n- d) Les joueurs et joueuses non classés et non couverts par 1.4.6b doivent être considérés comme classés 1400.  \nNorme de Grand Maître : 2200  \nNorme de Maître International : 2050  \nNorme de Grand Maître féminin : 2000  \nNorme de Maître International féminin : 1850"], "ground_truth": "une adversaire est en dessous du plancher, le classement de l'adversaire le plus faible sera augmenté."}
{"question": "Que precise de 2023_Reglement_Financier202306?", "answer": "", "contexts": ["## 2. L'ORGANISATION COMPTABLE ET BUDGÉTAIRE  \nLes modalités pratiques de tenue et de contrôle interne de la comptabilité sont définies par le Directeur Général, sous le contrôle du Trésorier. Le cas échéant, un cabinet d'expertise comptable indépendant peut intervenir sur tout ou partie de la comptabilité.  \nLe commissaire aux comptes certifie tous les ans la sincérité des comptes, du résultat, et de la situation patrimoniale de la fédération. Le Président, le Trésorier et son adjoint le cas échéant, veillent à ce que toutes les informations nécessaires soient communiquées en temps utile aux instances concernées.  \nLe trésorier assure le suivi de l'exécution du budget et présente les comptes à l'Assemblée Générale."], "ground_truth": "L'ORGANISATION COMPTABLE ET BUDGÉTAIRE  \nLes modalités pratiques de tenue et de contrôle interne de la comptabilité sont définies par le Directeur Général, sous le contrôle du Trésorier."}
{"question": "Quelle règle est énoncée à la page 63?", "answer": "", "contexts": ["- I.8 En dehors des cas dont il est fait mention dans les Articles 5, 5.2.2, 6.9 et 9.6, la partie est perdue par un joueur ou une joueuse dont le coup mis sous enveloppe est :\n- I.8.1. Ambigu, ou\n- I.8.2. I nscrit de telle façon qu'il est impossible d'établir sa véritable signification, ou\n- I.8.3. Illégal.\n- I.9 A l'heure fixée pour la reprise de la partie,\n- I.9.1. Si le joueur ou la joueuse devant répondre au coup mis sous enveloppe est présent/présente, l'enveloppe est ouverte, le coup mis sous enveloppe est effectué sur l'échiquier, et sa pendule est mise en marche ;"], "ground_truth": "I nscrit de telle façon qu'il est impossible d'établir sa véritable signification, ou\n- I.8.3."}
{"question": "Qu'est-ce que la DSC?", "answer": "", "contexts": ["## 5.3. Notifications et communications  \nToutes les notifications et communications que la DSC destine aux parties doivent être faites par l'intermédiaire du président de la DSC. Toutes les communications que les parties destinent à la DSC sont effectuées par l'intermédiaire du président de la DSC."], "ground_truth": "la DSC sont effectuées par l'intermédiaire du président de la DSC."}
{"question": "Quelle règle est énoncée à la page 18?", "answer": "", "contexts": ["## 7.1. Critères administratifs :  \nPour obtenir un titre d'arbitre fédéral, les conditions administratives suivantes sont nécessaires :  \n- Être titulaire d'une licence A valable pour la saison en cours\n- Respecter les limites d'âge et les titres requis, tels qu'indiqués dans la description du titre visé\n- Avoir possédé, à un moment donné, un classement Elo (lent ou rapide, national ou F.I.D.E.).\n- S'être soumis au contrôle d'honorabilité.\n- Pour les personnes de 16 ans et plus : avoir participé à un stage de sensibilisation contre les violences sexistes ou sexuelles agréé par la F.F.E."], "ground_truth": "- S'être soumis au contrôle d'honorabilité."}
{"question": "Quelle règle est énoncée à la page 176?", "answer": "", "contexts": ["| Attestations de normes (formulaires FIDE) le cas échéant : jordi.lopez@ffechecs.fr | X | | |  \nLe rapport technique complet doit nécessairement être réalisé dans les 7 jours qui suivent la fin du tournoi.  \nIl est demandé que les formulaires de normes envoyés soient le plus lisibles possible. Un format doc ou pdf est préconisé. Il est surtout demandé d'éviter tout envoi d'une norme prise en photo avec un téléphone qui ne peut pas être un document recevable.  \n- → Adresse de la directrice des Tournois: Madame Chantal Hennequin soshin64@gmail.com\n- → Adresse du DNA: Monsieur Guillaume Gerandi gerandi.guillaume@gmail.com  \nIl convient d'adresser à l'organisateur une version personnalisée du rapport technique comportant les pièces susceptibles de l'intéresser."], "ground_truth": "Il est demandé que les formulaires de normes envoyés soient le plus lisibles possible."}
{"question": "Que se passe-t-il en cas de conflit?", "answer": "", "contexts": ["## 4.1.1. Rôle  \nLes superviseurs et superviseures sont des arbitres fédéraux expérimentés. Ce sont des cadres qui font autorité en matière d'arbitrage dans toute la France. Sur les lieux d'un tournoi, il s peuvent prendre les initiatives appropriées s'il s constatent que les règlements fédéraux et/ou l'une des clauses de la Charte de l'Arbitrage ne sont pas respectés  \nLeur rôle est avant tout pédagogique, ils s'engagent à répondre aux questions d'arbitrage posées par les collègues, à assister et à conseiller ces arbitres, à intervenir en cas de conflit, à agir dans un esprit de conciliation, de modération et d'ouverture, tout en veillant au strict respect sur le terrain des textes officiels de la FFE et de la FIDE.  \nIls peuvent d'eux même conseiller un arbitre sur les lieux d'un tournoi pour l'aider à améliorer sa pratique sur les événements ultérieurs."], "ground_truth": "en cas de conflit, à agir dans un esprit de conciliation, de modération et d'ouverture, tout en veillant au strict respect sur le terrain des textes officiels de la FFE et de la FIDE."}
{"question": "Qu'est-il permis de faire selon J02_2025_26_Championnat_de_Fra?", "answer": "", "contexts": ["## 3.7.c) Ordre des échiquiers  \nLes échiquiers 1 à 8 (1 à 4 en N 3) sont rangés par âge, le plus petit échiquier étant le plus âgé.  \nDans le respect de l'article précédent, un membre de l'équipe peut toutefois se placer devant un autre plus âgé dans le cas où il possède un Elo supérieur ou égal à l'Elo du membre plus âgé.  \nL'échiquier 8 peut être placé devant l'échiquier 7, quels que soient les Elo.  \nLe non-respect de l'article 3.7.c. entraîne un forfait administratif sur l'échiquier du membre de l'équipe placé après un plus jeune que lui (voir article 4.1.b)."], "ground_truth": "Dans le respect de l'article précédent, un membre de l'équipe peut toutefois se placer devant un autre plus âgé dans le cas où il possède un Elo supérieur ou égal à l'Elo du membre plus âgé."}
{"question": "Quelle règle est énoncée à la page 152?", "answer": "", "contexts": ["## 11. Systèmes spécifiques pour un départage entre deux équipes.  \nMême si ces départages peuvent être utilisés dans les compétitions par équipe (voir article 12) et sont décrits comme tels, ils sont spécifiques au fait de déterminer un vainqueur entre deux équipes. (Ils sont aussi fonctionnels pour un match unique entre elles).  \nPour ces systèmes de départage :  \n- Les résultats obtenus par forfait sont considérés comme des résultats normaux.\n- Si l'équipe a bénéficié d'un point d'exemption, les points de jeu attribués pour chaque échiquier sont les mêmes que ceux pour une victoire normale."], "ground_truth": "Même si ces départages peuvent être utilisés dans les compétitions par équipe (voir article 12) et sont décrits comme tels, ils sont spécifiques au fait de déterminer un vainqueur entre deux équipes."}
{"question": "Qu'est-ce que le poste?", "answer": "", "contexts": ["## 9.9.2 Vacance  \nEn cas de démission adressée au secrétaire général ou de vacance constatée par le bureau fédéral, le poste est pourvu par un vote à bulletin secret lors du plus proche comité directeur sur proposition de tout membre de celui-ci."], "ground_truth": "le poste est pourvu par un vote à bulletin secret lors du plus proche comité directeur sur proposition de tout membre de celui-ci."}
{"question": "Quelle règle est énoncée à la page 17?", "answer": "", "contexts": ["## Art. 8-3 - Recyclage  \nLa loi relative à la lutte contre le gaspillage et à l'économie circulaire du 10 février 2020, dite loi AGEC, acte la mise en place d'une filière REP (Responsabilité Elargie du Producteur) « Articles de Sport et de Loisirs » (ASL) à compter du 1er janvier 2022.  \nDans la perspective de mise en œuvre par le Gouvernement et afin que les parties prenantes concernées disposent d'informations et de données récentes pour la création de cette filière, l'ADEME a lancé la réalisation d'une étude qui s'est conduite en deux phases. La synthèse de cette étude décrit l'organisation actuelle du marché des ASL, de la prise en charge des déchets et dessine le contour de ce que pourrait être l'organisation de la future filière (scénarios d'organisation, objectifs de performance, éco-modulations). La mise en place de cette filière devrait favoriser le réemploi et le recyclage des ASL lorsqu'ils arrivent en fin de vie.  \nLes fédérations sportives et leurs membres peuvent participer à la mise en place de cette filière de réemploi.  \nLors des championnats de France d'Agen et d'Albi, les sites des compétitions et d'accueil du public seront équipés de poubelles permettant le tri des déchets ainsi que de points d'eau potable librement accessible."], "ground_truth": "Dans la perspective de mise en œuvre par le Gouvernement et afin que les parties prenantes concernées disposent d'informations et de données récentes pour la création de cette filière, l'ADEME a lancé la réalisation d'une étude qui s'est conduite en deux phases."}
{"question": "Quelle règle est énoncée à la page 59?", "answer": "", "contexts": ["- C.7 En conséquence des règles précédentes, chacune des 64 cases de l'échiquier est indiquée de manière invariable comme une combinaison unique d'une lettre et d'un chiffre.\n- C.8 Chaque mouvement de pièce est indiqué par l'abréviation du nom de la pièce en question et de la case d'arrivée. Il n'est pas nécessaire d'inscrire un trait d'union entre le nom de la pièce et la case.  \n<!-- image -->  \nExemples : Fe5, Cf3, Td1.  \nDans le cas d'un pion, seule la case d'arrivée est indiquée. Exemples : e5, d4, a5.  \nUne forme plus longue de notation, contenant la case de départ, est acceptée.  \nExemples : Fb2e5, Cg1f3, Ta1d1, e7e5, d2d4, a6a5.  \n- C.9 Quand une pièce effectue une prise, un 'x' peut être intercalé entre\n- C.9.1. L 'abréviation de la pièce en question et\n- C.9.2. L a case d'arrivée. Exemple : Fxe5, Cxf3, Txd1. Voir aussi C.10\n- C.9.3. Quand un pion effectue une prise, la colonne de départ doit être indiquée, puis un 'x' peut être inséré et enfin la case d'arrivée.  \nExemples : dxe5, gxf3, axb5.  \nDans le cas de la prise 'en passant', 'e.p.' peut être rajouté à la suite de la notation.  \nExemple : exd6 e.p."], "ground_truth": "- C.8 Chaque mouvement de pièce est indiqué par l'abréviation du nom de la pièce en question et de la case d'arrivée."}
{"question": "Qu'est-ce que le club?", "answer": "", "contexts": ["## 2.1. Nationalité  \n- 2.1.1. En cas de réserve formulée sur la nationalité d'un joueur ou joueuse, le club est tenu de justifier cette nationalité à la direction de la compétition (ou du groupe pour les compétitions concernées) ou à la Direction Technique Fédérale dans les quinze jours suivant la notification de cette réserve. À défaut, ce joueur ou joueuse ne sera pas comptabilisé dans le quota des joueurs ou joueuses de nationalité française.\n- 2.1.2.a) Pour toute la saison sportive, le statut de résidant en France correspond à une résidence réelle au plus tard le 30 novembre de la saison en cours, même si la résidence change ultérieurement. Une résidence en France obtenue après cette date, ne sera valable que pour la saison suivante.\n- 2.1.2.b) En cas de réserve formulée sur le statut de \"résidence en France\", le club est tenu de justifier ce statut à la direction de la compétition (ou du groupe pour les compétitions concernées) ou à la Direction Technique Fédérale dans les quinze jours suivant la notification de cette réserve, au moyen d'un document officiel. À défaut, les joueurs ou joueuses concernés ne seront pas comptabilisés dans le quota des ressortissants de l'Union Européenne résidant en France ou extracommunautaires résidant en France depuis 5 ans.\n- 2.1.3. La possibilité de représenter la France dans les compétitions internationales est réservée aux joueurs et joueuses de nationalité française. Les compétitions internationales réservées aux jeunes sont ouvertes à tous les jeunes (U20 et catégories inferieures) scolarisés en France depuis au moins deux ans et inscrits sous le code FRA auprès de la FIDE."], "ground_truth": "le club est tenu de justifier cette nationalité à la direction de la compétition (ou du groupe pour les compétitions concernées) ou à la Direction Technique Fédérale dans les quinze jours suivant la notification de cette réserve."}
{"question": "Qu'est-ce que la recevabilité?", "answer": "", "contexts": ["## Article 2 : Compétence de la sous-commission disciplinaire de l'ARB et recevabilité des plaintes  \n- 2.1. La DSC exerce sa juridiction sur tous les arbitres licenciés de la FIDE en tant que membres de la famille de la FIDE, tels que définis ci-dessous. Le terme « arbitres » couvre également les formateurs accrédités pour les séminaires de la FIDE pour ces règlements.\n- 2.2. La DSC ne prendra en considération que les plaintes et les rapports reçus qui remplissent les conditions de recevabilité des plaintes et des rapports telles qu'elles sont définies dans le présent règlement.\n- 2.3. La DSC n'a pas le pouvoir d'enquêter de sa propre initiative sur des infractions à ces règles, elle ne peut étudier un dossier qu'après l'avoir reçu de l'ARB.\n- 2.4. Toutes les plaintes concernant la conduite des arbitres sont soumises à l'ARB, qui décide provisoirement si la plainte est recevable ou non. La question de la recevabilité est décidée à la majorité des membres votants de l'ARB. Si la plainte est jugée irrecevable, le plaignant en est informé et l'affaire est considérée comme close. Si la plainte est jugée recevable, elle sera transmise à la CSD pour enquête et décision, ou directement à la Commission d'éthique et de discipline (EDC) si l'infraction présumée est de nature grave et que, de l'avis de l'ARB, elle peut entraîner une suspension d'au moins 18 mois dans le cas d'un premier délit, ou de 24 mois dans le cas d'une récidive, ou dans d'autres cas où l'ARB estime qu'il n'est pas approprié que le dossier soit traité d'abord par la DSC."], "ground_truth": "la recevabilité est décidée à la majorité des membres votants de l'ARB."}
{"question": "Quelle obligation est énoncée à la page 2?", "answer": "", "contexts": ["## 2.2. Direction de groupe  \nLa direction de groupe est chargée de concevoir des appariements cohérents et de le proposer à la direction de la compétition, de faire respecter le règlement, de collecter les résultats et d'en vérifier la conformité. Dans le cas de la N3, il doit aussi concevoir le calendrier.  \nElle établit également les classements provisoires et le récapitulatif des résultats, transmet à la direction de la compétition et aux équipes du groupe l'ensemble des documents dans les plus brefs délais.  \nElle communique les résultats et le classement provisoire sur le site fédéral, au plus tard le lendemain de la rencontre à midi.  \nElle désigne, pour chaque match, un ou une \"Responsable du match\".  \nLes décisions concernant les litiges réglés par les directions de groupe sont notifiées aux intéressés par lettre recommandée avec avis de réception ou par tout moyen permettant de prouver leur réception par le destinataire."], "ground_truth": "Dans le cas de la N3, il doit aussi concevoir le calendrier."}
{"question": "Quelle règle est énoncée à la page 196?", "answer": "", "contexts": ["## 1.4.5. Titres des adversaires -voir Annexe pour les valeurs exactes :  \n- a) Au moins 50% des adversaires devront avoir un titre (TH) comme en 0.3, CM et CMF exclus.\n- b) Pour une norme de GM au moins 1/3 des adversaires, avec un minimum de 3, doivent être GM.\n- c) Pour une norme de MI, au moins 1/3 des adversaires, avec un minimum de 3, doivent être MI ou GM.\n- d) Pour une norme de GMF, au moins 1/3 des adversaires, avec un minimum de 3, doivent être GMF, MI ou GM.\n- e) Pour une norme de MIF, au moins 1/3 des adversaires, avec un minimum de 3, doivent être MIF, GMF, MI ou GM.\n- f) Les tournois toutes rondes en \"aller-retour\" requièrent un minimum de 6 joueurs et joueuses. Pour ces évé nements, le nombre d'adversaires avec les titres exigés par les articles 1.4.5b à 1.4.5e est divisé par deux -arrondi à l'entier supérieur ."], "ground_truth": "- b) Pour une norme de GM au moins 1/3 des adversaires, avec un minimum de 3, doivent être GM."}
{"question": "Qu'est-ce que une transposition?", "answer": "", "contexts": ["## D.1 Transpositions dans S2  \nUne transposition est un changement de l'ordre des NAN de S2 (tous représentant des joueurs /joueuses résidents).  \nToutes les transpositions possibles sont classées dans l'ordre croissant des valeurs lexicographiques de leurs N1 premiers numéros. (N1 est le nombre de joueurs et joueuses dans S1)  \nLes numéros des joueurs et joueuses restants de S2 sont ignorés car ils représentent des personnes obligées de constituer le niveau résiduel en cas de niveau hétérogène ; ou obligés de devenir flotteurs descendants dans le cas d'un niveau homogène."], "ground_truth": "Une transposition est un changement de l'ordre des NAN de S2 (tous représentant des joueurs /joueuses résidents)."}
{"question": "Que se passe-t-il en cas de manquement grave à l'un des articles par la Fédération?", "answer": "", "contexts": ["## Art. 13-2 - Révision du contrat  \nLe présent contrat peut être révisé si les deux Parties souhaitent en réviser le contenu.  \nIl peut également être révisé en cas d'inexécution des obligations nées de l'engagement contractuel des Parties au contrat. Dans ce cas, la partie qui constate l'inexécution peut :  \n- -Solliciter l'autre partie pour une révision du contrat ;\n- -Interrompre l'exécution de ses engagements contractuels réciproques.  \nEn cas de manquement grave à l'un des articles par la Fédération, le Ministère des sports pourra retirer la délégation pour une ou plusieurs disciplines sportives.  \nLe contrat de délégation est révisé lorsque la stratégie nationale de la fédération, dans sa version définitive, n'a pas été initialement annexée au contrat."], "ground_truth": "En cas de manquement grave à l'un des articles par la Fédération, le Ministère des sports pourra retirer la délégation pour une ou plusieurs disciplines sportives."}
{"question": "Qu'est-ce que une accusation?", "answer": "", "contexts": ["## D. Fausse accusation  \nD.1 Une fausse accusation est un abus de la liberté d'expression. Une fausse accusation aux échecs comme dans tout autre domaine peut porter atteinte à une réputation. Le droit à la protection de la réputation est protégé dans le cadre du droit au respect de la vie privée. Pour décider si une accusation est manifestement infondée et peut donc être considérée comme un abus de la liberté d'expression, les critères suivants sont pris en compte : a) le caractère suffisant de la base factuelle de l'accusation ; b) le niveau de la compétition ; c) le titre et le classement de la personne qui est accusée de tricherie en ligne ; d) le résultat final de la personne accusée dans la compétition en question ; e) le moyen et l'ampleur de la diffusion de l'accusation (médias sociaux, interview publique, blog, etc.) Cette liste des critères n'est pas exhaustive.  \nD.2 Une fausse accusation aux échecs en ligne est traitée mutatis mutandis comme pour le jeu physique sur l'échiquier."], "ground_truth": "une accusation est manifestement infondée et peut donc être considérée comme un abus de la liberté d'expression, les critères suivants sont pris en compte : a) le caractère suffisant de la base factuelle de l'accusation ; b) le niveau de la compétition ; c) le titre et le classement de la personne qui est accusée de tricherie en ligne ; d) le résultat final de la personne accusée dans la compétition en question ; e) le moyen et l'ampleur de la diffusion de l'accusation (médias sociaux, interview publique, blog, etc."}
{"question": "Qu'est-ce que le but?", "answer": "", "contexts": ["## 11.10. Autres infractions :  \n- Responsabilité pour le comportement des spectateurs : L'organisateur a la responsabilité d'intervenir en prenant des mesures raisonnables dans le cas d'inconduite de la part des spectateurs.\n- Tout accord entre deux ou plusieurs personnes dont le but est d'aboutir à la commission des infractions.\n- Infractions pénales et/ou les violations d'autres lois et règlements applicable s. Ce Code n'a pas pour but de remplacer mais plutôt de compléter ces lois et règlements par des règles de conduite supplémentaires pour les personnes impliquées dans la pratique sportive du jeu d'échecs. Il ne doit pas être interprété ou appliqué de manière à porter préjudice ou à saper de quelque manière que ce soit l'application de ces lois ou règlements."], "ground_truth": "le but est d'aboutir à la commission des infractions."}
{"question": "Qu'est-ce que le kilométrage?", "answer": "", "contexts": ["## 2) FRAIS DE DÉPLACEMENTS  \nLe calcul des frais de déplacement est régi par les tarifs fédéraux(2025) et le règlement financier de la FFE(2023). Ces documents restent la référence de calcul pour les frais de déplacement qui peuvent être sujet à évolution.  \nL'utilisation des transports en commun doit être privilégiée à chaque fois que possible.  \nNote : Le kilométrage est calculé sur le déplacement réel effectué -dans la limite d'un trajet raisonnable .  \n- ➔ Si l'arbitre doit nécessairement utiliser son véhicule :\n- o Cas Général : 0,32 € / km pour une distance aller 0 -110 km\n- o Cas Long déplacement : Au delà d'une distance de 110 km aller, utiliser le tableau et la formule ci-dessous  \nFormule de remboursement du trajet aller : R= C + (DxK)  \nLe remboursement total correspond au remboursement de la « distance aller » multiplié par 2 + 20 € forfaitaires couvrant les frais annexes."], "ground_truth": "Le kilométrage est calculé sur le déplacement réel effectué -dans la limite d'un trajet raisonnable ."}
{"question": "Que se passe-t-il en cas de partage égal des voix?", "answer": "", "contexts": ["## ARTICLE 5 - REUNION DES ORGANES DISCIPLINAIRES  \nLes organes disciplinaires de première instance et d'appel se réunissent sur convocation de leur président ou de la personne qu'il mandate à cet effet. Chacun d'eux ne peut délibérer valablement que lorsque trois au moins de ses membres sont présents.  \nEn cas de partage égal des voix, le président de séance a voix prépondérante.  \nLe président de séance de l'organe disciplinaire désigne soit un membre de celui-ci, soit une autre personne pour assurer les fonctions de secrétaire de séance.  \nEn cas d'absence ou d'empêchement définitif du président, la présidence de l'organe disciplinaire est assurée par le membre le plus âgé de l'organe disciplinaire."], "ground_truth": "En cas de partage égal des voix, le président de séance a voix prépondérante."}
{"question": "Qu'est-ce que la mission?", "answer": "", "contexts": ["## 9.1.2 Composition  \nOutre le directeur technique national qui la dirige et l'anime, la direction technique nationale est composée d'un directeur technique national adjoint et des entraîneurs nationaux dont la mission est d'encadrer les membres des équipes de France."], "ground_truth": "la mission est d'encadrer les membres des équipes de France."}
{"question": "Quelle règle est énoncée à la page 121?", "answer": "", "contexts": ["## Note préliminaire :  \nLe système suisse est un système d'appariements basé sur des règles générales précisées dans les chapitres C.04.1. Règles de base des systèmes suisses et C.04.2. Règles de gestion des tournois au système suisse présentés ci-après.  \nLe système utilisé majoritairement en France est le système néerlandai s (C.04.3). D'autres systèmes existent (non présentés dans le livre de l'arbitre) et sont disponibles, en version originale (langue anglaise) sur le site de la FIDE :  \n- Le système Dubov (C.04.4.1)  \nhttps://handbook.fide.com/chapter/C040401202507  \n- Le système Burstein (C.04.4.2)\n- https://handbook.fide.com/chapter/C040402202507\n- Le système Lim (C.04.4.3) https://handbook.fide.com/chapter/C040403202507  \n(C.04.4) « L'utilisation de ces systèmes est déconseillée par la FIDE, à moins que, pour un système, il n'y ait un programme approuvé par la FIDE (voir, à l'annexe C.04.A, l'annexe 3 « Liste des programmes approuvés par la FIDE ») avec un programme vérifiant les appariements en libre accès (voir A.5 dans la même annexe) capable de vérifier les tournois exécutés avec ce système. »  \nhttps://handbook.fide.com/chapter/C04A"], "ground_truth": "Règles de gestion des tournois au système suisse présentés ci-après."}
{"question": "Que se passe-t-il en cas de circonstances exceptionnelles?", "answer": "", "contexts": ["## ARTICLE 16 - DELAI DE DECISION DE PREMIERE INSTANCE  \nL'organe disciplinaire de première instance doit se prononcer dans un délai de dix semaines à compter de l'engagement des poursuites disciplinaires.  \nEn cas de circonstances exceptionnelles, le délai de dix semaines peut être prorogé d'un mois par une décision motivée du président de l'organe disciplinaire et notifiée à la personne poursuivie, le cas échéant, à son représentant légal, à son conseil ou à son avocat, à l'association sportive avec laquelle elle a un lien juridique, selon les modalités prévues à l'article 8.  \nLorsque la séance a été reportée en application de l'article 13, le délai mentionné à l'alinéa précédent est prolongé d'une durée égale à celle du report.  \nFaute d'avoir statué dans ces délais, l'organe disciplinaire de première instance est dessaisi et l'ensemble du dossier est transmis à l'organe disciplinaire d'appel compétent qui statue en dernier ressort."], "ground_truth": "En cas de circonstances exceptionnelles, le délai de dix semaines peut être prorogé d'un mois par une décision motivée du président de l'organe disciplinaire et notifiée à la personne poursuivie, le cas échéant, à son représentant légal, à son conseil ou à son avocat, à l'association sportive avec laquelle elle a un lien juridique, selon les modalités prévues à l'article 8."}
{"question": "Qu'est-ce que la décision?", "answer": "", "contexts": ["## ARTICLE 15 - DELIBERE, DECISION ET NOTIFICATION  \nL'organe disciplinaire délibère à huis clos, hors la présence de la personne poursuivie, des personnes qui l'assistent ou la représentent, des personnes entendues à l'audience et de la personne chargée de l'instruction.  \nLorsque les fonctions de secrétaire de séance sont assurées par une personne qui n'est pas membre de l'organe disciplinaire, celle-ci peut assister au délibéré sans y participer.  \nL'organe disciplinaire prend une décision motivée, signée par le président de séance et le secrétaire. La décision est notifiée à la personne poursuivie ou, le cas échéant, à son représentant légal, selon les modalités prévues par l'article 8.  \nLa notification mentionne les voies et délais de recours.  \nL'association sportive dont dépend la personne poursuivie est informée de cette décision.  \nLa FFE est informée des décisions disciplinaires des Commissions Régionales de Discipline."], "ground_truth": "La décision est notifiée à la personne poursuivie ou, le cas échéant, à son représentant légal, selon les modalités prévues par l'article 8."}
{"question": "Quelle règle est énoncée à la page 147?", "answer": "", "contexts": ["- Type C : une évaluation basée sur les résultats des adversaires rencontrées par chaque ex-aequo de manière à ce qu'on ne puisse les calculer qu'à la fin de la partie ou du tournoi.\n- Type D : une évaluation basée sur les données associées aux adversaires rencontrées (par exemple les classements Elo mais aussi les résultats des rondes précédentes), de manière à ce que ces valeurs puissent être calculées après la publication des appariements (c 'est -à-dire avant que les parties ne soient jouées)\n- Une combinaison des types précédents.\n- 4.4. Dans un système d'appariements où les participants ont pu s'affronter plus d'une fois , chaque partie ou match sera traité comme une rencontre distincte. Par conséquent, les données des adversaires (par exemple, les classements Elo, les scores) sont utilisées autant de fois que les deux participants ont joué l'un contre l'autre (par exemple, dans les sommes et les moyennes)."], "ground_truth": "- Type D : une évaluation basée sur les données associées aux adversaires rencontrées (par exemple les classements Elo mais aussi les résultats des rondes précédentes), de manière à ce que ces valeurs puissent être calculées après la publication des appariements (c 'est -à-dire avant que les parties ne soient jouées)\n- Une combinaison des types précédents."}
{"question": "Que se passe-t-il en cas de dissolution approuvée?", "answer": "", "contexts": ["## ARTICLE 17 : MODALITÉS DE DISSOLUTION  \nL'assemblée générale ne peut prononcer la dissolution de la FFE que si elle est convoquée spécialement à cet effet.  \nLa décision de dissolution ne peut être prise que dans les mêmes conditions de convocation, de quorum et de majorité que pour la modification des statuts.  \nEn cas de dissolution approuvée, l'assemblée générale désigne un ou plusieurs commissaire(s) chargé(s) de la liquidation de ses biens.  \nDans cette hypothèse, elle attribue l'actif net à un ou plusieurs établissements analogues, publics ou reconnus d'utilité publique, ou à des établissements mentionnés à l'article 6, cinquième alinéa, de la loi du 1 er juillet 1901 modifiée."], "ground_truth": "En cas de dissolution approuvée, l'assemblée générale désigne un ou plusieurs commissaire(s) chargé(s) de la liquidation de ses biens."}
{"question": "Quelle règle est énoncée à la page 15?", "answer": "", "contexts": ["## 3.6.2. Le pôle stage  \n- Accorde ou refuse l'homologation des stages de formations d'arbitres.\n- Assure le suivi des stages, en lien avec les organisateurs, les formateurs et formatrices.\n- Transmet au secrétariat fédéral et à la direction des titres les éléments financiers et administratifs nécessaires à leurs missions."], "ground_truth": "- Assure le suivi des stages, en lien avec les organisateurs, les formateurs et formatrices."}
{"question": "Qu'est-ce que une liste?", "answer": "", "contexts": ["## 6. Listes Officielles du Classement Rapide et blitz de la FIDE  \n- 6.1. Le premier jour de chaque mois, la FIDE prépare une liste des classements intégrant les parties prises en compte durant la période de classement à partir de la liste précédente. Cela est fait en utilisant la formule du système de classement.\n- 6.1.1. La période de classement (pour les nouveaux classés, voir 6.1.4) est la période pendant laquelle une certaine liste de classements est valide.\n- 6.1.2. Les données suivantes, concernant chaque joueur et joueuse dont le classement est d'au moins 1 400 dans la liste actuelle, sont publiées : Titre de la FIDE, Fédération, Classement Actuel, Code FIDE, Nombre de parties prises en compte dans la période de classement, Année de naissance, Sexe et la valeur actuelle du coefficient K pour le joueur.\n- 6.1.3. La date de clôture des tournois prise en compte pour une liste est de 3 jours avant la date de publication de la liste, les tournois se terminant à cette date ou avant sont pris en compte pour le calcul du classement. Les manifestations officielles de la FIDE sont prises en compte pour le classement même si elles se terminent le dernier jour avant la date de publication du classement.\n- 6.1.4. Un classement pour un joueur ou une joueuse entrant dans la liste sera publié lorsqu'il sera basé sur au moins 5 parties jouées contre des adversaires classés. Il n'est pas nécessaire que ces parties proviennent d'un seul tournoi. Les résultats d'autres tournois joués lors de périodes de classement consécutives, d'au plus 26 mois, sont regroupés pour obtenir le classement initial. Celui-ci doit être d' au moins 1400."], "ground_truth": "une liste est de 3 jours avant la date de publication de la liste, les tournois se terminant à cette date ou avant sont pris en compte pour le calcul du classement."}
{"question": "Qu'est-ce que la procuration?", "answer": "", "contexts": ["## 8.5 Représentation  \nEn cas d'absence à tout ou partie d'une séance, un membre peut donner procuration à un collègue de son choix. Il ne peut être donné procuration pour une séance entière plus d'une fois par saison sportive. La procuration est établie par courrier électronique adressé au secrétaire général.  \nAucun mandataire ne peut être porteur de plus d'un pouvoir."], "ground_truth": "La procuration est établie par courrier électronique adressé au secrétaire général."}
{"question": "Qu'est-ce que le président?", "answer": "", "contexts": ["## 9.8.2 Composition  \nLe président est nommé par le comité directeur parmi les médecins pris en son sein.  \nDeux autres membres sont également désignés par le comité directeur, le président de la commission ayant toute latitude pour la compléter."], "ground_truth": "Le président est nommé par le comité directeur parmi les médecins pris en son sein."}
{"question": "Qu'est-ce que la rencontre?", "answer": "", "contexts": ["## 4. Conservation des documents  \nLa personne responsable de la rencontre est tenue de conserver les feuilles de parties et le ou les procès-verbaux au moins 6 mois. En cas de réclamations, elle devra le ou les transmettre à la direction de la compétition."], "ground_truth": "la rencontre est tenue de conserver les feuilles de parties et le ou les procès-verbaux au moins 6 mois."}
{"question": "Que doit-on faire selon l'article mentionné dans 2022_Reglement_medical_1908202?", "answer": "", "contexts": ["## ATTESTATION DE RÉPONSES NÉGATIVES AU QUESTIONNAIRE SANTÉ  \nEn application du règlement médical de la Fédération Française des Échecs, toute personne souhaitant se voir délivrer une licence (ou le représentant légal pour un mineur) doit attester avoir répondu « non » à l'ensemble des questions du Questionnaire Santé.  \nÀ défaut, elle doit produire un certificat médical de non-contre-indication à la pratique des Échecs en et hors compétition datant de moins de 6 mois."], "ground_truth": "À défaut, elle doit produire un certificat médical de non-contre-indication à la pratique des Échecs en et hors compétition datant de moins de 6 mois."}
{"question": "Quelle règle est énoncée à la page 12?", "answer": "", "contexts": ["## 8.5 Le secrétaire général  \nLe secrétaire général assure, sous l'autorité du président, le fonctionnement administratif officiel de la FFE. Il veille notamment au respect du calendrier administratif et assure la diffusion des informations aux ligues régionales, comités départementaux et membres affiliés.  \nIl établit les procès-verbaux des réunions du bureau fédéral, du comité directeur et des assemblées générales."], "ground_truth": "Il établit les procès-verbaux des réunions du bureau fédéral, du comité directeur et des assemblées générales."}
{"question": "Quelle règle est énoncée à la page 37?", "answer": "", "contexts": ["- 2.3. La position initiale des pièces sur l ' échiquier est la suivante :  \n<!-- image -->  \n<!-- image -->  \n- 2.4. Les huit alignements verticaux de cases sont appelés « colonnes ». Les huit alignements horizontaux de cases sont appelés « rangées ». Une ligne droite de cases de la même couleur, allant d ' un bord de l ' échiquier à un bord adjacent, est appelée « diagonale ».  \nLes échiquiers peuvent être fabriqués dans différents matériaux mais les cases doivent être contrastées : foncées (noire s ou marron) et claires (blanches ou crèmes). Il est utile qu'elles soient mates pour éviter les reflets qui perturberaient les joueurs et joueuses . La taille de l'échiquier doit correspondre aux dimensions des pièces ( voir plus de détail dans le manuel de la FIDE C02)."], "ground_truth": "Les huit alignements verticaux de cases sont appelés « colonnes »."}
{"question": "Quelle règle est énoncée à la page 62?", "answer": "", "contexts": ["- D.2.10.2. Annoncer les coups de chacun des deux adversaires\n- D.2.10.3. Mettre à jour la feuille de partie de la personne handicapée visuelle et appuyer sur sa pendule\n- D.2.10.4. Informer la personne handicapée visuelle, uniquement à sa demande, du nombre de coups achevés et du temps employé par chacun des deux adversaires\n- D.2.10.5. Revendiquer la victoire dans le cas où la limite de temps est dépassée et informer l'arbitre que l'adversaire voyant a touché l'une de ses pièces.\n- D.2.10.6. Remplir les formalités nécessaires au cas où la partie est ajournée\n- D.2.11. Si la personne handicapée visuelle ne fait pas usage d'un assistant ou d'une assistante, l'adversaire voyant peut en employer un/une qui remplit les tâches D.2.10.1 et D.2.10.2. Un assistant ou une assistante doit être employé dans le cas où la personne déficiente visuelle est appariée avec une personne malentendante.  \nIntroduction : Les directives suivantes sont là pour aider à l'organisation de compétitions où elles peuvent être nécessaires. Bien qu'elles ne fassent pas partie des règles du jeu d'échecs de la FIDE, il est fortement recommandé qu'elles soient utilisées dans toutes les compétitions où elles sont applicables."], "ground_truth": "Mettre à jour la feuille de partie de la personne handicapée visuelle et appuyer sur sa pendule\n- D.2.10.4."}
{"question": "Qu'est-ce que les cadences?", "answer": "", "contexts": ["## Tournoi A à cadence longue et compétitions fédérales à toutes les cadences, avec les possibilités suivantes :  \n- Tournoi FIDE : pour les cadences des tournois FIDE, se référer aux règles FIDE en vigueur. Les parties jouées dans ce type de tournoi comptent pour le classement Elo FIDE. Quand la FIDE impose une limite Elo selon la cadence de jeu, le tournoi doit explicitement être réservé aux joueurs et joueuses ne dépassant pas cette limite.\n- Tournoi FIDE à normes : pour les cadences des tournois FIDE avec possibilité d'obtenir des normes, se référer aux règles FIDE en vigueur. Les parties jouées dans ce type de tournoi comptent pour le classement Elo FIDE.\n- Compétitions Fédérales (cadence longue, rapide ou blitz) : les cadences sont celles spécifiées dans les règlements des compétitions, ainsi que le classement Elo à prendre en compte. Si aucune limite Elo n'est précisée, l'accès à la compétition est permis sans limitation selon le classement Elo, mais les parties non compatibles ne seront pas prises en compte par la FIDE.  \nToutes les phases des championnats de France scolaires, et le championnat individuel féminin de parties rapides, sont considérés comme des Tournois de type B."], "ground_truth": "les cadences sont celles spécifiées dans les règlements des compétitions, ainsi que le classement Elo à prendre en compte."}
{"question": "Qu'est-ce que les candidats?", "answer": "", "contexts": ["## 9.9.1 Élection  \nLes membres du comité d'éthique sont élus à bulletin secret au scrutin plurinominal à un tour, lors du troisième comité directeur qui se tient l'année des Jeux Olympiques d'hiver.  \nChaque membre du comité directeur dispose au plus d'autant de voix qu'il y a de postes à pourvoir. Il ne peut attribuer plus d'une voix par candidat.  \nSont déclarés élus les candidats ayant obtenu le plus de voix dans la limite du nombre de sièges à pourvoir. En cas d'égalité, le candidat le plus âgé est déclaré élu.  \nLorsque le nombre de candidatures est égal ou inférieur au nombre maximum de postes à pourvoir, les candidats sont automatiquement proclamés élus.  \nAprès l'élection des membres du comité d'éthique, le comité directeur nomme parmi ces derniers le Président."], "ground_truth": "les candidats sont automatiquement proclamés élus."}
{"question": "Qu'est-ce que la Cadence?", "answer": "", "contexts": ["## 7. Cadence  \nLa Cadence est de 1h00 + 30'' par coup pour les échiquiers de 1 à 3, et de 50' + 10'' par coup pour l'échiquier 4.  \n<!-- image -->"], "ground_truth": "La Cadence est de 1h00 + 30'' par coup pour les échiquiers de 1 à 3, et de 50' + 10'' par coup pour l'échiquier 4."}
{"question": "Quelle règle est énoncée à la page 129?", "answer": "", "contexts": ["- C.12 Minimiser le nombre de personnes qui sont flotteurs descendants deux rondes de suite.\n- C.13 Minimiser le nombre de personnes qui sont flotteurs montants deux rondes de suite.\n- C.14 Minimiser le nombre de personnes qui sont flotteurs descendants à la ronde n (en cours d'appariement) et à la ronde n-2\n- C.15 Minimiser le nombre de personnes qui sont flotteurs montants à la ronde n (en cours d'appariement) et à la ronde n-2\n- C.16 Minimiser la différence de score des personnes qui sont flotteurs descendants deux rondes de suite.\n- C.17 Minimiser la différence de score des personnes qui sont flotteurs montants deux rondes de suite.\n- C.18 Minimiser la différence de score des personnes qui sont flotteurs descendants à cette ronde et qui l'étaient déjà deux rondes auparavant.\n- C.19 Minimiser la différence de score des personnes qui sont flotteurs montant à cette ronde et qui l'étaient déjà deux rondes auparavant."], "ground_truth": "- C.13 Minimiser le nombre de personnes qui sont flotteurs montants deux rondes de suite."}
{"question": "Que se passe-t-il en cas de constatation d'une irrégularité?", "answer": "", "contexts": ["## 11.1 Fonctions  \nLa commission de surveillance des opérations électorales est chargée de contrôler la régularité des opérations de vote relatives à l'élection du comité directeur, du président et du bureau fédéral.  \nElle a compétence pour :  \n- -veiller à ce que les dispositions prévues par les statuts et le règlement intérieur concernant l'organisation et le déroulement de la campagne électorale et du scrutin soient respectées ;\n- -se prononcer sur la recevabilité des candidatures par une décision prise en premier et dernier ressort ;\n- -avoir accès à tout moment aux bureaux de vote, leur adresser tout conseil et former à leur intention toutes observations susceptibles de les rappeler au respect des dispositions statutaires ;\n- -se faire présenter tout document nécessaire à l'exercice de ses missions ;\n- -contrôler le dépouillement des votes et proclamer les résultats du scrutin ;\n- -exiger, en cas de constatation d'une irrégularité, l'inscription d'observations au procès-verbal, soit avant la proclamation des résultats, soit après cette proclamation."], "ground_truth": "en cas de constatation d'une irrégularité, l'inscription d'observations au procès-verbal, soit avant la proclamation des résultats, soit après cette proclamation."}
{"question": "Quelle règle est énoncée à la page 155?", "answer": "", "contexts": ["Exemple 3 : Dans un tournoi en 7 rondes, la joueuse Myra demande un bye à la ronde 5.  \nElle termine le tournoi à 4.5/7  \nA la ronde 5, on considère qu'elle a fait match nul avec un adversaire qui termine aussi à 4.5/7"], "ground_truth": "Elle termine le tournoi à 4.5/7  \nA la ronde 5, on considère qu'elle a fait match nul avec un adversaire qui termine aussi à 4.5/7"}
{"question": "Qu'est-ce que le il?", "answer": "", "contexts": ["## Rappel des abréviations utilisées :  \nADN : Avant-Dernier Niveau à apparier  \nD-SA : Différence de Score du niveau d'appariement  \nD-S : Différences de Score (voir « score »)  \nDNE : Dernier Niveau Effondré  \nM0 : est le nombre de flotteurs descendants issus du niveau précédent.  \nMaxPaires est le nombre maximum de paires qui peuvent être appariées dans le niveau étudié (Voir C.5)  \nM1 est le nombre maximum de flotteurs descendants issus du niveau précédent pouvant être appariés dans le niveau étudié (voir C.6).  \nNAN : Numéros d'Appariement du Niveau  \nAfin de permettre une meilleure compréhension des règles, certaines terminologies ont été définies plus précisément qu'elles ne l'étaient dans les versions précédentes des règles du jeu. Voici une liste réduite des terminologies et définitions. Il s'agit ici d'une traduction partielle du glossaire de la FIDE  \nAbsolu, critère : voir Critères  \nAppariement : les possibilités de paires pour un niveau ou pour une ronde entière (voir aussi appariement d'une ronde).  \nAcceptable : une paire qui est en conformité avec les critères absolus d'appariement.  \nNiveau : voir Niveau d'appariement  \nAchevé : u n appariement légal dans lequel tous les joueurs ont été appariés (à l'exception d'au plus un dans le cas d'un exempt)  \nCritère : voir Critères  \nI mpossible : s ituation dans laquelle il est impossible d'achever l'appariement"], "ground_truth": "le il est impossible d'achever l'appariement"}
{"question": "Qu'est-ce que une plainte?", "answer": "", "contexts": ["## Partie 2:Les règles du jeu  \nH.1 La FPL a le droit de procéder à des enquêtes préliminaires sur un cas présumé ou possible de triche en ligne.  \nH.2 Si une plainte est irrecevable ou manifestement infondée, la FPL peut la rejeter par un vote à la majorité.  \n- H.3 Un membre de la FPL (la Personne Enquêtrice -PE), nommé par la présidence de la FPL, sur la base d'un système d'alternance, est désigné pour enquêter sur la plainte. La Personne Enquêtrice est un organe indépendant et n'est soumise à aucune consigne de la part d'une autre partie.  \nH.4 La PE examine les preuves statistiques présentées. Elle prend également en considération les éléments physiques et les observations faites dans le cadre de l'enquête, le cas échéant. Elle peut également recueillir des preuves supplémentaires au cours de son enquête.  \n- H.5 Les joueurs et joueuses, les membres de l'organisation , les arbitres, les fédérations nationales, l'hôte de la plateforme de jeu en ligne en question ainsi que les autres parties prenantes sont tous tenus de coopérer avec la PE. Tout manquement à cette obligation peut entrainer la saisine de la CED.  \nH.6 La PE instruit chaque cas dans un délai raisonnable, généralement en moins de deux semaines."], "ground_truth": "une plainte est irrecevable ou manifestement infondée, la FPL peut la rejeter par un vote à la majorité."}
{"question": "Qu'est-ce que une disqualification?", "answer": "", "contexts": ["## 4.1. La CSD dispose de trois niveaux de sanction :  \n- a) L'avertissement écrit  \nPour les infractions mineures, un arbitre sanctionné par un avertissement écrit recevra une lettre officielle de la CSD, indiquant l'infraction et les mesures correctives attendues de la part de l'arbitre.  \nUn avertissement écrit reste valable pendant 12 mois.  \n- La non-application des mesures correctives attendues peut entraîner une sanction plus sévère.\n- b) Le blâme écrit  \nPour les infractions plus graves, un arbitre sanctionné par un blâme écrit recevra une lettre officielle de la DSC, indiquant l'infraction et les mesures correctives attendues de la part de l'arbitre.  \nUn blâme écrit reste valable pendant 24 mois.  \nLa non-application des mesures correctives attendues peut entraîner une sanction plus sévère.  \n- c) Disqualification  \nEn cas d'infraction grave, un arbitre peut être disqualifié pour une durée déterminée. Une disqualification signifie que l'arbitre n'est pas éligible pour être nommé ou désigné comme arbitre dans un événement homologué par la FIDE et/ou pour officier lors d'un tel événement.  \n- Pour une première infraction, la disqualification peut aller jusqu'à 18 mois.\n- En cas de récidive, la disqualification peut aller jusqu'à 24 mois."], "ground_truth": "Une disqualification signifie que l'arbitre n'est pas éligible pour être nommé ou désigné comme arbitre dans un événement homologué par la FIDE et/ou pour officier lors d'un tel événement."}
{"question": "Qu'est-ce que le officielle?", "answer": "", "contexts": ["12.5. L'OC garanti t une couverture médicale pour tous les participants et participantes, leurs représentants/représentantes, arbitres et officiels/officielles et les assure contre les accidents et la nécessité de services médicaux, y compris les médicaments, les opérations chirurgicales, etc., mais pas dans le cas de maladie chronique. L'équipe médicale officielle est nommée pour la durée de la compétition.  \n12.6. La même procédure que dans les articles 12.3), 12.4) et 12.5) sera suivie pour les tournois de type L2 et L3, en les adaptant si c'est nécessaire."], "ground_truth": "le officielle est nommée pour la durée de la compétition."}
{"question": "Quelle règle est énoncée à la page 124?", "answer": "", "contexts": ["3. Les personnes qui abandonnent le tournoi ne seront plus appariées.\n4. Les personnes ayant prévenu de leur absence lors de certaines rondes ne seront pas appariées pour ces rondes et ne marqueront aucun point (sauf si le règlement du tournoi en décide autrement).\n5. Seules les parties jouées comptent dans les situations où l'historique des couleurs est à prendre en compte.  \nPar exemple, les séquences suivantes :  \n- o NBN=B (partie non jouée à la 4 e ronde) sera considérée comme si elle avait été la suivante : =NBNB.\n- o BN=BN compterait comme =BNBN\n- o NBB=N=B comme ==NBBNB\n6. Deux joueurs appariés ensemble qui n'ont pas joué leur partie peuvent à nouveau être appariés ensemble à l'occasion d'une future ronde.\n7. Les résultats d'une ronde doivent être publiés à l'endroit prévu à cet effet et à l'heure annoncée par le planning du tournoi.\n8. Dans le cas où :\n- o Un résultat erroné a été enregistré\n- o Une partie a été jouée couleurs inversées\n- o Le classement Elo d'un joueu r/d'une joueuse doit être corrigé (et les numéros d'appariement probablement rectifiés cf. C.04.2.C.3)  \net que le joueur/la joueuse signale le fait à l'arbitre dans un certain délai après la publication des résultats, la nouvelle information sera prise en compte pour le classement et les appariements de la ronde suivante. Le délai en-deçà duquel la réclamation devra être effectuée doit être indiqué dans le règlement du tournoi."], "ground_truth": "Les personnes ayant prévenu de leur absence lors de certaines rondes ne seront pas appariées pour ces rondes et ne marqueront aucun point (sauf si le règlement du tournoi en décide autrement)."}
{"question": "Qu'est-ce que les couleurs?", "answer": "", "contexts": ["## 3.2 Couleurs  \nL'équipe première nommée dans les appariements des rencontres a les blancs sur les échiquiers impairs et les noirs sur les échiquiers pairs.  \nLors de la phase finale, le mieux classé lors de la première phase a les blancs sur les échiquiers impairs. Toutefois, si 2 équipes se sont déjà rencontrées lors de la première phase, alors les couleurs sont inversées pour la phase finale. Pour les parties Armageddon de la phase finale, le vainqueur du tirage au sort choisit sa couleur."], "ground_truth": "les couleurs sont inversées pour la phase finale."}
{"question": "Que se passe-t-il en cas de divergence entre ceux-ci et le règlement intérieur ou en cas de difficultés d'interprétation?", "answer": "", "contexts": ["## PRÉAMBULE  \nLe présent règlement intérieur est pris en application des statuts de la Fédération Française des Échecs (FFE). Il ne peut être modifié que par délibération de l'assemblée générale.  \nIl a pour objet, sous réserve de compatibilité avec les dispositions législatives et réglementaires, de préciser le fonctionnement interne de la FFE et d'arrêter les modalités nécessaires à la bonne exécution des statuts. En cas de divergence entre ceux-ci et le règlement intérieur ou en cas de difficultés d'interprétation, les statuts ont prééminence."], "ground_truth": "En cas de divergence entre ceux-ci et le règlement intérieur ou en cas de difficultés d'interprétation, les statuts ont prééminence."}
{"question": "Quelle obligation est énoncée à la page 4?", "answer": "", "contexts": ["## 3.1.2 Licenciés majeurs  \nPour les personnes majeures, en vue de l'obtention ou du renouvellement de la licence, le licencié renseigne un questionnaire relatif à son état de santé.  \nLe licencié atteste par écrit auprès de son club que chacune des rubriques du questionnaire donne lieu à une réponse négative. Afin de respecter le secret médical, le questionnaire de santé renseigné ne doit pas être remis au club ni à la fédération.  \nÀ défaut, il est tenu de produire un nouveau certificat médical attestant de l'absence de contreindication à la pratique du jeu d'échecs en et hors compétition datant de moins de six mois pour obtenir sa licence."], "ground_truth": "Afin de respecter le secret médical, le questionnaire de santé renseigné ne doit pas être remis au club ni à la fédération."}
{"question": "Quelle règle est énoncée à la page 227?", "answer": "", "contexts": ["## 3.2. Le Directeur National ou la Directrice Nationale de l'Arbitrage.  \n- Préside et organise les réunions de la Direction Nationale de l'Arbitrage .\n- Organise le travail au sein de la D.N.A, veille au bon fonctionnement de chacun des secteurs et prend toute disposition utile pour remédier aux éventuels dysfonctionnements.\n- Il s'assure que les missions des différents pôles et directions soient gérés par des membres de la D.N.A.\n- En fonction des objectifs, il peut décider de créer de nouvelles directions ayant en charge des missions spécifiques.\n- Est le garant du bon fonctionnement des structures de l'arbitrage, du respect de la Charte des Arbitres et des règlements fédéraux de la part du corps arbitral. Il en est responsable devant le Président et le Comité Directeur de la Fédération.\n- Est le contact avec la Commission des Arbitres de la F.I.D.E. (Arbiters Committee) ainsi qu'avec la Commission des Règles de la FIDE (Rules Committee)\n- Soumet au vote du Comité Directeur de la F.F.E les modifications de textes.\n- Nomme les superviseurs et superviseures, il effectue lui aussi des visites de supervision.\n- Diligente les visites de supervision.\n- Participe à la procédure de nomination des arbitres qui officient dans le cadre des grands événements fédéraux. (Voir Règlements Fédéraux en vigueur)\n- Peut constituer des groupes de travail ad hoc ou nommer des chargés de mission pour aider la D.N.A. dans ses projets.\n- Assure le suivi des mesures administratives de la D.N.A."], "ground_truth": "- Préside et organise les réunions de la Direction Nationale de l'Arbitrage ."}
{"question": "Qu'est-ce que la norme?", "answer": "", "contexts": ["- 1.4.2. Les parties suivantes ne sont pas incluses :\n- a) Contre des adversaires qui ne font pas partie d'une fédération de la FIDE. Les joueurs et joueuses avec le code de fédération « FIDE » sont acceptés mais ne sont pas comptés comme des adversaires étrangers. Le conseil de la FIDE peut modifier cette exigence à titre temporaire.\n- b) Contre des joueurs et joueuses non classés qui marquent zéro contre les joueurs et joueuses classés dans les tournois toutes rondes.\n- c) Conclues par forfait, adjudication ou tout autre moyen que le jeu sur l'échiquier. Les autres parties, dès lors qu'elles ont commencé, seront incluses. Dans le cas où l'adversaire déclare forfait à la dernière ronde, la norme est quand même prise en compte si le joueur/la joueuse avait juste la nécessité de jouer pour avoir le nombre de parties requis mais pouvait se permettre de perdre.\n- d) Les tournois dans lesquels des adaptations ont eu pour effet d'avantager un ou plusieurs joueurs ou joueuses (par exemple en modifiant le nombre de rondes, l'ordre des rondes ou en fournissant des adversaires particuliers qui ne participent que pour cette raison à l'événement)  \nLes formats suivants peuvent être utilisés pour les tournois à norme, qu'ils soient individuels ou par équipes. Système suisse Toute Rondes Toute Rondes Aller-retour Elimination directe  \nLes autres formats nécessitent l'approbation préalable de la présidence de la CH."], "ground_truth": "la norme est quand même prise en compte si le joueur/la joueuse avait juste la nécessité de jouer pour avoir le nombre de parties requis mais pouvait se permettre de perdre."}
{"question": "Quelle règle est énoncée à la page 36?", "answer": "", "contexts": ["## 0.1 INTRODUCTION  \nLes Règles du Jeu d'Échecs de la FIDE couvrent les parties se jouant sur l'échiquier.  \nLes Règles du jeu se divisent en deux parties : 1. Les règles fondamentales du Jeu et 2. Les règles du jeu en compétition.  \nLa version anglaise de ce texte est la version officielle des Règles du Jeu d'Échecs telle qu'adoptée par le 93 ème Congrès de la FIDE qui s'est tenu à Chennai (Inde). C es Règles du Jeu d'Échecs entrent en vigueur le 1er janvier 2023."], "ground_truth": "Les règles fondamentales du Jeu et 2."}
{"question": "Quelle règle est énoncée à la page 44?", "answer": "", "contexts": ["## Article 6 La pendule d'échecs  \n- 6.1. La 'pendule d'échecs' désigne une horloge munie de deux afficheurs, reliés entre eux de telle manière qu'un seul puisse fonctionner à la fois. Dans les Règles du Jeu d'Échecs, le terme 'pendule' désigne l'un des deux afficheurs. Chacun des afficheurs est m uni d'un 'drapeau'.\n- La 'chute du drapeau' signifie la fin du temps imparti à un joueur ou une joueuse.  \nCertaines pendules électroniques affichent le symbole « -» à la place d'un drapeau.  \n- 6.2. Manipulation de la pendule d'échecs :\n- 6.2.1. Pendant la partie, chaque joueur ou joueuse, après avoir joué son coup sur l'échiquier, arrête sa pendule et démarre celle de son adversaire (autrement dit, il/elle appuie sur sa pendule). Ceci 'achève' le coup. Un coup est également achevé si :\n- 6.2.1.1. le coup met fin à la partie (voir les Articles 5.1.1, 5.2.1, 5.2.2 et 9.6), ou\n- 6.2.1.2. l e joueur ou la joueuse a joué son prochain coup, alors que son coup précédent n'était pas achevé.  \nNormalement, lorsqu'un joueur ou une joueuse oublie d'appuyer sur sa pendule après avoir joué son coup, l'une des possibilités suivantes s'applique :"], "ground_truth": "Dans les Règles du Jeu d'Échecs, le terme 'pendule' désigne l'un des deux afficheurs."}
{"question": "Que se passe-t-il en cas de match nul lors de la phase finale?", "answer": "", "contexts": ["## 1.2 Déroulement de la compétition  \nLe championnat se joue par équipes de clubs. Un club ne peut engager plus de 2 équipes. S'il reste de s places à pourvoir à la fin de la procédure d'inscription, une nouvelle étape d'inscription sera ouverte sans limitation d'équipes par club.  \nLa compétition est organisée en deux phases :  \n- Première phase : en système suisse en 15 rondes,\n- Phase finale : Après la dernière ronde en système suisse, les 4 premières équipes des trois catégories (A, B, C), disputent une phase à élimination directe en demi-finales et finale pour déterminer les 4 premières places de leur catégorie. Un seul match est disputé dans chacune des rencontres, la première équipe rencontrant la quatrième tandis que la deuxième est appariée à la troisième. Les équipes gagnantes jouent la finale pour le titre tandis que les perdants disputent un match de classement pour la troisième place.\n- En cas de match nul lors de la phase finale, un des échiquiers du match est tiré au sort afin de disputer une partie unique en Armageddon. Les deux joueurs ayant joué sur l'échiquier concerné procèdent à un tirage au sort. Le vainqueur du tirage choisit sa couleur."], "ground_truth": "En cas de match nul lors de la phase finale, un des échiquiers du match est tiré au sort afin de disputer une partie unique en Armageddon."}
{"question": "Qu'est-ce que le papi?", "answer": "", "contexts": ["## TRAITEMENT DES TOURNOIS FERMES A NORMES  \nLes obligations de rapport technique à l'adresse de la direction des tournois et du DNA sont les mêmes. Il convient juste d'y ajouter la grille des résultats renumérotée selon le classement final.  \nL'arbitre est tenu de conserver dans ses archives personnelles une copie du rapport technique pendant 1 an à compter de la fin du tournoi.  \nL'arbitre enverra également un rapport au secrétariat fédéral à l'attention du directeur technique national.  \nDirecteur Technique National : Monsieur Jordi Lopez jordi.lopez@ffechecs.fr  \nCe rapport doit être envoyé dans les 7 jours qui suivent la fin du tournoi. Tout retard pourra être sanctionné par le biais d'une mesure disciplinaire prise par la DNA à l'encontre de l'arbitre.  \nCe rapport comprend les pièces suivantes :  \n- → Liste des participants en respectant l'orthographe des noms adoptée par la FIDE, notamment pour l'alphabet cyrillique, avec numéros d'identification FIDE, Elo international, fédérations (en employant le code FIDE, en trois lettres).\n- → Grille des résultats (renumérotée selon le classement final)\n- → Fichier pgn de l'ensemble des parties (Ce fichier pgn peut être transmis sur le site de la fédération via le module « administration de tournois » où la boule papi est déposée - http://admin.echecs.asso.fr/ ).\n- → Attestations de normes, le cas échéant (formulaires FIDE) :"], "ground_truth": "le papi est déposée - http://admin."}
{"question": "Qu'est-ce que les informations?", "answer": "", "contexts": ["## 1.8. Certificats de tournoi pour les titres  \nL'Arbitre Principal doit préparer et signer un certificat de résultats obtenus pour les titres et l'envoyer au responsable du classement de la fédération organisatrice. Le/La responsable du classement ou le président/la présidente, après s'être assuré que toutes les informations sont correctes, contresignera le certificat au nom de la fédération organisatrice et fera parvenir une copie dûment signée à la fédération du joueur, au bureau de la FIDE et à l'arbitre en chef."], "ground_truth": "les informations sont correctes, contresignera le certificat au nom de la fédération organisatrice et fera parvenir une copie dûment signée à la fédération du joueur, au bureau de la FIDE et à l'arbitre en chef."}
{"question": "Qu'est-ce que le VI?", "answer": "", "contexts": ["## 1.1 Structure  \nLe championnat par équipes de Nationale VI est organisé chaque saison sous la responsabilité du C.D.J.E 13  \nLes championnats par équipes organisés chaque saison sous la responsabilité des Comités Départementaux, selon des procédures approuvées par la Ligue, est :  \nLa Nationale VI (ou Départementale), composé d'un ou plusieurs groupes d'équipes de 4 joueurs. Au moins une équipe par département a le droit d'accéder à la Nationale V (ou Régionale) à l'issue de chaque saison. Le nombre d'équipes promues par département est établi en fonction du nombre de licenciés de chaque département."], "ground_truth": "le VI est organisé chaque saison sous la responsabilité du C."}
{"question": "Quelle règle est énoncée à la page 136?", "answer": "", "contexts": ["## Remarques :  \n- Lors de la ronde 4 et de la ronde 8, Jema Pari est déclaré sans adversaire et sans couleur car il n'a pas joué. Lors de ces deux rondes il est obligatoirement déclaré flotteur descendant.\n- Jema Pari est apparié une seconde fois contre « Adversaire 4 » à la ronde 6 car au final il ne l'avait pas encore affronté.\n- Pour des appariements manuels, il sera pertinent de rajouter une colonne pour la préférence couleur ainsi qu'une colonne pour le score ajusté des adversaires dans le cadre du calcul du départage."], "ground_truth": "- Jema Pari est apparié une seconde fois contre « Adversaire 4 » à la ronde 6 car au final il ne l'avait pas encore affronté."}
{"question": "Qu'est-ce que le représentent?", "answer": "", "contexts": ["## ARTICLE 14 - DEROULEMENT DE L'AUDIENCE  \nLorsque l'affaire est dispensée d'instruction, le président de séance de l'organe disciplinaire ou la personne qu'il désigne expose les faits et le déroulement de la procédure.  \nDans les autres cas, la personne chargée de l'instruction présente oralement son rapport ou délègue cette tâche au président de séance ou à la personne que ce dernier désigne.  \nToute personne dont l'audition paraît utile peut être entendue par l'organe disciplinaire. Si une telle audition est décidée, le président en informe la personne poursuivie avant la séance.  \nLa personne poursuivie et, le cas échéant, son représentant légal ainsi que la ou les personnes qui l'assistent ou le représentent sont invités à prendre la parole en dernier."], "ground_truth": "le représentent sont invités à prendre la parole en dernier."}
{"question": "Que se passe-t-il en cas de suspicion de tricherie est définitive. Toutefois?", "answer": "", "contexts": ["A.12 Le règlement de la compétition peut prévoir que la décision de l'arbitre en chef ou d'un groupe d'expertise, désigné à cet effet, sur la perte d'une partie ou sur l'exclusion de la compétition en cas de suspicion de tricherie est définitive. Toutefois, cela ne porte pas préjudice au droit de la personne concernée de faire appel si des sanctions plus importantes lui sont infligées.  \nA.13 La FPL peut créer une sous-commission ou un groupe de travail dédié uniquement aux échecs en ligne.  \nA.14 Le règlement de la compétition ne peut pas prévoir que toutes les questions de Fair-Play pour la compétition relèvent de la seule responsabilité de la plateforme de jeu."], "ground_truth": "en cas de suspicion de tricherie est définitive. Toutefois, cela ne porte pas préjudice au droit de la personne concernée de faire appel si des sanctions plus importantes lui sont infligées."}
{"question": "Que se passe-t-il en cas de réclamations?", "answer": "", "contexts": ["## 3.10. Procès-verbal de rencontre  \nDès la fin du match, l'arbitre établit un procès-verbal feuille de match, comportant le nom des membres de l'équipe , leur code fédéral, leur Elo, les résultats des parties et du match.  \nLe procès-verbal est signé par les capitaines ainsi que par l'arbitre.  \nLa ou le responsable de la rencontre doit garder le ou les procès-verbaux 6 mois, comme pour les feuilles de parties. En cas de réclamations, il devra le ou les transmettre à la direction de groupe. Les éventuelles réclamations, attestations, etc., sont expédiées au tarif \"lettre\" par le responsable de la rencontre à la direction de groupe, au plus tard le surlendemain du jour du match. Le non-respect de cette obligation entraînera, en cas de récidive, une demande de sanction envers le responsable de la rencontre."], "ground_truth": "En cas de réclamations, il devra le ou les transmettre à la direction de groupe."}
{"question": "Quelle règle est énoncée à la page 94?", "answer": "", "contexts": ["## ANNEXE I. Règles de fair-play de la FIDE pour les tournois en ligne avec supervision  \nLes règles suivantes concernent les échecs en ligne. Elles s'appliquent à toutes les compétitions officielles de la FIDE. Pour les compétitions nationales et les tournois privés, il est fortement recommandé d'adopter ces règles, adaptées le cas échéant."], "ground_truth": "Elles s'appliquent à toutes les compétitions officielles de la FIDE."}
{"question": "Qu'est-ce que les résultats?", "answer": "", "contexts": ["## Avantages des tournois homologués  \nUne promotion de l'événement sera incluse dans l'annonce officielle des tournois de la FFE (communiqués, ...). La FFE fournit gratuitement aux organisateurs de tournois homologués un logiciel d'appariements et de gestion des résultats. Les tournois homologués entrent dans le cadre de l'assurance souscrite par la FFE sur le plan national.  \nAprès réception du rapport technique de l'arbitre, les résultats sont traités par l'instance concernée (Elo FIDE, Elo Rapide FIDE ou national, Blitz...).  \nLa FFE veille à la formation des arbitres et effectue le contrôle de leur travail pour chaque tournoi."], "ground_truth": "les résultats sont traités par l'instance concernée (Elo FIDE, Elo Rapide FIDE ou national, Blitz."}
{"question": "Qu'est-ce que les assistantes?", "answer": "", "contexts": ["## ANNEXE III. Règles pour les personnes aveugles, handicapées visuelles pour les Compétitions Hybrides  \n1. Il est recommandé à l'équipe d'organisation locale de fournir une assistance aux personnes aveugles/handicapées visuelle s. Les missions de l'assistan ce sont :\n2. 1.1. Jouer en ligne les coups annoncés par son joueur/sa joueuse.\n3. 1.2. Annoncer les coups de l'adversaire.\n4. 1.3. Informer les personnes aveugles/handicapées visuelles seulement à leur demande du temps restant sur les pendules.\n5. 1.4. Informer les joueurs et joueuses des propositions de nulle de leurs adversaires, et faire les propositions de nulle qui lui ont été communiquées par son joueur ou sa joueuse.\n6. 1.5. Aucune autre communication entre l'assistan ce et les joueurs/joueuses n'est permise.\n7. 1.6. Les assistants et les assistantes sont supervisés par l'Arbitre en Chef, l'Arbitre en Chef Local et les autres arbitres.\n2. Toutes les autres règles s'appliquent en prolongeant le champ d'application de ces règles aux actions des personnes qui assistent les joueurs et joueuses."], "ground_truth": "les assistantes sont supervisés par l'Arbitre en Chef, l'Arbitre en Chef Local et les autres arbitres."}
{"question": "Quelle règle est énoncée à la page 208?", "answer": "", "contexts": ["- a) Un minimum de 4 échiquiers par équipes.\n- b) Un minimum de 10 équipes (6 en cas de toutes rondes aller-retour).\n- c) Au moins 60% des joueurs possédant un classement FIDE.\n- 4.9.3. Avoir été arbitre dans un tournoi d'échecs homologué pour le classement FIDE s'étant déroulé au format hybride, du niveau d'une norme d'AI classique et approuvée par la commission des arbitres de la FIDE.\n- 4.9.4. Avoir été arbitre de match durant une Olympiade.\n- 4.9.5. Posséder le titre d'Arbitre International dans une des fédérations IBCA, ICSC, IPCA est équivalent à une norme d'AI.\n- 4.10. Les normes obtenues en conformité avec les articles 4.8 et 4.9 doivent inclure des tournois avec au moins neuf (9) rondes.  \n4.10.1. Un(1) seul événement avec sept (7) ou huit (8) rondes pourra être accepté.  \n- 4.11. Le titre d'Arbitre International ne peut être décerné qu'à des candidats ayant déjà obtenu le titre d'Arbitre FIDE.\n- 4.12. Toutes les normes pour le titre d'AI doivent être différentes des normes déjà utilisées pour le titre d'AF et doivent avoir été réalisées après l'obtention du titre d'AF.\n- 4.13. Les normes soumises devront être signées par l'arbitre en chef.\n- 4.13.1. Elles ne pourront pas toutes être signées par le même arbitre en chef."], "ground_truth": "- b) Un minimum de 10 équipes (6 en cas de toutes rondes aller-retour)."}
{"question": "Qu'est-ce que une Norme?", "answer": "", "contexts": ["## Homologation des Tournois  \nAfin de permettre une transmission dans les délais indiqués par les règlements de la FIDE, les demandes d'homologation devront respecter les délais suivants :  \n- Pour les Tournois comptant uniquement pour le elo rapide FFE : 10 jours avant le début du tournoi\n- Pour les Tournois FIDE : 15 jours avant le début du tournoi  \nDepuis le 1 er janvier 2024 : Ce délai est augmenté à un mois si vous prévoyez d'accueillir de très forts joueurs et joueuses (Mixtes&gt;2700 ou Femme&gt;2500)  \n- Pour les Tournois FIDE où obtenir une Norme est possible : 40 jours avant le début du tournoi.  \nSi votre demande est hors délais le serveur le signale et demande de cocher une case \"demande en retard\". La demande sera alors prise en compte mais rien ne garantit qu'elle soit acceptée et les droits d'homologation fixes seront doublés.  \nToute demande d'homologation entraîne l'obligation pour le club organisateur de régler la partie fixe des droits d'homologation même si le tournoi est annulé.  \nPartie 5:Mission administrative et arbitrage  \nAttention : S'il est prévu d'attribuer des normes d'arbitres FIDE/Internationaux sur le tournoi, les noms des arbitres concernés doivent absolument être communiqués à la FIDE lors de l'homologation par le biais d'Erick Mouret : erick.mouret@echecs.asso.fr"], "ground_truth": "une Norme est possible : 40 jours avant le début du tournoi."}
{"question": "Quelle est l'obligation de l'organisateur?", "answer": "", "contexts": ["## 1) PRINCIPES GÉNÉRAUX  \n- Les principes de ce barème ont été votés par le comité directeur de la F.F.E de juin 2024.\n- U n événement doit respecter le minimum d'un ou d'une arbitre titré par tranche de 100 joueurs.\n- L'arbitre en chef peut négocier un nombre d'arbitres plus confortable avec l'équipe d'organisation.\n- L'indemnité d'arbitrage est calculée de manière journalière, elle est comprise entre 50 € (plancher) et 100 € (plafond) par jour.\n- Le montant précis est négocié avec l'organisateur suivant les règles établies dans ce chapitre du livre de l'arbitre.\n- Les arbitres stagiaires n'ayant pas de titre ne perçoivent aucune indemnité, mais ont le droit aux frais d'hébergement. L'organisateur n'est pas tenu de leur verser des frais de déplacements.\n- Dès lors qu'un tournoi est homologué, l'organisateur est tenu de faire appel à des arbitres fédéraux ayant au moins le titre minimal requis (voir règlements fédéraux : tournois homologués). L'indemnisation de l'arbitre est obligatoire et doit nécessairement figurer dans le budget de l'événement. Si un /une arbitre fait don d'une somme correspondant partiellement ou totalement au montant de l'indemnité due, cette opération apparaît à la fois en dépenses (ligne budgétaire « arbitrage ») et en recettes (don).\n- Le paiement de l'indemnité s'effectue avant le début de la dernière ronde. Une fiche d'indemnisation, signée par l'arbitre et par l'organisateur, est établie en double exemplaire."], "ground_truth": "l'organisateur est tenu de faire appel à des arbitres fédéraux ayant au moins le titre minimal requis (voir règlements fédéraux : tournois homologués)."}
{"question": "Qu'est-ce que le questionnaire?", "answer": "", "contexts": ["## QUESTIONNAIRE RELATIF À L'ÉTAT DE SANTÉ DU JOUEUR MINEUR EN VUE DE L'OBTENTION OU DU RENOUVELLEMENT DE LICENCE  \nAvertissement à destination des parents ou de la personne ayant l'autorité parentale: Il est préférable que ce questionnaire soit complété par votre enfant, c'est à vous d'estimer à quel âge il est capable de le faire. Il est de votre responsabilité de vous assurer que le questionnaire est correctement complété et de suivre les instructions en fonction des réponses données.  \nFaire du sport: c'est recommandé pour tous. En as-tu parlé avec un médecin? T'a-t-il examiné(e) pour te conseiller? Ce questionnaire n'est pas un contrôle. Tu réponds par OUI ou par NON, mais il n'y a pas de bonnes ou de mauvaises réponses. Tu peux regarder ton carnet de santé et demander à tes parents de t'aider.  \nNom : ......................................  \nPrénom : .............................  \nDate de naissance : ......................  \n- [ ] Tu es une fille □  \n- [ ] un garçon □  \nTon âge:  \n..............  \nans  \n| Depuis l'année dernière | OUI | NON |\n|---------------------------------------------------------------------------------------------------------------------------------------------------------------------------------------------------------------------|-------|-------|\n| Es-tu allé(e) à l'hôpital pendant toute une journée ou plusieurs jours ? | | |\n| As-tu été opéré(e) ? | | |\n| As-tu beaucoup plus grandi que les autres années ? | | |\n| As-tu beaucoup maigri ou grossi ? | | |"], "ground_truth": "le questionnaire est correctement complété et de suivre les instructions en fonction des réponses données."}
{"question": "Que se passe-t-il en cas de doute?", "answer": "", "contexts": ["## Glossaire  \nLes règles du jeu officielles restent les règles diffusées par la FIDE en anglais. En cas de doute, sur une traduction ou une interprétation, les arbitres sont priés de s'y référer. Laws of Chess 2023  \nDans la partie « approfondissement » du site internet de la DNA, nous mettons à votre disposition les règles traduites sans les commentaires ainsi qu'un document permettant la comparaison des règles en français et en anglais."], "ground_truth": "En cas de doute, sur une traduction ou une interprétation, les arbitres sont priés de s'y référer."}
{"question": "Que doit-on faire selon l'article mentionné dans F02_2025_26_Championnat_indivi?", "answer": "", "contexts": ["## 2.2. Arbitrage  \nLors de la phase zone interdépartementale, l'arbitre fédéral doit avoir l'agrément de la Direction Régionale de l'Arbitrage et au minimum le titre d'Open 1.  \nLa Direction de la compétition, après avis de la Direction Nationale de l'Arbitrage, désigne l'arbitre fédéral pour la phase finale. L'arbitre doit avoir au minimum le titre d'Open 1.  \nL'arbitre officiant valide et saisit les résultats sur le site fédéral, puis transmet les résultats du tournoi à la Direction de la compétition."], "ground_truth": "Arbitrage  \nLors de la phase zone interdépartementale, l'arbitre fédéral doit avoir l'agrément de la Direction Régionale de l'Arbitrage et au minimum le titre d'Open 1."}
{"question": "Quelle règle est énoncée à la page 90?", "answer": "", "contexts": ["- 10.9.7. une amende définie à l'avance ;\n- 10.9.8. l'exclusion pour une ou plusieurs rondes ;\n- 10.9.9. l'ex clusion de la compétition."], "ground_truth": "l'exclusion pour une ou plusieurs rondes ;\n- 10.9.9."}
{"question": "Quelle règle est énoncée à la page 156?", "answer": "", "contexts": ["## Exemples pour un open en 7 rondes :  \n| Arthur | 1890 | 4.5 pts | Inès | 1,5 pt | 1500 |\n|----------|-----------------|-----------|--------|----------|-----------------|\n| Bertrand | Sans Classement | 4.5 pts | Jules | 1,5 pt | 1400 |\n| Cécile | Sans Classement | 4 pts | Simon | 1 pt | Sans Classement |\n| Damien | Sans Classement | 4 pts | | | |\n| Emma | Sans Classement | 4 pts | | | |\n| Farid | 1650 | 3 pts | | | |\n| Germain | 1410 | 3 pts | | | |\n| Hortense | Sans Classement | 3 pts | | | |  \n- Bertrand est dans le même niveau de points qu'Arthur dont le Classement Elo est 1890.  \nOn lui attribue donc un classement Fictif de 1890 pour les calculs de départages.  \n- Hortense est dans le même niveau de Points que Farid et Germain,  \nLa moyenne de leurs Elo est (1650+1410) ÷2 = 1530  \nOn attribue donc à Hortense un classement fictif de 1530 pour les calculs de départages.  \n- Simon est seul dans son niveau à 1 pt (réussite d'environ 14%, Malus de x=-309)"], "ground_truth": "- Hortense est dans le même niveau de Points que Farid et Germain,  \nLa moyenne de leurs Elo est (1650+1410) ÷2 = 1530  \nOn attribue donc à Hortense un classement fictif de 1530 pour les calculs de départages."}
{"question": "Que se passe-t-il en cas de partage des voix?", "answer": "", "contexts": ["## 8.3 Modalités de réunion  \nLe bureau fédéral se réunit en présentiel ou par visioconférence au moins une fois tous les deux mois, et peut être convoqué à tout moment et sans formalité particulière par le président.  \nLa présence d'au moins 5 membres, hormis les représentants des sportifs de haut niveau, est requise pour la validité de ses délibérations. Les décisions sont prises à la majorité, en cas de partage des voix, celle du président est prépondérante. Les votes par procuration ne sont pas admis.  \nSur autorisation du président, le DTN et toute autre personne peuvent assister aux séances avec voix consultative."], "ground_truth": "en cas de partage des voix, celle du président est prépondérante."}
{"question": "Qu'est-ce que le audition?", "answer": "", "contexts": ["## ARTICLE 14 - DEROULEMENT DE L'AUDIENCE  \nLorsque l'affaire est dispensée d'instruction, le président de séance de l'organe disciplinaire ou la personne qu'il désigne expose les faits et le déroulement de la procédure.  \nDans les autres cas, la personne chargée de l'instruction présente oralement son rapport ou délègue cette tâche au président de séance ou à la personne que ce dernier désigne.  \nToute personne dont l'audition paraît utile peut être entendue par l'organe disciplinaire. Si une telle audition est décidée, le président en informe la personne poursuivie avant la séance.  \nLa personne poursuivie et, le cas échéant, son représentant légal ainsi que la ou les personnes qui l'assistent ou le représentent sont invités à prendre la parole en dernier."], "ground_truth": "le audition est décidée, le président en informe la personne poursuivie avant la séance."}
{"question": "Qu'est-ce que un arbitre?", "answer": "", "contexts": ["## 2.4 Responsable de rencontre  \nLe responsable de la rencontre, est chargé de préparer matériellement la salle de jeu et de veiller au bon déroulement du match, est le club recevant ou le club accueillant.  \nIl vérifie les feuilles de matchs, contrôle la situation des joueurs, procède aux redressements nécessaires, établit le récapitulatif des résultats de toutes les parties et les classements provisoires puis transmet ces documents accompagnés, le cas échéant, de ses observations au directeur du groupe dans les plus brefs délais. Néanmoins si un arbitre est présent il est prioritaire pour veiller au bon déroulement du match."], "ground_truth": "un arbitre est présent il est prioritaire pour veiller au bon déroulement du match."}
{"question": "Qu'est-ce que les absences?", "answer": "", "contexts": ["| Score | 0,5 | 0 | 0,5 | 0 | 0 | 1 | 2 |\n| Score Ajusté | 0,5 | 0 | 0,5 | 0,5 | 0,5 | 1 | 2 |  \nChapitre 4.2 :Les systèmes de départages  \n- MINH a eu un parcours « normal », son score ajusté est égal à son score normal.\n- LOIC a marqué deux points sur l'échiquier, mais il a perdu deux rondes sans jouer. Pour le score ajusté , celle de la ronde 1 est comptée « 0 » car il y a des parties derrières où il est apparié. La ronde 5 est comptée 0.5 car il n'y a plus de ronde où il est disponible derrière (Attention c'est important de préciser que c'est une absence prévenue).\n- INES a marqué 1 pt sur l'échiquier, elle a gagné deux rondes sans jouer. Pour son score ajusté ces deux rondes sont considérées comme des victoires.\n- LUDO a demandé un bye à la ronde 3 et n'est pas venu aux rondes 4 et 5. Les absences sont prévenues et il n'a plus de ronde où il est disponible à partir de la ronde 3. Ces trois rondes sont considérées comme des matchs nuls pour le score ajusté.  \n14.5. Score ajusté de type direct : Si la personne dont on calcule le départage a des rondes non jouées. On considère qu'à chacune de ces rondes, elle a affronté un adversaire fictif tel que:  \n- o A la fin du tournoi , l'adversaire fictif aura le même score que la personne étudiée,"], "ground_truth": "Les absences sont prévenues et il n'a plus de ronde où il est disponible à partir de la ronde 3."}
{"question": "Quelle règle est énoncée à la page 212?", "answer": "", "contexts": ["## 4.2.1. Contenu du stage de formation continue  \nLes sujets suivants sont traités dans le stage de formation continue :  \n- a) Les derniers règlements de l'arbitrage, les Règles, la Qualification, les Appariements, le Fair -Play et les Commissions Techniques.\n- b) Questions et réponses des participants\n- c) En option : familiarisation avec les équipements modernes liés au jeu d'échecs (incluant les pendules d'échecs, les échiquiers électroniques et les dispositifs anti -triche)"], "ground_truth": "- b) Questions et réponses des participants\n- c) En option : familiarisation avec les équipements modernes liés au jeu d'échecs (incluant les pendules d'échecs, les échiquiers électroniques et les dispositifs anti -triche)"}
{"question": "Quelle obligation est énoncée à la page 80?", "answer": "", "contexts": ["- 5.4.3.10. Les pendules doivent disposer d'un bref manuel d'utilisation.\n- 5.4.3.11. Toute cadence officielle doit être mentionnée dans les procédures de test des pendules.\n- 5.4.3.12. Les pendules d'échecs électroniques utilisées pour les événement s de la FIDE doivent être approuvées par la commission technique de la FIDE.\n- 5.5. Les pendules électroniques approuvées par la FIDE sont les suivantes :\n- 5.5.1. DGT XL (année 2007)\n- 5.5.2. DGT 2010 (année 2010)\n- 5.5.3. Silver Timer (année 2007)\n- 5.5.4. Sistemco (année 2009)\n- 5.5.5. DGT 3000 (année 2014)\n- 5.5.6. CE classic clock (2017) et CE premium clock (2017)\n- 5.5.7. LEAP clock KK 9908 (2017) et la Leap Clock model KK 9909 (2024)  \nNote : Il est rappelé que pour les autres compétitions, si un modèle de pendules n'est pas approuvé par la FIDE, il appartient à l'arbitre d'indiquer s'il accepte ce modèle ou non."], "ground_truth": "Toute cadence officielle doit être mentionnée dans les procédures de test des pendules."}
{"question": "Quelle règle est énoncée à la page 80?", "answer": "", "contexts": ["## 6. Feuilles de Notation  \n6.1. Pour les compétitions sous l'égide de l'EVE et de la GSC, des feuilles de score papier ou des feuilles de score électroniques conformes à la FIDE peuvent être utilisées.  \n- 6.2. Les feuilles de score papier doivent permettre de noter :\n- 6.2.1. Le nom de la compétition.\n- 6.2.2. Le numéro de la ronde.\n- 6.2.3. Le numéro de l'échiquier.\n- 6.2.4. La date de la ronde.\n- 6.2.5. Le nom du joueur ayant les blancs.\n- 6.2.6. Le nom du joueur ayant les noirs.\n- 6.2.7. Le résultat de la partie.\n- 6.2.8. Les signatures des deux joueurs et de l'arbitre.\n- 6.2.9. Zone permettant d 'enregistrer les coups des blancs et des noirs et indiquant le nombre de coups effectués."], "ground_truth": "Les feuilles de score papier doivent permettre de noter :\n- 6.2.1."}
{"question": "Qu'est-ce que les autres?", "answer": "", "contexts": ["## Communication et transparence  \n6.31. Les joueurs et officiels ont les devoirs suivants :  \n- S'assurer que toutes les déclarations et autres formes de communication au sujet d'autrui sont factuelles et/ou ne sont pas délibérément blessantes, y compris toutes les formes de médias sociaux.\n- S'assurer que les joueurs, les entraîneurs, les officiels et les autres sont correctement informés et disposent d'informations précises pour prendre des décisions.\n- S'abstenir de toute critique négative publique des bénévoles, entraîneurs, officiels et autres personnes impliquées dans une activité échiquéenne. Signaler les difficultés ou les préoccupations de manière appropriée.\n- Lorsqu'il s'agit de donner un rappel à l'ordre à un participant, être honnête, mais positif et assurer une approche factuelle et constructive qui permet la remise en question personnelle de ce participant."], "ground_truth": "les autres sont correctement informés et disposent d'informations précises pour prendre des décisions."}
{"question": "Quelle règle est énoncée à la page 157?", "answer": "", "contexts": ["## Prix attribués à la place (par départage)  \nCe système est le plus simple, un classement précis est donné par le nombre de points obtenu par chaque joueur et joueuse et l'aide d'un système de départage bien choisi.  \n| | Prix annoncé | Joueur | Points | Départage |\n|-------|----------------|----------|----------|-------------|\n| 1 er | 1000 € | Arthur | 6 pts | 29 |\n| 2 ème | 700 € | Bertrand | 6 pts | 27 |\n| 3 ème | 500 € | Cécile | 5,5 pts | 27 |\n| 4 ème | 400 € | Damien | 5,5 pts | 24 |\n| 5 ème | 200 € | Emma | 5 pts | 25 |\n| 6 ème | 100 € | Farid | 5 pts | 21 |\n| 7 ème | 0 € | Germain | 5 pts | 20 |\n| 8 ème | 0 € | Hortense | 5 pts | 16 |  \nDans ce système il suffit d'attribuer à chacun le prix correspondant à la place à laquelle il a terminé. Arthur obtient 1000 €, Bertrand obtient 700 €, Cécile obtient 500 €, ..."], "ground_truth": "Arthur obtient 1000 €, Bertrand obtient 700 €, Cécile obtient 500 €, ..."}
{"question": "Qu'est-ce que les visites?", "answer": "", "contexts": ["## 4.1.2. Visite et rapport de supervision  \nTous les arbitres pourront être visités par les superviseurs. Aucun arbitre ne peut refuser d'être supervisé.  \nLes visites sont diligentées par la D.N.A. En ce cas, les frais de déplacements sont pris en charge par la F.F.E.  \nLa visite de supervision peut être demandée par l'arbitre supervisé, dans le cadre de son cursus, via la Direction Régionale de l'Arbitrage. Les visites peuvent aussi être directement diligentées par une Direction Régionale de l 'Arbitrage (sur le territoire de sa ligue exclusivement).  \nDans ces deux cas, les frais de déplacements sont alors pris en charge par la Ligue concernée.  \nTout superviseur ou superviseure peut prendre l'initiative de superviser un arbitre même si aucune visite n'a été diligentée."], "ground_truth": "Les visites sont diligentées par la D."}
{"question": "Quelle règle est énoncée à la page 85?", "answer": "", "contexts": ["## Chapitre 2.4 : Règles du jeu en ligne  \nIntroduction Partie I : Règles du Jeu fondamentales Partie II : Règles du Jeu en ligne Partie III : Règles pour les compétitions en ligne Partie III a) : Règles pour les compétitions en ligne avec supervision Partie III b) : Règlements pour des Compétitions d'échecs Hybrides ANNEXE I. Règles de fair-play de la FIDE pour les tournois en ligne avec supervision ANNEXE II. Règles applicables aux personnes aveugles, handicapées visuelles ou à mobilité réduite pour les compétitions en ligne avec supervision ANNEXE III. Règles pour les personnes aveugles, handicapées visuelles pour les Compétitions Hybrides  \nGlossaire des Termes dans les Règles du Jeu d'Échecs en ligne  \nRègles du jeu en ligne approuvées par la FIDE"], "ground_truth": "Règles applicables aux personnes aveugles, handicapées visuelles ou à mobilité réduite pour les compétitions en ligne avec supervision ANNEXE III."}
{"question": "Qu'est-ce que une enquête?", "answer": "", "contexts": ["## I. Procédure  \n- I.1 Le délai de prescription est d'un an à compter de la dernière ronde de la compétition en ligne en question.\n- I.2 La langue officielle de travail de la PE est l'anglais. La PE peut, à la demande d'une des parties, autoriser l'emploi d'une langue autre que l'anglais par les parties concernées. Dans ce cas, la PE peut ordonner à l'un ou l'autre ou à tous les requérants de prendre en charge tout ou partie des frais de traduction et d'interprétation. La PE peut ordonner que tous les documents soumis dans des langues autres que l'anglais soient déposés avec une traduction certifiée dans la langue de la procédure.\n- I.3 Lorsque la PE ne rejette pas une affaire, la personne accusée doit être informée par écrit (par lettre, par courrier électronique ou tout autre moyen) de l'affaire en cours et de son droit de présenter à la PE toute déclaration et tout document en appui de sa défense.\n- I.4 La partie plaignante et la personne accusée ont le droit d'être représentées ou assistées par des personnes de leur choix.\n- I.5 Les documents relatifs à la procédure doivent être présentés par écrit, de préférence par courrier électronique.\n- I.6 Chaque partie impliquée dans une enquête est responsable de ses propres frais, directement ou indirectement liés à l'affaire.\n- I.7 Lorsqu'une personne soumise à la juridiction disciplinaire d'une autre commission de la FIDE est partie prenante à une enquête, la FPL peut fournir toute information appropriée à cette commission de la FIDE."], "ground_truth": "une enquête est responsable de ses propres frais, directement ou indirectement liés à l'affaire."}
{"question": "Qu'est-ce que un joueur?", "answer": "", "contexts": ["## 0. Introduction  \n- 0.1. La réglementation qui suit pourra être modifiée par le conseil de la FIDE sur recommandation de la Commission d'Homologation (CH -Qualification Commission). En ce qui concerne les tournois, les changements s'appliquent uniquement à ceux débutant le jour de leur entrée en vigueur, ou ceux qui auront lieu ultérieurement.\n- 0.2. Les tournois à prendre en compte pour le classement devront être préenregistrés par la fédération hôte qui sera responsable de la transmission des résultats et des droits d'homologation. Le conseil peut également accorder ce droit et cette responsabilité aux organisations affiliées représentant un territoire autonome ne relevant pas de plus d'une fédération.  \nLe tournoi et son calendrier devront être homologués :  \n- 0.2.1. Au plus tard 30 jours avant le début du tournoi, si le classement d'un joueur est supérieur à 2700 ou si le classement d'une joueuse est supérieur à 2500.\n- 0.2.2. Trois jours avant le début du tournoi dans les autres cas.  \nLa présidence de la CH peut refuser d'homologuer un tournoi.  \nDes tournois peuvent exceptionnellement être homologués malgré le dépassement du délai de préavis :  \n- 0.2.3. Tournois de la catégorie 0.2.1 : Avec l'accord de la présidence de la FIDE.\n- 0.2.4. Tournois de la catégorie 0.2.2 : Avec l'accord de la présidence de la CH  \nTous les tournois se déroulant dans des conditions hybrides telles que décrites au point 2.1 doivent être approuvés individuellement par la Présidence de la CH"], "ground_truth": "un joueur est supérieur à 2700 ou si le classement d'une joueuse est supérieur à 2500."}
{"question": "Que precise de E02-Le_classement_rapide?", "answer": "", "contexts": ["## 3.1. Premier RAPIDE  \n- soit avec Nj ≥ 7 alors Pj est arrondi à la dizaine la plus proche et devient le Rapide\n- soit avec cumul Nj/Pj et des archives Pa/Na si Nj + Na ≥7  \nSi Nj &lt; 7 et pas d'archive, la performance est archivée et conservée uniquement jusqu'à la fin de la saison suivante. Si ces archives ne sont pas utilisées lors du calcul de fin de la saison n+1 alors elles sont définitivement perdues."], "ground_truth": "Premier RAPIDE  \n- soit avec Nj ≥ 7 alors Pj est arrondi à la dizaine la plus proche et devient le Rapide\n- soit avec cumul Nj/Pj et des archives Pa/Na si Nj + Na ≥7  \nSi Nj &lt; 7 et pas d'archive, la performance est archivée et conservée uniquement jusqu'à la fin de la saison suivante."}
{"question": "Que doit-on faire selon l'article mentionné dans 2018_Reglement_Disciplinaire20?", "answer": "", "contexts": ["## ARTICLE 8 - TRANSMISSION DES DOCUMENTS ET ACTES DE PROCEDURE  \nLa transmission des documents et actes de procédure mentionnés au présent règlement est effectuée par courrier recommandé avec accusé de réception ou par courrier remis en main propre contre décharge ou, le cas échéant, par courrier électronique à la personne poursuivie ou à son représentant légal, à son avocat, à l'association sportive avec laquelle elle a un lien juridique.  \nL'utilisation du courrier électronique doit garantir la fiabilité de l'identification des parties à la communication électronique, l'intégrité des documents adressés ainsi que la sécurité et la confidentialité des échanges entre l'ensemble des personnes participant à la procédure disciplinaire. Elle doit permettre également d'établir de manière certaine la date et l'heure de la transmission des documents ainsi que celles de leur réception par leur destinataire."], "ground_truth": "L'utilisation du courrier électronique doit garantir la fiabilité de l'identification des parties à la communication électronique, l'intégrité des documents adressés ainsi que la sécurité et la confidentialité des échanges entre l'ensemble des personnes participant à la procédure disciplinaire."}
{"question": "Quelle obligation est énoncée à la page 1?", "answer": "", "contexts": ["## 1. Appels sportifs  \nEn règle générale et dans toutes les compétitions, il peut être fait appel, dans le cadre de l'article 9.5 du Règlement intérieur, auprès de la commission d'appels sportifs (CAS) des décisions d'arbitres, des directions de groupe, des directions de la compétition et, dans le cadre de l'article 9.2.1 du Règlement Intérieur, de la commission technique fédérale.  \nSous peine d'irrecevabilité, l'appel doit être formulé par voie postale ou électronique dans un délai de dix jours à compter de la date de réception de la décision contestée."], "ground_truth": "Sous peine d'irrecevabilité, l'appel doit être formulé par voie postale ou électronique dans un délai de dix jours à compter de la date de réception de la décision contestée."}
{"question": "Qu'est-ce que le statut?", "answer": "", "contexts": ["## 1.1. Statut des Arbitres  \nLes Arbitres d'Échecs (AIs et AFs) peuvent avoir deux (2) statuts distincts :  \n- Actifs (a)\n- Inactifs (i)  \nLe statut est utilisé pour déterminer si un arbitre est autorisé ou non à exercer dans une manifestation comptabilisée pour le classement FIDE."], "ground_truth": "Le statut est utilisé pour déterminer si un arbitre est autorisé ou non à exercer dans une manifestation comptabilisée pour le classement FIDE."}
{"question": "Qu'est-ce que le niveau?", "answer": "", "contexts": ["## Score ;  \ndifférence (DS) : (1) la différence de score entre deux adversaires d'une paire ; (2) la différence de score entre un joueur flotteur descendant et une valeur artificielle particulière (A8), classiquement utilisée parce qu'il n'y a pas d'adversaire ;  \neffondré : score des joueurs/joueuses résident dans l'avant dernier niveau d'appariement (voir A.9). Toutes les personnes qui ont un score inférieur au score effondré sont considérés comme résidents du groupe de point spécial effondré.  \nSous-groupe : chacun des deux sousgroupes (éventuellement trois s'il y a des limbes dans lesquels le niveau est subdivisé dans l'optique d'apparier (voir S1, S2, limbes).  \nTirage au sort : Détermine de la couleur initiale des joueurs (voir règle d'attribution des couleurs E -E5)  \nTop joueur : (voir aussi A.7) un joueur qui, lorsque l'on apparie la dernière ronde à un score supérieur à la moitié des points possibles.  \nTransposition : opération qui modifie l'ordre des joueurs dans le sous -groupe S2, afin d'obtenir un appariement de meilleure qualité."], "ground_truth": "le niveau est subdivisé dans l'optique d'apparier (voir S1, S2, limbes)."}
{"question": "Qu'est-ce que les que?", "answer": "", "contexts": ["## 0.2 PRÉAMBULE  \nLes Règles du Jeu d'Échecs ne sauraient couvrir la totalité des situations pouvant survenir au cours d'une partie, pas plus qu'elles ne sauraient trancher toutes les questions d'ordre administratif. Lorsqu'une situation se présente qui ne se trouve décrite précisément par aucun des Articles des présentes Règles du Jeu, on devrait parvenir à une décision correcte en considérant les situations analogues traitées par ces mêmes Règles du Jeu.  \nCes Règles du Jeu supposent que les arbitres possèdent ces qualités indispensables que sont la compétence, la faculté de discernement et l'objectivité absolue. Des règles trop détaillées pourraient priver un ou une arbitre de sa liberté de jugement et l'empêcher par là même d'apporter une solution à un problème qui lui soit dictée par l'équité, la logique et la prise en considération de circonstances particulières. La FIDE demande à tous les joueurs et joueuses d'échecs et à toutes les fédérations de bien vouloir accepter ce point de vue.  \nUne condition nécessaire à la prise en compte d'une partie pour le classement de la FIDE est d'être jouée selon les Règles du Jeu de la FIDE.  \nIl est recommandé que les parties d'une compétition non comptabilisée pour le classement de la FIDE soient jouées selon les Règles du Jeu d'Échecs de la FIDE.  \nUne fédération membre peut demander à la FIDE de statuer sur les questions relatives aux Règles du Jeu d'Échecs.  \nNote de traduction : Les commentaires en grisés sont adaptés des commentaires publiés par la commission des Arbitres de la Fide (version octobre 2022 pour les règles en vigueur au 1 er janvier 2018) -La version mise à jour pour les règles en vigueur au 1 er janvier 2023 est en attente de confirmation. Quelques notes de traduction encadrées ont été ajoutées."], "ground_truth": "les que sont la compétence, la faculté de discernement et l'objectivité absolue."}
{"question": "Quelle règle est énoncée à la page 199?", "answer": "", "contexts": ["## 1.10.1. Enregistrement des Titres directs  \nL'Arbitre en chef envoie les résultats au secrétariat de la FIDE en incluant une liste des titres directement obtenus. Celle-ci comporte les titres conditionnés par le classement. Après examen par la CH, les fédérations concernées sont informées par le secrétariat de la FIDE."], "ground_truth": "Celle-ci comporte les titres conditionnés par le classement."}
{"question": "Que se passe-t-il en cas de défaillance dûment constatée. Également destinataire des documents à caractère financier soumis à l'examen du comité directeur et de l'assemblée générale?", "answer": "", "contexts": ["## 9.6.1 Fonctions  \nLa commission de contrôle économique et de gestion est notamment chargée d'assurer la conformité économique et budgétaire des organes déconcentrés de la FFE : comités départementaux et ligues régionales.  \nElle propose au comité directeur toute mesure de redressement ou toute sanction appropriée en cas de défaillance dûment constatée. Également destinataire des documents à caractère financier soumis à l'examen du comité directeur et de l'assemblée générale, elle donne son avis sur leur contenu avant qu'ils ne soient présentés.  \nLe reste de ses attributions est défini dans son règlement intérieur."], "ground_truth": "en cas de défaillance dûment constatée. Également destinataire des documents à caractère financier soumis à l'examen du comité directeur et de l'assemblée générale, elle donne son avis sur leur contenu avant qu'ils ne soient présentés."}
{"question": "Qu'est-ce que un délégué?", "answer": "", "contexts": ["## 5.2 Les ligues régionales  \nLes ligues régionales favorisent le développement de la pratique des Échecs et appliquent la politique fédérale dans leur ressort territorial défini par les services déconcentrés du ministère chargé des Sports.  \nDans leur ressort territorial, les ligues ont aussi compétence pour les relations avec les collectivités territoriales et la presse, la discipline, l'arbitrage, la formation de l'élite, l'organisation des compétitions et le suivi administratif et technique. Elles ont délégation pour assurer le contrôle de compatibilité des statuts et règlement intérieur des comités départementaux de leur ressort territorial, avec les statuts et règlement intérieur fédéraux.  \nElles sont chargées de faire appliquer la politique fédérale par les comités départementaux et d'assurer le suivi administratif des clubs en lieu et place des comités non constitués.  \nDans le mois qui suit la réunion de chaque assemblée générale, les ligues régionales sont tenues d'en adresser le procès-verbal au secrétaire général de la FFE, ainsi que les pièces comptables et financières produites à cette occasion qui seront soumises à la commission de contrôle économique et de gestion dans les conditions prévues dans son règlement intérieur. Elles se doivent également de communiquer au secrétaire général de la FFE le compte rendu des réunions de leur comité directeur.  \nLors de l'assemblée générale des ligues régionales, le nombre total de voix dont peut disposer un délégué est limité à 15 % du total des voix de la ligue régionale concernée. Cette limite est arrondie à l'unité supérieure et ne s'applique qu'aux ligues régionales composées d'au moins 10 clubs."], "ground_truth": "un délégué est limité à 15 % du total des voix de la ligue régionale concernée."}
{"question": "Qu'est-ce que la commission?", "answer": "", "contexts": ["## 9.10.3 Obligations de confidentialité  \nLes membres de la commission sont tenus à une obligation de confidentialité concernant les informations dont ils ont connaissance dans le cadre de leurs missions. Ils sont en outre tenus de s'abstenir de toute déclaration publique qui serait de nature à remettre en cause leur impartialité."], "ground_truth": "la commission sont tenus à une obligation de confidentialité concernant les informations dont ils ont connaissance dans le cadre de leurs missions."}
{"question": "Qu'est-ce que la réputation?", "answer": "", "contexts": ["## D. Fausse accusation  \nD.1 Une fausse accusation est un abus de la liberté d'expression. Une fausse accusation aux échecs comme dans tout autre domaine peut porter atteinte à une réputation. Le droit à la protection de la réputation est protégé dans le cadre du droit au respect de la vie privée. Pour décider si une accusation est manifestement infondée et peut donc être considérée comme un abus de la liberté d'expression, les critères suivants sont pris en compte : a) le caractère suffisant de la base factuelle de l'accusation ; b) le niveau de la compétition ; c) le titre et le classement de la personne qui est accusée de tricherie en ligne ; d) le résultat final de la personne accusée dans la compétition en question ; e) le moyen et l'ampleur de la diffusion de l'accusation (médias sociaux, interview publique, blog, etc.) Cette liste des critères n'est pas exhaustive.  \nD.2 Une fausse accusation aux échecs en ligne est traitée mutatis mutandis comme pour le jeu physique sur l'échiquier."], "ground_truth": "la réputation est protégé dans le cadre du droit au respect de la vie privée."}
{"question": "Que se passe-t-il en cas de ré -appariement à la suite de forfaits avec l'accord des deux adversaires. Si la cadence est avec incrément?", "answer": "", "contexts": ["- a) Dans les dossiers de candidature pour le titre de GM ou GMF basés sur des normes, au moins une norme devra être obtenue dans un tournoi comprenant au moins 3 jours à une ronde par jour.\n- b) Dans tout tournoi permettant l'obtention de normes, les cadences et réglages de pendules devront être les mêmes pour tous les joueurs et joueuses à l'exception des cas autorisés dans les directives III des règles du jeu d'échecs ou en cas de ré -appariement à la suite de forfaits avec l'accord des deux adversaires. Si la cadence est avec incrément, tous les joueurs et joueuses doivent utiliser l'incrément ; si c'est une cadence temps différé, tous les joueurs et joueuses doivent utiliser le temps différé ; si aucun incrément ou temps différé n'est spécifié, alors tous les joueurs et joueuses doivent jouer sans incrément ni temps différé. Il ne peut pas y avoir d'utilisation mélangée de réglages de pendules (incrément, temps différé, rien du tout).\n3. 1.1.4. Dans les tournois durant plus de 30 jours, les classements et titres des adversaires utilisés seront ceux en vigueur au moment où les parties ont été jouées.\n4. 1.1.5. L'Arbitre Principal d'un tournoi permettant l'obtention de normes sera Arbitre International (AI) ou Arbitre FIDE (AF). Un/Une AI ou un/une AF doit toujours se trouver sur les lieux de la compétition.\n5. 1.1.6. Aucun arbitre désigné ne peut jouer dans un tournoi permettant l'obtention de normes .\n6. 1.2. Titres obtenus par le biais de Championnats Internationaux :"], "ground_truth": "en cas de ré -appariement à la suite de forfaits avec l'accord des deux adversaires. Si la cadence est avec incrément, tous les joueurs et joueuses doivent utiliser l'incrément ; si c'est une cadence temps différé, tous les joueurs et joueuses doivent utiliser le temps différé ; si aucun incrément ou temps différé n'est spécifié, alors tous les joueurs et joueuses doivent jouer sans incrément ni temps différé."}
{"question": "Qu'est-ce que les Ligues?", "answer": "", "contexts": ["## 1.1. Structure  \nLe championnat de France Interclubs Jeunes est organisé chaque saison et comporte 4 divisions :  \n- Le Top Jeunes, composé d'un groupe de 16 équipes ;\n- La Nationale 1, composée de 4 groupes de 8 équipes ;\n- La Nationale 2 composée de 12 groupes de 8 équipes ;\n- La Nationale 3.  \nLes groupes de Top Jeunes, de Nationales 1 et 2 sont organisés sous la responsabilité de la Commission Technique Fédérale, les groupes de Nationale 3 sous la responsabilité des Ligues.  \nLes Ligues sont libres d'avoir autant des groupes de Nationale 3 qu'elles le désirent et d'organiser leurs qualifications pour la Nationale 2 comme elles l'entendent, mais elles ne pourront qualifier en Nationale 2 qu'une équipe par Zone Interdépartementale (ZID). S'il reste des places disponibles, les Ligues ayant le plus de licences A minimes (U16, U16F) et plus jeunes, ont droit à une place supplémentaire.  \nEn National 3, les Ligues doivent respecter les articles 3.7.a. et 3.7.b. du présent règlement concernant le nombre d'échiquiers et les catégories d'âge. Les Ligues souhaitant des dérogations sur ces points doivent obtenir l'accord de la Commission Technique Fédérale. A défaut, le règlement fédéral sera strictement appliqué."], "ground_truth": "Les Ligues sont libres d'avoir autant des groupes de Nationale 3 qu'elles le désirent et d'organiser leurs qualifications pour la Nationale 2 comme elles l'entendent, mais elles ne pourront qualifier en Nationale 2 qu'une équipe par Zone Interdépartementale (ZID)."}
{"question": "Qu'est-ce que la caution?", "answer": "", "contexts": ["- 10.3. Un joueur/Une joueuse (ou une personne représentant officiellement un joueur, une joueuse ou une équipe) peut faire appel de toute décision prise par l'AP, l'OC ou l'un/l'une de leurs assistants/assistantes. Cela inclut les capitaines d'équipe, les chefs/cheffes de délégation ou toute personne définie dans le Règlement de l'événement.\n- 10.4. Un appel doit être accompagné d'une caution et soumis par écrit avant la fin du délai imparti. Les frais et le délai sont fixés à l'avance. Les décisions du JA sont définitives. La caution est remboursable si l'appel aboutit. La caution (ou une partie de celle-ci) peut également être remboursée si l'appel a échoué mais est considéré comme raisonnable par le JA."], "ground_truth": "La caution est remboursable si l'appel aboutit."}
{"question": "Qu'est-ce que le exception?", "answer": "", "contexts": ["## A.3 Groupe de points et niveaux d'appariement  \nUn groupe de points est normalement composé de (toutes) les personnes ayant le même score. La seule exception est le Groupe de Point Spécial « effondré » défini en A.9.  \nUn niveau d'appariement est un groupe de personnes devant être appariées entre elles. Il est composé de personnes venant d'un même groupe de points (appelés joueurs /joueuses résidents) et des personnes restantes non appariées après l'appariement du niveau précédent.  \nUn niveau d'appariement est dit « homogène » si tous les joueurs et joueuses ont le même score ; dans le cas contraire, il est dit « hétérogène ».  \nUn niveau d'appariement résiduel est un sous -niveau d'un niveau hétérogène, contenant certains des joueurs et joueuses résidents (voir B3 pour plus de détails)"], "ground_truth": "le exception est le Groupe de Point Spécial « effondré » défini en A."}
{"question": "Que se passe-t-il en cas de forfait général dans les compétitions nationales déclaré avant le début de la compétition?", "answer": "", "contexts": ["## 3.3.2 Pénalités financières  \nEn cas de forfait général dans les compétitions nationales déclaré avant le début de la compétition, aucune pénalité financière n'est prononcée.  \nEn cas de forfait général déclaré après le début de la compétition, la pénalité prévue dans le règlement spécifique est plafonnée à 3 fois la pénalité prévue pour un forfait d'équipe isolé. Dans tous les cas de forfait général, les droits d'engagement restent acquis à l'instance gestionnaire de la compétition."], "ground_truth": "En cas de forfait général dans les compétitions nationales déclaré avant le début de la compétition, aucune pénalité financière n'est prononcée."}
{"question": "Qu'est-ce que la conséquence?", "answer": "", "contexts": ["## 1. Objectifs :  \nCette variante du système Suisse traditionnel a pour but d'apparier de façon rigoureuse tous les joueurs et joueuses d'un tournoi à des adversaires de force relativement proche durant la totalité du tournoi.  \nLa conséquence est de permettre l'obtention de normes internationales dans un open où moins de la moitié des joueurs sont classés par la FIDE."], "ground_truth": "La conséquence est de permettre l'obtention de normes internationales dans un open où moins de la moitié des joueurs sont classés par la FIDE."}
{"question": "Quelle obligation est énoncée à la page 186?", "answer": "", "contexts": ["## 10. Inscription dans la liste de classement  \n- 10.1. Pour être inscrit dans la liste de classement de la FIDE, un joueur ou une joueuse doit être membre d'une fédération nationale d'échecs , elle-même membre de la FIDE. Il peut toutefois en être décidé autrement avec l'approbation du Conseil de la FIDE. La fédération ne de vra pas avoir été exclue de manière temporaire ou permanente de son adhésion à la FIDE\n- 10.2. Il est de la responsabilité de la fédération nationale d'informer la FIDE du décès de ses joueurs et joueuses."], "ground_truth": "Pour être inscrit dans la liste de classement de la FIDE, un joueur ou une joueuse doit être membre d'une fédération nationale d'échecs , elle-même membre de la FIDE."}
{"question": "Quelle règle s'applique aux joueurs selon R02_2025_26_Regles_generales_A?", "answer": "", "contexts": ["## 2. Moyenne Elo avec une équipe de 3  \nLorsqu'une équipe joue avec 3 joueurs/joueuses au lieu de 4, on devra considérer que la moyenne Elo est égale à la somme des Elo des trois joueurs/joueuses, divisée par 3.  \nD'une manière générale, chaque fois qu'une équipe jouera avec moins de membres d'une équipe que ne prévoit le règlement, on devra considérer que la moyenne Elo est égale à la somme des Elo des membres divisée par le nombre réel de joueurs/joueuses."], "ground_truth": "D'une manière générale, chaque fois qu'une équipe jouera avec moins de membres d'une équipe que ne prévoit le règlement, on devra considérer que la moyenne Elo est égale à la somme des Elo des membres divisée par le nombre réel de joueurs/joueuses."}
{"question": "Quelle règle est énoncée à la page 190?", "answer": "", "contexts": ["## 7.2. Détermination du Classement initial 'Ru' d'un joueur ou d'une joueuse (Voir Exemple)  \n- 7.2.1. Si une personne non classée possède un classement FIDE standard au début d'un tournoi rapide ou blitz, ce classement standard est utilisé pour le calcul du classement. Cette personne est considérée comme étant classée et les points 7.2.2 à 7.2.5 cidessous ne s'appliquent pas.\n- 7.2.2. Si une personne non classée marque zéro point dans sa première manifestation. Ce score n'est pas pris en compte. Dans le cas contraire, son classement est calculé en utilisant tous ses résultats tel qu'indiqué au 6.1.4.\n- 7.2.3. Ra est le classement moyen des adversaires classés auxquels se sont ajoutés deux adversaires virtuels classés 1800. On considère que les résultats contre ces adversaires virtuels sont des matchs nuls.\n- 7.2.4. Ru = Ra + dp.  \nRu est arrondi à l'entier le plus proche.  \nLe classement initial maximal est 2200.  \n- 7.2.5. Si une personne non classée reçoit un classement publié avant qu'un tournoi dans lequel elle a joué soit pris en compte pour le classement, alors il est pris en compte en la considérant comme une personne classée avec son classement actuel. Cependant, pour le calcul du classement de ses adversaires, elle est comptabilisée comme une personne non classée."], "ground_truth": "Si une personne non classée possède un classement FIDE standard au début d'un tournoi rapide ou blitz, ce classement standard est utilisé pour le calcul du classement."}
{"question": "Qu'est-il interdit de faire selon 2025_Reglement_Interieur_20250?", "answer": "", "contexts": ["## 8.7 Vote électronique  \nEntre deux sessions de réunion du comité directeur, un vote électronique par mail peut être soumis au comité directeur par le bureau fédéral.  \nCe vote ne peut pas être utilisé pour une décision portant sur une personne physique et ne peut être utilisé que pour des scrutins nécessitant la majorité simple. Il ne peut être utilisé dans les 15 jours qui précèdent une réunion du comité directeur, ni dans le mois qui précède une assemblée générale.  \nLes membres du comité directeur doivent recevoir les documents nécessaires pour se forger une opinion au minimum une semaine avant l'ouverture du vote. Ils doivent avoir un interlocuteur identifié apte à répondre à toutes les questions concernant ce vote. Les questions et les réponses seront obligatoirement diffusées à tous les membres.  \nLe scrutin sera ouvert pendant 3 jours ouvrés. Les votes seront envoyés à un(e) salarié(e) de la Fédération Française des Échecs, en utilisant le formulaire spécifique au vote électronique.  \nLorsqu'un vote aura été enregistré, il ne pourra être modifié.  \nLa question ne doit appeler que 3 réponses possibles : oui, non, ou abstention. Tout mail qui ne se limiterait pas à ces 3 termes sera considéré comme nul."], "ground_truth": "Ce vote ne peut pas être utilisé pour une décision portant sur une personne physique et ne peut être utilisé que pour des scrutins nécessitant la majorité simple."}
{"question": "Que se passe-t-il en cas de constat d'infraction ou d'irrégularité?", "answer": "", "contexts": ["## 7.1 Réclamations lors des compétitions par équipes  \nEn cas de constat d'infraction ou d'irrégularité, les capitaines plaignants sont fondés à rédiger une réclamation consignée au dos du Procès-verbal et contresignée par les deux capitaines d'équipe et par l'arbitre.  \nLes deux capitaines d'équipe ne pourront pas refuser d'apposer leurs visas écrits, mais pourront le compléter brièvement par des réserves sur le même document.  \nCeux-ci ont alors 48 heures pour poster par lettre recommandée ou par tout moyen permettant d'obtenir un avis de réception, un complément détaillé en plainte ou en défense envoyé à la direction de groupe ou à la direction de la compétition.  \nTous les directeurs ou directrices ont le statut de \"direction de la compétition\"."], "ground_truth": "En cas de constat d'infraction ou d'irrégularité, les capitaines plaignants sont fondés à rédiger une réclamation consignée au dos du Procès-verbal et contresignée par les deux capitaines d'équipe et par l'arbitre."}
{"question": "Quelle obligation est énoncée à la page 161?", "answer": "", "contexts": ["## Organisation du tournoi  \n1. Organiser une réunion pour tous les joueurs et joueuses avant la 1 re ronde du tournoi, de préférence dans l'une des salles de jeu.\n2. Si possible une seule ronde par jour doit être jouée."], "ground_truth": "Si possible une seule ronde par jour doit être jouée."}
{"question": "Quelle règle est énoncée à la page 148?", "answer": "", "contexts": ["| 9 | HAMID | 0 | 0 | 0,5 | 0 | 1 | 0,5 | 0 | 1 | | 0 | 3 |\n| 10 | ISIDORE | 0 | 0 | 0 | 0 | 0 | 0,5 | 0,5 | 1 | 1 | | 3 |  \nDiane et Alma sont ex-aequo à 6 pts mais lors de leur rencontre Diane l'a emporté. Elle est donc placé devant au classement.  \nGuy et Fatou sont ex-aequo à 5 pts et lors de leur rencontre ils ont fait match nul, le départage à la rencontre directe ne permet pas de briser l'égalité.  \nEric, Béatrice et Claude sont ex-aequo à 4,5 pts. Si on ne prend que les parties réalisées entre eux, Eric aurait 2 pts, Béatrice 1pt et Claude 0 pt. La rencontre directe permet donc de les classer."], "ground_truth": "Elle est donc placé devant au classement."}
{"question": "Quelle règle est énoncée à la page 141?", "answer": "", "contexts": ["## Chapitre 4.1 : Les directives contre la tricherie  \nRéalisé d'après les directives anti -triche de la FIDE -document datant du 21 avril 2022  \nComplété avec les mesures de protections anti-triche -Document approuvé par la FIDE en 2018  \nCette traduction en français ne présente que des extraits choisis. La lecture des textes officiels intégraux est conseillée en guise d'approfondissement pour les arbitres FIDE et Internationaux.  \nLa Fédération Française d'Echecs dispose de l'autorité suffisante pour statuer sur des cas de triche durant les événements où la surveillance anti-triche reste standard.  \nPour les tournois dans lesquels le niveau de protection doit être élevé voire maximal (Evénements de la FIDE, tournois où le montant des prix dépasse 20000 €, tournois ou des normes de MI et GMI peuvent être obtenues, tournois toutesrondes avec une moyenne Elo supérieure à 2400,...), les cas de triche doivent être remontés à la « Fair-Play Commission » (FPL) de la FIDE qui pourra éventuellement décider de laisser la fédération nationale statuer)  \nIl est demandé aux arbitres fédéraux d'utiliser la Fédération Française d'Echecs comme intermédiaire pour tout signalement de triche à envoyer à la FIDE"], "ground_truth": "La Fédération Française d'Echecs dispose de l'autorité suffisante pour statuer sur des cas de triche durant les événements où la surveillance anti-triche reste standard."}
{"question": "Quelle règle est énoncée à la page 123?", "answer": "", "contexts": ["Dans tout tournoi où de tels systèmes sont utilisés, des arbitres différents ou tout logiciel d'appariement approuvé par la FIDE doivent aboutir à des appariements identiques.  \n5. Il n'est pas permis de modifier les appariements valides en faveur d'une quelconque personne. S'il s'avère que l'on peut prouver que des modifications des appariements d'origine ont été réalisées en faveur d'une personne pour lui permettre d'obtenir une norme ou un titre direct, un rapport pourra être soumis à la commission d'homologation de la FIDE afin d'initier des mesures disciplinaires par le biais de la Commission d'éthique et de discipline."], "ground_truth": "Il n'est pas permis de modifier les appariements valides en faveur d'une quelconque personne."}
{"question": "Qu'est-ce que la délégation?", "answer": "", "contexts": ["## Art. 13-1 - Durée du contrat  \nLe présent contrat produit ses effets jusqu'au 31 décembre 2025.  \nAu terme de cette période, le contrat de délégation cesse de plein droit. Par exception, le contrat cesse de produire ses effets si :  \n- -La délégation est retirée dans les conditions prévues par les articles R. 131-29 et suivants du code du sport ;\n- -L'arrêté de délégation est abrogé ou annulé par les juridictions administratives ;\n- -La fédération demande le retrait de la délégation. Dans ce cas le contrat cesse de produire ces effets pour les disciplines pour lesquelles la délégation a été retirée.  \nIl peut être mis fin à tout ou partie du contrat de manière anticipée dans les conditions prévues le code du sport ou par l'article 13-1 du présent contrat."], "ground_truth": "La délégation est retirée dans les conditions prévues par les articles R."}
{"question": "Qu'est-ce que la pendule?", "answer": "", "contexts": ["## Parfois, ce qui suit se produit :  \nUn joueur ou une joueuse renverse des pièces ; dans cette situation, l'adversaire laisse son doigt sur le balancier de la pendule pour l'empêcher d'appuyer sur la pendule. Ceci est interdit selon cet Article.  \nSi un joueur ou une joueuse joue un coup avec une main et appuie sur la pendule avec l'autre main, cela n'est pas considéré comme un coup illégal mais cela peut être sanctionné selon l'article 12.9.  \nNote de traduction : La plupart du temps c'est un acte involontaire ou lié à la méconnaissance de la règle, un simple avertissement peut suffire, dans le cas d'une action visant à gagner du temps ou à mettre la pression sur l'adversaire une sanction plus sévère est choisie.  \n6.2.4. Les joueurs et joueuses doivent manipuler la pendule d'échecs convenablement. Il est interdit de l'actionner avant de jouer son coup, de l'actionner de force, de la prendre dans ses mains ou de la renverser. Toute manipulation incorrecte est sanctionnée selon l'Article 12.9.  \nDans le cas d'un joueur appuyant sur la pendule sans jouer un coup, comme mentionné dans l'article 6.2.4, ceci est considéré comme un coup illégal et sanctionné comme tel selon l'article 7.5.3.  \n- 6.2.5. Seul le joueur ou la joueuse dont la pendule est en marche a l'autorisation d' adouber les pièces."], "ground_truth": "la pendule est en marche a l'autorisation d' adouber les pièces."}
{"question": "Quelle règle est énoncée à la page 177?", "answer": "", "contexts": ["- → Attestations de normes, le cas échéant (formulaires FIDE) :  \nIl est demandé que les formulaires de normes envoyés soient le plus lisible possible. Un format doc ou pdf est préconisé. Il est surtout demandé d'éviter tout envoi d'une norme prise en photo avec un téléphone qui ne peut pas être un document recevable."], "ground_truth": "Un format doc ou pdf est préconisé."}
{"question": "Qu'est-ce que la victime?", "answer": "", "contexts": ["## Chapitre 4.5 : Violences  \nFace à des violences en tournoi, la sanction immédiate de l'arbitre en concertation avec l'équipe d'organisation doit être l'exclusion immédiate de la compétition et interdire l'accès aux locaux à la personne concernée.  \nNous pouvons distinguer plusieurs formes de violence (liste ne sera exhaustive) :  \n- Les violences physiques et verbales\n- Les violences sexistes et sexuelles.\n- Les violences morales et psychologiques  \nEnfants, femmes, personnes issues de représentations minoritaires, personnes en situation de handicap sont les victimes les plus fréquentes de ces violences.  \nDevant une violence constatée ou soupçonnée, l'arbitre a l'obligation de tout mettre en œuvre pour effectuer les signalements nécessaires, il n'a aucunement la possibilité de considérer l'affaire close une fois le tournoi terminé et les sanctions en son pouvoir sont clairement insuffisantes au vu des actes reprochés.  \nToute violence doit être signalée à la police. L'absence de signalement est considérée comme une non -assistance à personne en danger et cela est d'autant plus grave quand la victime est un enfant.  \nLa Fédération Française des Echecs dispose d'une cellule de signalement et de prévention des violences :"], "ground_truth": "la victime est un enfant."}
{"question": "Qu'est-ce que la Ligue?", "answer": "", "contexts": ["## 5.1.1. Le Directeur Régional ou la Directrice Régionale de l'arbitrage.  \nLe Président ou la Présidente de la ligue de la Ligue désigne une personne pour diriger la D.R.A. Cette nomination doit être approuvée par le Comité Directeur de la Ligue."], "ground_truth": "la Ligue désigne une personne pour diriger la D."}
{"question": "Quelle règle est énoncée à la page 39?", "answer": "", "contexts": ["## Note de traduction : Les deux articles suivants définissent la prise en passant.  \n- 3.7.3.1. Un pion occupant une case située sur la même rangée et sur une colonne adjacente à un pion adverse qui vient d ' avancer de deux cases en un seul coup depuis sa case de départ, peut prendre ce pion adverse comme si ce dernier n ' avait été avancé que d ' une seule case.\n- 3.7.3.2. Cette prise n'est autorisée que sur le coup qui suit l'avance ment du pion adverse. Cette prise est appelée « prise en passant ».  \n<!-- image -->  \nNote de traduction : Les trois articles suivants définissent la promotion.  \n<!-- image -->  \n- 3.5. Lors de leurs déplacements, un fou, une tour ou une dame ne peuvent passer par-dessus des pièces qui se trouveraient sur leur chemin.\n- 3.6. Un cavalier peut se déplacer sur l ' une des cases les plus proches de celle où il se trouve mais non située sur la même rangée, la même colonne ou la même diagonale.  \n<!-- image -->  \n- 3.7.3.3. Quand un joueur ou une joueuse au trait déplace un pion sur la rangée la plus éloignée de sa position de départ, il/elle doit remplacer ce pion -lors de ce coup- par une nouvelle dame, une nouvelle tour, un nouveau fou ou un nouveau cavalier de la même cou leur sur cette case d'arrivée que l'on nomme case de « promotion ».\n- 3.7.3.4. Le choix du joueur ou de la joueuse n ' est pas restreint aux pièces capturées précédemment."], "ground_truth": "Cette prise n'est autorisée que sur le coup qui suit l'avance ment du pion adverse."}
{"question": "Quelle règle est énoncée à la page 122?", "answer": "", "contexts": ["- 2) Si les couleurs qu' elle a déjà eu sont équilibrées, alors, en général elle reçoit la couleur inverse de celle qu'il a reçue lors de la ronde précédente.\n- i) Les règles d'appariement doivent être suffisamment transparentes pour qu'une personne en charge des appariements puisse les expliquer."], "ground_truth": "- i) Les règles d'appariement doivent être suffisamment transparentes pour qu'une personne en charge des appariements puisse les expliquer."}
{"question": "Qu'est-ce que le Rapide?", "answer": "", "contexts": ["## 1. COMPATIBILITE  \nLa règle de compatibilité appliquée pour le Rapide est de ± 320 points .  \nLe seuil d'entrée au Rapide est de 7 parties compatibles.  \nPlancher Rapide : 800. Les calculs sont publiés mensuellement."], "ground_truth": "le Rapide est de ± 320 points ."}
{"question": "Que se passe-t-il en cas de violation des Articles 20.4 et 20.5?", "answer": "", "contexts": ["- 20.6. En cas de violation des Articles 20.4 et 20.5, l'arbitre a le droit d'intervenir et les pénalités décrites à l'Article 18.4 s'appliquent.\n- 20.7. Les règles spécifiques de la compétition peuvent imposer l'usage obligatoire de feuilles de partie par les joueurs et joueuses."], "ground_truth": "En cas de violation des Articles 20.4 et 20.5, l'arbitre a le droit d'intervenir et les pénalités décrites à l'Article 18."}
{"question": "Qu'est-ce que la batterie?", "answer": "", "contexts": ["## 6.3.2. Mode « Partie »  \nIl s'agit du mode où le joueur/la joueuse note sa partie. Ce mode peut être activé par le joueur/la joueuse, par l'équipe d'organisation du tournoi ou l'arbitre. Les règles suivantes s'appliquent pour le mode « Partie »  \n- Pendant la partie, il n'est pas possible de changer de mode.\n- La notation de la partie est clairement visible par l'arbitre\n- Un minimum de 7 coups doit être visible dans une liste de coups.\n- Le fait que l'appareil est en mode « Partie » doit être visible.\n- Un indicateur doit être visible si la batterie est faible ; lorsque cet indicateur apparaît, la batterie doit avoir encore au moins 8 heures d'autonomie afin de permettre de noter une partie complète.\n- L'entrée graphique par un échiquier avec des figurines est autorisée.\n- Le défilement des coups est autorisé, de même que la correction des coups saisies de manière incorrecte.\n- La partie s' achève quand un résultat est noté et que les deux joueurs ont signé le score. La confirmation du résultat et du déroulement de la partie peut se faire en imprimant la partie ou selon un protocole indiqué par l'arbitre.\n- Sur la saisie des coups :\n- o Il est permis de noter un coup illégal ;\n- o Il est permis de noter les temps des pendules, les propositions de nulle et les autres abréviations permises par les règles du jeu d'échecs. L'entrée des temps des pendules peut se faire avec une notation sous forme d'image ;\n- o L'appareil ne doit pas corriger ou signaler de lui -même les coups illégaux ;"], "ground_truth": "la batterie est faible ; lorsque cet indicateur apparaît, la batterie doit avoir encore au moins 8 heures d'autonomie afin de permettre de noter une partie complète."}
{"question": "Quelle règle est énoncée à la page 79?", "answer": "", "contexts": ["## 3. Échiquier.  \n- 3.1. Pour les compétitions organisées sous l'égide de la GSC, des échiquiers en bois doivent être utilisés. Dans tous les cas, les échiquiers doivent être rigides. Des bois naturels présentant un contraste suffisant, tels que le bouleau, l'érable ou le frêne européen contre le noyer, le teck, le hêtre, peuvent également être utilisés pour les échiquiers. Les échiquiers ne doivent pas être brillants, et avoir une finition terne ou neutre. Une combinaison de couleurs, telles que le marron, ou le feu très clair et le blanc, le crème, le blanc cassé, l'ivoire ou le chamois, peut être utilisée pour les cases d'échecs en plus des couleurs naturelles.\n- 3.2. Pour les compétitions sous l'égide de l'EVE et de la GSC, si des échiquiers électroniques sont utilisés, ils doivent être des échiquiers électroniques approuvés par la FIDE.\n- 3.3. Le côté de chaque case carrée doit mesurer 5-6 cm. Quatre pions doivent pouvoir tenir sur une case."], "ground_truth": "Dans tous les cas, les échiquiers doivent être rigides."}
{"question": "Qu'est-ce que le départage?", "answer": "", "contexts": ["## 4.4. Classement  \nEn N1, N2 et N3, le classement final de chaque groupe est effectué suivant le total des points de match.  \nEn cas d'égalité de points de matchs, on utilise les résultats (points de match, différentiel, points de parties) réalisés entre elles par les équipes à départager.  \nEn cas de nouvelle égalité, le départage est effectué par les différentiels calculés sur l'ensemble de la compétition puis, en cas de nouvelle égalité, sur le nombre de points « pour » réalisés par les équipes à départager sur l'ensemble de la compétition.  \nSi une égalité subsiste, on prend dans l'ordre la somme des différentiels au 1 er échiquier, puis au 2 e , etc.  \nEn Top Jeunes, les places 1 à 8 sont attribuées aux équipes de la poule haute, les places 9 à 16 à celles de la poule basse. Dans chaque poule, le classement est effectué suivant le total des points de match. Pour départager plusieurs équipes, on utilise les mêmes critères que pour les autres Nationales, mais en ne tenant compte que des matchs joués entre elles et contre les adversaires communs à toutes ces équipes."], "ground_truth": "le départage est effectué par les différentiels calculés sur l'ensemble de la compétition puis, en cas de nouvelle égalité, sur le nombre de points « pour » réalisés par les équipes à départager sur l'ensemble de la compétition."}
{"question": "Qu'est-ce que le vote?", "answer": "", "contexts": ["## 7.7.3 Mode de scrutin  \nLe scrutin se déroule électroniquement, dans les conditions de sécurité prévues par les dispositions légales en vigueur, notamment la délibération n o 2019-053 de la Commission nationale de l'informatique et des libertés.  \nLe vote est ouvert trois jours francs avant la date de l'assemblée générale élective et clos en même temps que le scrutin pour les membres ordinaires.  \nL'élection a lieu au scrutin plurinominal à un tour. Chaque électeur dispose d'un nombre de voix égal au nombre de sièges à pourvoir et ne peut attribuer plus d'une voix par candidat.  \nSi plusieurs candidats obtiennent le même nombre de suffrages, l'élection est acquise au(x) candidat(s) le(s) plus jeune(s)."], "ground_truth": "Le vote est ouvert trois jours francs avant la date de l'assemblée générale élective et clos en même temps que le scrutin pour les membres ordinaires."}
{"question": "Qu'est-ce que la possibilité?", "answer": "", "contexts": ["Si possible, les spectateurs et spectatrices ne doivent pas pénétrer dans la zone de jeu. Il est conseillé d'avoir toutes les salles (espace pour fumeur, toilettes, bar, etc) toujours sous le contrôle des arbitres, de leurs assistants et assistantes.  \nNote de traduction : Définir la zone de jeu n'est pas simple : l'allée où se trouve notre échiquier et où l'on peut se dégourdir les jambes fait partie de notre zone de jeu mais on ne peut pas considérer que l'on est toujours dans notre zone de jeu si l'on va au coin opposé d'un immense gymnase.  \n- 11.2.4. Le règlement d'une compétition peut spécifier que l'adversaire d'un joueur ou d'une joueuse au trait soit dans l'obligation de signaler à l'arbitre lorsqu'il /elle souhaite quitter la zone de jeu.  \nCet article ne doit pas être confondu avec les Articles 11.2.3.1 et 11.2.3.2. Dans le 11.2.3.1, il est interdit à tous les joueurs et joueuses de quitter le lieu de la compétition sans la permission de l'arbitre. En 11.2.3.2, il est interdit de quitter la zone de jeu pour ceux qui ont le trait.  \nEn 11.2.4, la possibilité est donnée d'inclure, dans le règlement de la manifestation, l'interdiction de quitter la zone de jeu, sans la permission de l'arbitre, pour le s joueurs et joueuses n'ayant pas le trait.  \n- 11.3. Usage de notes et matériels électroniques :"], "ground_truth": "la possibilité est donnée d'inclure, dans le règlement de la manifestation, l'interdiction de quitter la zone de jeu, sans la permission de l'arbitre, pour le s joueurs et joueuses n'ayant pas le trait."}
{"question": "Qu'est-ce que les modalités?", "answer": "", "contexts": ["## 7.3 Modalités de réunions  \nLe comité directeur se réunit à l'initiative de son président au moins 3 fois par an, à raison d'une séance par tranche de 4 mois qui ont impérativement lieu en présentiel. Il se réunit également de plein droit sur un ordre du jour déterminé si la majorité de ses membres en fait la requête auprès du secrétaire général.  \nD'éventuelles séances supplémentaires peuvent se tenir en visioconférence.  \nLe directeur technique national (DTN) assiste au comité directeur avec voix consultative, ainsi que toute autre personne dûment autorisée par le président.  \nLe règlement intérieur précise les modalités de fixation des dates des séances, de vote et de représentation, d'établissement de l'ordre du jour et du compte rendu, et de publicité des séances.  \nEntre deux réunions, une question peut être soumise aux membres du comité directeur par un vote électronique dont les modalités sont précisées dans le règlement intérieur."], "ground_truth": "les modalités sont précisées dans le règlement intérieur."}
{"question": "Qu'est-ce que les statuts?", "answer": "", "contexts": ["## ARTICLE 16 : MODALITÉS DE MODIFICATION DES STATUTS  \nHormis la modification de siège social prévue au premier alinéa de l'article 1.2 des présents statuts, l'assemblée générale destinée à modifier les statuts est convoquée sur un ordre du jour comportant les propositions de modifications, sur proposition du comité directeur ou sur proposition du tiers au moins des membres de l'assemblée générale représentant au moins le tiers des voix.  \nEn toute hypothèse, la convocation et son ordre du jour sont adressés, par voie électronique ou postale, aux membres affiliés à la FFE quinze jours au moins avant la date fixée pour la réunion de l'assemblée générale.  \nL'assemblée générale ne peut modifier les statuts que si la moitié au moins de ses membres, représentant au moins la moitié des voix, sont présents ou représentés.  \nSi ce quorum n'est pas atteint, l'assemblée peut à nouveau être convoquée sur le même ordre du jour, quinze jours au moins avant la nouvelle date fixée. L'assemblée statue alors sans condition de quorum.  \nLes statuts ne peuvent être modifiés qu'à la majorité des deux tiers des membres présents ou représentés, représentant au moins les deux tiers des voix."], "ground_truth": "les statuts est convoquée sur un ordre du jour comportant les propositions de modifications, sur proposition du comité directeur ou sur proposition du tiers au moins des membres de l'assemblée générale représentant au moins le tiers des voix."}
{"question": "Quelle règle est énoncée à la page 128?", "answer": "", "contexts": ["## B.7 Modification dans un niveau hétérogène  \nLe niveau résiduel est traité avec les mêmes règles que celles utilisées dans un niveau homogène (voir B.6).  \nNote : les sousgroupes de départ du niveau résiduel sont ceux formés juste après l'appariement des FD. Ils sont appelés S1R et S2R (pour éviter toute confusion avec les sous-groupes S1 et S2 du niveau hétérogène complet).  \nSi toutes les transpositions et tous les échanges ont été testés pour S1R et S2R, on modifie l'ordre des joueurs /joueuses de S2 avec une transposition (voir D.1), formant ainsi un nouvel appariement des FD et peut-être un nouveau niveau résiduel (à traiter comme précédemment).  \nSi toutes les transpositions de S2 ont été testées, il convient de modifier, si possible (c'est -àdire s'il y a un Limbe), le S1 d'origine et le Limbe (voir B.2), en effectuant un échange de flotteur(s) descendant(s) entre S1 et le Limbe (voir D.3), en réordonnant le nouveau S1 ainsi formé conformément à A.2 et en restaurant le S2 dans sa composition de départ."], "ground_truth": "Ils sont appelés S1R et S2R (pour éviter toute confusion avec les sous-groupes S1 et S2 du niveau hétérogène complet)."}
{"question": "Quelle règle est énoncée à la page 209?", "answer": "", "contexts": ["- 5.3.3. La candidature devra être soumise moins d'un an après la date du dernier événement lié à celle -ci.\n- 5.4. Pour qu'une candidature d'AF soit valide, les règles suivantes devront être respectées :\n- 5.4.1. Le formulaire de candidature pour le titre d'arbitre FIDE (FA2) devra être soumis avec les informations pertinentes et la signature d'un représentant de la fédération.\n- 5.4.2. Le candidat au titre d' Arbitre FIDE devra avoir au minimum 19 ans.\n- 5.4.3. La candidature devra être soumise avec le nombre exact de normes d'AF tel que décrit à l'article 3\n- Une norme obtenue lors d'un séminaire d' Arbitre FIDE ;\n- Trois attestations de normes d'AF obtenues lors de tournois ;\n- 5.5. Pour qu'une candidature d'AI soit valide, les règles suivantes devront être respectées :\n- 5.5.1. Le formulaire de candidature pour le titre d' Arbitre International (IA2) devra être soumis avec les informations pertinentes et la signature d'un représentant de la fédération.\n- 5.5.2. Le candidat au titre d' Arbitre International devra avoir au minimum 21 ans.\n- 5.5.3. La candidature devra être soumise avec le nombre exact de normes d'AI tel que décrit à l'article 4\n- Quatre attestations de normes d'AI obtenues lors de tournois ;\n- 5.6. Des droits de titre devront être versés conformément au règlement financier de la FIDE.\n- 5.6.1. La fédération nationale est responsable du paiement de ces frais."], "ground_truth": "Pour qu'une candidature d'AF soit valide, les règles suivantes devront être respectées :\n- 5.4.1."}
{"question": "Quelle règle s'applique aux joueurs selon R03_2025_26_Competitions_homol?", "answer": "", "contexts": ["## 2.2.1. Article 11.3.2.2 adapté :  \nSauf stipulation contraire du règlement de la compétition fédérale ou du tournoi, l'article 11.3.2.1 des règles du jeu autorisant les appareils électroniques éteints dans un sac s'appliquera. Outre les sacs, ces appareils peuvent être rangés dans d'autres endroits hors de portée du joueur ou la joueuse. Dans ce cas, ils devront être rangés de manière que les joueurs et joueuses ne puissent pas y accéder pendant leurs parties.  \nPar défaut, les appareils pouvant être connectés à internet ou à un autre appareil, ainsi que les appareils où une application permettant la triche peut être installée, font perdre directement la partie si ceux-ci ne sont pas rangés comme indiqué précédemment.  \nSi cet appareil émet un son dans la salle de jeu pendant la partie, le joueur ou joueuse perdra sa partie et l'adversaire gagnera. Cet article s'applique aux tournois organisés en France (sauf si le règlement intérieur du tournoi prévoit autre chose) et aux compétitions par équipes. Cette adaptation ne s'applique pas lors des tournois de haut niveau (national, national féminin, Top 16, phase finale de la coupe de France et Top 12F)."], "ground_truth": "Outre les sacs, ces appareils peuvent être rangés dans d'autres endroits hors de portée du joueur ou la joueuse."}
{"question": "Quelle obligation est énoncée à la page 191?", "answer": "", "contexts": ["## 9. Inscription dans la liste de classement  \n- 9.1. Pour être inscrit dans la liste de classement de la FIDE, un joueur ou une joueuse doit être membre d'une fédération nationale d'échecs , elle-même membre de la FIDE. Il peut toutefois en être décidé autrement avec l'approbation du Conseil de la FIDE. La fédération ne de vra pas avoir été exclue de manière temporaire ou permanente de son adhésion à la FIDE\n- 9.2. Il est de la responsabilité de la fédération nationale d'informer la FIDE du décès de ses joueurs et joueuses.  \nChapitre 6.3 :Titres de la FIDE"], "ground_truth": "Pour être inscrit dans la liste de classement de la FIDE, un joueur ou une joueuse doit être membre d'une fédération nationale d'échecs , elle-même membre de la FIDE."}
{"question": "Quelle règle est énoncée à la page 56?", "answer": "", "contexts": ["- 12.9.8. l 'exclusion pour une ou plusieurs rondes ,\n- 12.9.9. l 'ex clusion de la compétition.  \nCes sanctions ont un degré de gravité progressif. Par exemple, l'article 12.9.8 peut être utilisé pour un joueur ou une joueuse qui arrive sous l'influence de l'alcool mais ne perturbe par les parties. L'article 12.9.9 peut nécessiter un accord avec l'équipe organisatrice de l'événement."], "ground_truth": "l 'ex clusion de la compétition."}
{"question": "Quelle règle est énoncée à la page 22?", "answer": "", "contexts": ["## Art. 12-7 - Aides exceptionnelles  \nDes aides exceptionnelles sont menées par l'État pour soutenir financièrement le monde sportif (prêt à taux zéro, subventions exceptionnelles « COVID » - « Compensation billetterie », en période de crise sanitaire).  \nPar ailleurs, un plan relance a été engagé pour favoriser la reprise des licences dans les fédérations au travers du Pass'Sport.  \nAussi, pour accompagner la création du Pass'Sport, un nouveau plan « 5000 terrains » va donner la possibilité de créer des équipements innovants, de proximité, dans un contexte où le parc existant est saturé.  \nEnfin, pour permettre aux usagers les plus éloignés de la pratique ou malades de bénéficier d'une pratique sportive régulière, la labellisation « Maison sport santé » a permis la mise en œuvre d'un réseau de plus de 400 structures.  \nPour certains GESI, l'État produit des lettres d'engagement relatives notamment aux services d'ordre indemnisés."], "ground_truth": "Par ailleurs, un plan relance a été engagé pour favoriser la reprise des licences dans les fédérations au travers du Pass'Sport."}
{"question": "Que doit faire l'arbitre d'après R01_2025_26_Regles_generales.p?", "answer": "", "contexts": ["## 9. Comportement des joueurs et joueuses  \nLa conduite des joueurs et joueuses est assujettie à une attitude correcte qui interdit par exemple :  \n- De fixer le résultat d'une partie avant son commencement ou dans un but lucratif,\n- D'abandonner un tournoi sans justification,\n- De déclarer forfait sans raison valable,\n- Pendant le jeu, de contrevenir aux règles du jeu.  \nLe non-respect de ces règles élémentaires sera sanctionné par des pénalités prises, soit par l'arbitre, soit par la juridiction fédérale compétente.  \nTout joueur et joueuse devra également se conformer à la Charte Éthique de la FFE."], "ground_truth": "Le non-respect de ces règles élémentaires sera sanctionné par des pénalités prises, soit par l'arbitre, soit par la juridiction fédérale compétente."}
{"question": "Qu'est-ce que le classement?", "answer": "", "contexts": ["## 4.4. Classement  \nEn N1, N2 et N3, le classement final de chaque groupe est effectué suivant le total des points de match.  \nEn cas d'égalité de points de matchs, on utilise les résultats (points de match, différentiel, points de parties) réalisés entre elles par les équipes à départager.  \nEn cas de nouvelle égalité, le départage est effectué par les différentiels calculés sur l'ensemble de la compétition puis, en cas de nouvelle égalité, sur le nombre de points « pour » réalisés par les équipes à départager sur l'ensemble de la compétition.  \nSi une égalité subsiste, on prend dans l'ordre la somme des différentiels au 1 er échiquier, puis au 2 e , etc.  \nEn Top Jeunes, les places 1 à 8 sont attribuées aux équipes de la poule haute, les places 9 à 16 à celles de la poule basse. Dans chaque poule, le classement est effectué suivant le total des points de match. Pour départager plusieurs équipes, on utilise les mêmes critères que pour les autres Nationales, mais en ne tenant compte que des matchs joués entre elles et contre les adversaires communs à toutes ces équipes."], "ground_truth": "le classement est effectué suivant le total des points de match."}
{"question": "Quelle règle est énoncée à la page 51?", "answer": "", "contexts": ["Aucune condition ne peut être liée à cette offre de match nul.  \nPar exemple : Demander à l'adversaire de répondre dans les 2mn, en cas de nulle sur un autre échiquier).  \nDans les matchs par équipe : si le match nul est proposé à la condition qu'une autre partie soit abandonnée ou également match nul.  \nDans les deux cas la proposition de match nul est valable mais pas la condition jointe."], "ground_truth": "Par exemple : Demander à l'adversaire de répondre dans les 2mn, en cas de nulle sur un autre échiquier)."}
{"question": "Que doit-on faire selon l'article mentionné dans R03_2025_26_Competitions_homol?", "answer": "", "contexts": ["## Commissions d'Appel  \nLa mise en place d'une Commission d'Appel est obligatoire dans le cadre des grands tournois internationaux et des grands événements fédéraux. Sa composition doit être affichée dans l'aire de jeu.  \nPour les autres tournois, la mise en place de cette commission est facultative. Les éventuels appels des joueurs et joueuses seront examinés par la Commission d'Appels Sportifs fédérale ou, lorsqu'elle existe, par la Commission d'Appels Sportifs de la Ligue."], "ground_truth": "Sa composition doit être affichée dans l'aire de jeu."}
{"question": "Quelle règle est énoncée à la page 73?", "answer": "", "contexts": ["## 3. L'Arbitre Principal/ L'Arbitre Principale (AP)  \n3.1. Ses devoirs sont spécifiés en particulier par les Règles du Jeu d'Échecs, les règles générales pour les compétitions FIDE, les directives anti-triche, etc..."], "ground_truth": "Ses devoirs sont spécifiés en particulier par les Règles du Jeu d'Échecs, les règles générales pour les compétitions FIDE, les directives anti-triche, etc..."}
{"question": "Quelle règle est énoncée à la page 149?", "answer": "", "contexts": ["## 7.1. Buchholz (Bu)  \nLa somme des scores ajustés de chaque adversaire que l'on a affronté. (Voir article 14 pour le calcul du score ajusté pour la gestion des rondes non jouées)"], "ground_truth": "(Voir article 14 pour le calcul du score ajusté pour la gestion des rondes non jouées)"}
{"question": "Quelle obligation est énoncée à la page 34?", "answer": "", "contexts": ["## JE RESPECTE LES RÈGLES  \n- → Les règles doivent être appliquées de bonne foi.\n- → Le résultat de la partie doit être acquis loyalement.\n- → Une proposition de nullité ne doit intervenir qu'à l'occasion d'un réel affrontement sur l'échiquier."], "ground_truth": "- → Une proposition de nullité ne doit intervenir qu'à l'occasion d'un réel affrontement sur l'échiquier."}
{"question": "Que se passe-t-il en cas de différence?", "answer": "", "contexts": ["## 1.6. Résumé des critères de Tournois à Normes.  \nEn cas de différence, les règles ci-dessus ont la priorité.  \n| | | Article |\n|----------------------------|------------------------------------------------------------------------------------------------|-----------|\n| Nombre de parties par jour | Pas plus de 2 | 1.1.3 |\n| Cadence de jeu | Critères minimum | 1.1.3 |\n| Durée de la manifestation | Moins de 90 jours, sauf exceptions | 1.1.4 |\n| Responsable | Arbitre International ou Arbitre FIDE | 1.1.5 |\n| Nombre de parties | Minimum 9 (7 en Championnat du monde ou continental par équipes se disputant sur 7 à 9 rondes) | 1.41a-d |\n| Type de tournoi | | 1.4.2.e |  \n| | | Articles |\n|------------------------------------------|----------------------------------------------|------------|\n| Nombre de GM, pour normes deGM | 1/3 des adversaires, 3 GMminimum | 1.4.5b |\n| Nombre de MI, pour normes de MI | 1/3 des adversaires, 3 MI minimum | 1.4.5c |\n| Nombre de GMF, pour normes de GMF | 1/3 des adversaires, 3 GMFminimum | 1.4.5d |\n| Nombre de MIF, pour normes de MIF | 1/3 des adversaires, 3 MIF minimum | 1.4.5e |"], "ground_truth": "En cas de différence, les règles ci-dessus ont la priorité."}
{"question": "Qu'est-ce que les montants?", "answer": "", "contexts": ["## Remarques :  \n- Quel que soit le système utilisé, le montant total des prix est le même.\n- Le système Hort n'est généralement utilisé que pour les prix au classement général. Pour les prix spéciaux (catégories Elo, jeunes, etc) les ex-aequo sont généralement en trop grand nombre.\n- Les systèmes partageant les prix ont le défaut de devoir attendre de connaître le classement final pour connaître les montants et que l'équipe organisatrice prépare les prix (chèque/enveloppe). Quand on les utilise il faut être sûr d'avoir un temps suffisant entre l'édition du classement et la remise des prix.\n- Quand le nombre d' ex-aequo est trop important, il arrive que les derniers prix attribués soient faibles. Pour éviter cela on pourra prévoir sur la liste des prix que le système Hort sera utilisé de manière à ne pas distribuer de prix inférieur à un certain montant (une pratique courante est de ne pas distribuer de prix inférieur au montant des droits d'inscription).  \nDans le cadre de la dernière remarque, on reprend la liste des joueurs ex-aequo ayant amené un prix de montant trop faible. On retire le dernier d'entre eux et on recalcule les prix au système Hort avec les joueurs restants. Si les montants sont encore trop faibles on enlève encore un joueur supplémentaire.  \nPour l'exemple précédent, supposons que l'on ne veut pas attribuer de prix inférieur à 40 €.  \nHortense est donc retirée du calcul des prix, le système Hort n'est calculé que pour Emma, Farid et Germain.  \n| | Prix annoncé | Joueur | Prix à la place | Prix au partage intégral | Prix au système Hort |\n|-------|----------------|----------|-------------------------------|-------------------------------|-------------------------------|"], "ground_truth": "les montants sont encore trop faibles on enlève encore un joueur supplémentaire."}
{"question": "Qu'est-ce que le Molter?", "answer": "", "contexts": ["## Introduction  \nLe système Molter est un système créé pour organiser des tournois par équipes se déroulant en un nombre réduit de rondes.  \nL'arbitre doit connaître les conditions dans lesquelles il est pertinent de l'utiliser :  \n- Nombre d'équipes restreint par rapport au nombre de rondes.\n- Nombre de joueurs et joueuses pair par équipe.\n- En général : nombre d'équipes impair. (Le Molter est souvent utilisé pour éviter les exempts)"], "ground_truth": "Le Molter est souvent utilisé pour éviter les exempts)"}
{"question": "Quelle règle est énoncée à la page 144?", "answer": "", "contexts": ["9. 4.3. Tous les dispositifs et l'unité centrale doivent être capables d'afficher les séquences capturées dans une vidéo ou image par image à la demande de l'opérateur.\n5. Les caméras ou autres dispositifs d'enregistrement qui ne respectent pas les articles 1.2 à 1.4 ne sont pas considérés comme un système d'assistance vidéo. Cela n'interdit pas à l'arbitre de les utiliser pour prendre une décision conformément aux règles du jeu d'échecs.\n6. Lorsqu'un système d'assistance vidéo est mis en place, il doit être supervisé par un opérateur/une opératrice ayant reçu une formation appropriée. La décision de mettre en place un système d'assistance vidéo dans un tournoi revient à l'équipe d'organisatio n."], "ground_truth": "Les caméras ou autres dispositifs d'enregistrement qui ne respectent pas les articles 1.2 à 1.4 ne sont pas considérés comme un système d'assistance vidéo."}
{"question": "Qu'est-ce que la nulle?", "answer": "", "contexts": ["## Partie III a) : Règles pour les compétitions en ligne avec supervision Dispositions générales  \n- 8.1. « Le lieu de la compétition » est défini comme étant la « zone de jeu », les toilettes et les salles de repos. La zone de jeu est définie comme la pièce où le joueur ou la joueuse effectue ses coups. Le règlement d'une compétition peut exiger que la zone de jeu soit surveillée par des caméras.\n- 8.2. Personne d'autre que le s joueurs et joueuses ne sont autorisés dans la zone de jeu sans la permission des arbitres.\n- 8.3. La cadence de jeu et la méthode de mise en œuvre doivent être précisées dans le règlement de la compétition.\n- 8.4. Si la plateforme de jeu permet aux joueurs et joueuses de déplacer des pièces en contradiction avec l'article 3.3 (coups illégaux), le règlement de la compétition doit préciser comment gérer de telles irrégularités.\n- 8.5. Le règlement de la compétition doit préciser à l'avance le délai de forfait. S'il n'est pas spécifié, le délai de forfait par défaut est de zéro. Si le règlement de la compétition précise que le délai de forfait par défaut est différent de zéro et si aucun des deux adversaire s n'est présent initialement, la personne ayant les blancs perd tout le temps écoulé jusqu'à son arrivée, à moins que le règlement de la compétition ne le précise autrement ou que l'arbitre n'en décide autrement.\n- 8.6. La plateforme de jeu doit enregistrer l'offre de nulle à côté de la notation du coup jouée lorsque la nulle est proposée."], "ground_truth": "la nulle est proposée."}
{"question": "Qu'est-ce que les participants?", "answer": "", "contexts": ["6.27. L'obligation général e de coopérer, les participants ont le droit de signaler toute violation potentielle de ce code en réclamant le bénéfice de l'anonymat sous réserve des règles lié es aux diverses procédures administratives.  \nLes participants sont tenus sur demande, de contribuer à clarifier les faits d'une affaire, à élucider les éventuelles infractions ou à fournir les éléments de preuves liées à celles-ci."], "ground_truth": "Les participants sont tenus sur demande, de contribuer à clarifier les faits d'une affaire, à élucider les éventuelles infractions ou à fournir les éléments de preuves liées à celles-ci."}
{"question": "Qu'est-ce que le bonus?", "answer": "", "contexts": ["Dans les règles du jeu d'échecs, l'incrément et le temps différé sont traités de la même manière. Par exemple, lorsqu'on calcule la durée d'une session de jeu, les deux sont multipliés par 60 pour trouver le temps total.  \nCADENCE FISCHER : Un temps fixe supplémentaire (incrément) est ajouté au temps principal de réflexion des joueurs/joueuses à chaque coup achevé. L'incrément pour le premier coup est ajouté avant le début de la partie. Si un joueur/une joueuse joue rapidement alors son temps restant peut augmenter.  \nIl existe deux types de cadences en temps différé, Bronstein et Simple (ou US). Avec le délai, un joueur/une joueuse ne peut jamais augmenter son temps au-delà de celui qu'il avait au début d'un coup. Si l'horloge est pressée avant que tout le temps de bonus ait été utilisé alors le temps de bonus restant est perdu.  \nLes deux méthodes de temps différé ont le même effet global.  \nCADENCE DELAY - SIMPLE : La pendule affiche le temps principal. Un autre affichage montre le compte à rebours du temps bonus, ce n'est que lorsque celui -ci est épuisé que le temps principal commence à diminuer.  \nCADENCE BRONSTEIN DELAY : Dans ce mode, le bonus est ajouté au temps principal et la pendule commence immédiatement le compte à rebours.  \n- 6.4. Immédiatement après la chute d'un drapeau, les exigences de l'Article 6.3.1 doivent être contrôlées."], "ground_truth": "le bonus est ajouté au temps principal et la pendule commence immédiatement le compte à rebours."}
{"question": "Quelle règle est énoncée à la page 134?", "answer": "", "contexts": ["Lexicographique (ordre) : L'ordre normal du dictionnaire, il est aussi utilisé en mathématiques pour trier et comparer des listes de nombres, c'est appliqué ici pour les transpositions, échanges et les différences de score.  \nLimbe : Sousgroupe d'un niveau d'appariement hétérogène qui contient tous les flotteurs descendants qui ne seront pas appariés avec ce niveau. (Par nécessité, ces joueurs doivent flotter à nouveau)  \nNiveau d'appariement : Un ensemble de personnes à apparier. De manière générale, il correspond à un groupe de points, mais il peut également contenir des personnes ayant un score plus élevé qui n'ont pas pu être apparié dans le groupe de points précédent (voir alors Flotteur descendant) ;  \nEffondré : (voir dernier niveau effondré) ;  \nHétérogène"], "ground_truth": "Limbe : Sousgroupe d'un niveau d'appariement hétérogène qui contient tous les flotteurs descendants qui ne seront pas appariés avec ce niveau."}
{"question": "Quelle règle est énoncée à la page 213?", "answer": "", "contexts": ["## 4.4. Programme d'entraînement d'Arbitre National  \nLe développement des programmes d'entraînement d'Arbitre National est sous la responsabilité de la Fédération Nationale. De tels programmes seront conçus pour répondre aux besoins de la Fédération Nationale et ajustés aux règlements internationaux.  \nQuand une Fédération Nationale a besoin d'assistance, elle peut consulter les chargés du volet Éducation de la Commission des Arbitres pour avis et support."], "ground_truth": "De tels programmes seront conçus pour répondre aux besoins de la Fédération Nationale et ajustés aux règlements internationaux."}
{"question": "Quelle règle est énoncée à la page 210?", "answer": "", "contexts": ["## 4. Formation des arbitres.  \nLes formations d'un arbitre sont séparées en trois catégories :  \n- Formation initiale.\n- Formation continue.\n- Préparation aux évènements mondiaux.  \nEn supplément, la commission FIDE des Arbitres assistera, sur demande, les fédérations concernant leurs programmes nationaux de formation à l'arbitrage."], "ground_truth": "- Préparation aux évènements mondiaux."}
{"question": "Qu'est-ce que le risque?", "answer": "", "contexts": ["## 10.1. Cas de force majeure  \nRecommandations pour les arbitres et l'équipe d'organisation d'événements échiquéens : ils doivent indiquer aux joueurs/joueuses s'il est nécessaire d'interrompre la ronde ou le tournoi en cas de force majeure. (Alerte incendie, incident grave pendant le t ournoi,...)  \n10.1.1. Les parties peuvent être interrompues avec la possibilité de mettre un coup sous enveloppe (ajournement), il est toutefois préférable de reprendre les parties, si possible, même après une longue pause où le risque est présent que des joueurs/joueuses puissent avoir eu accès à une aide extérieure.  \nDans la mesure du possible, arbitre et organisateur mettront tout en place pour éviter les risques d'accès à une aide extérieure pendant la pause.  \n- 10.1.2. Si nécessaire, l'arbitre est autorisé à modifier la cadence de jeu (c'est -à-dire réduire le temps restant pour terminer les parties)\n- 10.1.3. Si nécessaire, il est permis de dépasser les 12 heures de jeu dans la journée pour terminer les parties interrompues et atteindre le nombre prévu de rondes.\n- 10.1.4. L'arbitre en chef et l'équipe d'organisation peuvent organiser, si nécessaire, une ronde avec une cadence de jeu différente pour terminer la journée/le tournoi avec le nombre de rondes requis.\n- 10.2. Autres cas (panne de courant, température basse, bruit, conditions de jeu difficiles, absence d'arbitre, ... )"], "ground_truth": "le risque est présent que des joueurs/joueuses puissent avoir eu accès à une aide extérieure."}
{"question": "Qu'est-ce que le avertissement?", "answer": "", "contexts": ["## 17.2.1. Signalement et mise en archive  \nSi la D.N.A . estime qu'un simple avertissement est nécessaire, elle informera le joueur ou la joueuse par courrier électronique ou par courrier recommandé qu'un signalement à son encontre a été effectué, que cette information et les pièces qui y sont attachées sont archivées sous la responsabilité du directeur ou de la directrice de la D.N.A. pour une durée de 2 ans dans le cas où de tels faits se répéteraient.  \nLe joueur ou la joueuse est informé qu'il dispose d'un droit de réponse à ce signalement qui sera ajouté aux pièces mises en archives."], "ground_truth": "le avertissement est nécessaire, elle informera le joueur ou la joueuse par courrier électronique ou par courrier recommandé qu'un signalement à son encontre a été effectué, que cette information et les pièces qui y sont attachées sont archivées sous la responsabilité du directeur ou de la directrice de la D."}
{"question": "Qu'est-ce que les parties?", "answer": "", "contexts": ["La vérification d'une réclamation de nulle se fait en présence des deux adversaires. Il vaut mieux reconstituer toute la partie sans se fier uniquement aux feuilles de parties. On peut utiliser l'ordinateur si les parties sont retransmises.  \n- 9.3. La partie est nulle, sur une demande correcte du joueur/de la joueuse ayant le trait, si :\n- 9.3.1. il/elle indique son coup, qui ne peut être changé, en l'écrivant sur sa feuille de partie en papier ou en le notant sur sa feuille de partie électronique et déclare à l'arbitre son intention de jouer ce coup ayant pour conséquence que les 50 derniers coups ont été joués par chacun des deux adversaires sans mouvement de pion ni aucune prise, ou\n- 9.3.2. les 50 derniers coups ont été achevés par chacun des deux adversaires sans mouvement de pion ni aucune prise."], "ground_truth": "les parties sont retransmises."}
{"question": "Qu'est-ce que les organisateurs?", "answer": "", "contexts": ["## Généralités pour la prévention anti-triche  \nLes mesures de prévention antitriche varieront selon les niveaux de tournois afin de prendre en compte l'impact budgétaire de celles-ci.  \nLes organisateurs sont responsables de la mise en œuvre de ces mesures de prévention et l'arbitre en chef a le devoir de vérifier que le tournoi se déroule en conformité avec ces mesures. Dans son rapport de tournoi, l'arbitre en chef doit signaler tous les manquements et violations de ces mesures de prévention.  \nLe fait de ne pas se conformer aux mesures de prévention et/ou de ne pas vérifier et rapporter cette conformité sera considéré comme un manquement majeur et pourra être signalé à la commission compétente.  \nLes organisateurs/organisatrices de tournois doivent adopter l'un des trois niveaux de prévention (Prévention Standard, Prévention Accrue ou Prévention Maximale). Les mesures de prévention doivent être indiquées dans l'annonce du tournoi.  \nDans les tournois au niveau de protection accru ou maximal, on peut prévoir des arbitres dont le rôle est l'anti -triche."], "ground_truth": "Les organisateurs sont responsables de la mise en œuvre de ces mesures de prévention et l'arbitre en chef a le devoir de vérifier que le tournoi se déroule en conformité avec ces mesures."}
{"question": "Quelle règle est énoncée à la page 95?", "answer": "", "contexts": ["## B. Infractions de tricherie en ligne  \n- B.1 Conceptuellement, la tricherie aux échecs en ligne est définie comme tout comportement qu'un joueur ou une joueuse adopte afin d'obtenir un avantage sur son adversaire ou d'atteindre un objectif dans une partie en ligne si, selon les règles du jeu, cet avantage ou cet objectif n'est pas censé avoir été atteint.  \nB.2 Plus précisément, on entend par \"tricherie\" :  \n- i) l'utilisation délibérée de dispositifs électroniques ou d'autres sources d'information ou de conseil au cours d'une partie, ou bien ;\n2. ii) la manipulation des compétitions d'échecs, c'est-à-dire un arrangement, un acte ou une omission intentionnelle visant à altérer de manière inappropriée le résultat ou le déroulement d'une compétition d'échecs afin de supprimer tout ou partie du caractère imprévisible de ladite compétition d'échecs en vue d'obtenir un avantage indu pour soi-même ou pour autrui.  \nLa manipulation des compétitions d'échecs comprend, sans s'y limiter, la manipulation des résultats, la tromperie (baisse artificielle du classement par la perte délibérée de parties), le trucage de parties, la fraude au classement et la participation délibérée à des compétitions ou à des parties fictives.  \n- B.3 Les infractions liées à la tricherie spécifiques aux échecs en ligne sont le piratage et l'usurpation d'identité, c'està-dire lorsque quelqu'un d'autre joue à la place du joueur ou de la joueuse. Les modalités de traitement de ce type d'infractions sont analogues à celles des infractions de tricherie, y compris l'application des mesures disciplinaires internes de la FIDE."], "ground_truth": "B.2 Plus précisément, on entend par \"tricherie\" :  \n- i) l'utilisation délibérée de dispositifs électroniques ou d'autres sources d'information ou de conseil au cours d'une partie, ou bien ;\n2."}
{"question": "Qu'est-ce que le manière?", "answer": "", "contexts": ["## Mise en œuvre :  \nAvant le début du tournoi il est nécessaire d'attribuer un numéro d'appariement de chaque joueur /joueuse. La manière dont est attribué ce numéro est définie avant et apparaîtra dans le règlement du tournoi. (Tirage au sort, classement Elo, utilisation du protocole de Varma)  \nNotez que dans le cadre d'un tirage au sort il faut aussi préciser de quelle manière est décidé l'ordre du tirage au sort.  \nUne fois les numéros connus, il suffit d'appliquer strictement la table correspondante au nombre de participants.  \nPour un tournoi à double ronde (match aller-retour), il est recommandé d'inverser l'ordre des deux derniers tours du premier cycle. Ceci afin d'éviter trois parties consécutives de la même couleur.  \nLes arbitres souhaitant approfondir leurs connaissances et leur compréhension de ces tables peuvent se rendre sur le site de la DNA : https://dna.ffechecs.fr/reglements/approfondissement/  \n- Tables de Berger de 3 à 18 joueurs\n- Explications des tables de Berger\n- Application des tables pour les compétitions par équipes\n- Appariements dirigés en toute-rondes\n- Utilisation du système Rutsch Berger"], "ground_truth": "le manière est décidé l'ordre du tirage au sort."}
{"question": "Qu'est-ce que les documents?", "answer": "", "contexts": ["## 5.4. Droits des parties  \nChaque personne accusée d'une violation du règlement disciplinaire de l'arbitre a le droit d'être informée par écrit (que ce soit par lettre, courriel ou autre) du dossier en cours avant la décision finale de la DSC et a le droit de présenter à la DSC des documents et des pièces à l'appui de sa position. Chaque personne a le droit d'être représentée par un arbitre licencié par la FIDE ou par un avocat.  \n- 5.5. Soumission de documents et clarifications\n- a) Le président de la DSC fixera un délai, normalement d'au moins quinze jours, pour la soumission des éléments et documents, passé ce délai la DSC n'acceptera plus aucun document. Ce délai peut être prolongé à la demande de l'une des parties.\n- b) Les documents sont normalement soumis par courrier électronique, mais peuvent être envoyés par la poste.\n- c) Si la DSC a besoin d'éclaircissements sur un point particulier, elle peut se renseigner auprès de l'une ou l'autre des parties ou demander des documents particuliers pour répondre à la question.\n- d) Si la DSC a besoin d'éclaircissements sur un point particulier, elle peut se renseigner auprès des organes de la FIDE, des fédérations de la FIDE, des arbitres, des joueurs, des organisateurs, des directeurs de tournois et d'autres témoins.\n- e) Le DSC prendra une décision sur le cas."], "ground_truth": "Les documents sont normalement soumis par courrier électronique, mais peuvent être envoyés par la poste."}
{"question": "Qu'est-ce que la composition?", "answer": "", "contexts": ["## 4.7. A partir du 1er janvier 2024 : Participation à un (1) Séminaire d' Arbitre International et avec une évaluation d'assiduité positive.  \n- 4.8. Expérience en tant qu'arbitre dans quatre (4) événements, en conformité avec les articles 2.3 à 2.8, qui seront considérés valides pour une norme dans l'une des conditions suivantes :\n- 4.8.1. La finale du championnat individuel (adulte, open ou féminin) national. (Deux normes maximum).\n- 4.8.2. Tout tournoi ou matchs officiels de la FIDE.\n- 4.8.3. Tout tournoi international dont la composition est telle qu'un joueur peut théoriquement obtenir une norme (FIDE Handbook B01).\n- 4.8.4. Tout championnat Rapide ou Blitz, Mondial ou Continental (Une norme maximum).\n- 4.9. Chacune des possibilités suivantes pourra être utilisée une (1) seule fois dans le cadre d'une demande de titre d'AI :\n- 4.9.1. Être arbitre d'un tournoi international homologué pour le classement FIDE avec au moins 100 joueurs représentant au moins 3 fédérations, au moins 30% de joueurs classés FIDE, et au moins 7 rondes.\n- 4.9.2. Être arbitre dans au moins sept (7) rondes de la plus haute division d'un championnat par équipe national vérifiant les conditions suivantes :\n- a) Un minimum de 4 échiquiers par équipes.\n- b) Un minimum de 10 équipes (6 en cas de toutes rondes aller-retour)."], "ground_truth": "la composition est telle qu'un joueur peut théoriquement obtenir une norme (FIDE Handbook B01)."}
{"question": "Quelle obligation est énoncée à la page 10?", "answer": "", "contexts": ["## 7.1. Généralités :  \nPendant les séances de jeu, l'arbitre a pour principale mission l'application des Règles définies par la FIDE et la FFE. Pour cela, il doit pouvoir mettre à disposition la dernière édition des règlements aux joueurs et joueuses qui en ferait la demande.  \nUn arbitre doit toujours se trouver sur les lieux de la compétition.  \nIl assure la meilleure surveillance possible des parties et intervient en suivant les règles du jeu en vigueur."], "ground_truth": "Pour cela, il doit pouvoir mettre à disposition la dernière édition des règlements aux joueurs et joueuses qui en ferait la demande."}
{"question": "Qu'est-ce que le incorrectes?", "answer": "", "contexts": ["En Blitz et en Rapide, si le joueur demande à l'arbitre de voir la feuille de match, la pendule ne doit pas être arrêtée.  \n- B.3 Autrement, le jeu est régi par les Règles du Jeu Rapide spécifiées dans les articles A.2, A.3 et A.5  \nNote de traduction : On applique la même règle qu'en rapide, les sanctions pour coups irréguliers et réclamations de nulle incorrectes sont d'une minute.  \n- B.4 Le règlement d'une compétition spécifie si l'Article B. 2 ou l'Article B. 3 s'applique pour l'intégralité de la compétition."], "ground_truth": "le incorrectes sont d'une minute."}
{"question": "Quelle règle est énoncée à la page 107?", "answer": "", "contexts": ["## Organisation des tournois  \nPour connaître le nombre d'échiquiers à prévoir dans un tournoi, il suffit de multiplier le nombre des équipes par la moitié du nombre des joueurs d'une équipe (17 équipes à 8 joueurs exigent 17 ×4 soient 68 échiquiers).  \nDès leur arrivée, les capitaines d'équipe remettent à l'arbitre la liste ordonnée de s membres de leur équipe, classé conformément au règlement de la compétition concernée.  \nIl est ensuite effectué un tirage au sort pour attribuer une lettre à chacune des équipes.  \nLes membres de l'équipe A sont alors nommés A1 , A2, A3....selon le nombre de joueurs par équipe.  \nDans les tournois à plusieurs rondes, l'ordre des membres de l'équipe ne doit pas être permuté. Le cas échéant, un(e) remplaçant(e) devra prendre la place de la personne sortante.  \nEn théorie l'arbitre connaît à l'avance le nombre d'équipes et a préparé son tableau d'appariements en conséquence.  \nLe système Molter semble complexe au premier abord mais bien préparé il présente l'avantage de prévoir l'ensemble des appariements dès le début du tournoi.  \nImportant : Il sera toujours prudent d'envisager la défection ou l'inscription sur place d'une, voire de plusieurs équipes et de préparer matériel et tableaux d'appariements pour tous les cas envisageables."], "ground_truth": "Il est ensuite effectué un tirage au sort pour attribuer une lettre à chacune des équipes."}
{"question": "Quelle règle est énoncée à la page 82?", "answer": "", "contexts": ["## 7.1. Remarques générales et informations  \n- 7.1.1. L'échiquier électronique remplace l'échiquier en bois. La taille de l'échiquier, la taille des cases, le matériau, la couleur doivent être similaires.\n- 7.1.2. Les pièces utilisées doivent être en bois, plastique ou une imitation de ces matériaux, avec une hauteur, un poids, des proportions et une stabilité similaire aux pièces décrites au point 2.2.\n- 7.1.3. Il faut savoir si l'échiquier doit être alimenté par câble ou par batterie (nombre et type pour les piles) .\n- 7.1.4. Il faut savoir le type de câble de connexion utilisé et le nombre maximum d'échiquiers pouvant être connectés à une « ligne » de câble.\n- 7.1.5. Il faut savoir le type de connexion sans fil utilisé.\n- 7.1.6. Il faut savoir si l'échiquier électronique est compatible avec les pendules d'échecs choisi es.\n- 7.1.7. Il faut connaître les dispositifs prévus pour la transmission et la diffusion des parties."], "ground_truth": "L'échiquier électronique remplace l'échiquier en bois."}
{"question": "Qu'est-ce que le lieu?", "answer": "", "contexts": ["## 2.3. Calendrier  \nPour la phase zone interdépartementale, la date et le lieu sont fixés par la Ligue. Cette phase doit se dérouler au plus tard à la date limite fixée dans le calendrier fédéral.  \nLa date et le lieu de la phase finale sont fixés par la Commission Technique Fédérale, en accord avec le Comité Directeur Fédéral."], "ground_truth": "le lieu sont fixés par la Ligue."}
{"question": "Qu'est-ce que les échiquiers?", "answer": "", "contexts": ["## 4.1.c) Non-respect de l'article 3.7.f  \nForfait administratif sur l'échiquier du joueur ou la joueuse en infraction, avec la marque de - 1.  \nLe score d'une équipe en points de parties est égal à la somme des marques individuelles de ses échiquiers et de ses pénalités ; il ne peut être inférieur à zéro. Lorsqu'une équipe gagne par forfait sportif ou à la suite de pénalités administratives de l'équipe adverse, le score du match est au maximum de 10/0 (5/0 en N 3), mais le score obtenu sur les échiquiers est retenu s'il est supérieur (11/1 12/1, etc. étant supérieur à 10/0).  \nL'énoncé du score précise les points marqués par les deux équipes. Le différentiel d'une équipe pour un match est défini par la différence entre les points de parties marqués et ceux concédés."], "ground_truth": "les échiquiers est retenu s'il est supérieur (11/1 12/1, etc."}
{"question": "Quelle règle est énoncée à la page 25?", "answer": "", "contexts": ["## 17.2. Mesures administratives  \nEn plus de ces mesures à caractère sportif, un arbitre peut aussi solliciter la demande d'une sanction à l'encontre d'un joueur ou d'une joueuse . Il/Elle joindra à son rapport technique un formulaire de signalement pour demander l'étude du cas auprès de la D.N.A. qui prendra en compte la gravité des faits signalés ainsi que les signalements répétés concernant une même personne.  \nEn particulier, à l'occasion des tournois homologués, tout forfait fait l'objet d'une enquête de la part de l'arbitre principal. Si le joueur ou la joueuse ne répond pas de façon satisfaisante à la demande d'explications envoyée par l'arbitre principal, ce dernier le signale à la D.N.A."], "ground_truth": "Il/Elle joindra à son rapport technique un formulaire de signalement pour demander l'étude du cas auprès de la D.N.A."}
{"question": "Quelle règle est énoncée à la page 216?", "answer": "", "contexts": ["- 2.5. Un AI ou AF inactif peut être considéré comme actif à nouveau, seulement après avoir participé avec succès à un séminaire de remise à niveau et après validation par la Commission des Arbitres.\n- 2.6. Transition 2021 pour une mise en œuvre harmonieuse des nouveaux règlements. La date initiale de fin d'activité sera calculée comme suit, au fur et à mesure de l'entrée en vigueur du nouveau règlement :\n- 2.6.1. Arbitres actifs avec un dernier tournoi en 2016 ou avant : 31/12/2020, statut défini comme inactif.\n- 2.6.2. Arbitres actifs dont le dernier tournoi a eu lieu en 2017 : AI 31/12/2021 - AF 31/12/2022\n- 2.6.3. Arbitres actifs dont le dernier tournoi a eu lieu en 2018 : 31/12/2022\n- 2.6.4. Arbitres actifs ayant un dernier tournoi en 2019 : 31/12/2023\n- 2.6.5. Arbitres actifs ayant un dernier tournoi en 2020 : 31/12/2024"], "ground_truth": "Transition 2021 pour une mise en œuvre harmonieuse des nouveaux règlements."}
{"question": "Quelle règle est énoncée à la page 41?", "answer": "", "contexts": ["## Article 4 L ' exécution du déplacement des pièces  \n- 4.1. Chaque coup doit être exécuté à l ' aide d ' une seule main.\n- 4.2. Ajustement des pièces ou tout autre contact physique avec une pièce :\n- 4.2.1. Seul le joueur ou la joueuse ayant le trait peut recentrer une ou plusieurs pièces sur leurs cases respectives, à la condition d'en exprimer l'intention au préalable (par exemple en disant «j' adoube» ou «I adjust»).  \nL'Article 4.2.1 peut être utilisé uniquement pour corriger le placement de pièces mal placées. Si l'adversaire est absent alors il faut informer, si possible, un ou une arbitre avant que tout ajustement ait lieu. Le joueur ou la joueuse doit toujours annon cer son intention d'ajuster une pièce. S'il/elle ne le fait pas, les règles normales de la ' pièce touchée' s'appliquent (voir 4.3).  \n- 4.2.2. Tout autre contact physique avec une pièce, à l'exception d'un contact clairement accidentel, doit être considéré comme intentionnel.  \nSelon cette règle, si un joueur ou une joueuse n'a pas dit « j'adoube » ou quelque chose de similaire avant de toucher une pièce et que le contact n'est pas accidentel alors la pièce touchée doit être déplacée.  \nPar exemple, si les Blancs ont joué 1. Fe2xg5 en soulevant le fou et en retirant le cavalier (ce coup n'est pas possible) alors le fou sur e2 doit être déplacé car il a été touché dans l'intention de le déplacer.  \n<!-- image -->"], "ground_truth": "Ajustement des pièces ou tout autre contact physique avec une pièce :\n- 4.2.1."}
{"question": "Qu'est-ce que un coup?", "answer": "", "contexts": ["## 3.9. Mise du roi en échec :  \n- 3.9.1. Le roi est dit « en échec » s'il est attaqué par une ou plusieurs pièces adverses, même si ces pièces ne peuvent pas se déplacer sur la case occupée par ce roi parce qu ' elles laisseraient ou mettraient en échec le roi de leur propre camp.\n- 3.9.2. Aucune pièce ne peut être déplacée si elle expose le roi de son propre camp à un échec ou si elle le laisse en échec.\n- 3.10. Coup légaux et illégaux, positions illégales :\n- 3.10.1. Un coup est dit légal lorsqu ' il respecte toutes les conditions associées fixées par les articles 3.1 à 3.9.\n- 3.10.2. Un coup est dit illégal quand il ne respecte pas l ' une des conditions associées fixées par les articles 3.1 à 3.9\n- 3.10.3. Une position est illégale lorsqu'elle ne peut avoir été atteinte par aucune suite de coups légaux."], "ground_truth": "Un coup est dit légal lorsqu ' il respecte toutes les conditions associées fixées par les articles 3."}
